Номер закупки;Ссылка на продукт;Статус;Описание объекта;Организация;Дата размещения;Цена;Ссылка на поставщика;Заказчик;Победитель;Статус победителя;Цена победителя;Второй номер;Статус второго номера;Цена второго номера;Дата начала контракта;Дата окончания контракта;ФИО Руководителя;ИНН;Контакты
№ 0101300001921000013;https://zakupki.gov.ru//epz/order/notice/ea44/view/common-info.html?regNumber=0101300001921000013;Подача заявок;Оказание услуг по финансовой аренде (лизингу)  снегопогрузчик лаповый;АДМИНИСТРАЦИЯ ГОРОДСКОГО ОКРУГА ГОРОД НЕФТЕКАМСК РЕСПУБЛИКИБАШКОРТОСТАН;04.02.2021;6 301 121,00 ₽;;;;;;;;;;;;;;
№ 0101600002821000001;https://zakupki.gov.ru//epz/order/notice/ea44/view/common-info.html?regNumber=0101600002821000001;Подача заявок;Выполнение работ по ремонтудороггородского округа город Октябрьский РеспубликиБашкортостан(ямочный);ОТДЕЛ МУНИЦИПАЛЬНЫХ ЗАКУПОК АДМИНИСТРАЦИИ ГОРОДСКОГО ОКРУГА ГОРОД ОКТЯБРЬСКИЙ РЕСПУБЛИКИБАШКОРТОСТАН;04.02.2021;20 000 000,00 ₽;;;;;;;;;;;;;;
№ 32109958236;https://zakupki.gov.ru/https://zakupki.gov.ru/223/purchase/public/purchase/info/common-info.html?regNumber=32109958236;Подача заявок;Запрос предложений на выполнение буровзрывных работ на объекте «Реконструкция автомобильнойдорогиБирск – Тастуба – Сатка на участке обход с. Караидель до км 168,35 в Дуванском и Караидельском районах РеспубликиБашкортостан».;"АКЦИОНЕРНОЕ ОБЩЕСТВО ""БАШКИРАВТОДОР""";04.02.2021;49 401 268,20 ₽;;;;;;;;;;;;;;
№ 0101300043321000001;https://zakupki.gov.ru//epz/order/notice/ea44/view/common-info.html?regNumber=0101300043321000001;Подача заявок;Выполнение работ по текущему содержаниюдорог(в чистоте) городского поселения город Мелеуз муниципального района Мелеузовский район РеспубликиБашкортостан;АДМИНИСТРАЦИЯ ГОРОДСКОГО ПОСЕЛЕНИЯ ГОРОД МЕЛЕУЗ МУНИЦИПАЛЬНОГО РАЙОНА МЕЛЕУЗОВСКИЙ РАЙОН РЕСПУБЛИКИБАШКОРТОСТАН;03.02.2021;5 147 706,00 ₽;;;;;;;;;;;;;;
№ 0301100012721000002;https://zakupki.gov.ru//epz/order/notice/ok504/view/common-info.html?regNumber=0301100012721000002;Подача заявок;"Содержание действующей сетиавтомобильныхдорогобщего пользования федерального значения ( ...  «Устройство слоевизноса на автомобильнойдорогеА-305 Оренбург- Илек-граница ... ; Устройство слоев износа на автомобильнойдорогеА-305 Оренбург-Илек-граница ... ; Устройство слоев износа на автомобильнойдорогеМ-7 ""Волга"" Москва – Владимир ...  направление), РеспубликаБашкортостан; Устройство слоев износа на автомобильнойдорогеР-240 ...  178+000, РеспубликаБашкортостан;Устройство слоев износа на автомобильнойдорогеР-239 ...";"ФЕДЕРАЛЬНОЕ КАЗЕННОЕ УЧРЕЖДЕНИЕ ""ФЕДЕРАЛЬНОЕ УПРАВЛЕНИЕ АВТОМОБИЛЬНЫХДОРОГ""ПРИУРАЛЬЕ"" ФЕДЕРАЛЬНОГО ДОРОЖНОГО АГЕНТСТВА """;02.02.2021;360 895 796,00 ₽;;;;;;;;;;;;;;
№ 0301100012721000001;https://zakupki.gov.ru//epz/order/notice/ok504/view/common-info.html?regNumber=0301100012721000001;Подача заявок;Содержание действующей сети автомобильныхдорогобщего пользования федерального значения. Замена парапетного ограждения научастке км 1441+000 – км 1450+000 автомобильнойдорогиМ-5 «Урал» Москва –Рязань – Пенза – Самара – Уфа – Челябинск по РеспубликеБашкортостан;"ФЕДЕРАЛЬНОЕ КАЗЕННОЕ УЧРЕЖДЕНИЕ ""ФЕДЕРАЛЬНОЕ УПРАВЛЕНИЕ АВТОМОБИЛЬНЫХДОРОГ""ПРИУРАЛЬЕ"" ФЕДЕРАЛЬНОГО ДОРОЖНОГО АГЕНТСТВА """;02.02.2021;269 867 456,00 ₽;;;;;;;;;;;;;;
