Номер закупки;Ссылка на продукт;Статус;Описание объекта;Организация;Дата размещения;Цена;Ссылка на поставщика;Заказчик;Победитель;Статус победителя;Цена победителя;Второй номер;Статус второго номера;Цена второго номера;Дата начала контракта;Дата окончания контракта;ФИО Руководителя;ИНН;Контакты
№ 0131300045220000201;https://zakupki.gov.ru//epz/order/notice/ea44/view/common-info.html?regNumber=0131300045220000201;Определение поставщика завершено;"Осуществление строительного контроля по объекту: ""Строительство автомобильнойдороги«М «Дон» - Бобров - Таловая – Новохоперск» - КФХ Колесников Ю.Н в Бобровском муниципальном районеВоронежскойобласти""";АДМИНИСТРАЦИЯ БОБРОВСКОГО МУНИЦИПАЛЬНОГО РАЙОНАВОРОНЕЖСКОЙОБЛАСТИ;30.12.2020;4 890 682,00 ₽;https://zakupki.gov.ru/epz/order/notice/ea44/view/supplier-results.html?regNumber=0131300045220000201;АДМИНИСТРАЦИЯ БОБРОВСКОГО МУНИЦИПАЛЬНОГО РАЙОНА ВОРОНЕЖСКОЙ ОБЛАСТИ;"МУНИЦИПАЛЬНОЕ КАЗЕННОЕ ПРЕДПРИЯТИЕ ""СЛУЖБА КАПИТАЛЬНОГО СТРОИТЕЛЬСТВА И ОКАЗАНИЯ УСЛУГ ДЛЯ МУНИЦИПАЛЬНЫХ НУЖД"" БОБРОВСКОГО МУНИЦИПАЛЬНОГО РАЙОНА ВОРОНЕЖСКОЙ ОБЛАСТИ";1 - Победитель;73 360,23;"ОБЩЕСТВО С ОГРАНИЧЕННОЙ ОТВЕТСТВЕННОСТЬЮ ""МАЛАХИТ""";2 - Второй номер;97 813,64;31.01.2023;02.02.2021;;397700, ОБЛ ВОРОНЕЖСКАЯ 36, Г БОБРОВ, УЛ ИМ КИРОВА, 32, А, 9А;3602011301;7-47350-40262bobrzakaz@mail.ru
№ 0131300045220000199;https://zakupki.gov.ru//epz/order/notice/ea44/view/common-info.html?regNumber=0131300045220000199;Определение поставщика завершено;Строительство и реконструкция подъездной автомобильнойдорогик ЖК Соколовка;АДМИНИСТРАЦИЯ БОБРОВСКОГО МУНИЦИПАЛЬНОГО РАЙОНАВОРОНЕЖСКОЙОБЛАСТИ;30.12.2020;282 811 105,00 ₽;https://zakupki.gov.ru/epz/order/notice/ea44/view/supplier-results.html?regNumber=0131300045220000199;АДМИНИСТРАЦИЯ БОБРОВСКОГО МУНИЦИПАЛЬНОГО РАЙОНА ВОРОНЕЖСКОЙ ОБЛАСТИ;Согласование получено;;По результатам рассмотрения вторых частей заявок принято решение о соответствии указанным требованиям только одной второй части заявки на участие в нем (ч.13 ст.69 Закона № 44-ФЗ).;;"ОБЩЕСТВО С ОГРАНИЧЕННОЙ ОТВЕТСТВЕННОСТЬЮ ""РОССОШАНСКОЕ ДОРОЖНОЕ РЕМОНТНО-СТРОИТЕЛЬНОЕ УПРАВЛЕНИЕ № 1""";;;;;;;
№ 0131300045220000198;https://zakupki.gov.ru//epz/order/notice/ea44/view/common-info.html?regNumber=0131300045220000198;Определение поставщика завершено;Ремонт автомобильныхдорогобщего пользования местного значения на территории Бобровского муниципального районаВоронежскойобласти (I этап);АДМИНИСТРАЦИЯ БОБРОВСКОГО МУНИЦИПАЛЬНОГО РАЙОНАВОРОНЕЖСКОЙОБЛАСТИ;29.12.2020;86 048 025,00 ₽;https://zakupki.gov.ru/epz/order/notice/ea44/view/supplier-results.html?regNumber=0131300045220000198;АДМИНИСТРАЦИЯ БОБРОВСКОГО МУНИЦИПАЛЬНОГО РАЙОНА ВОРОНЕЖСКОЙ ОБЛАСТИ;"ОБЩЕСТВО С ОГРАНИЧЕННОЙ ОТВЕТСТВЕННОСТЬЮ ""ДОРСТРОЙ""";1 - Победитель;81 315 383,57;"ОБЩЕСТВО С ОГРАНИЧЕННОЙ ОТВЕТСТВЕННОСТЬЮ ""РОССОШАНСКОЕ ДОРОЖНОЕ РЕМОНТНО-СТРОИТЕЛЬНОЕ УПРАВЛЕНИЕ № 1""";2 - Второй номер;81 745 623,70;31.01.2023;02.02.2021;;397710, ОБЛ ВОРОНЕЖСКАЯ 36, Г БОБРОВ, ТЕР СТАНЦИЯ БИТЮГ, ДОМ 5, ОФИС 1;3602009091;7-473-2621346dorstrou@mail.ru
№ 0131300045220000197;https://zakupki.gov.ru//epz/order/notice/ea44/view/common-info.html?regNumber=0131300045220000197;Определение поставщика завершено;Ремонт автомобильныхдорогобщего пользования местного значения на территории Бобровского муниципального районаВоронежскойобласти (II этап);АДМИНИСТРАЦИЯ БОБРОВСКОГО МУНИЦИПАЛЬНОГО РАЙОНАВОРОНЕЖСКОЙОБЛАСТИ;29.12.2020;55 980 637,00 ₽;https://zakupki.gov.ru/epz/order/notice/ea44/view/supplier-results.html?regNumber=0131300045220000197;АДМИНИСТРАЦИЯ БОБРОВСКОГО МУНИЦИПАЛЬНОГО РАЙОНА ВОРОНЕЖСКОЙ ОБЛАСТИ;"ОБЩЕСТВО С ОГРАНИЧЕННОЙ ОТВЕТСТВЕННОСТЬЮ ""СТИЛЬ СТРОЙ СЕРВИС РАЗВИТИЕ""";1 - Победитель;41 985 477,50;"ОБЩЕСТВО С ОГРАНИЧЕННОЙ ОТВЕТСТВЕННОСТЬЮ ""ВЕКТОР С""";2 - Второй номер;54 021 314,67;31.01.2023;08.02.2021;;394026, ОБЛ ВОРОНЕЖСКАЯ 36, Г ВОРОНЕЖ, УЛ БРЯНСКАЯ, ДОМ 15 А, ПОМ. 2, ОФИС 4А;3666197796;7-960-1068989ooo.sssr.17@mail.ru
№ 0131300045220000196;https://zakupki.gov.ru//epz/order/notice/ea44/view/common-info.html?regNumber=0131300045220000196;Определение поставщика отменено;Ремонт автомобильныхдорогобщего пользования местного значения на территории Бобровского муниципального районаВоронежскойобласти (I этап).;АДМИНИСТРАЦИЯ БОБРОВСКОГО МУНИЦИПАЛЬНОГО РАЙОНАВОРОНЕЖСКОЙОБЛАСТИ;29.12.2020;86 048 025,00 ₽;;;;;;;;;;;;;;
№ 32009864663;https://zakupki.gov.ru/https://zakupki.gov.ru/223/purchase/public/purchase/info/common-info.html?regNumber=32009864663;Закупка завершена;...  геоинформационной системы автомобильныхдорогГосударственной компании «Российские автомобильныедороги»: М-1 «Беларусь ...  Украиной, М-4 «Дон» Москва –Воронеж– Ростов-на-Дону – Краснодар – Новороссийск ... -Санкт-Петербург», А 105 «Подъезднаядорогаот Москвы к аэропорту Домодедово ...;"ОБЩЕСТВО С ОГРАНИЧЕННОЙ ОТВЕТСТВЕННОСТЬЮ ""АВТОДОР-ИНЖИНИРИНГ""";29.12.2020;18 269 254,00 ₽;;;;;;;;;;;;;;
№ 32009863913;https://zakupki.gov.ru/https://zakupki.gov.ru/223/purchase/public/purchase/info/common-info.html?regNumber=32009863913;Закупка завершена;Запрос котировок в электронной форме № 4642/ЗКТЭ-ДЖВ/20 на право заключения договора оказания услуг по пожарной безопасности (вокзалыВоронеж-1, Лиски, Россошь, Поворино, Борисоглебск, Таловая,Воронеж-Южный, Белгород, Валуйки, Старый Оскол);"ОТКРЫТОЕ АКЦИОНЕРНОЕ ОБЩЕСТВО ""РОССИЙСКИЕ ЖЕЛЕЗНЫЕДОРОГИ""";29.12.2020;1 172 784,00 ₽;;;;;;;;;;;;;;
№ 0131300045220000194;https://zakupki.gov.ru//epz/order/notice/ea44/view/common-info.html?regNumber=0131300045220000194;Определение поставщика завершено;Строительство автомобильнойдороги«М «Дон» - Бобров - Таловая – Новохоперск» - КФХ Колесников Ю.Н в Бобровском муниципальном районеВоронежскойобласти;АДМИНИСТРАЦИЯ БОБРОВСКОГО МУНИЦИПАЛЬНОГО РАЙОНАВОРОНЕЖСКОЙОБЛАСТИ;28.12.2020;272 772 241,00 ₽;https://zakupki.gov.ru/epz/order/notice/ea44/view/supplier-results.html?regNumber=0131300045220000194;АДМИНИСТРАЦИЯ БОБРОВСКОГО МУНИЦИПАЛЬНОГО РАЙОНА ВОРОНЕЖСКОЙ ОБЛАСТИ;Согласование получено;;По результатам рассмотрения вторых частей заявок принято решение о соответствии указанным требованиям только одной второй части заявки на участие в нем (ч.13 ст.69 Закона № 44-ФЗ).;;"ОБЩЕСТВО С ОГРАНИЧЕННОЙ ОТВЕТСТВЕННОСТЬЮ ""РОССОШАНСКОЕ ДОРОЖНОЕ РЕМОНТНО-СТРОИТЕЛЬНОЕ УПРАВЛЕНИЕ № 1""";;;;;;;
№ 32009857213;https://zakupki.gov.ru/https://zakupki.gov.ru/223/purchase/public/purchase/info/common-info.html?regNumber=32009857213;Закупка завершена;Оказание услуг по поставке электроэнергии для нуждВоронежскогоотряда филиала ФГП ВО ЖДТ России на Юго-Восточной железнойдороге;"ФЕДЕРАЛЬНОЕ ГОСУДАРСТВЕННОЕ ПРЕДПРИЯТИЕ ""ВЕДОМСТВЕННАЯ ОХРАНА ЖЕЛЕЗНОДОРОЖНОГО ТРАНСПОРТА РОССИЙСКОЙ ФЕДЕРАЦИИ""";28.12.2020;2 608 200,00 ₽;;;;;;;;;;;;;;
№ 0131300021820000092;https://zakupki.gov.ru//epz/order/notice/ea44/view/common-info.html?regNumber=0131300021820000092;Определение поставщика завершено;Выполнение работ по содержанию объектов улично-дорожной сети, благоустройства и озеленения в городе Павловске 1 квартал;АДМИНИСТРАЦИЯ ГОРОДСКОГО ПОСЕЛЕНИЯ ГОРОД ПАВЛОВСК ПАВЛОВСКОГО МУНИЦИПАЛЬНОГО РАЙОНАВОРОНЕЖСКОЙОБЛАСТИ;26.12.2020;6 000 000,00 ₽;https://zakupki.gov.ru/epz/order/notice/ea44/view/supplier-results.html?regNumber=0131300021820000092;АДМИНИСТРАЦИЯ ГОРОДСКОГО ПОСЕЛЕНИЯ ГОРОД ПАВЛОВСК ПАВЛОВСКОГО МУНИЦИПАЛЬНОГО РАЙОНА ВОРОНЕЖСКОЙ ОБЛАСТИ;;По окончании срока подачи заявок подана только одна заявка. Такая заявка признана соответствующей требованиям Федерального закона № 44-ФЗ и документации об аукционе. Электронный аукцион признан несостоявшимся по основанию, предусмотренному ч. 1 ст. 71 Федерального закона № 44-ФЗ;;ПАВЛОВСКОЕ МУНИЦИПАЛЬНОЕ УНИТАРНОЕ ПРЕДПРИЯТИЕ ЖИЛИЩНО-КОММУНАЛЬНОГО ХОЗЯЙСТВА;;6 000 000,00;30.04.2021;25.01.2021;;396420, ОБЛ ВОРОНЕЖСКАЯ 36, Г ПАВЛОВСК, УЛ ЮЛИУСА ФУЧИКА, 11;3620002772;
№ 32009832211;https://zakupki.gov.ru/https://zakupki.gov.ru/223/purchase/public/purchase/info/common-info.html?regNumber=32009832211;Закупка завершена;Конкурс в электронной форме на право заключения Договора на выполнение работ по капитальному ремонту автомобильнойдорогиМ-4 «Дон» Москва –Воронеж– Ростов –на – Дону – Краснодар – Новороссийск на участке км 1494+000 – км 1503+000, Краснодарский край(с привлечением к исполнению договора субподрядчиков (соисполнителей) из числа субъектов малого и среднего предпринимательства);"ГОСУДАРСТВЕННАЯ КОМПАНИЯ ""РОССИЙСКИЕ АВТОМОБИЛЬНЫЕДОРОГИ""";22.12.2020;1 541 721 150,00 ₽;;;;;;;;;;;;;;
№ 32009830880;https://zakupki.gov.ru/https://zakupki.gov.ru/223/purchase/public/purchase/info/common-info.html?regNumber=32009830880;Работа комиссии;...  объекту АвтомобильнаядорогаМ-4 «Дон» - от Москвы черезВоронеж, Ростов-на ... +300 автомобильнойдорогиМ-4 «Дон» - от Москвы черезВоронеж, Ростов-на ...;"ГОСУДАРСТВЕННАЯ КОМПАНИЯ ""РОССИЙСКИЕ АВТОМОБИЛЬНЫЕДОРОГИ""";22.12.2020;299 146 580,00 ₽;;;;;;;;;;;;;;
№ 32009830060;https://zakupki.gov.ru/https://zakupki.gov.ru/223/purchase/public/purchase/info/common-info.html?regNumber=32009830060;Работа комиссии;Конкурс в электронной форме на право заключения Договора на разработку проектно-сметной и технической документации по объекту: АвтомобильнаядорогаМ-4 «Дон» Москва -Воронеж- Ростов-на-Дону - Краснодар - Новороссийск. Капитальный ремонт водопропускной трубы на км 886+339. Проход по н.п. Тарасовский, Ростовская область» (участниками которого могут являться только субъекты малого и среднего предпринимательства);"ГОСУДАРСТВЕННАЯ КОМПАНИЯ ""РОССИЙСКИЕ АВТОМОБИЛЬНЫЕДОРОГИ""";22.12.2020;1 491 840,00 ₽;;;;;;;;;;;;;;
№ 0131200001020013549;https://zakupki.gov.ru//epz/order/notice/ea44/view/common-info.html?regNumber=0131200001020013549;Определение поставщика завершено;2020-14624/ Выполнение работ по капитальному ремонту мостового перехода через р. Гаврило  на км 6+160 автомобильнойдорогиПавловск-Калач-Петропавловка в Павловском муниципальном районеВоронежскойобласти;УПРАВЛЕНИЕ ПО РЕГУЛИРОВАНИЮ КОНТРАКТНОЙ СИСТЕМЫ В СФЕРЕ ЗАКУПОКВОРОНЕЖСКОЙОБЛАСТИ;21.12.2020;67 314 137,00 ₽;https://zakupki.gov.ru/epz/order/notice/ea44/view/supplier-results.html?regNumber=0131200001020013549;ДЕПАРТАМЕНТ ДОРОЖНОЙ ДЕЯТЕЛЬНОСТИ ВОРОНЕЖСКОЙ ОБЛАСТИ;"ОБЩЕСТВО С ОГРАНИЧЕННОЙ ОТВЕТСТВЕННОСТЬЮ ""РУСТЕХНОЛОГИИ""";1 - Победитель;53 514 738,71;"ОБЩЕСТВО С ОГРАНИЧЕННОЙ ОТВЕТСТВЕННОСТЬЮ ""ДОРОЖНО-СТРОИТЕЛЬНОЕ УПРАВЛЕНИЕ №7""";2 - Второй номер;66 977 566,31;31.12.2021;27.01.2021;;394033, г.Воронеж, ул. Остужева, д.43Г, помещение 1;3666187131;8-910-34180822001520@mail.ru
№ 0131200001020013512;https://zakupki.gov.ru//epz/order/notice/ea44/view/common-info.html?regNumber=0131200001020013512;Определение поставщика завершено;"2020-14598/ Выполнение работ по ремонту мостового перехода на км 23+500 автомобильнойдорогиМ ""Дон""-Богучар-Петропавловка в Петропавловском муниципальном районеВоронежскойобласти";УПРАВЛЕНИЕ ПО РЕГУЛИРОВАНИЮ КОНТРАКТНОЙ СИСТЕМЫ В СФЕРЕ ЗАКУПОКВОРОНЕЖСКОЙОБЛАСТИ;18.12.2020;150 351 160,00 ₽;https://zakupki.gov.ru/epz/order/notice/ea44/view/supplier-results.html?regNumber=0131200001020013512;ДЕПАРТАМЕНТ ДОРОЖНОЙ ДЕЯТЕЛЬНОСТИ ВОРОНЕЖСКОЙ ОБЛАСТИ;"ОБЩЕСТВО С ОГРАНИЧЕННОЙ ОТВЕТСТВЕННОСТЬЮ СТРОИТЕЛЬНОЕ ПРЕДПРИЯТИЕ ""МОСТОСТРОЙ""";1 - Победитель;141 330 090,40;"ОБЩЕСТВО С ОГРАНИЧЕННОЙ ОТВЕТСТВЕННОСТЬЮ ""ИНЖСТРОЙ""";2 - Второй номер;142 081 846,20;31.12.2021;26.01.2021;;392524, ОБЛ ТАМБОВСКАЯ, Р-Н ТАМБОВСКИЙ, МКР ПЕРИКСИНСКИЙ, ПОСЕЛЕНИЕ ПОКРОВО-ПРИГОРОДНЫЙ С/С, СТРОЕНИЕ 6А,;6820039655;791-588-95522vasia77@mail.ru
№ 0818500000820007014;https://zakupki.gov.ru//epz/order/notice/ok504/view/common-info.html?regNumber=0818500000820007014;Определение поставщика завершено;"Выполнение проектно-изыскательских работ по объекту: ""Капитальный ремонт автомобильнойдорогист-цаВоронежская- с.Суворовское - ст-ца Пластуновская на участке км 32+530 - км 36+802 в Динском районе""";"ГОСУДАРСТВЕННОЕ КАЗЕННОЕ УЧРЕЖДЕНИЕ КРАСНОДАРСКОГО КРАЯ ""ДИРЕКЦИЯ ГОСУДАРСТВЕННЫХ ЗАКУПОК""";17.12.2020;18 679 693,20 ₽;https://zakupki.gov.ru/epz/order/notice/ea44/view/supplier-results.html?regNumber=0818500000820007014;МИНИСТЕРСТВО ТРАНСПОРТА И ДОРОЖНОГО ХОЗЯЙСТВА КРАСНОДАРСКОГО КРАЯ;"ОБЩЕСТВО С ОГРАНИЧЕННОЙ ОТВЕТСТВЕННОСТЬЮ ""ИНЖПРОЕКТСТРОЙ""";1 - Победитель;16 624 926,00;"ОБЩЕСТВО С ОГРАНИЧЕННОЙ ОТВЕТСТВЕННОСТЬЮ ""АНДЭКСПРО""";2 - Второй номер;8 590 195,75;31.08.2021;11.02.2021;;350038, КРАЙ КРАСНОДАРСКИЙ, Г КРАСНОДАР, УЛ ПРОМЫШЛЕННАЯ, ДОМ 49, ПОМЕЩЕНИЕ 37;2309118153;7-861-2595054post@injps.ru
№ 0818500000820007011;https://zakupki.gov.ru//epz/order/notice/ok504/view/common-info.html?regNumber=0818500000820007011;Определение поставщика завершено;"Выполнение проектно-изыскательских работ по объекту: ""Капитальный ремонт автомобильнойдорогист-цаВоронежская- с.Суворовское - ст-ца Пластуновская  на участке км 0+000 - км 10+800 в Усть-Лабинском районе""";"ГОСУДАРСТВЕННОЕ КАЗЕННОЕ УЧРЕЖДЕНИЕ КРАСНОДАРСКОГО КРАЯ ""ДИРЕКЦИЯ ГОСУДАРСТВЕННЫХ ЗАКУПОК""";17.12.2020;19 605 775,20 ₽;https://zakupki.gov.ru/epz/order/notice/ea44/view/supplier-results.html?regNumber=0818500000820007011;МИНИСТЕРСТВО ТРАНСПОРТА И ДОРОЖНОГО ХОЗЯЙСТВА КРАСНОДАРСКОГО КРАЯ;"ОБЩЕСТВО С ОГРАНИЧЕННОЙ ОТВЕТСТВЕННОСТЬЮ ""ИНЖПРОЕКТСТРОЙ""";1 - Победитель;17 449 140,00;"ОБЩЕСТВО С ОГРАНИЧЕННОЙ ОТВЕТСТВЕННОСТЬЮ ""ПРОЕКТНО-КОНСТРУКТОРСКОЕ БЮРО ""ИДЕЯ""";2 - Второй номер;19 605 775,20;31.08.2021;11.02.2021;;350038, КРАЙ КРАСНОДАРСКИЙ, Г КРАСНОДАР, УЛ ПРОМЫШЛЕННАЯ, ДОМ 49, ПОМЕЩЕНИЕ 37;2309118153;7-861-2595054post@injps.ru
№ 32009808398;https://zakupki.gov.ru/https://zakupki.gov.ru/223/purchase/public/purchase/info/common-info.html?regNumber=32009808398;Закупка завершена;...  объекту «АвтомобильнаядорогаМ-4 «Дон» - от Москвы черезВоронеж, Ростов-на ...  основе автомобильнойдорогиМ-4 «Дон» от Москвы черезВоронеж, Ростов-на ... » Этап №5. Строительство автомобильнойдорогиМ-4 «Дон» на участке ...;"ОБЩЕСТВО С ОГРАНИЧЕННОЙ ОТВЕТСТВЕННОСТЬЮ ""АВТОДОР-ИНЖИНИРИНГ""";16.12.2020;417 322 754,10 ₽;;;;;;;;;;;;;;
№ 0131300069020000022;https://zakupki.gov.ru//epz/order/notice/ea44/view/common-info.html?regNumber=0131300069020000022;Определение поставщика завершено;Выполнение работ по содержаниюдорогв 2021 году Ольховатского городского поселения Ольховатского муниципального районаВоронежскойобласти (уборка снега);АДМИНИСТРАЦИЯ ОЛЬХОВАТСКОГО ГОРОДСКОГО ПОСЕЛЕНИЯ ОЛЬХОВАТСКОГО МУНИЦИПАЛЬНОГО РАЙОНАВОРОНЕЖСКОЙОБЛАСТИ;15.12.2020;1 500 000,00 ₽;https://zakupki.gov.ru/epz/order/notice/ea44/view/supplier-results.html?regNumber=0131300069020000022;АДМИНИСТРАЦИЯ ОЛЬХОВАТСКОГО ГОРОДСКОГО ПОСЕЛЕНИЯ ОЛЬХОВАТСКОГО МУНИЦИПАЛЬНОГО РАЙОНА ВОРОНЕЖСКОЙ ОБЛАСТИ;Петрова В. Ю.;1 - Победитель;1 466 700,98;Тищенко Л. В.;2 - Второй номер;1 474 999,80;31.12.2021;11.01.2021;;ОБЛ ВОРОНЕЖСКАЯ 36, Р-Н ОЛЬХОВАТСКИЙ, - ОЛЬХОВАТКА;Да;субъект малого предпринимательства
№ 32009804235;https://zakupki.gov.ru/https://zakupki.gov.ru/223/purchase/public/purchase/info/common-info.html?regNumber=32009804235;Закупка завершена;Договор на выполнение работ по уточнению границавтодорогив ЕГРН для безвозмездной передачи в Департамент автомобильныхдорог Воронежскойобласти;"ОБЩЕСТВО С ОГРАНИЧЕННОЙ ОТВЕТСТВЕННОСТЬЮ ""ГАЗПРОМ ТРАНСГАЗ ВОЛГОГРАД""";15.12.2020;92 000,00 ₽;;;;;;;;;;;;;;
№ 0354100008420000111;https://zakupki.gov.ru//epz/order/notice/ok504/view/common-info.html?regNumber=0354100008420000111;Определение поставщика завершено;"...  по повышению уровня обустройства автомобильныхдорогфедерального значения. Расходы на ...  автомобильныхдорогфедерального значения. Устройство стационарного электрического освещения на автомобильнойдороге...  Р-298 Курск -Воронеж- автомобильнаядорогаР-22 ""Каспий ...  Бродовое), на автомобильнойдорогеР-193Воронеж- Тамбов на участке км ... .п. Большой Самовец),Воронежскаяобласть";"ФЕДЕРАЛЬНОЕ КАЗЕННОЕ УЧРЕЖДЕНИЕ ""УПРАВЛЕНИЕ АВТОМОБИЛЬНОЙ МАГИСТРАЛИ МОСКВА-ХАРЬКОВ ФЕДЕРАЛЬНОГО ДОРОЖНОГО АГЕНТСТВА""";15.12.2020;3 120 000,00 ₽;https://zakupki.gov.ru/epz/order/notice/ea44/view/supplier-results.html?regNumber=0354100008420000111;"ФЕДЕРАЛЬНОЕ КАЗЕННОЕ УЧРЕЖДЕНИЕ ""УПРАВЛЕНИЕ АВТОМОБИЛЬНОЙ МАГИСТРАЛИ МОСКВА-ХАРЬКОВ ФЕДЕРАЛЬНОГО ДОРОЖНОГО АГЕНТСТВА""";;По окончании срока подачи заявок подана только одна заявка, заявка соответствует требованиям. Конкурс в электронной форме признан несостоявшимся (ч. 16 ст. 54.4 Закона № 44-ФЗ);;"ОБЩЕСТВО С ОГРАНИЧЕННОЙ ОТВЕТСТВЕННОСТЬЮ ""ЦЕНТР - ДОРСЕРВИС""";;3 120 000,00;09.08.2021;29.01.2021;;394033, ОБЛ ВОРОНЕЖСКАЯ 36, Г ВОРОНЕЖ, ПР-КТ Ленинский  д.172 офис 11;3666094663;7-4732-610850cds@cds.vrn.ru
