Номер закупки;Ссылка на продукт;Статус;Описание объекта;Организация;Дата размещения;Цена;Ссылка на поставщика;Заказчик;Победитель;Статус победителя;Цена победителя;Второй номер;Статус второго номера;Цена второго номера;Дата начала контракта;Дата окончания контракта;ФИО Руководителя;ИНН;Контакты
№ 0833600000820000603;https://zakupki.gov.ru//epz/order/notice/ea44/view/common-info.html?regNumber=0833600000820000603;Определение поставщика завершено;Выполнение кадастровых работ по подготовке технических планов автомобильныхдорог;"МУНИЦИПАЛЬНОЕ КАЗЕННОЕ УЧРЕЖДЕНИЕ ""УПРАВЛЕНИЕ МУНИЦИПАЛЬНЫМИ ЗАКУПКАМИ""";11.11.2020;221 733,33 ₽;https://zakupki.gov.ru/epz/order/notice/ea44/view/supplier-results.html?regNumber=0833600000820000603;ИВАНОВСКИЙ ГОРОДСКОЙ КОМИТЕТ ПО УПРАВЛЕНИЮ ИМУЩЕСТВОМ;"ОБЩЕСТВО С ОГРАНИЧЕННОЙ ОТВЕТСТВЕННОСТЬЮ ""ГЕОСТРОЙ""";1 - Победитель;64 891,33;"ОБЩЕСТВО С ОГРАНИЧЕННОЙ ОТВЕТСТВЕННОСТЬЮ ""НАУЧНО-ТЕХНИЧЕСКИЙ ЦЕНТР ЭВЕРЕСТ""";2 - Второй номер;66 000,00;31.12.2020;07.12.2020;;153000, ОБЛ ИВАНОВСКАЯ 37, Г ИВАНОВО, ПЛ РЕВОЛЮЦИИ, 7, ОФИС 412;3702706138;субъект малого предпринимательства
№ 0848300048220000543;https://zakupki.gov.ru//epz/order/notice/ok504/view/common-info.html?regNumber=0848300048220000543;Определение поставщика завершено;Выполнение работ по содержанию муниципальных автомобильныхдорогв территориальных отделах Павло-Слободское, Обушковское,Ивановское;"МУНИЦИПАЛЬНОЕ КАЗЕННОЕ УЧРЕЖДЕНИЕ ""ЦЕНТР ЗАКУПОК""";11.11.2020;36 560 000,00 ₽;https://zakupki.gov.ru/epz/order/notice/ea44/view/supplier-results.html?regNumber=0848300048220000543;АДМИНИСТРАЦИЯ ГОРОДСКОГО ОКРУГА ИСТРА МОСКОВСКОЙ ОБЛАСТИ;"ОБЩЕСТВО С ОГРАНИЧЕННОЙ ОТВЕТСТВЕННОСТЬЮ ""СОГЛАСИЕ""";1 - Победитель;36 560 000,00;"ОБЩЕСТВО С ОГРАНИЧЕННОЙ ОТВЕТСТВЕННОСТЬЮ ""КОНОР""";2 - Второй номер;27 602 800,00;31.12.2021;28.12.2020;;129128, г.Москва, ул.ПРОЕЗД БУДАЙСКИЙ, д.3;7716804301;89670547797ooosoglasie00@mail.ru
№ 0125300003920000096;https://zakupki.gov.ru//epz/order/notice/ea44/view/common-info.html?regNumber=0125300003920000096;Определение поставщика завершено;Ремонт автомобильнойдорогиобщего пользования местного значения по ул. Пушкина (от ул. Черно-Ивановадо ул. Волгоградская) в г. Ахтубинске Астраханской области;"АДМИНИСТРАЦИЯ МУНИЦИПАЛЬНОГО ОБРАЗОВАНИЯ ""ГОРОД АХТУБИНСК""";11.11.2020;3 718 126,80 ₽;https://zakupki.gov.ru/epz/order/notice/ea44/view/supplier-results.html?regNumber=0125300003920000096;"АДМИНИСТРАЦИЯ МУНИЦИПАЛЬНОГО ОБРАЗОВАНИЯ ""ГОРОД АХТУБИНСК""";;По окончании срока подачи заявок подана только одна заявка. Такая заявка признана соответствующей требованиям Федерального закона № 44-ФЗ и документации об аукционе. Электронный аукцион признан несостоявшимся по основанию, предусмотренному ч. 1 ст. 71 Федерального закона № 44-ФЗ;;"ОБЩЕСТВО С ОГРАНИЧЕННОЙ ОТВЕТСТВЕННОСТЬЮ ""БАРС""";;3 718 126,80;31.12.2020;02.12.2020;;416506, ОБЛ АСТРАХАНСКАЯ 30, Г АХТУБИНСК, УЛ ЩЕРБАКОВА, 15, В, 55;3001042344;субъект малого предпринимательства
№ 0133300013220000009;https://zakupki.gov.ru//epz/order/notice/ea44/view/common-info.html?regNumber=0133300013220000009;Определение поставщика завершено;Подсыпкадорогпротивогололедной смесью;АДМИНИСТРАЦИЯ КОЛОБОВСКОГО ГОРОДСКОГО ПОСЕЛЕНИЯ ШУЙСКОГО МУНИЦИПАЛЬНОГО РАЙОНАИВАНОВСКОЙОБЛАСТИ;09.11.2020;340 166,40 ₽;https://zakupki.gov.ru/epz/order/notice/ea44/view/supplier-results.html?regNumber=0133300013220000009;АДМИНИСТРАЦИЯ КОЛОБОВСКОГО ГОРОДСКОГО ПОСЕЛЕНИЯ ШУЙСКОГО МУНИЦИПАЛЬНОГО РАЙОНА ИВАНОВСКОЙ ОБЛАСТИ;;По окончании срока подачи заявок подана только одна заявка. Такая заявка признана соответствующей требованиям Федерального закона № 44-ФЗ и документации об аукционе. Электронный аукцион признан несостоявшимся по основанию, предусмотренному ч. 1 ст. 71 Федерального закона № 44-ФЗ;;"ОБЩЕСТВО С ОГРАНИЧЕННОЙ ОТВЕТСТВЕННОСТЬЮ ""КАРЬЕР ЮЖНЫЙ""";;340 166,40;31.12.2021;01.12.2020;;155630, Российская Федерация, Ивановская область, Шуйский р-н, д. Семейкино, ул. Строителей, д.9, кв. 2;3706020460;7-910-6684133kotygin1977@mail.ru
№ 0133200001720002732;https://zakupki.gov.ru//epz/order/notice/ea44/view/common-info.html?regNumber=0133200001720002732;Определение поставщика отменено;Внедрение интеллектуальных транспортных систем, предусматривающих автоматизацию процессов управления дорожным движением в городских агломерациях, включающих города с населением свыше 300 тысяч человек;ДЕПАРТАМЕНТ КОНКУРСОВ И АУКЦИОНОВИВАНОВСКОЙОБЛАСТИ;05.11.2020;54 363 244,23 ₽;;;;;;;;;;;;;;
№ 32009648488;https://zakupki.gov.ru/https://zakupki.gov.ru/223/purchase/public/purchase/info/common-info.html?regNumber=32009648488;Закупка завершена;Оказание услуг по проведению предрейсовых и послерейсовых медицинских осмотров (водителей) структурных подразделений филиала ФГП ВО ЖДТ России на Северной железнойдорогев г.Иваново;"ФЕДЕРАЛЬНОЕ ГОСУДАРСТВЕННОЕ ПРЕДПРИЯТИЕ ""ВЕДОМСТВЕННАЯ ОХРАНА ЖЕЛЕЗНОДОРОЖНОГО ТРАНСПОРТА РОССИЙСКОЙ ФЕДЕРАЦИИ""";05.11.2020;26 650,00 ₽;;;;;;;;;;;;;;
№ 0128200000120005856;https://zakupki.gov.ru//epz/order/notice/ok504/view/common-info.html?regNumber=0128200000120005856;Определение поставщика завершено;"Выполнение работ по ремонту автомобильныхдорогСобинка – Вышманово – Буланово – Коняево на  ... +003 - км 3+745, ""Владимир -Иваново"" - Спасское-Городище на участке км ...";ДЕПАРТАМЕНТ ИМУЩЕСТВЕННЫХ И ЗЕМЕЛЬНЫХ ОТНОШЕНИЙ ВЛАДИМИРСКОЙ ОБЛАСТИ;03.11.2020;308 238 735,00 ₽;https://zakupki.gov.ru/epz/order/notice/ea44/view/supplier-results.html?regNumber=0128200000120005856;"ГОСУДАРСТВЕННОЕ БЮДЖЕТНОЕ УЧРЕЖДЕНИЕ ВЛАДИМИРСКОЙ ОБЛАСТИ ""УПРАВЛЕНИЕ АВТОМОБИЛЬНЫХ ДОРОГ АДМИНИСТРАЦИИ ВЛАДИМИРСКОЙ ОБЛАСТИ""";"ОБЩЕСТВО С ОГРАНИЧЕННОЙ ОТВЕТСТВЕННОСТЬЮ ""ВЛАДИМИРСКАЯ СТРОИТЕЛЬНАЯ КОМПАНИЯ""";1 - Победитель;219 000 000,00;"ОБЩЕСТВО С ОГРАНИЧЕННОЙ ОТВЕТСТВЕННОСТЬЮ ""ДОРОЖНО-СТРОИТЕЛЬНАЯ КОМПАНИЯ ""ТРАССА""";2 - Второй номер;225 013 276,55;08.10.2021;22.12.2020;;600020, ОБЛ ВЛАДИМИРСКАЯ 33, Г ВЛАДИМИР, УЛ БОЛЬШАЯ НИЖЕГОРОДСКАЯ, 34Б, 405;3329066353;8-4922-471154vladsk33@yandex.ru
№ 0133300020020000161;https://zakupki.gov.ru//epz/order/notice/ea44/view/common-info.html?regNumber=0133300020020000161;Определение поставщика завершено;Работы по оборудованию искусственным освещением участков улично-дорожной сети ул. Кооперативная в границах д. ж.-д. ст. ЕрмолиноИвановскогорайона;АДМИНИСТРАЦИЯИВАНОВСКОГОМУНИЦИПАЛЬНОГО РАЙОНА;03.11.2020;904 437,95 ₽;https://zakupki.gov.ru/epz/order/notice/ea44/view/supplier-results.html?regNumber=0133300020020000161;АДМИНИСТРАЦИЯ ТИМОШИХСКОГО СЕЛЬСКОГО ПОСЕЛЕНИЯ;"ОБЩЕСТВО С ОГРАНИЧЕННОЙ ОТВЕТСТВЕННОСТЬЮ ""СТРОЙИНЖЕНЕРМОНТАЖ""";1 - Победитель;786 861,01;"ОБЩЕСТВО С ОГРАНИЧЕННОЙ ОТВЕТСТВЕННОСТЬЮ ""СТРОЙМОНТАЖ""";2 - Второй номер;791 383,20;30.12.2020;26.11.2020;;153000, ОБЛ ИВАНОВСКАЯ 37, Г ИВАНОВО, УЛ КУЗНЕЦОВА, ДОМ 11/38, ОФИС 37;3702000511;7-4932-2220201234@mail.ru
№ 0133300013220000008;https://zakupki.gov.ru//epz/order/notice/ea44/view/common-info.html?regNumber=0133300013220000008;Определение поставщика завершено;Расчисткадорогот снега в населенных пунктах Колобовского городского поселения;АДМИНИСТРАЦИЯ КОЛОБОВСКОГО ГОРОДСКОГО ПОСЕЛЕНИЯ ШУЙСКОГО МУНИЦИПАЛЬНОГО РАЙОНАИВАНОВСКОЙОБЛАСТИ;03.11.2020;483 201,68 ₽;https://zakupki.gov.ru/epz/order/notice/ea44/view/supplier-results.html?regNumber=0133300013220000008;АДМИНИСТРАЦИЯ КОЛОБОВСКОГО ГОРОДСКОГО ПОСЕЛЕНИЯ ШУЙСКОГО МУНИЦИПАЛЬНОГО РАЙОНА ИВАНОВСКОЙ ОБЛАСТИ;;По окончании срока подачи заявок подана только одна заявка. Такая заявка признана соответствующей требованиям Федерального закона № 44-ФЗ и документации об аукционе. Электронный аукцион признан несостоявшимся по основанию, предусмотренному ч. 1 ст. 71 Федерального закона № 44-ФЗ;;"ОБЩЕСТВО С ОГРАНИЧЕННОЙ ОТВЕТСТВЕННОСТЬЮ ""ЦЕНТР КЛИНИНГОВЫХ УСЛУГ""";;483 201,68;22.05.2021;23.11.2020;;108814, Г МОСКВА 77, ПОС. СОСЕНСКОЕ, Д СОСЕНКИ, УЛ СОСНОВАЯ, СТРОЕНИЕ 4, ЭТАЖ 3 КОМН 215;7751164189;7-966-0509271zku2019@mail.ru
№ 0133200001720002715;https://zakupki.gov.ru//epz/order/notice/ea44/view/common-info.html?regNumber=0133200001720002715;Определение поставщика завершено;Текущий ремонт технических средств автоматической фотовидеофиксации нарушений ПДД, установленных на автомобильныхдорогахобщего пользования регионального и межмуниципального значенияИвановскойобласти в целях обеспечения их работы;ДЕПАРТАМЕНТ КОНКУРСОВ И АУКЦИОНОВИВАНОВСКОЙОБЛАСТИ;02.11.2020;2 926 000,00 ₽;https://zakupki.gov.ru/epz/order/notice/ea44/view/supplier-results.html?regNumber=0133200001720002715;ДЕПАРТАМЕНТ ДОРОЖНОГО ХОЗЯЙСТВА И ТРАНСПОРТА ИВАНОВСКОЙ ОБЛАСТИ;;В течение десяти минут после начала проведения электронного аукциона было подано единственное предложение о цене контракта. По результатам рассмотрения второй части такой заявки принято решение о ее соответствии требованиям, установленным документацией об электронном аукционе (ч.13 ст.69 Закона № 44-ФЗ).;;"ОБЩЕСТВО С ОГРАНИЧЕННОЙ ОТВЕТСТВЕННОСТЬЮ ""ТЕПЛОЭНЕРГОСТРОЙ""";;2 911 370,00;31.12.2020;04.12.2020;;398042, Российская Федерация,  ОБЛ ЛИПЕЦКАЯ,  Г ЛИПЕЦК,  ПРОЕЗД УНИВЕРСАЛЬНЫЙ,  ВЛД 14, ПОМЕЩЕНИЕ 8;4825132911;79036996818tec48@mail.ru
№ 0133100007020000090;https://zakupki.gov.ru//epz/order/notice/ea44/view/common-info.html?regNumber=0133100007020000090;Определение поставщика завершено;"Поставка возимых радиостанций ""Гранит-203"" РМНК.464511.321ТУ (либо эквивалент) для нужд УМВД России поИвановскойобласти (в рамках реализации федерального проекта ""Безопасность дорожного движения"" национального проекта ""Безопасные и качественные автомобильныедороги"")";УПРАВЛЕНИЕ МИНИСТЕРСТВА ВНУТРЕННИХ ДЕЛ РОССИЙСКОЙ ФЕДЕРАЦИИ ПОИВАНОВСКОЙОБЛАСТИ;30.10.2020;1 436 000,00 ₽;https://zakupki.gov.ru/epz/order/notice/ea44/view/supplier-results.html?regNumber=0133100007020000090;УПРАВЛЕНИЕ МИНИСТЕРСТВА ВНУТРЕННИХ ДЕЛ РОССИЙСКОЙ ФЕДЕРАЦИИ ПО ИВАНОВСКОЙ ОБЛАСТИ;;По окончании срока подачи заявок подана только одна заявка. Такая заявка признана соответствующей требованиям Федерального закона № 44-ФЗ и документации об аукционе. Электронный аукцион признан несостоявшимся по основанию, предусмотренному ч. 1 ст. 71 Федерального закона № 44-ФЗ;;"ОБЩЕСТВО С ОГРАНИЧЕННОЙ ОТВЕТСТВЕННОСТЬЮ ""КОМПАНИЯ АЛЬФА-РАДИО""";;1 436 000,00;31.12.2020;23.11.2020;;129346, г. Москва, ул. Изумрудная, д.50, кв.107;7717792546;7-495-3746047info@alfaradio.ru
№ 32009631806;https://zakupki.gov.ru/https://zakupki.gov.ru/223/purchase/public/purchase/info/common-info.html?regNumber=32009631806;Закупка завершена;Запрос котировок среди субъектов малого и среднего предпринимательства в электронной форме № 3718/ЗКТЭ-ЦДЗС/20 на право заключения договоров оказания услуг по охране имущества на объектах Северной дирекции снабжения;"ОТКРЫТОЕ АКЦИОНЕРНОЕ ОБЩЕСТВО ""РОССИЙСКИЕ ЖЕЛЕЗНЫЕДОРОГИ""";29.10.2020;;;;;;;;;;;;;;;
№ 0133300026320000014;https://zakupki.gov.ru//epz/order/notice/ea44/view/common-info.html?regNumber=0133300026320000014;Определение поставщика завершено;Содержание автомобильныхдорогЮрьевецкого городского поселения в осенне-зимний период;КОМИТЕТ ПО УПРАВЛЕНИЮ МУНИЦИПАЛЬНЫМ ИМУЩЕСТВОМ, ЗЕМЕЛЬНЫМ ОТНОШЕНИЯМ И СЕЛЬСКОМУ ХОЗЯЙСТВУ АДМИНИСТРАЦИИ ЮРЬЕВЕЦКОГО МУНИЦИПАЛЬНОГО РАЙОНА;29.10.2020;3 991 470,50 ₽;https://zakupki.gov.ru/epz/order/notice/ea44/view/supplier-results.html?regNumber=0133300026320000014;АДМИНИСТРАЦИЯ ЮРЬЕВЕЦКОГО МУНИЦИПАЛЬНОГО РАЙОНА ИВАНОВСКОЙ ОБЛАСТИ;;По окончании срока подачи заявок подана только одна заявка. Такая заявка признана соответствующей требованиям Федерального закона № 44-ФЗ и документации об аукционе. Электронный аукцион признан несостоявшимся по основанию, предусмотренному ч. 1 ст. 71 Федерального закона № 44-ФЗ;;"ОБЩЕСТВО С ОГРАНИЧЕННОЙ ОТВЕТСТВЕННОСТЬЮ ""НЕЗАВИСИМАЯ СТРОИТЕЛЬНАЯ КОМПАНИЯ""";;3 991 470,50;29.01.2021;17.11.2020;;153510, ОБЛ ИВАНОВСКАЯ 37, Г КОХМА, ПЛ ОКТЯБРЬСКАЯ, ДОМ 8, КАБИНЕТ 3;3702129265;субъект малого предпринимательства
№ 0169300027820000191;https://zakupki.gov.ru//epz/order/notice/ea44/view/common-info.html?regNumber=0169300027820000191;Определение поставщика завершено;Обслуживание уличного освещения;АДМИНИСТРАЦИЯ КАТАВ-ИВАНОВСКОГОМУНИЦИПАЛЬНОГО РАЙОНА;29.10.2020;30 000,00 ₽;https://zakupki.gov.ru/epz/order/notice/ea44/view/supplier-results.html?regNumber=0169300027820000191;АДМИНИСТРАЦИЯ ВЕРХ-КАТАВСКОГО СЕЛЬСКОГО ПОСЕЛЕНИЯ КАТАВ-ИВАНОВСКОГО МУНИЦИПАЛЬНОГО РАЙОНА ЧЕЛЯБИНСКОЙ ОБЛАСТИ;;;;;;;;;;;;
№ 0169300027820000188;https://zakupki.gov.ru//epz/order/notice/ea44/view/common-info.html?regNumber=0169300027820000188;Определение поставщика завершено;Обслуживание уличного освещения;АДМИНИСТРАЦИЯ КАТАВ-ИВАНОВСКОГОМУНИЦИПАЛЬНОГО РАЙОНА;29.10.2020;55 966,40 ₽;https://zakupki.gov.ru/epz/order/notice/ea44/view/supplier-results.html?regNumber=0169300027820000188;АДМИНИСТРАЦИЯ СЕРПИЕВСКОГО СЕЛЬСКОГО ПОСЕЛЕНИЯ КАТАВ-ИВАНОВСКОГО МУНИЦИПАЛЬНОГО РАЙОНА ЧЕЛЯБИНСКОЙ ОБЛАСТИ;;;;;;;;;;;;
№ 0119200000120012133;https://zakupki.gov.ru//epz/order/notice/ea44/view/common-info.html?regNumber=0119200000120012133;Определение поставщика завершено;"№ ЭА 89229/20 ""Установка дорожно-знаковой информации в с.ИвановкаШарыповского района""";АГЕНТСТВО ГОСУДАРСТВЕННОГО ЗАКАЗА КРАСНОЯРСКОГО КРАЯ;28.10.2020;123 772,80 ₽;https://zakupki.gov.ru/epz/order/notice/ea44/view/supplier-results.html?regNumber=0119200000120012133;АДМИНИСТРАЦИЯ ИВАНОВСКОГО СЕЛЬСОВЕТА ШАРЫПОВСКОГО РАЙОНА КРАСНОЯРСКОГО КРАЯ РОССИЙСКОЙ ФЕДЕРАЦИИ;"ОБЩЕСТВО С ОГРАНИЧЕННОЙ ОТВЕТСТВЕННОСТЬЮ ""СЕРВИС-КОМ""";1 - Победитель;101 493,48;"ОБЩЕСТВО С ОГРАНИЧЕННОЙ ОТВЕТСТВЕННОСТЬЮ ""СПЕЦИАЛИЗИРОВАННОЕ МОНТАЖНО-ЭКСПЛУАТАЦИОННОЕ ПРЕДПРИЯТИЕ""";2 - Второй номер;102 112,35;31.12.2020;24.11.2020;;662306, КРАЙ КРАСНОЯРСКИЙ 24, Г ШАРЫПОВО, ГП ДУБИНИНО, УЛ ЛЕСНАЯ, ДОМ 7, КВАРТИРА 1;2459020679;7-962-0777799servis-kom.sh@yandex.ru
№ 32009630802;https://zakupki.gov.ru/https://zakupki.gov.ru/223/purchase/public/purchase/info/common-info.html?regNumber=32009630802;Закупка завершена;Запрос котировок среди субъектов малого и среднего предпринимательства в электронной форме № 3534/ЗКТЭ-СЕВ/20 на право заключения договоров оказания услуг по охране имущества объектов Северной дирекции по эксплуатации зданий и сооружений;"ОТКРЫТОЕ АКЦИОНЕРНОЕ ОБЩЕСТВО ""РОССИЙСКИЕ ЖЕЛЕЗНЫЕДОРОГИ""";28.10.2020;;;;;;;;;;;;;;;
№ 0156600036720000064;https://zakupki.gov.ru//epz/order/notice/ea44/view/common-info.html?regNumber=0156600036720000064;Определение поставщика завершено;Содержание а/дорогиЮм-У-Берёзовка-В-Коса-Сюзьва, Петраково-Ивановская(январь-декабрь 2021 г.);АДМИНИСТРАЦИЯ ЮРЛИНСКОГО МУНИЦИПАЛЬНОГО ОКРУГА ПЕРМСКОГО КРАЯ;28.10.2020;3 793 204,00 ₽;https://zakupki.gov.ru/epz/order/notice/ea44/view/supplier-results.html?regNumber=0156600036720000064;АДМИНИСТРАЦИЯ ЮРЛИНСКОГО МУНИЦИПАЛЬНОГО ОКРУГА ПЕРМСКОГО КРАЯ;Стамиков Н. И.;1 - Победитель;2 655 242,80;"ОБЩЕСТВО С ОГРАНИЧЕННОЙ ОТВЕТСТВЕННОСТЬЮ ""АГРОДОРСТРОЙ""";2 - Второй номер;2 674 208,82;31.12.2021;08.12.2020;;614000, г Пермь, ул Николая Островского, д 29, кв 51;Да;83422375337agrodorkochevo@mail.ru
№ 32009622544;https://zakupki.gov.ru/https://zakupki.gov.ru/223/purchase/public/purchase/info/common-info.html?regNumber=32009622544;Закупка завершена;Проведение периодических проверок работников Ярославского отряда филиала ФГП ВО ЖДТ России на Северной железнойдорогев г.Иваново;"ФЕДЕРАЛЬНОЕ ГОСУДАРСТВЕННОЕ ПРЕДПРИЯТИЕ ""ВЕДОМСТВЕННАЯ ОХРАНА ЖЕЛЕЗНОДОРОЖНОГО ТРАНСПОРТА РОССИЙСКОЙ ФЕДЕРАЦИИ""";28.10.2020;80 500,00 ₽;;;;;;;;;;;;;;
№ 0133300031420000006;https://zakupki.gov.ru//epz/order/notice/zk504/view/common-info.html?regNumber=0133300031420000006;Определение поставщика завершено;Выполнение работ по содержанию автомобильныхдорогобщего пользования местного значения п. Лух Лухского муниципального районаИвановскойобласти;УПРАВЛЕНИЕ ГОРОДСКОГО ХОЗЯЙСТВА, БЛАГОУСТРОЙСТВА И ДОРОЖНОЙ ДЕЯТЕЛЬНОСТИ АДМИНИСТРАЦИИ ЛУХСКОГО МУНИЦИПАЛЬНОГО РАЙОНА;26.10.2020;119 999,00 ₽;https://zakupki.gov.ru/epz/order/notice/ea44/view/supplier-results.html?regNumber=0133300031420000006;УПРАВЛЕНИЕ ГОРОДСКОГО ХОЗЯЙСТВА, БЛАГОУСТРОЙСТВА И ДОРОЖНОЙ ДЕЯТЕЛЬНОСТИ АДМИНИСТРАЦИИ ЛУХСКОГО МУНИЦИПАЛЬНОГО РАЙОНА;;По окончании срока подачи заявок подана только одна заявка (ч. 14 ст. 82.3 Закона № 44-ФЗ). Заявка соответствует требованиям.;;"ОБЩЕСТВО С ОГРАНИЧЕННОЙ ОТВЕТСТВЕННОСТЬЮ ""ЛУХСКИЙ ДОРОЖНО-СТРОИТЕЛЬНЫЙ УЧАСТОК""";;119 990,00;25.12.2020;24.11.2020;;155281, Ивановская область, Лухский район, с. Тимирязево, ул. Центральная, д. 33, кв. 10;3706027970;7-962-1590469bakhadurb@bk.ru
