Номер закупки;Ссылка на продукт;Статус;Описание объекта;Организация;Дата размещения;Цена;Ссылка на поставщика;Заказчик;Победитель;Статус победителя;Цена победителя;Второй номер;Статус второго номера;Цена второго номера;Дата начала контракта;Дата окончания контракта;ФИО Руководителя;ИНН;Контакты
№ 0337100016520000077;https://zakupki.gov.ru//epz/order/notice/ea44/view/common-info.html?regNumber=0337100016520000077;Определение поставщика завершено;Выполнение работ по нормативному содержанию искусственных дорожных сооружений на действующей сети автомобильныхдорогобщего пользования федерального значения. Планово-предупредительные работы путепровода через автомобильнуюдорогуна км 24+549 автомобильнойдорогиР-132Калуга– Тула – Михайлов – Рязань, обход г.Калуги, Калужскаяобласть.;"ФЕДЕРАЛЬНОЕ КАЗЕННОЕ УЧРЕЖДЕНИЕ ""УПРАВЛЕНИЕ АВТОМОБИЛЬНОЙ МАГИСТРАЛИ МОСКВА-БОБРУЙСК ФЕДЕРАЛЬНОГО ДОРОЖНОГО АГЕНТСТВА""";02.11.2020;35 783 727,00 ₽;https://zakupki.gov.ru/epz/order/notice/ea44/view/supplier-results.html?regNumber=0337100016520000077;"ФЕДЕРАЛЬНОЕ КАЗЕННОЕ УЧРЕЖДЕНИЕ ""УПРАВЛЕНИЕ АВТОМОБИЛЬНОЙ МАГИСТРАЛИ МОСКВА-БОБРУЙСК ФЕДЕРАЛЬНОГО ДОРОЖНОГО АГЕНТСТВА""";;По окончании срока подачи заявок подана только одна заявка. Такая заявка признана соответствующей требованиям Федерального закона № 44-ФЗ и документации об аукционе. Электронный аукцион признан несостоявшимся по основанию, предусмотренному ч. 1 ст. 71 Федерального закона № 44-ФЗ;;"ОБЩЕСТВО С ОГРАНИЧЕННОЙ ОТВЕТСТВЕННОСТЬЮ ""ДОРМОСТСЕРВИС""";;35 783 727,00;30.09.2021;25.11.2020;;141407, ОБЛ МОСКОВСКАЯ 50, Г ХИМКИ, ПРОСПЕКТ ЮБИЛЕЙНЫЙ, ДОМ 7,ЭТАЖ  01,ПОМ.V, ОФИС 4;7743930506;8-499-7071661dms.in@yandex.ru
№ 0337100016520000076;https://zakupki.gov.ru//epz/order/notice/ea44/view/common-info.html?regNumber=0337100016520000076;Определение поставщика завершено;"Оказание услуг по содержанию действующей сети автомобильныхдорогобщего пользования федерального значения Р-132Калуга- Тула - Михайлов - Рязань км 7+822 - км 9+672, Р-92Калуга-Перемышль -Белев - Орел км 8+271 - км 11+202, М-3 ""Украина"" Москва -Калуга- Брянск - граница с Украиной, подъезд к г.Калугикм 6+990 км 8+083 вКалужскойобласти.";"ФЕДЕРАЛЬНОЕ КАЗЕННОЕ УЧРЕЖДЕНИЕ ""УПРАВЛЕНИЕ АВТОМОБИЛЬНОЙ МАГИСТРАЛИ МОСКВА-БОБРУЙСК ФЕДЕРАЛЬНОГО ДОРОЖНОГО АГЕНТСТВА""";02.11.2020;41 187 179,00 ₽;https://zakupki.gov.ru/epz/order/notice/ea44/view/supplier-results.html?regNumber=0337100016520000076;"ФЕДЕРАЛЬНОЕ КАЗЕННОЕ УЧРЕЖДЕНИЕ ""УПРАВЛЕНИЕ АВТОМОБИЛЬНОЙ МАГИСТРАЛИ МОСКВА-БОБРУЙСК ФЕДЕРАЛЬНОГО ДОРОЖНОГО АГЕНТСТВА""";;По окончании срока подачи заявок подана только одна заявка. Такая заявка признана соответствующей требованиям Федерального закона № 44-ФЗ и документации об аукционе. Электронный аукцион признан несостоявшимся по основанию, предусмотренному ч. 1 ст. 71 Федерального закона № 44-ФЗ;;"ОБЩЕСТВО С ОГРАНИЧЕННОЙ ОТВЕТСТВЕННОСТЬЮ "" ЧЕРНОЗЕМЬЕ""";;41 187 179,00;31.12.2022;25.11.2020;;393310, ОБЛ ТАМБОВСКАЯ 68, Р-Н ИНЖАВИНСКИЙ, РАБОЧИЙ ПО ИНЖАВИНО, УЛ ПОСЕЛКОВАЯ, 48;6805003407;8-4842-509512info@chernozemie-klg.ru
№ 0137300016920000069;https://zakupki.gov.ru//epz/order/notice/ea44/view/common-info.html?regNumber=0137300016920000069;Определение поставщика завершено;Выполнение работ по ремонту участкадорогиобщего пользования по ул. Садовая в г. Белоусово Жуковского районаКалужскойобласти (Реестровый номер: 3044Э-21/20сб);"ГОРОДСКАЯ УПРАВА ГОРОДСКОГО ПОСЕЛЕНИЯ ""ГОРОД БЕЛОУСОВО""";02.11.2020;200 074,48 ₽;https://zakupki.gov.ru/epz/order/notice/ea44/view/supplier-results.html?regNumber=0137300016920000069;"ГОРОДСКАЯ УПРАВА ГОРОДСКОГО ПОСЕЛЕНИЯ ""ГОРОД БЕЛОУСОВО""";"ОБЩЕСТВО С ОГРАНИЧЕННОЙ ОТВЕТСТВЕННОСТЬЮ ""АРХИТЕКТУРНО-СТРОИТЕЛЬНАЯ КОМПАНИЯ СИТИ ГРУПП""";1 - Победитель;139 051,91;"ОБЩЕСТВО С ОГРАНИЧЕННОЙ ОТВЕТСТВЕННОСТЬЮ ""МЕГАСТРОЙ-21""";2 - Второй номер;140 052,28;31.12.2020;30.11.2020;;249160, ОБЛ КАЛУЖСКАЯ 40, Г БЕЛОУСОВО, - ТЕКСТИЛЬЩИК-1, УЧАСТОК 7;4011031375;7-920-8895344askcitigrupp@mail.ru
№ 0137300037320000091;https://zakupki.gov.ru//epz/order/notice/ea44/view/common-info.html?regNumber=0137300037320000091;Определение поставщика завершено;Устройство пешеходной дорожки  в районе контейнерной площадки ул. ОПХ Ермолино  в   г. ЕрмолиноКалужскойобласти Боровского района (Реестровый номер: 3029Э-02/20сб);"АДМИНИСТРАЦИЯ МУНИЦИПАЛЬНОГО ОБРАЗОВАНИЯ ""ГОРОДСКОЕ ПОСЕЛЕНИЕ ""ГОРОД ЕРМОЛИНО""";02.11.2020;401 415,33 ₽;https://zakupki.gov.ru/epz/order/notice/ea44/view/supplier-results.html?regNumber=0137300037320000091;"АДМИНИСТРАЦИЯ МУНИЦИПАЛЬНОГО ОБРАЗОВАНИЯ ""ГОРОДСКОЕ ПОСЕЛЕНИЕ ""ГОРОД ЕРМОЛИНО""";;В течение десяти минут после начала проведения электронного аукциона ни один из его участников не подал предложение о цене контракта (ч.20 ст.68 44-ФЗ). По результатам рассмотрения вторых частей заявок принято решение о соответствии требованиям, установленным документацией об электронном аукционе, двух и более вторых частей заявок.;;Шафиев Ф. А.;1 - Победитель;401 415,33;31.12.2020;23.12.2020;;ОБЛ КАЛУЖСКАЯ 40, Г ОБНИНСК;Да;8-919-0362186shafiev.64@mail.ru
№ 0137200001220005252;https://zakupki.gov.ru//epz/order/notice/ea44/view/common-info.html?regNumber=0137200001220005252;Определение поставщика завершено;Выполнение работ по содержанию освещения автомобильныхдорогобщего пользования регионального или межмуниципального значения и  искусственных дорожных  сооружений на них в Жуковском  районеКалужскойобласти на 2021-2024 гг.;МИНИСТЕРСТВО КОНКУРЕНТНОЙ ПОЛИТИКИКАЛУЖСКОЙОБЛАСТИ;02.11.2020;71 725 800,00 ₽;https://zakupki.gov.ru/epz/order/notice/ea44/view/supplier-results.html?regNumber=0137200001220005252;"ГОСУДАРСТВЕННОЕ КАЗЕННОЕ УЧРЕЖДЕНИЕ КАЛУЖСКОЙ ОБЛАСТИ ""КАЛУГАДОРЗАКАЗЧИК""";"ФИЛИАЛ ""КАЛУГАЭНЕРГО"" ПАО ""МРСК ЦЕНТРА И ПРИВОЛЖЬЯ""";1 - Победитель;24 028 143,00;"ОБЩЕСТВО С ОГРАНИЧЕННОЙ ОТВЕТСТВЕННОСТЬЮ ""КАЛУЖСКОЕ МОНТАЖНОЕ УПРАВЛЕНИЕ ""ЦЕНТРОЭЛЕКТРОМОНТАЖ""";2 - Второй номер;24 386 772,00;31.01.2025;23.11.2020;;31.01.2025;5260200603;01.01.2023
№ 0137300017520000221;https://zakupki.gov.ru//epz/order/notice/ea44/view/common-info.html?regNumber=0137300017520000221;Определение поставщика завершено;"Ремонт уличного освещения в СП ""Село Ильинское"", с. Ильинское, д. Башкировка, д. Пирогово Малоярославецкого районаКалужскойобласти (Реестровый номер: 3018Э-10/20сб)";"МАЛОЯРОСЛАВЕЦКАЯ РАЙОННАЯ АДМИНИСТРАЦИЯ МУНИЦИПАЛЬНОГО РАЙОНА ""МАЛОЯРОСЛАВЕЦКИЙ РАЙОН""";31.10.2020;1 138 906,15 ₽;https://zakupki.gov.ru/epz/order/notice/ea44/view/supplier-results.html?regNumber=0137300017520000221;"АДМИНИСТРАЦИЯ СЕЛЬСКОГО ПОСЕЛЕНИЯ ""СЕЛО ИЛЬИНСКОЕ""";Ким П. Ю.;1 - Победитель;499 228,51;"ОБЩЕСТВО С ОГРАНИЧЕННОЙ ОТВЕТСТВЕННОСТЬЮ ""ЭНЕРГОСТРОЙСЕРВИС""";2 - Второй номер;504 923,04;31.12.2020;30.11.2020;;248033, г. Калуга, ул. 65 Лет Победы, 29-300;Да;7-953-3150482instyle111@mail.ru
№ 0137200001220005222;https://zakupki.gov.ru//epz/order/notice/ea44/view/common-info.html?regNumber=0137200001220005222;Определение поставщика завершено;Выполнение работ по ремонту автомобильныхдорогобщего пользования местного значения:  по пр. Маркса (участок  пр. Маркса д. 79 – пр. Маркса д. 108),  по ул. Белкинская  (от ул. Гагарина до ул. Борисоглебской) в г. ОбнинскеКалужскойобласти.;МИНИСТЕРСТВО КОНКУРЕНТНОЙ ПОЛИТИКИКАЛУЖСКОЙОБЛАСТИ;30.10.2020;41 193 284,56 ₽;https://zakupki.gov.ru/epz/order/notice/ea44/view/supplier-results.html?regNumber=0137200001220005222;"МУНИЦИПАЛЬНОЕ КАЗЕННОЕ УЧРЕЖДЕНИЕ ""ГОРОДСКОЕ СТРОИТЕЛЬСТВО""";"ОБЩЕСТВО С ОГРАНИЧЕННОЙ ОТВЕТСТВЕННОСТЬЮ ""АВАНГАРД""";1 - Победитель;31 100 929,89;"ОБЩЕСТВО С ОГРАНИЧЕННОЙ ОТВЕТСТВЕННОСТЬЮ ""СТРОИТЕЛЬНАЯ КОМПАНИЯ ОЛИМП""";2 - Второй номер;33 572 526,96;31.12.2021;24.11.2020;;249023, Российская Федерация,  ОБЛ КАЛУЖСКАЯ,  Р-Н БОРОВСКИЙ,  Д КУРЧИНО,  УЛ ЛУГОВАЯ, ДОМ 69,;4003031540;79056419040avangarddor@mail.ru
№ 0137300036420000063;https://zakupki.gov.ru//epz/order/notice/ea44/view/common-info.html?regNumber=0137300036420000063;Определение поставщика завершено;Ремонт автомобильнойдорогипо дер. Уколовка Бабынинского районаКалужскойобласти (Реестровый номер: 3025Э-15/20сб);"АДМИНИСТРАЦИЯ ГОРОДСКОГО ПОСЕЛЕНИЯ ""ПОСЕЛОК ВОРОТЫНСК""";29.10.2020;584 980,00 ₽;https://zakupki.gov.ru/epz/order/notice/ea44/view/supplier-results.html?regNumber=0137300036420000063;"АДМИНИСТРАЦИЯ ГОРОДСКОГО ПОСЕЛЕНИЯ ""ПОСЕЛОК ВОРОТЫНСК""";"ОБЩЕСТВО С ОГРАНИЧЕННОЙ ОТВЕТСТВЕННОСТЬЮ ""ОВСТРОЙ""";1 - Победитель;520 632,20;"АКЦИОНЕРНОЕ ОБЩЕСТВО ""КАЛУГАВТОДОР""";2 - Второй номер;523 557,10;31.12.2020;09.12.2020;;248016, Калужская область, г. Калуга, ул. Карла Либкнехта, д.29, офис 212, стр. 13;4029062462;
№ 0137300031920000241;https://zakupki.gov.ru//epz/order/notice/ea44/view/common-info.html?regNumber=0137300031920000241;Определение поставщика завершено;Выполнение работ по установке пешеходных секций на светофорных объектах в г. КировеКалужскойобласти (Реестровый номер: 3008Э-14/20сб).;"КИРОВСКАЯ РАЙОННАЯ АДМИНИСТРАЦИЯ (ИСПОЛНИТЕЛЬНО-РАСПОРЯДИТЕЛЬНЫЙ ОРГАН) МУНИЦИПАЛЬНОГО РАЙОНА ""ГОРОД КИРОВ И КИРОВСКИЙ РАЙОН""";29.10.2020;363 466,80 ₽;https://zakupki.gov.ru/epz/order/notice/ea44/view/supplier-results.html?regNumber=0137300031920000241;"КИРОВСКАЯ РАЙОННАЯ АДМИНИСТРАЦИЯ (ИСПОЛНИТЕЛЬНО-РАСПОРЯДИТЕЛЬНЫЙ ОРГАН) МУНИЦИПАЛЬНОГО РАЙОНА ""ГОРОД КИРОВ И КИРОВСКИЙ РАЙОН""";;По окончании срока подачи заявок подана только одна заявка. Такая заявка признана соответствующей требованиям Федерального закона № 44-ФЗ и документации об аукционе. Электронный аукцион признан несостоявшимся по основанию, предусмотренному ч. 1 ст. 71 Федерального закона № 44-ФЗ;;"ОБЩЕСТВО С ОГРАНИЧЕННОЙ ОТВЕТСТВЕННОСТЬЮ ""МОНТАЖНИК""";;363 466,80;31.12.2020;01.12.2020;;249442, ОБЛ КАЛУЖСКАЯ 40, Г КИРОВ, УЛ СТРОИТЕЛЬНАЯ, 8;4023006729;7-48456-50400montagnik-kirov@mail.ru
№ 0137300031920000239;https://zakupki.gov.ru//epz/order/notice/ea44/view/common-info.html?regNumber=0137300031920000239;Определение поставщика завершено;Выполнение работ по установке светофоров в г. КировеКалужскойобласти (Реестровый номер: 3007Э-14/20сб).;"КИРОВСКАЯ РАЙОННАЯ АДМИНИСТРАЦИЯ (ИСПОЛНИТЕЛЬНО-РАСПОРЯДИТЕЛЬНЫЙ ОРГАН) МУНИЦИПАЛЬНОГО РАЙОНА ""ГОРОД КИРОВ И КИРОВСКИЙ РАЙОН""";28.10.2020;489 970,80 ₽;https://zakupki.gov.ru/epz/order/notice/ea44/view/supplier-results.html?regNumber=0137300031920000239;"КИРОВСКАЯ РАЙОННАЯ АДМИНИСТРАЦИЯ (ИСПОЛНИТЕЛЬНО-РАСПОРЯДИТЕЛЬНЫЙ ОРГАН) МУНИЦИПАЛЬНОГО РАЙОНА ""ГОРОД КИРОВ И КИРОВСКИЙ РАЙОН""";;По окончании срока подачи заявок подана только одна заявка. Такая заявка признана соответствующей требованиям Федерального закона № 44-ФЗ и документации об аукционе. Электронный аукцион признан несостоявшимся по основанию, предусмотренному ч. 1 ст. 71 Федерального закона № 44-ФЗ;;"ОБЩЕСТВО С ОГРАНИЧЕННОЙ ОТВЕТСТВЕННОСТЬЮ ""МОНТАЖНИК""";;489 970,80;31.12.2020;20.11.2020;;249442, ОБЛ КАЛУЖСКАЯ 40, Г КИРОВ, УЛ СТРОИТЕЛЬНАЯ, 8;4023006729;7-48456-50400montagnik-kirov@mail.ru
№ 0137300000320000069;https://zakupki.gov.ru//epz/order/notice/ea44/view/common-info.html?regNumber=0137300000320000069;Определение поставщика завершено;"Зимнее содержание автомобильныхдорогобщего пользования местного значения муниципального района ""Мещовский район""Калужскойобласти (Реестровый номер: 2031Э-09/20сб)";"АДМИНИСТРАЦИЯ (ИСПОЛНИТЕЛЬНО-РАСПОРЯДИТЕЛЬНЫЙ ОРГАН) МУНИЦИПАЛЬНОГО РАЙОНА ""МЕЩОВСКИЙ РАЙОН""КАЛУЖСКОЙОБЛАСТИ";28.10.2020;3 371 913,60 ₽;https://zakupki.gov.ru/epz/order/notice/ea44/view/supplier-results.html?regNumber=0137300000320000069;"АДМИНИСТРАЦИЯ (ИСПОЛНИТЕЛЬНО-РАСПОРЯДИТЕЛЬНЫЙ ОРГАН) МУНИЦИПАЛЬНОГО РАЙОНА ""МЕЩОВСКИЙ РАЙОН"" КАЛУЖСКОЙ ОБЛАСТИ";;По окончании срока подачи заявок подана только одна заявка. Такая заявка признана соответствующей требованиям Федерального закона № 44-ФЗ и документации об аукционе. Электронный аукцион признан несостоявшимся по основанию, предусмотренному ч. 1 ст. 71 Федерального закона № 44-ФЗ;;"ОБЩЕСТВО С ОГРАНИЧЕННОЙ ОТВЕТСТВЕННОСТЬЮ ""ГРАВИЙ""";;3 371 913,60;31.01.2022;23.11.2020;;249240, ОБЛ КАЛУЖСКАЯ 40, Г МЕЩОВСК, УЛ 9 МАЯ, 1;4013003817;субъект малого предпринимательства
№ 0137200001220005143;https://zakupki.gov.ru//epz/order/notice/ea44/view/common-info.html?regNumber=0137200001220005143;Определение поставщика завершено;Выполнение работ по содержанию освещения автомобильныхдорогобщего пользования регионального или межмуниципального значения и  искусственных дорожных  сооружений на них в Жиздринском районеКалужскойобласти на 2021-2024 гг.;МИНИСТЕРСТВО КОНКУРЕНТНОЙ ПОЛИТИКИКАЛУЖСКОЙОБЛАСТИ;28.10.2020;10 814 564,00 ₽;https://zakupki.gov.ru/epz/order/notice/ea44/view/supplier-results.html?regNumber=0137200001220005143;"ГОСУДАРСТВЕННОЕ КАЗЕННОЕ УЧРЕЖДЕНИЕ КАЛУЖСКОЙ ОБЛАСТИ ""КАЛУГАДОРЗАКАЗЧИК""";"ОБЩЕСТВО С ОГРАНИЧЕННОЙ ОТВЕТСТВЕННОСТЬЮ ""КАЛУЖСКОЕ МОНТАЖНОЕ УПРАВЛЕНИЕ ""ЦЕНТРОЭЛЕКТРОМОНТАЖ""";1 - Победитель;8 110 923,00;"ОБЩЕСТВО С ОГРАНИЧЕННОЙ ОТВЕТСТВЕННОСТЬЮ ""СУХИНИЧИ ДОР СЕРВИС""";2 - Второй номер;8 164 995,82;31.01.2025;20.11.2020;;31.01.2025;4028060102;01.01.2023
№ 0137200001220005114;https://zakupki.gov.ru//epz/order/notice/ea44/view/common-info.html?regNumber=0137200001220005114;Определение поставщика завершено;Выполнение работ по установке технических средств организации дорожного движения на территории МО «ГородКалуга»;МИНИСТЕРСТВО КОНКУРЕНТНОЙ ПОЛИТИКИКАЛУЖСКОЙОБЛАСТИ;27.10.2020;9 580 219,80 ₽;https://zakupki.gov.ru/epz/order/notice/ea44/view/supplier-results.html?regNumber=0137200001220005114;"МУНИЦИПАЛЬНОЕ КАЗЕННОЕ УЧРЕЖДЕНИЕ ""СЛУЖБА ЕДИНОГО ЗАКАЗА ГОРОДСКОГО ХОЗЯЙСТВА""";;По окончании срока подачи заявок подана только одна заявка. Такая заявка признана соответствующей требованиям Федерального закона № 44-ФЗ и документации об аукционе. Электронный аукцион признан несостоявшимся по основанию, предусмотренному ч. 1 ст. 71 Федерального закона № 44-ФЗ;;"ОБЩЕСТВО С ОГРАНИЧЕННОЙ ОТВЕТСТВЕННОСТЬЮ ""ПРОИЗВОДСТВЕННАЯ КОМПАНИЯ ""ЗНАКЪ""";;9 580 219,80;31.12.2020;17.11.2020;;248025, Российская Федерация,  ОБЛ КАЛУЖСКАЯ,  Г КАЛУГА,  УЛ ПУТЕЙСКАЯ,  ДОМ 18;4029049937;74842278247minaev.ol@yandex.ru
№ 0137200001220005109;https://zakupki.gov.ru//epz/order/notice/ea44/view/common-info.html?regNumber=0137200001220005109;Определение поставщика завершено;"Выполнение работ по эксплуатации автомобильнойдорогиобщего пользования межмуниципального значенияКалужскойобласти Мещовск-Молодежный-М-3 ""Украина"" в Мещовском районе на участке с км 12+130 по км 17+330 (дополнительные объемы работ по ремонту)";МИНИСТЕРСТВО КОНКУРЕНТНОЙ ПОЛИТИКИКАЛУЖСКОЙОБЛАСТИ;27.10.2020;19 675 499,00 ₽;https://zakupki.gov.ru/epz/order/notice/ea44/view/supplier-results.html?regNumber=0137200001220005109;"ГОСУДАРСТВЕННОЕ КАЗЕННОЕ УЧРЕЖДЕНИЕ КАЛУЖСКОЙ ОБЛАСТИ ""КАЛУГАДОРЗАКАЗЧИК""";"ОБЩЕСТВО С ОГРАНИЧЕННОЙ ОТВЕТСТВЕННОСТЬЮ ""НОВЫЕ СТРОИТЕЛЬНЫЕ ТЕХНОЛОГИИ""";1 - Победитель;15 543 644,00;"ОБЩЕСТВО С ОГРАНИЧЕННОЙ ОТВЕТСТВЕННОСТЬЮ ""КАРАТ""";2 - Второй номер;15 642 021,50;21.07.2021;20.11.2020;;248000, Российская Федерация,  ОБЛ КАЛУЖСКАЯ,  Г КАЛУГА,  УЛ ГАГАРИНА,  ДОМ 6А/47, ПОМЕЩЕНИЕ 5;4027091820;79657000113NST040@gmail.com
№ 0137300003820000063;https://zakupki.gov.ru//epz/order/notice/ea44/view/common-info.html?regNumber=0137300003820000063;Определение поставщика завершено;Содержаниедорогобщего пользования местного значения в г. Спас-ДеменскКалужскойобласти (Реестровый номер: 2995Э-18/20сб);"АДМИНИСТРАЦИЯ МУНИЦИПАЛЬНОГО РАЙОНА ""СПАС-ДЕМЕНСКИЙ РАЙОН""";26.10.2020;2 815 178,40 ₽;https://zakupki.gov.ru/epz/order/notice/ea44/view/supplier-results.html?regNumber=0137300003820000063;"АДМИНИСТРАЦИЯ МУНИЦИПАЛЬНОГО РАЙОНА ""СПАС-ДЕМЕНСКИЙ РАЙОН""";;По окончании срока подачи заявок подана только одна заявка. Такая заявка признана соответствующей требованиям Федерального закона № 44-ФЗ и документации об аукционе. Электронный аукцион признан несостоявшимся по основанию, предусмотренному ч. 1 ст. 71 Федерального закона № 44-ФЗ;;"МУНИЦИПАЛЬНОЕ УНИТАРНОЕ ПРЕДПРИЯТИЕ ""БЛАГОУСТРОЙСТВО""";;2 815 178,40;31.12.2021;16.11.2020;;249610, ОБЛ КАЛУЖСКАЯ 40, Г СПАС-ДЕМЕНСК, ПЕР ШКОЛЬНЫЙ, 14;4016003572;
№ 0137300036420000062;https://zakupki.gov.ru//epz/order/notice/zk504/view/common-info.html?regNumber=0137300036420000062;Определение поставщика завершено;Ремонтавтодорогипо ул. Озерная в дер. Кумовское Бабынинского районаКалужскойобласти;"АДМИНИСТРАЦИЯ ГОРОДСКОГО ПОСЕЛЕНИЯ ""ПОСЕЛОК ВОРОТЫНСК""";26.10.2020;181 819,00 ₽;https://zakupki.gov.ru/epz/order/notice/ea44/view/supplier-results.html?regNumber=0137300036420000062;"АДМИНИСТРАЦИЯ ГОРОДСКОГО ПОСЕЛЕНИЯ ""ПОСЕЛОК ВОРОТЫНСК""";"ОБЩЕСТВО С ОГРАНИЧЕННОЙ ОТВЕТСТВЕННОСТЬЮ ""ОВСТРОЙ""";1 - Победитель;175 000,00;"ОБЩЕСТВО С ОГРАНИЧЕННОЙ ОТВЕТСТВЕННОСТЬЮ ""МИТАС-СТРОЙ""";2 - Второй номер;181 000,00;30.12.2020;02.12.2020;;248016, Калужская область, г. Калуга, ул. Карла Либкнехта, д.29, офис 212, стр. 13;4029062462;
