Номер закупки;Ссылка на продукт;Статус;Описание объекта;Организация;Дата размещения;Цена;Ссылка на поставщика;Заказчик;Победитель;Статус победителя;Цена победителя;Второй номер;Статус второго номера;Цена второго номера;Дата начала контракта;Дата окончания контракта;ФИО Руководителя;ИНН;Контакты
№ 32109939928;https://zakupki.gov.ru/https://zakupki.gov.ru/223/purchase/public/purchase/info/common-info.html?regNumber=32109939928;Подача заявок;"Выполнение комплекса работ по ремонту лотков системы водоотведения ливневых поверхностных сточных вод, расположенных вдоль автомобильныхдорогобщего пользования местного значения в границах МО "" Город Обнинск"" на ул. Шацкого.";"МУНИЦИПАЛЬНОЕ ПРЕДПРИЯТИЕ ГОРОДА ОБНИНСКАКАЛУЖСКОЙОБЛАСТИ ""КОММУНАЛЬНОЕ ХОЗЯЙСТВО""";29.01.2021;2 812 525,57 ₽;;;;;;;;;;;;;;
№ 0137200001221000067;https://zakupki.gov.ru//epz/order/notice/ea44/view/common-info.html?regNumber=0137200001221000067;Подача заявок;Выполнение работ по реконструкции автомобильнойдорогиКозельск-Ульяново-Дудоровский-Хвастовичи на участке с км 10+980 по км 13+365, с. Волконское в Козельском районе (устройство тротуаров);МИНИСТЕРСТВО КОНКУРЕНТНОЙ ПОЛИТИКИКАЛУЖСКОЙОБЛАСТИ;28.01.2021;17 612 659,00 ₽;;;;;;;;;;;;;;
№ 0137200001221000064;https://zakupki.gov.ru//epz/order/notice/ea44/view/common-info.html?regNumber=0137200001221000064;Подача заявок;Выполнение работ по реконструкции автомобильнойдорогиМалоярославец-Боровск в Боровском районе (устройство электроосвещения,  тротуаров и автобусных остановок на участке  с км 15+630 по км 17+100, д. Тимашово);МИНИСТЕРСТВО КОНКУРЕНТНОЙ ПОЛИТИКИКАЛУЖСКОЙОБЛАСТИ;28.01.2021;22 043 436,00 ₽;;;;;;;;;;;;;;
№ 0127200000221000102;https://zakupki.gov.ru//epz/order/notice/ea44/view/common-info.html?regNumber=0127200000221000102;Подача заявок;"Выполнение подрядных работ по объекту: ""Капитальный ремонт автомобильнойдорогиБрянск - Дятьково - границаКалужскойобласти на участках  км 8+797-км 9+863, км 13+403-км 15+414, км 17+590-км 22+719, км 30+505-км 31+299, км 32+417-км 32+576, км 33+367-км 35+056  в Брянском и Дятьковском районах Брянской области""";УПРАВЛЕНИЕ ГОСУДАРСТВЕННЫХ ЗАКУПОК БРЯНСКОЙ ОБЛАСТИ;26.01.2021;176 974 073,16 ₽;;;;;;;;;;;;;;
№ 0348100042421000004;https://zakupki.gov.ru//epz/order/notice/ok504/view/common-info.html?regNumber=0348100042421000004;Подача заявок;"Выполнение работ по ремонту действующей сети автомобильныхдорогобщего пользования федерального значения. Ремонт автомобильнойдорогиА-108 ""Московское большое кольцо""  Дмитров - Сергиев Посад - Орехово-Зуево - Воскресенск - Михнево - Балабаново - Руза - Клин - Дмитров. Подъезд к государственному комплексу ""Таруса"",Калужскаяобласть (лот 4)";"ФЕДЕРАЛЬНОЕ КАЗЕННОЕ УЧРЕЖДЕНИЕ ""ФЕДЕРАЛЬНОЕ УПРАВЛЕНИЕ АВТОМОБИЛЬНЫХДОРОГ""ЦЕНТРАЛЬНАЯ РОССИЯ"" ФЕДЕРАЛЬНОГО ДОРОЖНОГО АГЕНТСТВА""";26.01.2021;88 202 781,00 ₽;;;;;;;;;;;;;;
№ 0169300024821000018;https://zakupki.gov.ru//epz/order/notice/ea44/view/common-info.html?regNumber=0169300024821000018;Работа комиссии;Строительствоавтодорогиот с. Пашнино доавтодорогиКанашево-Калуга-Соловьевка в Красноармейском муниципальном районе Челябинской области;АДМИНИСТРАЦИЯ КРАСНОАРМЕЙСКОГО МУНИЦИПАЛЬНОГО РАЙОНА;26.01.2021;156 137 188,00 ₽;;;;;;;;;;;;;;
№ 32109915633;https://zakupki.gov.ru/https://zakupki.gov.ru/223/purchase/public/purchase/info/common-info.html?regNumber=32109915633;Работа комиссии;Запрос котировок среди субъектов малого и среднего предпринимательства в электронной форме № 8/ЗКТЭ-ДЖВ/21 на право заключения договора оказания услуг по вывозу и утилизации ртутных люминесцентных и ультрафиолетовых бактерицидных ламп на вокзалах Московской региональной дирекции железнодорожных вокзалов (вокзалы Белорусский, Казанский, Киевский, Павелецкий, Рижский, Савеловский, Ярославский, Брянск-Орловский,Калуга-1, Курск, Орел, Рязань-1,2, Смоленск, Тула).;"ОТКРЫТОЕ АКЦИОНЕРНОЕ ОБЩЕСТВО ""РОССИЙСКИЕ ЖЕЛЕЗНЫЕДОРОГИ""";22.01.2021;1 023 514,80 ₽;;;;;;;;;;;;;;
№ 32109911724;https://zakupki.gov.ru/https://zakupki.gov.ru/223/purchase/public/purchase/info/common-info.html?regNumber=32109911724;Закупка завершена;Разработка годовых потребностей в ресурсах (трудовых, материальных, машин и механизмов), необходимых для содержания и ремонта автомобильныхдороги объектов благоустройства МО «Город Обнинск» на период 2021-2023г.г.;"МУНИЦИПАЛЬНОЕ ПРЕДПРИЯТИЕ ГОРОДА ОБНИНСКАКАЛУЖСКОЙОБЛАСТИ ""КОММУНАЛЬНОЕ ХОЗЯЙСТВО""";21.01.2021;485 000,00 ₽;;;;;;;;;;;;;;
№ 0137300000321000004;https://zakupki.gov.ru//epz/order/notice/ea44/view/common-info.html?regNumber=0137300000321000004;Подача заявок;"Содержание автомобильныхдороггородского поселения ""Город Мещовск""  в 2021 году (Реестровый номер:08Э-09/21сб)";"АДМИНИСТРАЦИЯ (ИСПОЛНИТЕЛЬНО-РАСПОРЯДИТЕЛЬНЫЙ ОРГАН) МУНИЦИПАЛЬНОГО РАЙОНА ""МЕЩОВСКИЙ РАЙОН""КАЛУЖСКОЙОБЛАСТИ";20.01.2021;3 200 569,20 ₽;;;;;;;;;;;;;;
№ 0137300000321000002;https://zakupki.gov.ru//epz/order/notice/zk504/view/common-info.html?regNumber=0137300000321000002;Определение поставщика завершено;"Содержание автомобильныхдороггородского поселения ""Город Мещовск""  в 2021 году";"АДМИНИСТРАЦИЯ (ИСПОЛНИТЕЛЬНО-РАСПОРЯДИТЕЛЬНЫЙ ОРГАН) МУНИЦИПАЛЬНОГО РАЙОНА ""МЕЩОВСКИЙ РАЙОН""КАЛУЖСКОЙОБЛАСТИ";12.01.2021;299 430,80 ₽;https://zakupki.gov.ru/epz/order/notice/ea44/view/supplier-results.html?regNumber=0137300000321000002;"АДМИНИСТРАЦИЯ (ИСПОЛНИТЕЛЬНО-РАСПОРЯДИТЕЛЬНЫЙ ОРГАН) МУНИЦИПАЛЬНОГО РАЙОНА ""МЕЩОВСКИЙ РАЙОН"" КАЛУЖСКОЙ ОБЛАСТИ";;По окончании срока подачи заявок подана только одна заявка (ч. 14 ст. 82.3 Закона № 44-ФЗ). Заявка соответствует требованиям.;;"ОБЩЕСТВО С ОГРАНИЧЕННОЙ ОТВЕТСТВЕННОСТЬЮ ""ГРАВИЙ""";;299 430,00;;;;;;
№ 0348100006020000065;https://zakupki.gov.ru//epz/order/notice/ea44/view/common-info.html?regNumber=0348100006020000065;Подача заявок;"...  на сети автомобильныхдорогобщего пользования федерального значения:автомобильнаядорогаМ-7 ... +000 - км 32+239; автомобильнаядорогаМ-7 ""Волга"" Москва - Владимир ... +000 - км 20+660; автомобильнаядорогаР-132 ""Золотое кольцо"" Ярославль ...  - Гусь-Хрустальный - Рязань - Михайлов - Тула -Калуга- Вязьма - Ржев - Тверь - Углич - Ярославль ...  226+840, Владимирская область; автомобильнаядорогаР-132 ""Золотое кольцо"" Ярославль ...  - Гусь-Хрустальный - Рязань - Михайлов - Тула -Калуга- Вязьма - Ржев - Тверь - Углич - Ярославль ...";"ФЕДЕРАЛЬНОЕ КАЗЕННОЕ УЧРЕЖДЕНИЕ ""УПРАВЛЕНИЕ АВТОМОБИЛЬНОЙ МАГИСТРАЛИ МОСКВА - НИЖНИЙ НОВГОРОД ФЕДЕРАЛЬНОГО ДОРОЖНОГО АГЕНТСТВА""";31.12.2020;51 739 634,32 ₽;;;;;;;;;;;;;;
№ 32009864663;https://zakupki.gov.ru/https://zakupki.gov.ru/223/purchase/public/purchase/info/common-info.html?regNumber=32009864663;Закупка завершена;...  геоинформационной системы автомобильныхдорогГосударственной компании «Российские автомобильныедороги»: М-1 «Беларусь ...  Белоруссия, М-3 «Украина» Москва –Калуга– Брянск – граница с Украиной, М ... -Санкт-Петербург», А 105 «Подъезднаядорогаот Москвы к аэропорту Домодедово ...;"ОБЩЕСТВО С ОГРАНИЧЕННОЙ ОТВЕТСТВЕННОСТЬЮ ""АВТОДОР-ИНЖИНИРИНГ""";29.12.2020;18 269 254,00 ₽;;;;;;;;;;;;;;
№ 32009830318;https://zakupki.gov.ru/https://zakupki.gov.ru/223/purchase/public/purchase/info/common-info.html?regNumber=32009830318;Работа комиссии;Конкурс в электронной форме на право заключения Договора на разработку проектно-сметной и технической документации по объекту: «АвтомобильнаядорогаМ-3 «Украина» Москва -Калуга-Брянск - граница с Украиной. Капитальный ремонт водопропускных труб на км 396+350, км 435+350, км 454+700, км 465+200, км 470+100, км 472+500, км 477+150, км 478+800, км 480+100, Брянская область» (участниками которого могут являться только субъекты малого и среднего предпринимательства);"ГОСУДАРСТВЕННАЯ КОМПАНИЯ ""РОССИЙСКИЕ АВТОМОБИЛЬНЫЕДОРОГИ""";22.12.2020;13 406 680,00 ₽;;;;;;;;;;;;;;
№ 0135300007520000255;https://zakupki.gov.ru//epz/order/notice/ea44/view/common-info.html?regNumber=0135300007520000255;Определение поставщика завершено;Ремонт асфальтового покрытия по ул. Крюкова в пос.Калужское, Черняховского района, Калининградской области (второй этап).;"АДМИНИСТРАЦИЯ МУНИЦИПАЛЬНОГО ОБРАЗОВАНИЯ ""ЧЕРНЯХОВСКИЙ ГОРОДСКОЙ ОКРУГ""";15.12.2020;597 241,20 ₽;https://zakupki.gov.ru/epz/order/notice/ea44/view/supplier-results.html?regNumber=0135300007520000255;"МУНИЦИПАЛЬНОЕ БЮДЖЕТНОЕ УЧРЕЖДЕНИЕ ""КАЛУЖСКОЕ""";;По окончании срока подачи заявок подана только одна заявка. Такая заявка признана соответствующей требованиям Федерального закона № 44-ФЗ и документации об аукционе. Электронный аукцион признан несостоявшимся по основанию, предусмотренному ч. 1 ст. 71 Федерального закона № 44-ФЗ;;"ОТКРЫТОЕ АКЦИОНЕРНОЕ ОБЩЕСТВО ""ЧЕРНЯХОВСКИЙ ""РАЙАВТОДОР""";;597 241,20;05.03.2021;12.01.2021;;238151, ОБЛ КАЛИНИНГРАДСКАЯ 39, Г ЧЕРНЯХОВСК, УЛ 22 ЯНВАРЯ, 10, -, -;3914111446;субъект малого предпринимательства
№ 0137300002320000088;https://zakupki.gov.ru//epz/order/notice/zk504/view/common-info.html?regNumber=0137300002320000088;Определение поставщика завершено;Зимнее содержание автомобильныхдорог, тротуаров  общего пользования местного значения города Жиздра,Калужскойобласти.;"АДМИНИСТРАЦИЯ (ИСПОЛНИТЕЛЬНО-РАСПОРЯДИТЕЛЬНЫЙ ОРГАН) МУНИЦИПАЛЬНОГО РАЙОНА ""ЖИЗДРИНСКИЙ РАЙОН""";15.12.2020;499 999,06 ₽;https://zakupki.gov.ru/epz/order/notice/ea44/view/supplier-results.html?regNumber=0137300002320000088;"АДМИНИСТРАЦИЯ ГОРОДСКОГО ПОСЕЛЕНИЯ ""ГОРОД ЖИЗДРА""";;По окончании срока подачи заявок подана только одна заявка (ч. 14 ст. 82.3 Закона № 44-ФЗ). Заявка соответствует требованиям.;;"ОБЩЕСТВО С ОГРАНИЧЕННОЙ ОТВЕТСТВЕННОСТЬЮ ""ТВОЙ ДОМ""";;499 999,06;30.03.2021;19.01.2021;;249340, ОБЛ КАЛУЖСКАЯ 40, Г ЖИЗДРА, УЛ САДОВАЯ, 16;4006004249;субъект малого предпринимательства
№ 32009803743;https://zakupki.gov.ru/https://zakupki.gov.ru/223/purchase/public/purchase/info/common-info.html?regNumber=32009803743;Закупка завершена;Выполнение работ согласно техническому заданию по объекту: «СМР Реконструкциядорогипо ул. Веры Андриановой в г.Калуга»;"ПУБЛИЧНОЕ АКЦИОНЕРНОЕ ОБЩЕСТВО ""МЕЖРЕГИОНАЛЬНАЯ РАСПРЕДЕЛИТЕЛЬНАЯ СЕТЕВАЯ КОМПАНИЯ ЦЕНТРА И ПРИВОЛЖЬЯ""";15.12.2020;55 669 049,22 ₽;;;;;;;;;;;;;;
№ 0137300039720000195;https://zakupki.gov.ru//epz/order/notice/ea44/view/common-info.html?regNumber=0137300039720000195;Определение поставщика завершено;Устройство технологических проездов для участков многодетных семей, расположенных в д. Красное Боровского районаКалужскойобласти (Реестровый номер: 3645Э-02/20сб);"АДМИНИСТРАЦИЯ МУНИЦИПАЛЬНОГО ОБРАЗОВАНИЯ МУНИЦИПАЛЬНОГО РАЙОНА ""БОРОВСКИЙ РАЙОН""";14.12.2020;7 569 195,60 ₽;https://zakupki.gov.ru/epz/order/notice/ea44/view/supplier-results.html?regNumber=0137300039720000195;"АДМИНИСТРАЦИЯ МУНИЦИПАЛЬНОГО ОБРАЗОВАНИЯ МУНИЦИПАЛЬНОГО РАЙОНА ""БОРОВСКИЙ РАЙОН""";"ОБЩЕСТВО С ОГРАНИЧЕННОЙ ОТВЕТСТВЕННОСТЬЮ ""СВ-СТРОЙ";1 - Победитель;6 262 154,02;"ОБЩЕСТВО С ОГРАНИЧЕННОЙ ОТВЕТСТВЕННОСТЬЮ ""РЕКОРД""";2 - Второй номер;6 300 000,00;31.12.2021;20.01.2021;;249039, ОБЛ КАЛУЖСКАЯ 40, Г ОБНИНСК, УЛ КУРЧАТОВА, ДОМ 76, КВАРТИРА 42;4025451524;
№ 32009792938;https://zakupki.gov.ru/https://zakupki.gov.ru/223/purchase/public/purchase/info/common-info.html?regNumber=32009792938;Закупка завершена;Право заключения Договора на выполнение работ согласно техническому заданию по объекту: «ПИР «Реконструкция ВЛ-10кВ № 9 ПС «Ворсино», ВЛ-10кВ №7 ПС «Вега» по объекту: «Внешняя инженерная инфраструктура. Внеплощадочная подъездная автомобильнаядорога.I этап по адресу:Калужскаяобласть, Боровский район, д. Ильино и д. Козельское», на основании договора о снятии ограничений по использованию земельного участка № 401034036 от 16.04.2020 г» для нужд филиала «Калугаэнерго» ПАО «МРСК Центра и Приволжья»;"ПУБЛИЧНОЕ АКЦИОНЕРНОЕ ОБЩЕСТВО ""МЕЖРЕГИОНАЛЬНАЯ РАСПРЕДЕЛИТЕЛЬНАЯ СЕТЕВАЯ КОМПАНИЯ ЦЕНТРА И ПРИВОЛЖЬЯ""";11.12.2020;915 098,40 ₽;;;;;;;;;;;;;;
№ 0336100012520000142;https://zakupki.gov.ru//epz/order/notice/ok504/view/common-info.html?regNumber=0336100012520000142;Определение поставщика завершено;Подготовка проектной документации и выполнение инженерных изысканий. Капитальный ремонт моста через реку Медведица на км 51+500 автомобильнойдорогиР-132 «Золотое кольцо» Ярославль – Кострома – Иваново – Владимир – Гусь-Хрустальный – Рязань – Михайлов – Тула –Калуга– Вязьма – Ржев – Тверь – Углич - Ярославль, Калязин - Кашин - Горицы - Кушалино, Тверская область;"ФЕДЕРАЛЬНОЕ КАЗЕННОЕ УЧРЕЖДЕНИЕ ""УПРАВЛЕНИЕ АВТОМОБИЛЬНОЙ МАГИСТРАЛИ ОРДЕНА ЛЕНИНА ""МОСКВА-САНКТ-ПЕТЕРБУРГ"" ФЕДЕРАЛЬНОГО ДОРОЖНОГО АГЕНТСТВА""";09.12.2020;9 363 867,50 ₽;https://zakupki.gov.ru/epz/order/notice/ea44/view/supplier-results.html?regNumber=0336100012520000142;"ФЕДЕРАЛЬНОЕ КАЗЕННОЕ УЧРЕЖДЕНИЕ ""УПРАВЛЕНИЕ АВТОМОБИЛЬНОЙ МАГИСТРАЛИ ОРДЕНА ЛЕНИНА ""МОСКВА-САНКТ-ПЕТЕРБУРГ"" ФЕДЕРАЛЬНОГО ДОРОЖНОГО АГЕНТСТВА""";"ОБЩЕСТВО С ОГРАНИЧЕННОЙ ОТВЕТСТВЕННОСТЬЮ ""ПРОЕКТИРОВАНИЕ АВТОМОБИЛЬНЫХ ДОРОГ И ИСКУССТВЕННЫХ СООРУЖЕНИЙ""";1 - Победитель;9 363 860,00;"ОБЩЕСТВО С ОГРАНИЧЕННОЙ ОТВЕТСТВЕННОСТЬЮ ""ИНВЕСТ ГРУПП""";2 - Второй номер;6 554 707,00;;;;;;
№ 32009781088;https://zakupki.gov.ru/https://zakupki.gov.ru/223/purchase/public/purchase/info/common-info.html?regNumber=32009781088;Закупка завершена;Конкурс в электронной форме на право заключения Договора на оказание услуг по защите объектов транспортной инфраструктуры мост через реку Угра км 177+100 (левый, правый), расположенного на автомобильнойдорогеМ-3 «Украина» Москва -Калуга- Брянск - граница с Украиной вКалужскойобласти с использованием инженерно-технических средств (систем) обеспечения транспортной безопасности;"ГОСУДАРСТВЕННАЯ КОМПАНИЯ ""РОССИЙСКИЕ АВТОМОБИЛЬНЫЕДОРОГИ""";09.12.2020;12 070 000,00 ₽;;;;;;;;;;;;;;
№ 32009766641;https://zakupki.gov.ru/https://zakupki.gov.ru/223/purchase/public/purchase/info/common-info.html?regNumber=32009766641;Закупка завершена;Выполнение комплекса работ по содержанию тротуаров, расположенных вдоль автомобильныхдорогобщего пользования местного значения, в зимний период 2021 года;"МУНИЦИПАЛЬНОЕ ПРЕДПРИЯТИЕ ГОРОДА ОБНИНСКАКАЛУЖСКОЙОБЛАСТИ ""КОММУНАЛЬНОЕ ХОЗЯЙСТВО""";04.12.2020;7 452 211,60 ₽;;;;;;;;;;;;;;
№ 0354100008420000108;https://zakupki.gov.ru//epz/order/notice/ea44/view/common-info.html?regNumber=0354100008420000108;Определение поставщика завершено;"Оказание услуг по содержанию автомобильныхдорог: М-2 «Крым» Москва - Тула - Орел - Курск - Белгород - граница с Украиной на участках км 108+000 - км 177+292, км 160+472 - км 304+300, подъезды к г. Тула км 0+000 - км 7+492, км 28+720 - км 37+700, км 41+460 - км 46+880; Р-92Калуга- Перемышль - Белев - Орел на участках км 42+719 – км 60+004, км 61+561 - км 97+680, км 102+670 - км 132+1190; Р-132Калуга- Тула - Михайлов - Рязань на участках км 57+143 - км 98+680, км 119+700 – км 209+546, Тульская область";"ФЕДЕРАЛЬНОЕ КАЗЕННОЕ УЧРЕЖДЕНИЕ ""УПРАВЛЕНИЕ АВТОМОБИЛЬНОЙ МАГИСТРАЛИ МОСКВА-ХАРЬКОВ ФЕДЕРАЛЬНОГО ДОРОЖНОГО АГЕНТСТВА""";04.12.2020;326 842 245,00 ₽;https://zakupki.gov.ru/epz/order/notice/ea44/view/supplier-results.html?regNumber=0354100008420000108;"ФЕДЕРАЛЬНОЕ КАЗЕННОЕ УЧРЕЖДЕНИЕ ""УПРАВЛЕНИЕ АВТОМОБИЛЬНОЙ МАГИСТРАЛИ МОСКВА-ХАРЬКОВ ФЕДЕРАЛЬНОГО ДОРОЖНОГО АГЕНТСТВА""";;По окончании срока подачи заявок подана только одна заявка. Такая заявка признана соответствующей требованиям Федерального закона № 44-ФЗ и документации об аукционе. Электронный аукцион признан несостоявшимся по основанию, предусмотренному ч. 1 ст. 71 Федерального закона № 44-ФЗ;;"ОБЩЕСТВО С ОГРАНИЧЕННОЙ ОТВЕТСТВЕННОСТЬЮ ""ВЕКТОР""";;326 842 245,00;06.02.2023;22.01.2021;;302525, ОБЛ ОРЛОВСКАЯ 57, С/П ПЛАТОНОВСКОЕ, УЛ РАЗДОЛЬНАЯ, ДОМ 111;5720022409;7-4862-781782vektor-r57@yandex.ru
