Номер закупки;Ссылка на продукт;Статус;Описание объекта;Организация;Дата размещения;Цена;Ссылка на поставщика;Заказчик;Победитель;Статус победителя;Цена победителя;Второй номер;Статус второго номера;Цена второго номера;Дата начала контракта;Дата окончания контракта;ФИО Руководителя;ИНН;Контакты
№ 0311100007221000010;https://zakupki.gov.ru//epz/order/notice/ok504/view/common-info.html?regNumber=0311100007221000010;Подача заявок;"Устройство защитных слоев на автомобильнойдорогеР-176 ""Вятка"" Чебоксары -  Йошкар-Ола - Киров - Сыктывкар на участках км 19+008 - км 31+500, км 46+000 - км 51+000, км 59+000 - км 79+000, РеспубликаМарийЭл";"ФЕДЕРАЛЬНОЕ КАЗЕННОЕ УЧРЕЖДЕНИЕ ""ФЕДЕРАЛЬНОЕ УПРАВЛЕНИЕ АВТОМОБИЛЬНЫХДОРОГВОЛГО-ВЯТСКОГО РЕГИОНА ФЕДЕРАЛЬНОГО ДОРОЖНОГО АГЕНТСТВА""";10.02.2021;20 000 000,00 ₽;;;;;;;;;;;;;;
№ 0308200000121000005;https://zakupki.gov.ru//epz/order/notice/ea44/view/common-info.html?regNumber=0308200000121000005;Подача заявок;Выполнение работ по содержанию автомобильнойдорогиЯльчикский – Яльчик  на участке км 0+000 – км 6+088;"ГОСУДАРСТВЕННОЕ КАЗЕННОЕ УЧРЕЖДЕНИЕ РЕСПУБЛИКИМАРИЙЭЛ ""МАРИЙСКАВТОДОР""";05.02.2021;54 257 555,00 ₽;;;;;;;;;;;;;;
№ 0108300014821000002;https://zakupki.gov.ru//epz/order/notice/ea44/view/common-info.html?regNumber=0108300014821000002;Подача заявок;"""Дорогане роскошь, а необходимость"" - ремонт улично-дорожной сети в дер. Мари-Ляжмарь";РУССКО-ЛЯЖМАРИНСКАЯ СЕЛЬСКАЯ АДМИНИСТРАЦИЯ ПАРАНЬГИНСКОГО МУНИЦИПАЛЬНОГО РАЙОНА РЕСПУБЛИКИМАРИЙЭЛ;05.02.2021;1 158 950,00 ₽;;;;;;;;;;;;;;
№ 0108300007021000001;https://zakupki.gov.ru//epz/order/notice/ea44/view/common-info.html?regNumber=0108300007021000001;Подача заявок;Капитальный ремонт грунтового проезда по д. Ершово Килемарского района;АРДИНСКАЯ СЕЛЬСКАЯ АДМИНИСТРАЦИЯ КИЛЕМАРСКОГО МУНИЦИПАЛЬНОГО РАЙОНА РЕСПУБЛИКИМАРИЙЭЛ;04.02.2021;990 340,00 ₽;;;;;;;;;;;;;;
№ 0108300013521000005;https://zakupki.gov.ru//epz/order/notice/ea44/view/common-info.html?regNumber=0108300013521000005;Подача заявок;Ремонт автомобильнойдорогиместного значения д.Ананур;АДМИНИСТРАЦИЯ СЕРНУРСКОГО МУНИЦИПАЛЬНОГО РАЙОНА РЕСПУБЛИКИМАРИЙЭЛ;02.02.2021;3 782 855,82 ₽;;;;;;;;;;;;;;
№ 0108300013521000004;https://zakupki.gov.ru//epz/order/notice/ea44/view/common-info.html?regNumber=0108300013521000004;Подача заявок;Ремонт участка автомобильнойдорогиместного значения д.Б.Сердеж;АДМИНИСТРАЦИЯ СЕРНУРСКОГО МУНИЦИПАЛЬНОГО РАЙОНА РЕСПУБЛИКИМАРИЙЭЛ;02.02.2021;1 557 168,23 ₽;;;;;;;;;;;;;;
№ 0108300014821000001;https://zakupki.gov.ru//epz/order/notice/ea44/view/common-info.html?regNumber=0108300014821000001;Определение поставщика отменено;Ремонт улично-дорожной сети д.Мари-Ляжмарь;РУССКО-ЛЯЖМАРИНСКАЯ СЕЛЬСКАЯ АДМИНИСТРАЦИЯ ПАРАНЬГИНСКОГО МУНИЦИПАЛЬНОГО РАЙОНА РЕСПУБЛИКИМАРИЙЭЛ;02.02.2021;1 158 950,00 ₽;;;;;;;;;;;;;;
№ 0108300011421000001;https://zakupki.gov.ru//epz/order/notice/ea44/view/common-info.html?regNumber=0108300011421000001;Работа комиссии;"Выполнение работ по благоустройству территории прилегающей к лыжной базе г. Волжск, РеспубликиМарийЭл: устройство асфальтобетонного покрытия тротуара ""Здоровье""";"АДМИНИСТРАЦИЯ ГОРОДСКОГО ОКРУГА ""ГОРОД ВОЛЖСК""";01.02.2021;14 806 512,00 ₽;;;;;;;;;;;;;;
№ 0108300013521000003;https://zakupki.gov.ru//epz/order/notice/ea44/view/common-info.html?regNumber=0108300013521000003;Подача заявок;Ремонт автомобильнойдорогиместного значения д.Калеево;АДМИНИСТРАЦИЯ СЕРНУРСКОГО МУНИЦИПАЛЬНОГО РАЙОНА РЕСПУБЛИКИМАРИЙЭЛ;01.02.2021;1 196 839,72 ₽;;;;;;;;;;;;;;
№ 0108300013521000002;https://zakupki.gov.ru//epz/order/notice/ea44/view/common-info.html?regNumber=0108300013521000002;Подача заявок;Ремонт автомобильнойдорогиместного значения д.Б.Коклала;АДМИНИСТРАЦИЯ СЕРНУРСКОГО МУНИЦИПАЛЬНОГО РАЙОНА РЕСПУБЛИКИМАРИЙЭЛ;01.02.2021;1 788 810,29 ₽;;;;;;;;;;;;;;
№ 0108300013521000001;https://zakupki.gov.ru//epz/order/notice/ea44/view/common-info.html?regNumber=0108300013521000001;Подача заявок;Ремонт автомобильнойдорогиместного значения д.Йошкар-Памаш;АДМИНИСТРАЦИЯ СЕРНУРСКОГО МУНИЦИПАЛЬНОГО РАЙОНА РЕСПУБЛИКИМАРИЙЭЛ;01.02.2021;3 083 079,64 ₽;;;;;;;;;;;;;;
№ 0108300015121000001;https://zakupki.gov.ru//epz/order/notice/ea44/view/common-info.html?regNumber=0108300015121000001;Определение поставщика завершено;Ремонт асфальтобетонного покрытия автомобильнойдорогиобщего пользования местного значения по ул. Советская, транзитные участки по ул. Комсомольская, ул. Юбилейная в пгт Килемары;КИЛЕМАРСКАЯ ГОРОДСКАЯ АДМИНИСТРАЦИЯ КИЛЕМАРСКОГО МУНИЦИПАЛЬНОГО РАЙОНА РЕСПУБЛИКИМАРИЙЭЛ;28.01.2021;18 740 000,00 ₽;https://zakupki.gov.ru/epz/order/notice/ea44/view/supplier-results.html?regNumber=0108300015121000001;КИЛЕМАРСКАЯ ГОРОДСКАЯ АДМИНИСТРАЦИЯ КИЛЕМАРСКОГО МУНИЦИПАЛЬНОГО РАЙОНА РЕСПУБЛИКИ МАРИЙ ЭЛ;"ОБЩЕСТВО С ОГРАНИЧЕННОЙ ОТВЕТСТВЕННОСТЬЮ ""ДОРОЖНИК""";1 - Победитель;17 896 700,00;"ОБЩЕСТВО С ОГРАНИЧЕННОЙ ОТВЕТСТВЕННОСТЬЮ ""КЕРМЕН""";2 - Второй номер;17 990 400,00;;;;;;
№ 0308200000121000002;https://zakupki.gov.ru//epz/order/notice/ea44/view/common-info.html?regNumber=0308200000121000002;Определение поставщика завершено;Выполнение работ по содержанию светофорных объектов на автомобильныхдорогахобщего пользования республиканского значения РеспубликиМарийЭл в 2021 году;"ГОСУДАРСТВЕННОЕ КАЗЕННОЕ УЧРЕЖДЕНИЕ РЕСПУБЛИКИМАРИЙЭЛ ""МАРИЙСКАВТОДОР""";28.01.2021;1 446 362,00 ₽;https://zakupki.gov.ru/epz/order/notice/ea44/view/supplier-results.html?regNumber=0308200000121000002;"ГОСУДАРСТВЕННОЕ КАЗЕННОЕ УЧРЕЖДЕНИЕ РЕСПУБЛИКИ МАРИЙ ЭЛ ""МАРИЙСКАВТОДОР""";;По окончании срока подачи заявок подана только одна заявка. Такая заявка признана соответствующей требованиям Федерального закона № 44-ФЗ и документации об аукционе. Электронный аукцион признан несостоявшимся по основанию, предусмотренному ч. 1 ст. 71 Федерального закона № 44-ФЗ;;Подзолков В. С.;;1 446 362,00;;;;;;
№ 0108300015521000001;https://zakupki.gov.ru//epz/order/notice/ea44/view/common-info.html?regNumber=0108300015521000001;Работа комиссии;Ремонт проезжей части ул.Зеленая,у.Дружбы,ул.Старосельская в с.Вятское Советского района;ВЯТСКАЯ СЕЛЬСКАЯ АДМИНИСТРАЦИЯ СОВЕТСКОГО МУНИЦИПАЛЬНОГО РАЙОНА РЕСПУБЛИКИМАРИЙЭЛ;27.01.2021;8 991 520,00 ₽;;;;;;;;;;;;;;
№ 0108300000821000001;https://zakupki.gov.ru//epz/order/notice/ea44/view/common-info.html?regNumber=0108300000821000001;Определение поставщика завершено;Капитальный ремонт проезжей части улицы Пограничная в пгт Оршанка;ОРШАНСКАЯ ГОРОДСКАЯ АДМИНИСТРАЦИЯ ОРШАНСКОГО МУНИЦИПАЛЬНОГО РАЙОНА РЕСПУБЛИКИМАРИЙЭЛ;26.01.2021;47 679 451,00 ₽;https://zakupki.gov.ru/epz/order/notice/ea44/view/supplier-results.html?regNumber=0108300000821000001;ОРШАНСКАЯ ГОРОДСКАЯ АДМИНИСТРАЦИЯ ОРШАНСКОГО МУНИЦИПАЛЬНОГО РАЙОНА РЕСПУБЛИКИ МАРИЙ ЭЛ;;По окончании срока подачи заявок подана только одна заявка. Такая заявка признана соответствующей требованиям Федерального закона № 44-ФЗ и документации об аукционе. Электронный аукцион признан несостоявшимся по основанию, предусмотренному ч. 1 ст. 71 Федерального закона № 44-ФЗ;;"АКЦИОНЕРНОЕ ОБЩЕСТВО ""МАРИЙ ЭЛ ДОРСТРОЙ""";;47 679 451,00;;;;;;
№ 0308200000121000001;https://zakupki.gov.ru//epz/order/notice/ea44/view/common-info.html?regNumber=0308200000121000001;Определение поставщика завершено;Выполнение работ по определению интенсивности движения и состава транспортных потоков на автомобильныхдорогахреспубликанского значения РеспубликиМарийЭл в 2021 году;"ГОСУДАРСТВЕННОЕ КАЗЕННОЕ УЧРЕЖДЕНИЕ РЕСПУБЛИКИМАРИЙЭЛ ""МАРИЙСКАВТОДОР""";19.01.2021;2 544 240,00 ₽;https://zakupki.gov.ru/epz/order/notice/ea44/view/supplier-results.html?regNumber=0308200000121000001;"ГОСУДАРСТВЕННОЕ КАЗЕННОЕ УЧРЕЖДЕНИЕ РЕСПУБЛИКИ МАРИЙ ЭЛ ""МАРИЙСКАВТОДОР""";Баруткин И. А.;1 - Победитель;1 666 477,20;"ОБЩЕСТВО С ОГРАНИЧЕННОЙ ОТВЕТСТВЕННОСТЬЮ ""КВАНТОР""";2 - Второй номер;1 679 198,39;;;;;;
№ 0108300014921000001;https://zakupki.gov.ru//epz/order/notice/ea44/view/common-info.html?regNumber=0108300014921000001;Определение поставщика завершено;Выполнение работ по содержаниюдорогГородского поселения Сернур в зимний период;СЕРНУРСКАЯ ГОРОДСКАЯ АДМИНИСТРАЦИЯ СЕРНУРСКОГО МУНИЦИПАЛЬНОГО РАЙОНА РЕСПУБЛИКИМАРИЙЭЛ;18.01.2021;297 000,00 ₽;https://zakupki.gov.ru/epz/order/notice/ea44/view/supplier-results.html?regNumber=0108300014921000001;СЕРНУРСКАЯ ГОРОДСКАЯ АДМИНИСТРАЦИЯ СЕРНУРСКОГО МУНИЦИПАЛЬНОГО РАЙОНА РЕСПУБЛИКИ МАРИЙ ЭЛ;;По окончании срока подачи заявок подана только одна заявка. Такая заявка признана соответствующей требованиям Федерального закона № 44-ФЗ и документации об аукционе. Электронный аукцион признан несостоявшимся по основанию, предусмотренному ч. 1 ст. 71 Федерального закона № 44-ФЗ;;Попов А. Н.;;297 000,00;31.12.2021;08.02.2021;;- Марий Эл 12, - Йошкар-Ола, ул. Мышино, д. 107а;Да;субъект малого предпринимательства
№ 0108300003521000001;https://zakupki.gov.ru//epz/order/notice/ea44/view/common-info.html?regNumber=0108300003521000001;Определение поставщика завершено;Содержание автомобильныхдорогместного значения в границах и вне границ населенных пунктов городского поселения Мари-Турек;МАРИ-ТУРЕКСКАЯ ГОРОДСКАЯ АДМИНИСТРАЦИЯ МАРИ-ТУРЕКСКОГО МУНИЦИПАЛЬНОГО РАЙОНА РЕСПУБЛИКИМАРИЙЭЛ;14.01.2021;1 319 000,00 ₽;https://zakupki.gov.ru/epz/order/notice/ea44/view/supplier-results.html?regNumber=0108300003521000001;МАРИ-ТУРЕКСКАЯ ГОРОДСКАЯ АДМИНИСТРАЦИЯ МАРИ-ТУРЕКСКОГО МУНИЦИПАЛЬНОГО РАЙОНА РЕСПУБЛИКИ МАРИЙ ЭЛ;;По окончании срока подачи заявок подана только одна заявка. Такая заявка признана соответствующей требованиям Федерального закона № 44-ФЗ и документации об аукционе. Электронный аукцион признан несостоявшимся по основанию, предусмотренному ч. 1 ст. 71 Федерального закона № 44-ФЗ;;"ОБЩЕСТВО С ОГРАНИЧЕННОЙ ОТВЕТСТВЕННОСТЬЮ ""АВТО-ЭКСПРЕСС""";;1 319 000,00;30.04.2021;03.02.2021;;425500, РЕСП МАРИЙ ЭЛ 12, Р-Н МАРИ-ТУРЕКСКИЙ, ПГТ МАРИ-ТУРЕК, УЛ ЛЕСНАЯ, ДОМ 12, ПОМЕЩЕНИЕ 1;1205004625;субъект малого предпринимательства
№ 0108300014621000001;https://zakupki.gov.ru//epz/order/notice/ea44/view/common-info.html?regNumber=0108300014621000001;Определение поставщика завершено;"Оказание услуг по содержанию, очистке и обслуживаниюдороги объектов коммунального хозяйства, тротуаров, площадей, лестниц, газонов, посадочных площадок автобусных остановок городского округа ""Город Козьмодемьянск"" на 2021 год";"АДМИНИСТРАЦИЯ ГОРОДСКОГО ОКРУГА ""ГОРОД КОЗЬМОДЕМЬЯНСК"" РЕСПУБЛИКИМАРИЙЭЛ";13.01.2021;3 800 000,00 ₽;https://zakupki.gov.ru/epz/order/notice/ea44/view/supplier-results.html?regNumber=0108300014621000001;"АДМИНИСТРАЦИЯ ГОРОДСКОГО ОКРУГА ""ГОРОД КОЗЬМОДЕМЬЯНСК"" РЕСПУБЛИКИ МАРИЙ ЭЛ";;По окончании срока подачи заявок подана только одна заявка. Такая заявка признана соответствующей требованиям Федерального закона № 44-ФЗ и документации об аукционе. Электронный аукцион признан несостоявшимся по основанию, предусмотренному ч. 1 ст. 71 Федерального закона № 44-ФЗ;;"МУНИЦИПАЛЬНОЕ УНИТАРНОЕ ПРЕДПРИЯТИЕ МУНИЦИПАЛЬНОГО ОБРАЗОВАНИЯ ""ГОРОДСКОЙ ОКРУГ ""ГОРОД КОЗЬМОДЕМЬЯНСК"" ""ГОРОДСКОЕ ХОЗЯЙСТВО""";;3 800 000,00;31.12.2021;01.02.2021;;425350, РЕСП МАРИЙ ЭЛ 12, Г КОЗЬМОДЕМЬЯНСК, УЛ 8 МАРТА, ДОМ 27;1217003866;8-83632-71461lopareva.t@inbox.ru
