Номер закупки;Ссылка на продукт;Статус;Описание объекта;Организация;Дата размещения;Цена;Ссылка на поставщика;Заказчик;Победитель;Статус победителя;Цена победителя;Второй номер;Статус второго номера;Цена второго номера;Дата начала контракта;Дата окончания контракта;ФИО Руководителя;ИНН;Контакты
№ 32109971886;https://zakupki.gov.ru/https://zakupki.gov.ru/223/purchase/public/purchase/info/common-info.html?regNumber=32109971886;Работа комиссии;Предоставление услуг временного использования Бугельной канатнойдорогойс горнолыжными склонами на горнолыжном комплексе Кольской АЭС во время проведения тренировочных сборов и соревнований в 2021 году;"ГОСУДАРСТВЕННОЕ АВТОНОМНОЕ УЧРЕЖДЕНИЕМУРМАНСКОЙОБЛАСТИ ""МОНЧЕГОРСКАЯ СПОРТИВНАЯ ШКОЛА ОЛИМПИЙСКОГО РЕЗЕРВА ПО ГОРНОЛЫЖНОМУ СПОРТУ""";09.02.2021;320 770,00 ₽;;;;;;;;;;;;;;
№ 0149200002321000277;https://zakupki.gov.ru//epz/order/notice/ea44/view/common-info.html?regNumber=0149200002321000277;Подача заявок;Выполнение работ по ремонту автомобильныхдорогобщего пользования местного значения Ленинского административного округа городаМурманска;КОМИТЕТ ПО КОНКУРЕНТНОЙ ПОЛИТИКЕМУРМАНСКОЙОБЛАСТИ;08.02.2021;157 237 178,40 ₽;;;;;;;;;;;;;;
№ 0149200002321000276;https://zakupki.gov.ru//epz/order/notice/ea44/view/common-info.html?regNumber=0149200002321000276;Подача заявок;Выполнение работ по ремонту автомобильныхдорогобщего пользования местного значения Октябрьского административного округа городаМурманска;КОМИТЕТ ПО КОНКУРЕНТНОЙ ПОЛИТИКЕМУРМАНСКОЙОБЛАСТИ;08.02.2021;164 051 128,80 ₽;;;;;;;;;;;;;;
№ 0149200002321000275;https://zakupki.gov.ru//epz/order/notice/ea44/view/common-info.html?regNumber=0149200002321000275;Подача заявок;Выполнение работ по ремонту автомобильныхдорогобщего пользования местного значения Первомайского административного округа городаМурманска;КОМИТЕТ ПО КОНКУРЕНТНОЙ ПОЛИТИКЕМУРМАНСКОЙОБЛАСТИ;08.02.2021;218 710 940,40 ₽;;;;;;;;;;;;;;
№ 0306100000421000001;https://zakupki.gov.ru//epz/order/notice/ok504/view/common-info.html?regNumber=0306100000421000001;Подача заявок;"Разработка проектной документации: Расходы на мероприятия по повышению уровня обустройства автомобильныхдорогфедерального значения. Устройство стационарного электрического освещения на автомобильнойдорогеР-21 ""Кола"" Санкт-Петербург - Петрозаводск -Мурманск- Печенга - граница с Королевством Норвегия. Подъезд к аэропорту городаМурманскна участке км 0+200 - км 17+148,Мурманскаяобласть";"ФЕДЕРАЛЬНОЕ КАЗЕННОЕ УЧРЕЖДЕНИЕ ""УПРАВЛЕНИЕ АВТОМОБИЛЬНОЙ МАГИСТРАЛИ САНКТ-ПЕТЕРБУРГ -МУРМАНСКФЕДЕРАЛЬНОГО ДОРОЖНОГО АГЕНТСТВА""";04.02.2021;8 678 500,00 ₽;;;;;;;;;;;;;;
