Номер закупки;Ссылка на продукт;Статус;Описание объекта;Организация;Дата размещения;Цена;Ссылка на поставщика;Заказчик;Победитель;Статус победителя;Цена победителя;Второй номер;Статус второго номера;Цена второго номера;Дата начала контракта;Дата окончания контракта;ФИО Руководителя;ИНН;Контакты
№ 0332300365520000024;https://zakupki.gov.ru//epz/order/notice/ea44/view/common-info.html?regNumber=0332300365520000024;Определение поставщика завершено;Содержаниедорог, площадей, тротуаров и набережной в городе ВетлугеНижегородскойобласти в ноябре-деабре 2020 года;АДМИНИСТРАЦИЯ ГОРОДА ВЕТЛУГИ ВЕТЛУЖСКОГО МУНИЦИПАЛЬНОГО РАЙОНАНИЖЕГОРОДСКОЙОБЛАСТИ;23.10.2020;750 000,00 ₽;https://zakupki.gov.ru/epz/order/notice/ea44/view/supplier-results.html?regNumber=0332300365520000024;АДМИНИСТРАЦИЯ ГОРОДА ВЕТЛУГИ ВЕТЛУЖСКОГО МУНИЦИПАЛЬНОГО РАЙОНА НИЖЕГОРОДСКОЙ ОБЛАСТИ;;По окончании срока подачи заявок подана только одна заявка. Такая заявка признана соответствующей требованиям Федерального закона № 44-ФЗ и документации об аукционе. Электронный аукцион признан несостоявшимся по основанию, предусмотренному ч. 1 ст. 71 Федерального закона № 44-ФЗ;;"ОБЩЕСТВО С ОГРАНИЧЕННОЙ ОТВЕТСТВЕННОСТЬЮ ""НАШ ГОРОД""";;750 000,00;29.01.2021;13.11.2020;;606860, ОБЛ НИЖЕГОРОДСКАЯ 52, Г ВЕТЛУГА, УЛ МИКРОРАЙОН, 24;5209005659;8-83150-21780nashgorodn@mail.ru
№ 0132300017320000082;https://zakupki.gov.ru//epz/order/notice/ea44/view/common-info.html?regNumber=0132300017320000082;Определение поставщика завершено;Содержание автомобильныхдорогобщего пользования муниципального значения без автобусного движения по селу Сеченово и селу Ясное;АДМИНИСТРАЦИЯ СЕЧЕНОВСКОГО МУНИЦИПАЛЬНОГО РАЙОНАНИЖЕГОРОДСКОЙОБЛАСТИ;23.10.2020;1 200 000,00 ₽;https://zakupki.gov.ru/epz/order/notice/ea44/view/supplier-results.html?regNumber=0132300017320000082;ОТДЕЛ ПО РАЗВИТИЮ ТЕРРИТОРИИ И СЕЛЬСКОЙ ИНФРАСТРУКТУРЫ АДМИНИСТРАЦИИ СЕЧЕНОВСКОГО МУНИЦИПАЛЬНОГО РАЙОНА НИЖЕГОРОДСКОЙ ОБЛАСТИ;;По окончании срока подачи заявок подана только одна заявка. Такая заявка признана соответствующей требованиям Федерального закона № 44-ФЗ и документации об аукционе. Электронный аукцион признан несостоявшимся по основанию, предусмотренному ч. 1 ст. 71 Федерального закона № 44-ФЗ;;"ОБЩЕСТВО С ОГРАНИЧЕННОЙ ОТВЕТСТВЕННОСТЬЮ ""РЕГИОН""";;1 200 000,00;31.12.2021;17.11.2020;;607580, ОБЛ НИЖЕГОРОДСКАЯ 52, Р-Н СЕЧЕНОВСКИЙ, С СЕЧЕНОВО, УЛ ПРОМЫШЛЕННАЯ, 2, -, -;5230003608;субъект малого предпринимательства
№ 0332200011320000032;https://zakupki.gov.ru//epz/order/notice/ea44/view/common-info.html?regNumber=0332200011320000032;Определение поставщика завершено;Поставка прибора для измерения коэффициента световозвращения/ светоотражения горизонтальной дорожной разметки.;"ГОСУДАРСТВЕННОЕ КАЗЕННОЕ УЧРЕЖДЕНИЕНИЖЕГОРОДСКОЙОБЛАСТИ ""ГЛАВНОЕ УПРАВЛЕНИЕ АВТОМОБИЛЬНЫХДОРОГ""";22.10.2020;1 668 500,00 ₽;https://zakupki.gov.ru/epz/order/notice/ea44/view/supplier-results.html?regNumber=0332200011320000032;"ГОСУДАРСТВЕННОЕ КАЗЕННОЕ УЧРЕЖДЕНИЕ НИЖЕГОРОДСКОЙ ОБЛАСТИ ""ГЛАВНОЕ УПРАВЛЕНИЕ АВТОМОБИЛЬНЫХ ДОРОГ""";;По окончании срока подачи заявок подана только одна заявка. Такая заявка признана соответствующей требованиям Федерального закона № 44-ФЗ и документации об аукционе. Электронный аукцион признан несостоявшимся по основанию, предусмотренному ч. 1 ст. 71 Федерального закона № 44-ФЗ;;"ОБЩЕСТВО С ОГРАНИЧЕННОЙ ОТВЕТСТВЕННОСТЬЮ ""СМАРТ СИСТЕМС""";;1 668 500,00;06.01.2021;18.11.2020;;"ОБЩЕСТВО С ОГРАНИЧЕННОЙ ОТВЕТСТВЕННОСТЬЮ ""СМАРТ СИСТЕМС"" (ОБЩЕСТВО С ОГРАНИЧЕННОЙ ОТВЕТСТВЕННОСТЬЮ ""СМАРТ СИСТЕМС"")Код по ОКПО:69207849ИНН:7801536100КПП:780101001Датапостановкина учет:16.12.2010";7801536100;199106, Г САНКТ-ПЕТЕРБУРГ 78, ЛИНИЯ 22-Я В.О., 3, 1. ЛИТЕР М, ПОМЕЩЕНИЕ 1Н КОМНАТА 221
№ 0332200011320000031;https://zakupki.gov.ru//epz/order/notice/ea44/view/common-info.html?regNumber=0332200011320000031;Определение поставщика завершено;Устройство светофорного объекта на км 0+300 автомобильнойдороги(22ОП РЗ 22К-0099) Нижний Новгород – Афонино в Кстовском районеНижегородскойобласти;"ГОСУДАРСТВЕННОЕ КАЗЕННОЕ УЧРЕЖДЕНИЕНИЖЕГОРОДСКОЙОБЛАСТИ ""ГЛАВНОЕ УПРАВЛЕНИЕ АВТОМОБИЛЬНЫХДОРОГ""";22.10.2020;1 240 450,00 ₽;https://zakupki.gov.ru/epz/order/notice/ea44/view/supplier-results.html?regNumber=0332200011320000031;"ГОСУДАРСТВЕННОЕ КАЗЕННОЕ УЧРЕЖДЕНИЕ НИЖЕГОРОДСКОЙ ОБЛАСТИ ""ГЛАВНОЕ УПРАВЛЕНИЕ АВТОМОБИЛЬНЫХ ДОРОГ""";;В течение десяти минут после начала проведения электронного аукциона было подано единственное предложение о цене контракта. По результатам рассмотрения второй части такой заявки принято решение о ее соответствии требованиям, установленным документацией об электронном аукционе (ч.13 ст.69 Закона № 44-ФЗ).;;"ОБЩЕСТВО С ОГРАНИЧЕННОЙ ОТВЕТСТВЕННОСТЬЮ ""ШУСТОВ И КОМПАНИЯ ""СПУТНИК""";;1 234 247,75;31.12.2020;17.11.2020;;603093, ОБЛ НИЖЕГОРОДСКАЯ 52, Г НИЖНИЙ НОВГОРОД, УЛ РОДИОНОВА, 23Ж;5260090728;7-831-4349656sputnik_nn@mail.ru
№ 0832200006620000864;https://zakupki.gov.ru//epz/order/notice/ea44/view/common-info.html?regNumber=0832200006620000864;Определение поставщика завершено;Выполнение работ по объекту: «Благоустройство территории Кремлевского бульвара на участке от Ивановской до Зачатьевской башен в границах территории объекта культурного наследия федерального значения «Ансамбль Кремля: Стены и башни, 1500- 1511 гг.»;"ГОСУДАРСТВЕННОЕ КАЗЕННОЕ УЧРЕЖДЕНИЕНИЖЕГОРОДСКОЙОБЛАСТИ ""ЦЕНТР РАЗМЕЩЕНИЯ ЗАКАЗАНИЖЕГОРОДСКОЙОБЛАСТИ""";21.10.2020;27 878 000,00 ₽;https://zakupki.gov.ru/epz/order/notice/ea44/view/supplier-results.html?regNumber=0832200006620000864;УПРАВЛЕНИЕ ДЕЛАМИ ПРАВИТЕЛЬСТВА НИЖЕГОРОДСКОЙ ОБЛАСТИ;"ОБЩЕСТВО С ОГРАНИЧЕННОЙ ОТВЕТСТВЕННОСТЬЮ ""УСПЕНСКОЕ""";1 - Победитель;25 508 370,00;Асатурян арутюн мкрдичович -.;2 - Второй номер;25 647 759,99;13.08.2021;24.11.2020;;603004, г. Нижний Новгород, пр-кт Ленина, д. 115, помещение 46;5258065756;
№ 0132300005820000261;https://zakupki.gov.ru//epz/order/notice/ea44/view/common-info.html?regNumber=0132300005820000261;Определение поставщика завершено;Выполнение работ по поставке и установке знаков дорожного движения в г. Балахна;АДМИНИСТРАЦИЯ БАЛАХНИНСКОГО МУНИЦИПАЛЬНОГО РАЙОНАНИЖЕГОРОДСКОЙОБЛАСТИ;20.10.2020;49 028,78 ₽;https://zakupki.gov.ru/epz/order/notice/ea44/view/supplier-results.html?regNumber=0132300005820000261;АДМИНИСТРАЦИЯ БАЛАХНИНСКОГО МУНИЦИПАЛЬНОГО РАЙОНА НИЖЕГОРОДСКОЙ ОБЛАСТИ;;;;;;;;;;;;
№ 0332300048420000011;https://zakupki.gov.ru//epz/order/notice/ea44/view/common-info.html?regNumber=0332300048420000011;Определение поставщика завершено;Ремонт автомобильныхдорогобщего пользования местного значения в Дивеевском районеНижегородскойобласти;УПРАВЛЕНИЕ КАПИТАЛЬНОГО СТРОИТЕЛЬСТВА И АРХИТЕКТУРЫ АДМИНИСТРАЦИИ ДИВЕЕВСКОГО МУНИЦИПАЛЬНОГО РАЙОНАНИЖЕГОРОДСКОЙОБЛАСТИ;20.10.2020;4 688 085,00 ₽;https://zakupki.gov.ru/epz/order/notice/ea44/view/supplier-results.html?regNumber=0332300048420000011;УПРАВЛЕНИЕ КАПИТАЛЬНОГО СТРОИТЕЛЬСТВА И АРХИТЕКТУРЫ АДМИНИСТРАЦИИ ДИВЕЕВСКОГО МУНИЦИПАЛЬНОГО РАЙОНА НИЖЕГОРОДСКОЙ ОБЛАСТИ;"ОБЩЕСТВО С ОГРАНИЧЕННОЙ ОТВЕТСТВЕННОСТЬЮ ""МАСТЕР-СТРОЙ""";1 - Победитель;3 492 623,07;"ОБЩЕСТВО С ОГРАНИЧЕННОЙ ОТВЕТСТВЕННОСТЬЮ ""ЭНКИ-НН СТРОЙ""";2 - Второй номер;3 516 063,50;31.12.2020;11.11.2020;;"603000, ОБЛ НИЖЕГОРОДСКАЯ 52, Г НИЖНИЙ НОВГОРОД, УЛ МАКСИМА ГОРЬКОГО, ДОМ 150, ОФИС 405""Б""";5238006713;8-83134-42087dorognik2010@mail.ru
№ 0832300001420000268;https://zakupki.gov.ru//epz/order/notice/ea44/view/common-info.html?regNumber=0832300001420000268;Определение поставщика завершено;Выполнение работ по ремонту асфальтобетонного покрытия картами в г. СеменовНижегородскойобласти (№ 258 ЭА-10-2020);АДМИНИСТРАЦИЯ ГОРОДСКОГО ОКРУГА СЕМЕНОВСКИЙНИЖЕГОРОДСКОЙОБЛАСТИ;19.10.2020;8 030 000,00 ₽;https://zakupki.gov.ru/epz/order/notice/ea44/view/supplier-results.html?regNumber=0832300001420000268;"МУНИЦИПАЛЬНОЕ БЮДЖЕТНОЕ УЧРЕЖДЕНИЕ ""БЛАГОУСТРОЙСТВО ГОРОДА""";"ОБЩЕСТВО С ОГРАНИЧЕННОЙ ОТВЕТСТВЕННОСТЬЮ ""БОРСКОЕ ДОРОЖНОЕ РЕМОНТНО-СТРОИТЕЛЬНОЕ ПРЕДПРИЯТИЕ""";1 - Победитель;6 303 550,00;"ОБЩЕСТВО С ОГРАНИЧЕННОЙ ОТВЕТСТВЕННОСТЬЮ ""БОРСКАЯ ДОРОЖНАЯ ПЕРЕДВИЖНАЯ МЕХАНИЗИРОВАННАЯ КОЛОННА""";2 - Второй номер;6 343 700,00;30.06.2021;13.11.2020;;606472, Нижегородская область, 606472, Нижегородская область, г. Бор, с.Кантаурово ( Кантауровский с/с) , ул. Заречная, д.38;5246052270;субъект малого предпринимательства
№ 0832200006620000855;https://zakupki.gov.ru//epz/order/notice/ea44/view/common-info.html?regNumber=0832200006620000855;Определение поставщика завершено;"Выполнение работ по объекту: «Благоустройство территории Кремлевского бульвара на участке от Кладовой до Коромысловой башен в границах территории объекта культурного наследия федерального значения ""Ансамбль Кремля: Стены и башни, 1500-1511 гг.»";"ГОСУДАРСТВЕННОЕ КАЗЕННОЕ УЧРЕЖДЕНИЕНИЖЕГОРОДСКОЙОБЛАСТИ ""ЦЕНТР РАЗМЕЩЕНИЯ ЗАКАЗАНИЖЕГОРОДСКОЙОБЛАСТИ""";19.10.2020;50 455 390,00 ₽;https://zakupki.gov.ru/epz/order/notice/ea44/view/supplier-results.html?regNumber=0832200006620000855;УПРАВЛЕНИЕ ДЕЛАМИ ПРАВИТЕЛЬСТВА НИЖЕГОРОДСКОЙ ОБЛАСТИ;"ОБЩЕСТВО С ОГРАНИЧЕННОЙ ОТВЕТСТВЕННОСТЬЮ ДОРОЖНО-СТРОИТЕЛЬНАЯ КОМПАНИЯ ""АЛМАЗАТОМСТРОЙ""";1 - Победитель;40 364 312,00;"ОБЩЕСТВО С ОГРАНИЧЕННОЙ ОТВЕТСТВЕННОСТЬЮ ""УСПЕНСКОЕ""";2 - Второй номер;41 373 419,80;13.09.2021;24.11.2020;;603607, Нижегородская область, Богородск, Чернышевского ул, 1 офис (квартира) 2;5245029020;
№ 0832200006620000853;https://zakupki.gov.ru//epz/order/notice/ea44/view/common-info.html?regNumber=0832200006620000853;Определение поставщика завершено;Выполнение работ по объектам: «Благоустройство территории Кремлевского бульвара на участке от Зачатьевской до Георгиевской башен в границах территории объекта культурного наследия федерального значения «Ансамбль Кремля: Стены и башни, 1500-1511гг.», г. Нижний Новгород»;"ГОСУДАРСТВЕННОЕ КАЗЕННОЕ УЧРЕЖДЕНИЕНИЖЕГОРОДСКОЙОБЛАСТИ ""ЦЕНТР РАЗМЕЩЕНИЯ ЗАКАЗАНИЖЕГОРОДСКОЙОБЛАСТИ""";19.10.2020;38 998 410,00 ₽;https://zakupki.gov.ru/epz/order/notice/ea44/view/supplier-results.html?regNumber=0832200006620000853;УПРАВЛЕНИЕ ДЕЛАМИ ПРАВИТЕЛЬСТВА НИЖЕГОРОДСКОЙ ОБЛАСТИ;"ОБЩЕСТВО С ОГРАНИЧЕННОЙ ОТВЕТСТВЕННОСТЬЮ ""УСПЕНСКОЕ""";1 - Победитель;34 318 600,80;"ОБЩЕСТВО С ОГРАНИЧЕННОЙ ОТВЕТСТВЕННОСТЬЮ ""МАСТЕРСТРОЙ-ИНВЕСТ""";2 - Второй номер;34 513 592,85;12.09.2021;20.11.2020;;603004, г. Нижний Новгород, пр-кт Ленина, д. 115, помещение 46;5258065756;
№ 0332300330420000152;https://zakupki.gov.ru//epz/order/notice/ea44/view/common-info.html?regNumber=0332300330420000152;Определение поставщика завершено;Выполнение работ по  ликвидации пучинообразований на автомобильнойдорогепо ул. Победы в  с. Протопоповка Арзамасского районаНижегородскойобласти;АДМИНИСТРАЦИЯ АРЗАМАССКОГО МУНИЦИПАЛЬНОГО РАЙОНАНИЖЕГОРОДСКОЙОБЛАСТИ;19.10.2020;2 316 597,00 ₽;https://zakupki.gov.ru/epz/order/notice/ea44/view/supplier-results.html?regNumber=0332300330420000152;АДМИНИСТРАЦИЯ АРЗАМАССКОГО МУНИЦИПАЛЬНОГО РАЙОНА НИЖЕГОРОДСКОЙ ОБЛАСТИ;"ОБЩЕСТВО С ОГРАНИЧЕННОЙ ОТВЕТСТВЕННОСТЬЮ ""АРЗАМАСЕЦ-1""";1 - Победитель;2 015 439,31;"ОБЩЕСТВО С ОГРАНИЧЕННОЙ ОТВЕТСТВЕННОСТЬЮ ""КАПСТРОЙ-20""";2 - Второй номер;2 027 022,30;23.12.2020;18.11.2020;;607220, ОБЛ НИЖЕГОРОДСКАЯ 52, Г АРЗАМАС, УЛ ЗАВОДСКАЯ, 3;5243017693;субъект малого предпринимательства
№ 0801300012820000148;https://zakupki.gov.ru//epz/order/notice/oku504/view/common-info.html?regNumber=0801300012820000148;Определение поставщика завершено;Оказание услуг по организации школьного питания;"МУНИЦИПАЛЬНОЕ КАЗЕННОЕ УЧРЕЖДЕНИЕ ""УПРАВЛЕНИЕ ПО ЦЕНТРАЛИЗОВАННЫМ ЗАКУПКАМ"" МУНИЦИПАЛЬНОГО РАЙОНА УФИМСКИЙ РАЙОН РЕСПУБЛИКИ БАШКОРТОСТАН";19.10.2020;13 530 330,00 ₽;https://zakupki.gov.ru/epz/order/notice/ea44/view/supplier-results.html?regNumber=0801300012820000148;МУНИЦИПАЛЬНОЕ ОБЩЕОБРАЗОВАТЕЛЬНОЕ БЮДЖЕТНОЕ УЧРЕЖДЕНИЕ ЛИЦЕЙ С.БУЛГАКОВО МУНИЦИПАЛЬНОГО РАЙОНА УФИМСКИЙ РАЙОН РЕСПУБЛИКИ БАШКОРТОСТАН;МУНИЦИПАЛЬНОЕ ОБЩЕОБРАЗОВАТЕЛЬНОЕ БЮДЖЕТНОЕ УЧРЕЖДЕНИЕ СРЕДНЯЯ ОБЩЕОБРАЗОВАТЕЛЬНАЯ ШКОЛА Д. ЮМАТОВО МУНИЦИПАЛЬНОГО РАЙОНА УФИМСКИЙ РАЙОН РЕСПУБЛИКИ БАШКОРТОСТАН;МУНИЦИПАЛЬНОЕ ОБЩЕОБРАЗОВАТЕЛЬНОЕ БЮДЖЕТНОЕ УЧРЕЖДЕНИЕ СРЕДНЯЯ ОБЩЕОБРАЗОВАТЕЛЬНАЯ ШКОЛА ИМЕНИ ГЕРОЯ СОВЕТСКОГО СОЮЗА АЛЫМОВА АЛЕКСЕЯ МИХАЙЛОВИЧА С.МИХАЙЛОВКА МУНИЦИПАЛЬНОГО РАЙОНА УФИМСКИЙ РАЙОН РЕСПУБЛИКИ БАШКОРТОСТАН;"МУНИЦИПАЛЬНОЕ ОБЩЕОБРАЗОВАТЕЛЬНОЕ БЮДЖЕТНОЕ УЧРЕЖДЕНИЕ ""ШКОЛА УСПЕХА"" С. ЖУКОВО МУНИЦИПАЛЬНОГО РАЙОНА УФИМСКИЙ РАЙОН РЕСПУБЛИКИ БАШКОРТОСТАН";МУНИЦИПАЛЬНОЕ ОБЩЕОБРАЗОВАТЕЛЬНОЕ БЮДЖЕТНОЕ УЧРЕЖДЕНИЕ СРЕДНЯЯ ОБЩЕОБРАЗОВАТЕЛЬНАЯ ШКОЛА С. АВДОН МУНИЦИПАЛЬНОГО РАЙОНА УФИМСКИЙ РАЙОН РЕСПУБЛИКИ БАШКОРТОСТАН;МУНИЦИПАЛЬНОЕ ОБЩЕОБРАЗОВАТЕЛЬНОЕ БЮДЖЕТНОЕ УЧРЕЖДЕНИЕ СРЕДНЯЯ ОБЩЕОБРАЗОВАТЕЛЬНАЯ ШКОЛА Д. ШАМОНИНО МУНИЦИПАЛЬНОГО РАЙОНА УФИМСКИЙ РАЙОН РЕСПУБЛИКИ БАШКОРТОСТАН;МУНИЦИПАЛЬНОЕ ОБЩЕОБРАЗОВАТЕЛЬНОЕ БЮДЖЕТНОЕ УЧРЕЖДЕНИЕ СРЕДНЯЯ ОБЩЕОБРАЗОВАТЕЛЬНАЯ ШКОЛА ИМЕНИ ГЕРОЯ СОВЕТСКОГО СОЮЗА ГОРЧИЛИНА АЛЕКСАНДРА МИХАЙЛОВИЧА С. ЧЕСНОКОВКА МУНИЦИПАЛЬНОГО РАЙОНА УФИМСКИЙ РАЙОН РЕСПУБЛИКИ БАШКОРТОСТАН;31.12.2020;24.11.2020;;Респ Башкортостан, Уфимский р-н, село Михайловка, ул Ленина, д 65;0245960618;
№ 0832200006620000849;https://zakupki.gov.ru//epz/order/notice/ea44/view/common-info.html?regNumber=0832200006620000849;Определение поставщика завершено;Ремонт участков автомобильнойдороги(22 ОП МЗ 22Н-2609) Кстово - Б.Мокрое - Вязовка км 3+000 - км 6+200, км 8+241 - км 11+875  в Кстовском районеНижегородскойобласти;"ГОСУДАРСТВЕННОЕ КАЗЕННОЕ УЧРЕЖДЕНИЕНИЖЕГОРОДСКОЙОБЛАСТИ ""ЦЕНТР РАЗМЕЩЕНИЯ ЗАКАЗАНИЖЕГОРОДСКОЙОБЛАСТИ""";16.10.2020;112 900 015,00 ₽;https://zakupki.gov.ru/epz/order/notice/ea44/view/supplier-results.html?regNumber=0832200006620000849;"ГОСУДАРСТВЕННОЕ КАЗЕННОЕ УЧРЕЖДЕНИЕ НИЖЕГОРОДСКОЙ ОБЛАСТИ ""ГЛАВНОЕ УПРАВЛЕНИЕ АВТОМОБИЛЬНЫХ ДОРОГ""";"ОБЩЕСТВО С ОГРАНИЧЕННОЙ ОТВЕТСТВЕННОСТЬЮ КОРПОРАЦИЯ ""СТРОЙИНВЕСТ""";1 - Победитель;84 675 011,05;"ОБЩЕСТВО С ОГРАНИЧЕННОЙ ОТВЕТСТВЕННОСТЬЮ ""АВТОБЕЛСТРОЙ""";2 - Второй номер;84 675 011,05;30.07.2021;12.11.2020;;603136, ОБЛ НИЖЕГОРОДСКАЯ 52, Г НИЖНИЙ НОВГОРОД, Б-Р 60-ЛЕТИЯ ОКТЯБРЯ, 25, 3, ПОМЕЩЕНИЕ 2;5262137820;7-831-4185968stroy-invest@mail.ru
№ 0832200006620000848;https://zakupki.gov.ru//epz/order/notice/ea44/view/common-info.html?regNumber=0832200006620000848;Определение поставщика отменено;"Ремонт участка автомобильнойдороги(22 ОП МЗ 22Н - 2935) Подъезд к с. Асташиха - с. Белозериха от а/д М-7 ""Волга"" км 0+016 - км 9+788  в Лысковском районеНижегородскойобласти";"ГОСУДАРСТВЕННОЕ КАЗЕННОЕ УЧРЕЖДЕНИЕНИЖЕГОРОДСКОЙОБЛАСТИ ""ЦЕНТР РАЗМЕЩЕНИЯ ЗАКАЗАНИЖЕГОРОДСКОЙОБЛАСТИ""";16.10.2020;80 330 420,00 ₽;;;;;;;;;;;;;;
№ 0832200006620000847;https://zakupki.gov.ru//epz/order/notice/ea44/view/common-info.html?regNumber=0832200006620000847;Определение поставщика завершено;Содержание наплавного моста через р.Ока на автомобильнойдороге(22 ОП РЗ 22К-0032) Павлово–Тумботино–Гороховец в Павловском районеНижегородскойобласти;"ГОСУДАРСТВЕННОЕ КАЗЕННОЕ УЧРЕЖДЕНИЕНИЖЕГОРОДСКОЙОБЛАСТИ ""ЦЕНТР РАЗМЕЩЕНИЯ ЗАКАЗАНИЖЕГОРОДСКОЙОБЛАСТИ""";16.10.2020;26 260 000,00 ₽;https://zakupki.gov.ru/epz/order/notice/ea44/view/supplier-results.html?regNumber=0832200006620000847;"ГОСУДАРСТВЕННОЕ КАЗЕННОЕ УЧРЕЖДЕНИЕ НИЖЕГОРОДСКОЙ ОБЛАСТИ ""ГЛАВНОЕ УПРАВЛЕНИЕ АВТОМОБИЛЬНЫХ ДОРОГ""";;В течение десяти минут после начала проведения электронного аукциона было подано единственное предложение о цене контракта. По результатам рассмотрения второй части такой заявки принято решение о ее соответствии требованиям, установленным документацией об электронном аукционе (ч.13 ст.69 Закона № 44-ФЗ).;;"АКЦИОНЕРНОЕ ОБЩЕСТВО ""ДОРОЖНОЕ""";;26 128 700,00;10.05.2021;12.11.2020;;606104, ОБЛ НИЖЕГОРОДСКАЯ 52, Г ПАВЛОВО, УЛ ЧКАЛОВА, 58;5252005775;7-83171-31278dorojnoe@dorpvl.ru
