Номер закупки;Ссылка на продукт;Статус;Описание объекта;Организация;Дата размещения;Цена;Ссылка на поставщика;Заказчик;Победитель;Статус победителя;Цена победителя;Второй номер;Статус второго номера;Цена второго номера;Дата начала контракта;Дата окончания контракта;ФИО Руководителя;ИНН;Контакты
№ 0171300004420000019;https://zakupki.gov.ru//epz/order/notice/ea44/view/common-info.html?regNumber=0171300004420000019;Определение поставщика завершено;Благоустройство придомовой территории по адресу:Ярославскаяобласть, г. Любим, ул. Октябрьская, д. 62 (ремонт проезда к многоквартирному дому).;АДМИНИСТРАЦИЯ ГОРОДСКОГО ПОСЕЛЕНИЯ ЛЮБИМЯРОСЛАВСКОЙОБЛАСТИ;23.11.2020;416 754,00 ₽;https://zakupki.gov.ru/epz/order/notice/ea44/view/supplier-results.html?regNumber=0171300004420000019;АДМИНИСТРАЦИЯ ГОРОДСКОГО ПОСЕЛЕНИЯ ЛЮБИМ ЯРОСЛАВСКОЙ ОБЛАСТИ;;По окончании срока подачи заявок подана только одна заявка. Такая заявка признана соответствующей требованиям Федерального закона № 44-ФЗ и документации об аукционе. Электронный аукцион признан несостоявшимся по основанию, предусмотренному ч. 1 ст. 71 Федерального закона № 44-ФЗ;;"ОБЩЕСТВО С ОГРАНИЧЕННОЙ ОТВЕТСТВЕННОСТЬЮ ""ГРИНВУД""";;416 754,00;23.07.2021;14.12.2020;;150001, ОБЛ ЯРОСЛАВСКАЯ 76, Г ЯРОСЛАВЛЬ, УЛ НАУМОВА, ДОМ 67/2, ОФИС 226;7604327393;
№ 0171200001920002240;https://zakupki.gov.ru//epz/order/notice/ea44/view/common-info.html?regNumber=0171200001920002240;Определение поставщика завершено;Ремонт асфальтового покрытия дворового проезда по адресу: с. Новый Некоуз, ул. Колхозная, д. 58, 60 Некоузского СП в Некоузском районеЯрославскойобласти;ДЕПАРТАМЕНТ ГОСУДАРСТВЕННОГО ЗАКАЗАЯРОСЛАВСКОЙОБЛАСТИ;23.11.2020;1 055 587,20 ₽;https://zakupki.gov.ru/epz/order/notice/ea44/view/supplier-results.html?regNumber=0171200001920002240;АДМИНИСТРАЦИЯ НЕКОУЗСКОГО СЕЛЬСКОГО ПОСЕЛЕНИЯ;;По окончании срока подачи заявок подана только одна заявка. Такая заявка признана соответствующей требованиям Федерального закона № 44-ФЗ и документации об аукционе. Электронный аукцион признан несостоявшимся по основанию, предусмотренному ч. 1 ст. 71 Федерального закона № 44-ФЗ;;"АКЦИОНЕРНОЕ ОБЩЕСТВО ""ЯРДОРМОСТ""";;1 055 587,20;11.11.2021;14.12.2020;;150510, ЯО, Ярославский р-н, д. Кузнечиха, ул. Индустриальная, д. 4;7627051656;84852764818markinaev@yardormost.ru
№ 0171300004420000018;https://zakupki.gov.ru//epz/order/notice/ea44/view/common-info.html?regNumber=0171300004420000018;Определение поставщика завершено;Благоустройство придомовой территории по адресу:Ярославскаяобласть, г. Любим, ул. Октябрьская, д. 62 (благоустройство придомовой территории).;АДМИНИСТРАЦИЯ ГОРОДСКОГО ПОСЕЛЕНИЯ ЛЮБИМЯРОСЛАВСКОЙОБЛАСТИ;23.11.2020;636 240,00 ₽;https://zakupki.gov.ru/epz/order/notice/ea44/view/supplier-results.html?regNumber=0171300004420000018;АДМИНИСТРАЦИЯ ГОРОДСКОГО ПОСЕЛЕНИЯ ЛЮБИМ ЯРОСЛАВСКОЙ ОБЛАСТИ;;По окончании срока подачи заявок подана только одна заявка. Такая заявка признана соответствующей требованиям Федерального закона № 44-ФЗ и документации об аукционе. Электронный аукцион признан несостоявшимся по основанию, предусмотренному ч. 1 ст. 71 Федерального закона № 44-ФЗ;;"ОБЩЕСТВО С ОГРАНИЧЕННОЙ ОТВЕТСТВЕННОСТЬЮ ""ГРИНВУД""";;636 240,00;23.07.2021;14.12.2020;;150001, ОБЛ ЯРОСЛАВСКАЯ 76, Г ЯРОСЛАВЛЬ, УЛ НАУМОВА, ДОМ 67/2, ОФИС 226;7604327393;
№ 0841300009020000724;https://zakupki.gov.ru//epz/order/notice/ea44/view/common-info.html?regNumber=0841300009020000724;Определение поставщика завершено;Выполнение работ по строительству сети наружного освещения (электроосвещение) на участке автомобильнойдорогиобщего пользования местного значения города Костромы по улицеЯрославской(от улицы Заволжской до улицы Магистральной).;"МУНИЦИПАЛЬНОЕ КАЗЕННОЕ УЧРЕЖДЕНИЕ ГОРОДА КОСТРОМЫ ""АГЕНТСТВО МУНИЦИПАЛЬНЫХ ЗАКУПОК""";23.11.2020;4 130 539,00 ₽;https://zakupki.gov.ru/epz/order/notice/ea44/view/supplier-results.html?regNumber=0841300009020000724;"МУНИЦИПАЛЬНОЕ КАЗЕННОЕ УЧРЕЖДЕНИЕ ГОРОДА КОСТРОМЫ ""СЛУЖБА МУНИЦИПАЛЬНОГО ЗАКАЗА ПО ЖИЛИЩНО-КОММУНАЛЬНОМУ ХОЗЯЙСТВУ""";"ОБЩЕСТВО С ОГРАНИЧЕННОЙ ОТВЕТСТВЕННОСТЬЮ ""ПРОФЭЛЕКТРОМОНТАЖ""";1 - Победитель;3 600 000,00;"ОБЩЕСТВО С ОГРАНИЧЕННОЙ ОТВЕТСТВЕННОСТЬЮ ""ЭНЕРГОСЕРВИС""";2 - Второй номер;3 658 694,60;28.02.2021;18.12.2020;;156009, ОБЛ КОСТРОМСКАЯ 44, Г КОСТРОМА, УЛ ЮБИЛЕЙНАЯ, ДОМ 28, ЛИТЕР З,З1,З2, ПОМЕЩЕНИЕ 1;4401066302;субъект малого предпринимательства
№ 0171200001920002227;https://zakupki.gov.ru//epz/order/notice/ea44/view/common-info.html?regNumber=0171200001920002227;Определение поставщика завершено;Ремонт пешеходной дорожки по адресу: г. Любим, ул. Красноармейская (от ул. Вологодская до ул. Комсомольская);ДЕПАРТАМЕНТ ГОСУДАРСТВЕННОГО ЗАКАЗАЯРОСЛАВСКОЙОБЛАСТИ;23.11.2020;1 859 444,40 ₽;https://zakupki.gov.ru/epz/order/notice/ea44/view/supplier-results.html?regNumber=0171200001920002227;АДМИНИСТРАЦИЯ ГОРОДСКОГО ПОСЕЛЕНИЯ ЛЮБИМ ЯРОСЛАВСКОЙ ОБЛАСТИ;;В течение десяти минут после начала проведения электронного аукциона было подано единственное предложение о цене контракта. По результатам рассмотрения второй части такой заявки принято решение о ее соответствии требованиям, установленным документацией об электронном аукционе (ч.13 ст.69 Закона № 44-ФЗ).;;"ОБЩЕСТВО С ОГРАНИЧЕННОЙ ОТВЕТСТВЕННОСТЬЮ ""ГРИНВУД""";;1 850 147,18;10.08.2021;22.12.2020;;150001, ОБЛ ЯРОСЛАВСКАЯ 76, Г ЯРОСЛАВЛЬ, УЛ НАУМОВА, ДОМ 67/2, ОФИС 226;7604327393;
№ 32009708801;https://zakupki.gov.ru/https://zakupki.gov.ru/223/purchase/public/purchase/info/common-info.html?regNumber=32009708801;Закупка завершена;№ 8592/ОКЭ-АО «РЖДстрой»/2020 на право заключения договоров на выполнение работ по текущему ремонту объектов Северной дирекции по эксплуатации зданий и сооружений – структурного подразделения Северной железнойдороги– филиала ОАО «РЖД».;"АКЦИОНЕРНОЕ ОБЩЕСТВО ""РЖДСТРОЙ""";23.11.2020;;;;;;;;;;;;;;;
№ 0171300006920000012;https://zakupki.gov.ru//epz/order/notice/ea44/view/common-info.html?regNumber=0171300006920000012;Определение поставщика завершено;Благоустройство общественной территории п. Красные Ткачи, ул. Парковый переулок – до парка «Берёзки» уличное освещение;АДМИНИСТРАЦИЯ КАРАБИХСКОГО СЕЛЬСКОГО ПОСЕЛЕНИЯЯРОСЛАВСКОГОМУНИЦИПАЛЬНОГО РАЙОНАЯРОСЛАВСКОЙОБЛАСТИ;23.11.2020;528 571,20 ₽;https://zakupki.gov.ru/epz/order/notice/ea44/view/supplier-results.html?regNumber=0171300006920000012;АДМИНИСТРАЦИЯ КАРАБИХСКОГО СЕЛЬСКОГО ПОСЕЛЕНИЯ ЯРОСЛАВСКОГО МУНИЦИПАЛЬНОГО РАЙОНА ЯРОСЛАВСКОЙ ОБЛАСТИ;"ОБЩЕСТВО С ОГРАНИЧЕННОЙ ОТВЕТСТВЕННОСТЬЮ ""ФАНО""";1 - Победитель;266 110,98;"ОБЩЕСТВО С ОГРАНИЧЕННОЙ ОТВЕТСТВЕННОСТЬЮ ""ЭСП-СФЕРА""";2 - Второй номер;268 753,84;11.08.2021;21.12.2020;;156016, ОБЛ КОСТРОМСКАЯ, Г КОСТРОМА, УЛ ПРОФСОЮЗНАЯ, 29, 271;4401079118;79036384743romakostroma@mail.ru
№ 0871600002820000290;https://zakupki.gov.ru//epz/order/notice/ea44/view/common-info.html?regNumber=0871600002820000290;Определение поставщика завершено;Содержание автомобильныхдорогобщего пользования местного значения в границах населенных пунктов Левобережного сельского поселения Тутаевского муниципального районаЯрославскойобласти на период с 01.01.2021 г. по 31.12.2021 г.;"МУНИЦИПАЛЬНОЕ КАЗЕННОЕ УЧРЕЖДЕНИЕ ""ЦЕНТР КОНТРАКТНЫХ ОТНОШЕНИЙ"" ТУТАЕВСКОГО МУНИЦИПАЛЬНОГО РАЙОНА";21.11.2020;2 520 951,99 ₽;https://zakupki.gov.ru/epz/order/notice/ea44/view/supplier-results.html?regNumber=0871600002820000290;АДМИНИСТРАЦИЯ ЛЕВОБЕРЕЖНОГО СЕЛЬСКОГО ПОСЕЛЕНИЯ ТУТАЕВСКОГО МУНИЦИПАЛЬНОГО РАЙОНА ЯРОСЛАВСКОЙ ОБЛАСТИ;;По окончании срока подачи заявок подана только одна заявка. Такая заявка признана соответствующей требованиям Федерального закона № 44-ФЗ и документации об аукционе. Электронный аукцион признан несостоявшимся по основанию, предусмотренному ч. 1 ст. 71 Федерального закона № 44-ФЗ;;"ОБЩЕСТВО С ОГРАНИЧЕННОЙ ОТВЕТСТВЕННОСТЬЮ УПРАВЛЯЮЩАЯ КОМПАНИЯ ""ЛЕВОБЕРЕЖЬЕ""";;2 520 951,99;01.02.2022;14.12.2020;;152302, ОБЛ ЯРОСЛАВСКАЯ 76, Г ТУТАЕВ, УЛ 2-Я ОВРАЖНАЯ, 25, 4;7611018780;7-48533-78593ptozkh@rambler.ru
№ 0171200001920002193;https://zakupki.gov.ru//epz/order/notice/ea44/view/common-info.html?regNumber=0171200001920002193;Определение поставщика завершено;Ремонт пешеходной дорожки по ул. Рыбинская в г. Пошехонье;ДЕПАРТАМЕНТ ГОСУДАРСТВЕННОГО ЗАКАЗАЯРОСЛАВСКОЙОБЛАСТИ;20.11.2020;3 907 543,20 ₽;https://zakupki.gov.ru/epz/order/notice/ea44/view/supplier-results.html?regNumber=0171200001920002193;МУНИЦИПАЛЬНОЕ УЧРЕЖДЕНИЕ АДМИНИСТРАЦИЯ ГОРОДСКОГО ПОСЕЛЕНИЯ ПОШЕХОНЬЕ ПОШЕХОНСКОГО МУНИЦИПАЛЬНОГО РАЙОНА ЯРОСЛАВСКОЙ ОБЛАСТИ;;По окончании срока подачи заявок подана только одна заявка. Такая заявка признана соответствующей требованиям Федерального закона № 44-ФЗ и документации об аукционе. Электронный аукцион признан несостоявшимся по основанию, предусмотренному ч. 1 ст. 71 Федерального закона № 44-ФЗ;;"АКЦИОНЕРНОЕ ОБЩЕСТВО ""ЯРДОРМОСТ""";;3 907 543,20;15.10.2021;22.12.2020;;150510, ОБЛ ЯРОСЛАВСКАЯ 76, Р-Н ЯРОСЛАВСКИЙ, Д КУЗНЕЧИХА (КУЗНЕЧИХИНСКИЙ С.О.), УЛ ИНДУСТРИАЛЬНАЯ, ДОМ 4;7627051656;
№ 0171200001920002190;https://zakupki.gov.ru//epz/order/notice/ea44/view/common-info.html?regNumber=0171200001920002190;Определение поставщика завершено;Благоустройство дворовой территории многоквартирного дома по адресу: г. Пошехонье, ул. Комсомольская, д. 33а и д. 35;ДЕПАРТАМЕНТ ГОСУДАРСТВЕННОГО ЗАКАЗАЯРОСЛАВСКОЙОБЛАСТИ;20.11.2020;2 052 186,00 ₽;https://zakupki.gov.ru/epz/order/notice/ea44/view/supplier-results.html?regNumber=0171200001920002190;МУНИЦИПАЛЬНОЕ УЧРЕЖДЕНИЕ АДМИНИСТРАЦИЯ ГОРОДСКОГО ПОСЕЛЕНИЯ ПОШЕХОНЬЕ ПОШЕХОНСКОГО МУНИЦИПАЛЬНОГО РАЙОНА ЯРОСЛАВСКОЙ ОБЛАСТИ;;По окончании срока подачи заявок подана только одна заявка. Такая заявка признана соответствующей требованиям Федерального закона № 44-ФЗ и документации об аукционе. Электронный аукцион признан несостоявшимся по основанию, предусмотренному ч. 1 ст. 71 Федерального закона № 44-ФЗ;;"АКЦИОНЕРНОЕ ОБЩЕСТВО ""ЯРДОРМОСТ""";;2 052 186,00;15.10.2021;22.12.2020;;150510, ОБЛ ЯРОСЛАВСКАЯ 76, Р-Н ЯРОСЛАВСКИЙ, Д КУЗНЕЧИХА (КУЗНЕЧИХИНСКИЙ С.О.), УЛ ИНДУСТРИАЛЬНАЯ, ДОМ 4;7627051656;
№ 0171200001920002189;https://zakupki.gov.ru//epz/order/notice/ea44/view/common-info.html?regNumber=0171200001920002189;Определение поставщика завершено;Благоустройство дворовой территории многоквартирного дома по адресу: г. Пошехонье, ул. Красноармейская, д. 62;ДЕПАРТАМЕНТ ГОСУДАРСТВЕННОГО ЗАКАЗАЯРОСЛАВСКОЙОБЛАСТИ;20.11.2020;1 578 093,60 ₽;https://zakupki.gov.ru/epz/order/notice/ea44/view/supplier-results.html?regNumber=0171200001920002189;МУНИЦИПАЛЬНОЕ УЧРЕЖДЕНИЕ АДМИНИСТРАЦИЯ ГОРОДСКОГО ПОСЕЛЕНИЯ ПОШЕХОНЬЕ ПОШЕХОНСКОГО МУНИЦИПАЛЬНОГО РАЙОНА ЯРОСЛАВСКОЙ ОБЛАСТИ;;По окончании срока подачи заявок подана только одна заявка. Такая заявка признана соответствующей требованиям Федерального закона № 44-ФЗ и документации об аукционе. Электронный аукцион признан несостоявшимся по основанию, предусмотренному ч. 1 ст. 71 Федерального закона № 44-ФЗ;;"АКЦИОНЕРНОЕ ОБЩЕСТВО ""ЯРДОРМОСТ""";;1 578 093,60;15.09.2021;22.12.2020;;150510, ОБЛ ЯРОСЛАВСКАЯ 76, Р-Н ЯРОСЛАВСКИЙ, Д КУЗНЕЧИХА (КУЗНЕЧИХИНСКИЙ С.О.), УЛ ИНДУСТРИАЛЬНАЯ, ДОМ 4;7627051656;
№ 0330100010520000126;https://zakupki.gov.ru//epz/order/notice/ea44/view/common-info.html?regNumber=0330100010520000126;Определение поставщика завершено;"Оказание услуг по содержанию искусственныхдорожных сооружений на автомобильнойдорогеобщего пользования федеральногозначения Р-132 ""Золотое кольцо""Ярославль- Кострома - Иваново -Владимир - Гусь-Хрустальный - Рязань - Михайлов - Тула - Калуга - Вязьма - Ржев- Тверь - Углич -Ярославлькм 72+850 - км 114+910, Костромская область";"ФЕДЕРАЛЬНОЕ КАЗЕННОЕ УЧРЕЖДЕНИЕ ""УПРАВЛЕНИЕ АВТОМОБИЛЬНОЙ МАГИСТРАЛИ МОСКВА-АРХАНГЕЛЬСК ФЕДЕРАЛЬНОГО ДОРОЖНОГО АГЕНТСТВА""";20.11.2020;10 697 769,00 ₽;https://zakupki.gov.ru/epz/order/notice/ea44/view/supplier-results.html?regNumber=0330100010520000126;"ФЕДЕРАЛЬНОЕ КАЗЕННОЕ УЧРЕЖДЕНИЕ ""УПРАВЛЕНИЕ АВТОМОБИЛЬНОЙ МАГИСТРАЛИ МОСКВА-АРХАНГЕЛЬСК ФЕДЕРАЛЬНОГО ДОРОЖНОГО АГЕНТСТВА""";"ОБЩЕСТВО С ОГРАНИЧЕННОЙ ОТВЕТСТВЕННОСТЬЮ ""СЕВЕРМОСТ""";1 - Победитель;9 734 969,70;"ОБЩЕСТВО С ОГРАНИЧЕННОЙ ОТВЕТСТВЕННОСТЬЮ ""ИНДУСТРИЯ""";2 - Второй номер;9 788 458,55;31.12.2022;21.12.2020;;31.10.2021;3525207829;01.09.2021
№ 0330100010520000125;https://zakupki.gov.ru//epz/order/notice/ea44/view/common-info.html?regNumber=0330100010520000125;Определение поставщика завершено;"...  автомобильныхдорогахобщего пользования федеральногозначения М-8 ""Холмогоры"" Москва -Ярославль- Вологда ... +718, М-8 ""Холмогоры"" Москва -Ярославль- Вологда- Архангельск подъезд к городу ... ,  А-114 Вологда -Тихвин - автомобильнаядорогаР-21 ""Кола"", км 4 ... +797, М-8 ""Холмогоры""Москва -Ярославль- Вологда - Архангельск (Обход города ...  протяженностью23,06 кмвЯрославской, Костромской и Вологодской областях";"ФЕДЕРАЛЬНОЕ КАЗЕННОЕ УЧРЕЖДЕНИЕ ""УПРАВЛЕНИЕ АВТОМОБИЛЬНОЙ МАГИСТРАЛИ МОСКВА-АРХАНГЕЛЬСК ФЕДЕРАЛЬНОГО ДОРОЖНОГО АГЕНТСТВА""";20.11.2020;11 000 000,00 ₽;https://zakupki.gov.ru/epz/order/notice/ea44/view/supplier-results.html?regNumber=0330100010520000125;"ФЕДЕРАЛЬНОЕ КАЗЕННОЕ УЧРЕЖДЕНИЕ ""УПРАВЛЕНИЕ АВТОМОБИЛЬНОЙ МАГИСТРАЛИ МОСКВА-АРХАНГЕЛЬСК ФЕДЕРАЛЬНОГО ДОРОЖНОГО АГЕНТСТВА""";;;;;;;;;;;;
№ 0171200001920002173;https://zakupki.gov.ru//epz/order/notice/ea44/view/common-info.html?regNumber=0171200001920002173;Определение поставщика завершено;Благоустройство придомовой территории по адресу:Ярославскаяобласть, Любимский район, п. Отрадный, д. 18,19;ДЕПАРТАМЕНТ ГОСУДАРСТВЕННОГО ЗАКАЗАЯРОСЛАВСКОЙОБЛАСТИ;20.11.2020;1 397 098,80 ₽;https://zakupki.gov.ru/epz/order/notice/ea44/view/supplier-results.html?regNumber=0171200001920002173;АДМИНИСТРАЦИЯ ГОРОДСКОГО ПОСЕЛЕНИЯ ЛЮБИМ ЯРОСЛАВСКОЙ ОБЛАСТИ;"ОБЩЕСТВО С ОГРАНИЧЕННОЙ ОТВЕТСТВЕННОСТЬЮ ""ГРИНВУД""";1 - Победитель;1 243 418,02;"ОБЩЕСТВО С ОГРАНИЧЕННОЙ ОТВЕТСТВЕННОСТЬЮ ""ИНТЕНТ""";2 - Второй номер;1 243 418,02;23.08.2021;15.12.2020;;150001, ОБЛ ЯРОСЛАВСКАЯ 76, Г ЯРОСЛАВЛЬ, УЛ НАУМОВА, ДОМ 67/2, ОФИС 226;7604327393;
№ 0171200001920002172;https://zakupki.gov.ru//epz/order/notice/ea44/view/common-info.html?regNumber=0171200001920002172;Определение поставщика завершено;Благоустройство территории между ул. Школьной и ул. Сосновой в д. Мордвиново: 2-й этап – мощение площади;ДЕПАРТАМЕНТ ГОСУДАРСТВЕННОГО ЗАКАЗАЯРОСЛАВСКОЙОБЛАСТИ;20.11.2020;2 091 363,60 ₽;https://zakupki.gov.ru/epz/order/notice/ea44/view/supplier-results.html?regNumber=0171200001920002172;АДМИНИСТРАЦИЯ КУРБСКОГО СЕЛЬСКОГО ПОСЕЛЕНИЯ ЯРОСЛАВСКОГО МУНИЦИПАЛЬНОГО РАЙОНА ЯРОСЛАВСКОЙ ОБЛАСТИ;"ОБЩЕСТВО С ОГРАНИЧЕННОЙ ОТВЕТСТВЕННОСТЬЮ ""СТРОЙГРАД""";1 - Победитель;1 871 770,42;"АКЦИОНЕРНОЕ ОБЩЕСТВО ""ЯРДОРМОСТ""";2 - Второй номер;1 882 227,24;04.08.2021;17.12.2020;;Российская Федерация, 150029, ОБЛ ЯРОСЛАВСКАЯ, Г ЯРОСЛАВЛЬ, УЛ 3-Я НОВОДУХОВСКАЯ, ДОМ 43,1;7604350988;79159879144smoyan1993@list.ru
№ 0171200001920002166;https://zakupki.gov.ru//epz/order/notice/ea44/view/common-info.html?regNumber=0171200001920002166;Определение поставщика завершено;Выполнение работ по комплексному благоустройству дворовой территории многоквартирных жилых домов № 5, 5а по ул. Центральная, пос. Фоминское, Тутаевского муниципального района,Ярославскойобласти;ДЕПАРТАМЕНТ ГОСУДАРСТВЕННОГО ЗАКАЗАЯРОСЛАВСКОЙОБЛАСТИ;19.11.2020;1 406 604,00 ₽;https://zakupki.gov.ru/epz/order/notice/ea44/view/supplier-results.html?regNumber=0171200001920002166;АДМИНИСТРАЦИЯ КОНСТАНТИНОВСКОГО СЕЛЬСКОГО ПОСЕЛЕНИЯ ТУТАЕВСКОГО МУНИЦИПАЛЬНОГО РАЙОНА ЯРОСЛАВСКОЙ ОБЛАСТИ;"ОБЩЕСТВО С ОГРАНИЧЕННОЙ ОТВЕТСТВЕННОСТЬЮ ""ЯРАВТОДОР""";1 - Победитель;1 216 712,46;"ОБЩЕСТВО С ОГРАНИЧЕННОЙ ОТВЕТСТВЕННОСТЬЮ ""ГЛОБАЛ ГРУПП АВТО""";2 - Второй номер;1 223 745,48;31.08.2021;15.12.2020;;150506, ОБЛ ЯРОСЛАВСКАЯ 76, Р-Н ЯРОСЛАВСКИЙ, - ЧЕНЦЫ, УЛ ПРОМЫШЛЕННАЯ, СТРОЕНИЕ 10;7602110885;8-4852-670907avtodor@bk.ru
