Номер закупки;Ссылка на продукт;Статус;Описание объекта;Организация;Дата размещения;Цена;Ссылка на поставщика;Заказчик;Победитель;Статус победителя;Цена победителя;Второй номер;Статус второго номера;Цена второго номера;Дата начала контракта;Дата окончания контракта;ФИО Руководителя;ИНН;Контакты
№ 0371300147320000085;https://zakupki.gov.ru//epz/order/notice/ea44/view/common-info.html?regNumber=0371300147320000085;Определение поставщика завершено;Благоустройство дворовых территорий многоквартирных домов городского округа город РыбинскЯрославскойобласти: Баррикадная ул., дом №47;"МУНИЦИПАЛЬНОЕ БЮДЖЕТНОЕ УЧРЕЖДЕНИЕ ГОРОДСКОГО ОКРУГА ГОРОД РЫБИНСК ""УПРАВЛЕНИЕ ГОРОДСКОГО ХОЗЯЙСТВА""";03.11.2020;7 380 069,60 ₽;https://zakupki.gov.ru/epz/order/notice/ea44/view/supplier-results.html?regNumber=0371300147320000085;"МУНИЦИПАЛЬНОЕ БЮДЖЕТНОЕ УЧРЕЖДЕНИЕ ГОРОДСКОГО ОКРУГА ГОРОД РЫБИНСК ""УПРАВЛЕНИЕ ГОРОДСКОГО ХОЗЯЙСТВА""";"ОБЩЕСТВО С ОГРАНИЧЕННОЙ ОТВЕТСТВЕННОСТЬЮ ""АВТОСПЕЦТЕХ""";1 - Победитель;6 605 162,25;"ОБЩЕСТВО С ОГРАНИЧЕННОЙ ОТВЕТСТВЕННОСТЬЮ ""ЯРОСЛАВЛЬРЕСТОРАНСЕРВИС""";2 - Второй номер;6 642 062,60;04.09.2021;27.11.2020;;152909, Ярославская область, город Рыбинск, ул.Новолосевская, д.3А;7610126208;7903821564317novikov78@mail.ru
№ 0371300037820000016;https://zakupki.gov.ru//epz/order/notice/ea44/view/common-info.html?regNumber=0371300037820000016;Определение поставщика завершено;Оказание услуг по разработке сметной документации на капитальный ремонт автомобильнойдорогиподъезд к д. Котово Некоузского районаЯрославскойобласти;АДМИНИСТРАЦИЯ НЕКОУЗСКОГО МУНИЦИПАЛЬНОГО РАЙОНА;03.11.2020;195 350,00 ₽;https://zakupki.gov.ru/epz/order/notice/ea44/view/supplier-results.html?regNumber=0371300037820000016;АДМИНИСТРАЦИЯ НЕКОУЗСКОГО МУНИЦИПАЛЬНОГО РАЙОНА;"ОБЩЕСТВО С ОГРАНИЧЕННОЙ ОТВЕТСТВЕННОСТЬЮ ""СТРОИТЕЛЬНАЯ КОМПАНИЯ ОЛИМП-СТРОЙ""";1 - Победитель;194 373,25;Родин Д. А.;2 - Второй номер;194 373,25;31.12.2021;30.11.2020;;Российская Федерация, 150045, ЯРОСЛАВСКАЯ ОБЛАСТЬ, Г. ЯРОСЛАВЛЬ, УЛ. ПАНИНА, ДОМ 23, КВАРТИРА 72;7603059173;79201175712olimp-76@inbox.ru
№ 0171300012720000123;https://zakupki.gov.ru//epz/order/notice/ea44/view/common-info.html?regNumber=0171300012720000123;Определение поставщика завершено;Ремонт асфальтобетонного покрытия дворовой территории многоквартирного жилого дома №21 по ул. Молодежная в с. Левашово;АДМИНИСТРАЦИЯ НЕКРАСОВСКОГО МУНИЦИПАЛЬНОГО РАЙОНАЯРОСЛАВСКОЙОБЛАСТИ;03.11.2020;806 659,20 ₽;https://zakupki.gov.ru/epz/order/notice/ea44/view/supplier-results.html?regNumber=0171300012720000123;АДМИНИСТРАЦИЯ СЕЛЬСКОГО ПОСЕЛЕНИЯ НЕКРАСОВСКОЕ ЯРОСЛАВСКОЙ ОБЛАСТИ;"ОБЩЕСТВО С ОГРАНИЧЕННОЙ ОТВЕТСТВЕННОСТЬЮ ""ВЕЛЕС""";1 - Победитель;629 227,30;АКЦИОНЕРНОЕ ОБЩЕСТВО БУРМАКИНСКАЯ ПЕРЕДВИЖНАЯ МЕХАНИЗИРОВАННАЯ КОЛОННА;2 - Второй номер;633 260,60;09.07.2021;30.11.2020;;150025, ОБЛ ЯРОСЛАВСКАЯ 76, Г ЯРОСЛАВЛЬ, УЛ МАГИСТРАЛЬНАЯ, ДОМ 42, ОФИС 25;7604367759;643-8923-6808318veless20@mail.ru
№ 0171300012720000122;https://zakupki.gov.ru//epz/order/notice/ea44/view/common-info.html?regNumber=0171300012720000122;Определение поставщика завершено;Ремонт асфальтобетонного покрытия дворовой территории многоквартирного жилого дома №19 по ул. Молодежная в с. Левашово;АДМИНИСТРАЦИЯ НЕКРАСОВСКОГО МУНИЦИПАЛЬНОГО РАЙОНАЯРОСЛАВСКОЙОБЛАСТИ;03.11.2020;821 752,80 ₽;https://zakupki.gov.ru/epz/order/notice/ea44/view/supplier-results.html?regNumber=0171300012720000122;АДМИНИСТРАЦИЯ СЕЛЬСКОГО ПОСЕЛЕНИЯ НЕКРАСОВСКОЕ ЯРОСЛАВСКОЙ ОБЛАСТИ;АКЦИОНЕРНОЕ ОБЩЕСТВО БУРМАКИНСКАЯ ПЕРЕДВИЖНАЯ МЕХАНИЗИРОВАННАЯ КОЛОННА;1 - Победитель;694 381,24;"ОБЩЕСТВО С ОГРАНИЧЕННОЙ ОТВЕТСТВЕННОСТЬЮ ""ВЕЛЕС""";2 - Второй номер;698 490,00;09.07.2021;30.11.2020;;152295, ОБЛ ЯРОСЛАВСКАЯ 76, Р-Н НЕКРАСОВСКИЙ, С БУРМАКИНО, УЛ ЗАРЕЧНАЯ, 1;7621000359;643-4852-53129burpmk@mail.ru
№ 0171200001920002061;https://zakupki.gov.ru//epz/order/notice/ea44/view/common-info.html?regNumber=0171200001920002061;Определение поставщика завершено;Комплексное благоустройство дворовой территории МКД по адресу:Ярославскаяобласть, г. Ростов, МКР №1, д. 11, 13, 14, 15;ДЕПАРТАМЕНТ ГОСУДАРСТВЕННОГО ЗАКАЗАЯРОСЛАВСКОЙОБЛАСТИ;02.11.2020;11 707 624,80 ₽;https://zakupki.gov.ru/epz/order/notice/ea44/view/supplier-results.html?regNumber=0171200001920002061;"МУНИЦИПАЛЬНОЕ УЧРЕЖДЕНИЕ ""РОДНОЙ ГОРОД"" ГОРОДСКОГО ПОСЕЛЕНИЯ РОСТОВ";"ОБЩЕСТВО С ОГРАНИЧЕННОЙ ОТВЕТСТВЕННОСТЬЮ ""ГЛОБАЛ ГРУПП АВТО""";1 - Победитель;10 127 095,56;"ОБЩЕСТВО С ОГРАНИЧЕННОЙ ОТВЕТСТВЕННОСТЬЮ ""ОРИГИНАЛ""";2 - Второй номер;10 185 633,68;23.07.2021;30.11.2020;;152170, ОБЛ ЯРОСЛАВСКАЯ 76, Р-Н БОРИСОГЛЕБСКИЙ, - БОРИСОГЛЕБСКИЙ, УЛ ПУШКИНСКАЯ, 6;7614005130;
№ 0171200001920002060;https://zakupki.gov.ru//epz/order/notice/ea44/view/common-info.html?regNumber=0171200001920002060;Определение поставщика завершено;Корректировка проектной документации на капитальный ремонт автомобильнойдорогиЯковлевское - Диево Городище (с устройством укрепительных работ в зоне подтопления) в Некрасовском муниципальном районеЯрославскойобласти;ДЕПАРТАМЕНТ ГОСУДАРСТВЕННОГО ЗАКАЗАЯРОСЛАВСКОЙОБЛАСТИ;02.11.2020;3 249 061,20 ₽;https://zakupki.gov.ru/epz/order/notice/ea44/view/supplier-results.html?regNumber=0171200001920002060;"ГОСУДАРСТВЕННОЕ КАЗЁННОЕ УЧРЕЖДЕНИЕ ЯРОСЛАВСКОЙ ОБЛАСТИ ""ЯРОСЛАВСКАЯ ОБЛАСТНАЯ ДОРОЖНАЯ СЛУЖБА""";;По окончании срока подачи заявок подана только одна заявка. Такая заявка признана соответствующей требованиям Федерального закона № 44-ФЗ и документации об аукционе. Электронный аукцион признан несостоявшимся по основанию, предусмотренному ч. 1 ст. 71 Федерального закона № 44-ФЗ;;"ОБЩЕСТВО С ОГРАНИЧЕННОЙ ОТВЕТСТВЕННОСТЬЮ ""ПРОЕКТНО-ИЗЫСКАТЕЛЬСКАЯ КОМПАНИЯ ""ЭНЕРГИЯ""";;3 249 061,20;07.06.2021;30.11.2020;;Российская Федерация, 196084, Г САНКТ-ПЕТЕРБУРГ, НАБ ОБВОДНОГО КАНАЛА, ДОМ 108, ЛИТЕР А, ПОМЕЩЕНИЕ 74-Н ОФИС 1;7839130518;792194898729489872@mail.ru
№ 0171300012720000121;https://zakupki.gov.ru//epz/order/notice/ea44/view/common-info.html?regNumber=0171300012720000121;Определение поставщика завершено;Ремонт асфальтобетонного покрытия дворовой территории многоквартирного жилого дома №17 по ул. Молодежная в с. Левашово;АДМИНИСТРАЦИЯ НЕКРАСОВСКОГО МУНИЦИПАЛЬНОГО РАЙОНАЯРОСЛАВСКОЙОБЛАСТИ;02.11.2020;770 473,20 ₽;https://zakupki.gov.ru/epz/order/notice/ea44/view/supplier-results.html?regNumber=0171300012720000121;АДМИНИСТРАЦИЯ СЕЛЬСКОГО ПОСЕЛЕНИЯ НЕКРАСОВСКОЕ ЯРОСЛАВСКОЙ ОБЛАСТИ;"ОБЩЕСТВО С ОГРАНИЧЕННОЙ ОТВЕТСТВЕННОСТЬЮ ""ВЕЛЕС""";1 - Победитель;670 311,57;АКЦИОНЕРНОЕ ОБЩЕСТВО БУРМАКИНСКАЯ ПЕРЕДВИЖНАЯ МЕХАНИЗИРОВАННАЯ КОЛОННА;2 - Второй номер;674 163,94;09.07.2021;30.11.2020;;150025, ОБЛ ЯРОСЛАВСКАЯ 76, Г ЯРОСЛАВЛЬ, УЛ МАГИСТРАЛЬНАЯ, ДОМ 42, ОФИС 25;7604367759;643-89236-808318veless20@mail.ru
№ 0371200001920000031;https://zakupki.gov.ru//epz/order/notice/zk504/view/common-info.html?regNumber=0371200001920000031;Определение поставщика завершено;"оказание услуг по обеспечению функционирования  комплексов измерения скорости движения транспортных средств ""Арена"" на автомобильныхдорогах Ярославскойобласти";"ГОСУДАРСТВЕННОЕ КАЗЁННОЕ УЧРЕЖДЕНИЕЯРОСЛАВСКОЙОБЛАСТИ ""ЯРОСЛАВСКАЯОБЛАСТНАЯ ДОРОЖНАЯ СЛУЖБА""";02.11.2020;450 000,00 ₽;https://zakupki.gov.ru/epz/order/notice/ea44/view/supplier-results.html?regNumber=0371200001920000031;"ГОСУДАРСТВЕННОЕ КАЗЁННОЕ УЧРЕЖДЕНИЕ ЯРОСЛАВСКОЙ ОБЛАСТИ ""ЯРОСЛАВСКАЯ ОБЛАСТНАЯ ДОРОЖНАЯ СЛУЖБА""";"ОБЩЕСТВО С ОГРАНИЧЕННОЙ ОТВЕТСТВЕННОСТЬЮ ОХРАННОЕ ПРЕДПРИЯТИЕ ""ЯРРЕГИОНЗАЩИТА""";1 - Победитель;414 000,00;"ОБЩЕСТВО С ОГРАНИЧЕННОЙ ОТВЕТСТВЕННОСТЬЮ ""ЧАСТНОЕ ОХРАННОЕ ПРЕДПРИЯТИЕ ""ПАРТНЕР-ЯРОСЛАВЛЬ""";2 - Второй номер;450 000,00;07.04.2021;24.11.2020;;150044, г. Ярославль, ул. Промышленная, д.19;7606056879;79108217235zashita90@yandex.ru
№ 0171300012720000120;https://zakupki.gov.ru//epz/order/notice/ea44/view/common-info.html?regNumber=0171300012720000120;Определение поставщика завершено;Ремонт асфальтобетонного покрытия дворовой территории многоквартирного жилого дома №18 по ул. Молодежная в с. Левашово;АДМИНИСТРАЦИЯ НЕКРАСОВСКОГО МУНИЦИПАЛЬНОГО РАЙОНАЯРОСЛАВСКОЙОБЛАСТИ;02.11.2020;742 530,00 ₽;https://zakupki.gov.ru/epz/order/notice/ea44/view/supplier-results.html?regNumber=0171300012720000120;АДМИНИСТРАЦИЯ СЕЛЬСКОГО ПОСЕЛЕНИЯ НЕКРАСОВСКОЕ ЯРОСЛАВСКОЙ ОБЛАСТИ;"ОБЩЕСТВО С ОГРАНИЧЕННОЙ ОТВЕТСТВЕННОСТЬЮ ""ВЕЛЕС""";1 - Победитель;651 436,75;АКЦИОНЕРНОЕ ОБЩЕСТВО БУРМАКИНСКАЯ ПЕРЕДВИЖНАЯ МЕХАНИЗИРОВАННАЯ КОЛОННА;2 - Второй номер;655 149,40;09.07.2021;30.11.2020;;150025, ОБЛ ЯРОСЛАВСКАЯ 76, Г ЯРОСЛАВЛЬ, УЛ МАГИСТРАЛЬНАЯ, ДОМ 42, ОФИС 25;7604367759;643-89236-808318veles@mail.ru
№ 0373200017520001166;https://zakupki.gov.ru//epz/order/notice/ea44/view/common-info.html?regNumber=0373200017520001166;Определение поставщика завершено;Выполнение работ по обустройству пешеходного перехода между домами 5 и 7 по ул. Проходчиков;"ГОСУДАРСТВЕННОЕ КАЗЕННОЕ УЧРЕЖДЕНИЕ ГОРОДА МОСКВЫ ""ДИРЕКЦИЯ ЗАКАЗЧИКА ЖИЛИЩНО-КОММУНАЛЬНОГО ХОЗЯЙСТВА И БЛАГОУСТРОЙСТВА СЕВЕРО-ВОСТОЧНОГО АДМИНИСТРАТИВНОГО ОКРУГА""";01.11.2020;182 771,12 ₽;https://zakupki.gov.ru/epz/order/notice/ea44/view/supplier-results.html?regNumber=0373200017520001166;"ГОСУДАРСТВЕННОЕ БЮДЖЕТНОЕ УЧРЕЖДЕНИЕ ГОРОДА МОСКВЫ ""ЖИЛИЩНИК ЯРОСЛАВСКОГО РАЙОНА""";;По окончании срока подачи заявок подана только одна заявка. Такая заявка признана соответствующей требованиям Федерального закона № 44-ФЗ и документации об аукционе. Электронный аукцион признан несостоявшимся по основанию, предусмотренному ч. 1 ст. 71 Федерального закона № 44-ФЗ;;"ОБЩЕСТВО С ОГРАНИЧЕННОЙ ОТВЕТСТВЕННОСТЬЮ ""ИНЖДОРСТРОЙ""";;182 771,12;31.12.2020;24.11.2020;;"г. Москва, Москва, ""Ул. Верхние Поля, д, 35, корп. 5, кв. 60""";7723860071;субъект малого предпринимательства
№ 0137300017520000221;https://zakupki.gov.ru//epz/order/notice/ea44/view/common-info.html?regNumber=0137300017520000221;Определение поставщика завершено;"Ремонт уличного освещения в СП ""Село Ильинское"", с. Ильинское, д. Башкировка, д. ПироговоМалоярославецкогорайона Калужской области (Реестровый номер: 3018Э-10/20сб)";"МАЛОЯРОСЛАВЕЦКАЯРАЙОННАЯ АДМИНИСТРАЦИЯ МУНИЦИПАЛЬНОГО РАЙОНА ""МАЛОЯРОСЛАВЕЦКИЙРАЙОН""";31.10.2020;1 138 906,15 ₽;https://zakupki.gov.ru/epz/order/notice/ea44/view/supplier-results.html?regNumber=0137300017520000221;"АДМИНИСТРАЦИЯ СЕЛЬСКОГО ПОСЕЛЕНИЯ ""СЕЛО ИЛЬИНСКОЕ""";Ким П. Ю.;1 - Победитель;499 228,51;"ОБЩЕСТВО С ОГРАНИЧЕННОЙ ОТВЕТСТВЕННОСТЬЮ ""ЭНЕРГОСТРОЙСЕРВИС""";2 - Второй номер;504 923,04;31.12.2020;30.11.2020;;248033, г. Калуга, ул. 65 Лет Победы, 29-300;Да;7-953-3150482instyle111@mail.ru
№ 0171200001920002024;https://zakupki.gov.ru//epz/order/notice/ea44/view/common-info.html?regNumber=0171200001920002024;Определение поставщика завершено;Строительство подходов и подъездных путей к физкультурно-оздоровительному комплексу с бассейном по адресуЯрославскаяобласть, МКР№3 1 этап;ДЕПАРТАМЕНТ ГОСУДАРСТВЕННОГО ЗАКАЗАЯРОСЛАВСКОЙОБЛАСТИ;31.10.2020;11 592 180,18 ₽;https://zakupki.gov.ru/epz/order/notice/ea44/view/supplier-results.html?regNumber=0171200001920002024;"МУНИЦИПАЛЬНОЕ УЧРЕЖДЕНИЕ ""РОДНОЙ ГОРОД"" ГОРОДСКОГО ПОСЕЛЕНИЯ РОСТОВ";;По окончании срока подачи заявок подана только одна заявка. Такая заявка признана соответствующей требованиям Федерального закона № 44-ФЗ и документации об аукционе. Электронный аукцион признан несостоявшимся по основанию, предусмотренному ч. 1 ст. 71 Федерального закона № 44-ФЗ;;"ОБЩЕСТВО С ОГРАНИЧЕННОЙ ОТВЕТСТВЕННОСТЬЮ ""162-КЖИ""";;11 592 180,18;25.01.2021;23.11.2020;;152155, ОБЛ ЯРОСЛАВСКАЯ 76, Г РОСТОВ, УЛ ФРУНЗЕ, ДОМ 48, ЭТАЖ/ОФИС 2/4;3664135233;субъект малого предпринимательства
№ 32009638205;https://zakupki.gov.ru/https://zakupki.gov.ru/223/purchase/public/purchase/info/common-info.html?regNumber=32009638205;Закупка завершена;Открытый аукцион среди субъектов малого и среднего предпринимательства в электронной форме № 5905/ОАЭ-ЦФТО/20 на право заключения договора оказания услуг по охране имущества объектов Северного территориального центра фирменного транспортного обслуживания, расположенных на территорииЯрославскойобласти;"ОТКРЫТОЕ АКЦИОНЕРНОЕ ОБЩЕСТВО ""РОССИЙСКИЕ ЖЕЛЕЗНЫЕДОРОГИ""";30.10.2020;983 502,72 ₽;;;;;;;;;;;;;;
№ 32009638005;https://zakupki.gov.ru/https://zakupki.gov.ru/223/purchase/public/purchase/info/common-info.html?regNumber=32009638005;Закупка завершена;Запрос котировок среди субъектов малого и среднего предпринимательства в электронной форме № 3900/ЗКТЭ-НПЦ ООС/20 на право заключения договора оказания услуг по техническому обслуживанию и аварийно-диспетчерскому обеспечению газораспределительной системы Комплекса термического обезвреживания отходов(Ярославскаяобл., Кузнечихинский с/о);"ОТКРЫТОЕ АКЦИОНЕРНОЕ ОБЩЕСТВО ""РОССИЙСКИЕ ЖЕЛЕЗНЫЕДОРОГИ""";30.10.2020;695 997,60 ₽;;;;;;;;;;;;;;
№ 32009637436;https://zakupki.gov.ru/https://zakupki.gov.ru/223/purchase/public/purchase/info/common-info.html?regNumber=32009637436;Закупка завершена;Открытый аукцион среди субъектов малого и среднего предпринимательства в электронной форме № 5875/ОАЭ-СЕВ/20 на право заключения договоров оказания услуг по обслуживанию общежитий;"ОТКРЫТОЕ АКЦИОНЕРНОЕ ОБЩЕСТВО ""РОССИЙСКИЕ ЖЕЛЕЗНЫЕДОРОГИ""";30.10.2020;;;;;;;;;;;;;;;
№ 32009636554;https://zakupki.gov.ru/https://zakupki.gov.ru/223/purchase/public/purchase/info/common-info.html?regNumber=32009636554;Закупка завершена;Запрос котировок среди субъектов малого и среднего предпринимательства в электронной форме № 3853/ЗКТЭ-ЦФТО/20 на право заключения договора оказания услуг по уборке территорий и внутренних служебных помещений на объектах Северного ТЦФТО, расположенных на территорииЯрославскойобласти;"ОТКРЫТОЕ АКЦИОНЕРНОЕ ОБЩЕСТВО ""РОССИЙСКИЕ ЖЕЛЕЗНЫЕДОРОГИ""";30.10.2020;566 714,36 ₽;;;;;;;;;;;;;;
№ 32009632129;https://zakupki.gov.ru/https://zakupki.gov.ru/223/purchase/public/purchase/info/common-info.html?regNumber=32009632129;Закупка завершена;Открытый аукцион среди субъектов малого и среднего предпринимательства в электронной форме № 5733/ОАЭ-НПЦ ООС/20 на право заключения договора на оказание услуг по техническому обслуживанию Комплекса по термическому обезвреживанию отходов(Ярославскаяобл., Кузнечихинский с/о);"ОТКРЫТОЕ АКЦИОНЕРНОЕ ОБЩЕСТВО ""РОССИЙСКИЕ ЖЕЛЕЗНЫЕДОРОГИ""";29.10.2020;7 054 635,11 ₽;;;;;;;;;;;;;;
№ 32009631806;https://zakupki.gov.ru/https://zakupki.gov.ru/223/purchase/public/purchase/info/common-info.html?regNumber=32009631806;Закупка завершена;Запрос котировок среди субъектов малого и среднего предпринимательства в электронной форме № 3718/ЗКТЭ-ЦДЗС/20 на право заключения договоров оказания услуг по охране имущества на объектах Северной дирекции снабжения;"ОТКРЫТОЕ АКЦИОНЕРНОЕ ОБЩЕСТВО ""РОССИЙСКИЕ ЖЕЛЕЗНЫЕДОРОГИ""";29.10.2020;;;;;;;;;;;;;;;
№ 0171300004420000017;https://zakupki.gov.ru//epz/order/notice/ea44/view/common-info.html?regNumber=0171300004420000017;Определение поставщика завершено;Благоустройство придомовой территории по адресу:Ярославскаяобласть, г. Любим, ул. Розы Люксембург, д. 5;АДМИНИСТРАЦИЯ ГОРОДСКОГО ПОСЕЛЕНИЯ ЛЮБИМЯРОСЛАВСКОЙОБЛАСТИ;29.10.2020;940 078,80 ₽;https://zakupki.gov.ru/epz/order/notice/ea44/view/supplier-results.html?regNumber=0171300004420000017;АДМИНИСТРАЦИЯ ГОРОДСКОГО ПОСЕЛЕНИЯ ЛЮБИМ ЯРОСЛАВСКОЙ ОБЛАСТИ;;По окончании срока подачи заявок подана только одна заявка. Такая заявка признана соответствующей требованиям Федерального закона № 44-ФЗ и документации об аукционе. Электронный аукцион признан несостоявшимся по основанию, предусмотренному ч. 1 ст. 71 Федерального закона № 44-ФЗ;;"ОБЩЕСТВО С ОГРАНИЧЕННОЙ ОТВЕТСТВЕННОСТЬЮ ""ГРИНВУД""";;940 078,80;08.09.2021;18.11.2020;;150001, ОБЛ ЯРОСЛАВСКАЯ 76, Г ЯРОСЛАВЛЬ, УЛ НАУМОВА, ДОМ 67/2, ОФИС 226;7604327393;
№ 0171300007920000073;https://zakupki.gov.ru//epz/order/notice/ea44/view/common-info.html?regNumber=0171300007920000073;Определение поставщика завершено;Выполнение работ по зимнему содержанию автомобильныхдорогобщего пользования местного значения в границах населенных пунктов и вне границ населенных пунктов на территории Середского сельского поселения Даниловского муниципального районаЯрославскойобласти в зимний период 2020-2021годов;АДМИНИСТРАЦИЯ ДАНИЛОВСКОГО МУНИЦИПАЛЬНОГО РАЙОНАЯРОСЛАВСКОЙОБЛАСТИ;29.10.2020;2 333 268,00 ₽;https://zakupki.gov.ru/epz/order/notice/ea44/view/supplier-results.html?regNumber=0171300007920000073;АДМИНИСТРАЦИЯ СЕРЕДСКОГО СЕЛЬСКОГО ПОСЕЛЕНИЯ ДАНИЛОВСКОГО МУНИЦИПАЛЬНОГО РАЙОНА ЯРОСЛАВСКОЙ ОБЛАСТИ;Муинов А. И.;1 - Победитель;1 749 951,00;"ОБЩЕСТВО С ОГРАНИЧЕННОЙ ОТВЕТСТВЕННОСТЬЮ ""ТРАНСБЫТ""";2 - Второй номер;1 761 617,34;31.12.2021;23.11.2020;;Российская Федерация, ОБЛ ЯРОСЛАВСКАЯ, Г ЯРОСЛАВЛЬ,;Да;79159707507muinoff@ya.ru
