Номер закупки;Ссылка на продукт;Статус;Описание объекта;Организация;Дата размещения;Цена;Ссылка на поставщика;Заказчик;Победитель;Статус победителя;Цена победителя;Второй номер;Статус второго номера;Цена второго номера;Дата начала контракта;Дата окончания контракта;ФИО Руководителя;ИНН;Контакты
№ 0330100010521000008;https://zakupki.gov.ru//epz/order/notice/ok504/view/common-info.html?regNumber=0330100010521000008;Подача заявок;"Оказание услуг по содержаниюавтомобильнойдорогиобщего пользования федерального значения Р-132""Золотое кольцо""Ярославль- Кострома - Иваново - Владимир - ГусьХрустальный - Рязань - Михайлов - Тула - Калуга - Вязьма - Ржев - Тверь - Углич-Ярославль, Ярославскаяобласть (участок от границы Тверскойобласти - г.Ярославль)";"ФЕДЕРАЛЬНОЕ КАЗЕННОЕ УЧРЕЖДЕНИЕ ""УПРАВЛЕНИЕ АВТОМОБИЛЬНОЙ МАГИСТРАЛИ МОСКВА-АРХАНГЕЛЬСК ФЕДЕРАЛЬНОГО ДОРОЖНОГО АГЕНТСТВА""";03.02.2021;23 926 732,00 ₽;;;;;;;;;;;;;;
№ 0330100010521000007;https://zakupki.gov.ru//epz/order/notice/ea44/view/common-info.html?regNumber=0330100010521000007;Подача заявок;"Ремонтавтомобильнойдорогиобщего пользования федерального значения М-8""Холмогоры"" Москва -Ярославль- Вологда - Архангельск на участке км844+628 - км 862+000 в Архангельской области";"ФЕДЕРАЛЬНОЕ КАЗЕННОЕ УЧРЕЖДЕНИЕ ""УПРАВЛЕНИЕ АВТОМОБИЛЬНОЙ МАГИСТРАЛИ МОСКВА-АРХАНГЕЛЬСК ФЕДЕРАЛЬНОГО ДОРОЖНОГО АГЕНТСТВА""";02.02.2021;344 639 186,00 ₽;;;;;;;;;;;;;;
№ 32109947481;https://zakupki.gov.ru/https://zakupki.gov.ru/223/purchase/public/purchase/info/common-info.html?regNumber=32109947481;Закупка завершена;Поставка ГСМ для нужд филиала ФГП ВО ЖДТ России на Северной железнойдорогевЯрославской, Костромской, Ивановской областях;"ФЕДЕРАЛЬНОЕ ГОСУДАРСТВЕННОЕ ПРЕДПРИЯТИЕ ""ВЕДОМСТВЕННАЯ ОХРАНА ЖЕЛЕЗНОДОРОЖНОГО ТРАНСПОРТА РОССИЙСКОЙ ФЕДЕРАЦИИ""";01.02.2021;2 373 855,50 ₽;;;;;;;;;;;;;;
№ 0371200001921000005;https://zakupki.gov.ru//epz/order/notice/zk504/view/common-info.html?regNumber=0371200001921000005;Определение поставщика отменено;Оказание услуг по обеспечению функционирования передвижных комплексов автоматической фотофиксации нарушений правил дорожного движения РФ «Арена» в режиме реального времени на автомобильныхдорогахг. Рыбинска и Рыбинского муниципального районаЯрославскойобласти;"ГОСУДАРСТВЕННОЕ КАЗЁННОЕ УЧРЕЖДЕНИЕЯРОСЛАВСКОЙОБЛАСТИ ""ЯРОСЛАВСКАЯОБЛАСТНАЯ ДОРОЖНАЯ СЛУЖБА""";01.02.2021;442 800,00 ₽;;;;;;;;;;;;;;
№ 0330100010521000006;https://zakupki.gov.ru//epz/order/notice/ea44/view/common-info.html?regNumber=0330100010521000006;Подача заявок;"Установкапешеходного ограждения на участках: км475+812 - 475+929 (справа), км475+782 -475+916 (слева) автомобильнойдорогиобщего пользования федерального значенияМ-8 ""Холмогоры"" Москва -Ярославль- Вологда - Архангельск,Вологодская область; установка светофорного объекта на пешеходном переходе (скнопкой вызова) с изменением схемы организации дорожного движения на км 475+864автомобильнойдорогиобщего пользования федерального значения М-8 ""Холмогоры""Москва -Ярославль- Вологда - Архангельск, Вологодская область";"ФЕДЕРАЛЬНОЕ КАЗЕННОЕ УЧРЕЖДЕНИЕ ""УПРАВЛЕНИЕ АВТОМОБИЛЬНОЙ МАГИСТРАЛИ МОСКВА-АРХАНГЕЛЬСК ФЕДЕРАЛЬНОГО ДОРОЖНОГО АГЕНТСТВА""";01.02.2021;2 400 000,00 ₽;;;;;;;;;;;;;;
№ 0371200001921000004;https://zakupki.gov.ru//epz/order/notice/zk504/view/common-info.html?regNumber=0371200001921000004;Определение поставщика отменено;Оказание услуг по обеспечению функционирования передвижных комплексов автоматической фотофиксации нарушений правил дорожного движения РФ «Арена» в режиме реального времени на автомобильныхдорогахТутаевского муниципального районаЯрославскойобласти;"ГОСУДАРСТВЕННОЕ КАЗЁННОЕ УЧРЕЖДЕНИЕЯРОСЛАВСКОЙОБЛАСТИ ""ЯРОСЛАВСКАЯОБЛАСТНАЯ ДОРОЖНАЯ СЛУЖБА""";01.02.2021;442 800,00 ₽;;;;;;;;;;;;;;
№ 0171200001921000022;https://zakupki.gov.ru//epz/order/notice/ea44/view/common-info.html?regNumber=0171200001921000022;Подача заявок;Выполнение работ по ремонтуавтодороги «Ярославль-Заячий Холм-а/д «Иваново-Писцово-Гаврилов-Ям-Ярославль»-д.Алексеевское»;ДЕПАРТАМЕНТ ГОСУДАРСТВЕННОГО ЗАКАЗАЯРОСЛАВСКОЙОБЛАСТИ;01.02.2021;5 781 010,80 ₽;;;;;;;;;;;;;;
№ 0171200001921000021;https://zakupki.gov.ru//epz/order/notice/ea44/view/common-info.html?regNumber=0171200001921000021;Подача заявок;Выполнение работ по ремонтуавтодороги«М8-д.Спицино»;ДЕПАРТАМЕНТ ГОСУДАРСТВЕННОГО ЗАКАЗАЯРОСЛАВСКОЙОБЛАСТИ;01.02.2021;2 242 798,80 ₽;;;;;;;;;;;;;;
№ 0171200001921000020;https://zakupki.gov.ru//epz/order/notice/ea44/view/common-info.html?regNumber=0171200001921000020;Подача заявок;Выполнение работ по ремонту автомобильныхдорог, расположенных вне границ населенных пунктов Кузнечихинского сельского поселения: д.Кузнечиха-д.Бутрево ПК 0+000-ПК 1+427;ДЕПАРТАМЕНТ ГОСУДАРСТВЕННОГО ЗАКАЗАЯРОСЛАВСКОЙОБЛАСТИ;01.02.2021;5 786 448,00 ₽;;;;;;;;;;;;;;
№ 0171200001921000019;https://zakupki.gov.ru//epz/order/notice/ea44/view/common-info.html?regNumber=0171200001921000019;Подача заявок;выполнение работ по капитальному ремонту автомобильнойдороги«п.Дубки - ТЭЦ – 3»;ДЕПАРТАМЕНТ ГОСУДАРСТВЕННОГО ЗАКАЗАЯРОСЛАВСКОЙОБЛАСТИ;01.02.2021;19 373 967,60 ₽;;;;;;;;;;;;;;
№ 32109941062;https://zakupki.gov.ru/https://zakupki.gov.ru/223/purchase/public/purchase/info/common-info.html?regNumber=32109941062;Подача заявок;Поставка железобетонных изделий (система водоотвода) для выполнения работ на мостовом переходе через реку Печегда  на автомобильнойдороге Ярославль-Рыбинск, км 29+345 в Тутаевском муниципальном районеЯрославскойобласти;"АКЦИОНЕРНОЕ ОБЩЕСТВО ""ЯРДОРМОСТ""";29.01.2021;994 976,50 ₽;;;;;;;;;;;;;;
№ 0137200001221000064;https://zakupki.gov.ru//epz/order/notice/ea44/view/common-info.html?regNumber=0137200001221000064;Подача заявок;Выполнение работ по реконструкции автомобильнойдороги  Малоярославец-Боровск в Боровском районе (устройство электроосвещения,  тротуаров и автобусных остановок на участке  с км 15+630 по км 17+100, д. Тимашово);МИНИСТЕРСТВО КОНКУРЕНТНОЙ ПОЛИТИКИ КАЛУЖСКОЙ ОБЛАСТИ;28.01.2021;22 043 436,00 ₽;;;;;;;;;;;;;;
№ 0171200001921000008;https://zakupki.gov.ru//epz/order/notice/ea44/view/common-info.html?regNumber=0171200001921000008;Подача заявок;Частичный ремонт автомобильныхдорогобщего пользования на территории гп. Ростов (ул. Северная, ул. Рабочая, ул. К. Маркса, ул. Моравского, ул. Ленинская, ул. Фрунзе, проезд к д.с. «Золотая рыбка», проезд между 1 и 2 МКР, Окружной проезд,Ярославскоешоссе, пл. Привокзальная, пл. Колхозная);ДЕПАРТАМЕНТ ГОСУДАРСТВЕННОГО ЗАКАЗАЯРОСЛАВСКОЙОБЛАСТИ;27.01.2021;14 703 388,80 ₽;;;;;;;;;;;;;;
№ 0371200001921000001;https://zakupki.gov.ru//epz/order/notice/zk504/view/common-info.html?regNumber=0371200001921000001;Подача заявок;"Оказание услуг по обеспечению функционирования комплексов измерения скорости движения транспортных средств ""Арена"" на автомобильныхдорогах Ярославскойобласти";"ГОСУДАРСТВЕННОЕ КАЗЁННОЕ УЧРЕЖДЕНИЕЯРОСЛАВСКОЙОБЛАСТИ ""ЯРОСЛАВСКАЯОБЛАСТНАЯ ДОРОЖНАЯ СЛУЖБА""";27.01.2021;450 000,00 ₽;;;;;;;;;;;;;;
№ 0348100042421000005;https://zakupki.gov.ru//epz/order/notice/ok504/view/common-info.html?regNumber=0348100042421000005;Подача заявок;"Выполнение работ по содержанию действующей сети автомобильныхдорогобщего пользования федерального значения (устройство защитных слоев, слоев износа и поверхностной обработки). Устройство слоев износа на автомобильнойдорогеМ-8 ""Холмогоры"" Москва -Ярославль- Вологда - Архангельск на участке км 16+600 - км 20+200 (лево 1,2,3 полосы), Московская область; Устройство слоев износа на автомобильнойдорогеМ-8 ""Холмогоры"" Москва -Ярославль- Вологда - Архангельск на участке км 16+600 - км 20+200 (право 1,2,3 полосы), Московская область (лот 5)";"ФЕДЕРАЛЬНОЕ КАЗЕННОЕ УЧРЕЖДЕНИЕ ""ФЕДЕРАЛЬНОЕ УПРАВЛЕНИЕ АВТОМОБИЛЬНЫХДОРОГ""ЦЕНТРАЛЬНАЯ РОССИЯ"" ФЕДЕРАЛЬНОГО ДОРОЖНОГО АГЕНТСТВА""";26.01.2021;125 972 220,81 ₽;;;;;;;;;;;;;;
№ 32109920975;https://zakupki.gov.ru/https://zakupki.gov.ru/223/purchase/public/purchase/info/common-info.html?regNumber=32109920975;Работа комиссии;Оказание услуг по ремонту и техническому обслуживанию автомобилей с заменой запасных частей для нужд филиала ФГП ВО ЖДТ России на Северной железнойдорогев г.Ярославль;"ФЕДЕРАЛЬНОЕ ГОСУДАРСТВЕННОЕ ПРЕДПРИЯТИЕ ""ВЕДОМСТВЕННАЯ ОХРАНА ЖЕЛЕЗНОДОРОЖНОГО ТРАНСПОРТА РОССИЙСКОЙ ФЕДЕРАЦИИ""";25.01.2021;300 357,00 ₽;;;;;;;;;;;;;;
№ 0330100010521000002;https://zakupki.gov.ru//epz/order/notice/ea44/view/common-info.html?regNumber=0330100010521000002;Подача заявок;"Ремонт мостачерез реку Печегда на км 181+319 автомобильнойдорогиМ-8 ""Холмогоры""Москва -Ярославль- Вологда - Архангельск,Ярославскаяобласть";"ФЕДЕРАЛЬНОЕ КАЗЕННОЕ УЧРЕЖДЕНИЕ ""УПРАВЛЕНИЕ АВТОМОБИЛЬНОЙ МАГИСТРАЛИ МОСКВА-АРХАНГЕЛЬСК ФЕДЕРАЛЬНОГО ДОРОЖНОГО АГЕНТСТВА""";25.01.2021;86 147 784,00 ₽;;;;;;;;;;;;;;
№ 32109915633;https://zakupki.gov.ru/https://zakupki.gov.ru/223/purchase/public/purchase/info/common-info.html?regNumber=32109915633;Работа комиссии;Запрос котировок среди субъектов малого и среднего предпринимательства в электронной форме № 8/ЗКТЭ-ДЖВ/21 на право заключения договора оказания услуг по вывозу и утилизации ртутных люминесцентных и ультрафиолетовых бактерицидных ламп на вокзалах Московской региональной дирекции железнодорожных вокзалов (вокзалы Белорусский, Казанский, Киевский, Павелецкий, Рижский, Савеловский,Ярославский, Брянск-Орловский, Калуга-1, Курск, Орел, Рязань-1,2, Смоленск, Тула).;"ОТКРЫТОЕ АКЦИОНЕРНОЕ ОБЩЕСТВО ""РОССИЙСКИЕ ЖЕЛЕЗНЫЕДОРОГИ""";22.01.2021;1 023 514,80 ₽;;;;;;;;;;;;;;
№ 0171300012721000001;https://zakupki.gov.ru//epz/order/notice/ea44/view/common-info.html?regNumber=0171300012721000001;Определение поставщика завершено;Выполнение работ по зимнему содержанию автомобильныхдорогобщего пользования местного значения в границах и вне границ населенных пунктов на территории сельского поселения Некрасовское, Некрасовского района,Ярославскойобласти;АДМИНИСТРАЦИЯ НЕКРАСОВСКОГО МУНИЦИПАЛЬНОГО РАЙОНАЯРОСЛАВСКОЙОБЛАСТИ;20.01.2021;4 095 086,09 ₽;https://zakupki.gov.ru/epz/order/notice/ea44/view/supplier-results.html?regNumber=0171300012721000001;АДМИНИСТРАЦИЯ СЕЛЬСКОГО ПОСЕЛЕНИЯ НЕКРАСОВСКОЕ ЯРОСЛАВСКОЙ ОБЛАСТИ;;По окончании срока подачи заявок подана только одна заявка. Такая заявка признана соответствующей требованиям Федерального закона № 44-ФЗ и документации об аукционе. Электронный аукцион признан несостоявшимся по основанию, предусмотренному ч. 1 ст. 71 Федерального закона № 44-ФЗ;;"ОБЩЕСТВО С ОГРАНИЧЕННОЙ ОТВЕТСТВЕННОСТЬЮ ""КЭТ""";;4 095 086,09;;;;;;
№ 0348100006020000065;https://zakupki.gov.ru//epz/order/notice/ea44/view/common-info.html?regNumber=0348100006020000065;Подача заявок;"...  на сети автомобильныхдорогобщего пользования федерального значения:автомобильнаядорогаМ-7 ... +000 - км 32+239; автомобильнаядорогаМ-7 ""Волга"" Москва - Владимир ...  20+660; автомобильнаядорогаР-132 ""Золотое кольцо""Ярославль- Кострома - Иваново - Владимир ...  - Калуга - Вязьма - Ржев - Тверь - Углич -Ярославльна участке км 177+080 ... , Владимирская область; автомобильнаядорогаР-132 ""Золотое кольцо""Ярославль- Кострома - Иваново - Владимир ...  - Калуга - Вязьма - Ржев - Тверь - Углич -Ярославль, подъезд к Усадьбе Черневых ( ...";"ФЕДЕРАЛЬНОЕ КАЗЕННОЕ УЧРЕЖДЕНИЕ ""УПРАВЛЕНИЕ АВТОМОБИЛЬНОЙ МАГИСТРАЛИ МОСКВА - НИЖНИЙ НОВГОРОД ФЕДЕРАЛЬНОГО ДОРОЖНОГО АГЕНТСТВА""";31.12.2020;51 739 634,32 ₽;;;;;;;;;;;;;;
№ 32009875041;https://zakupki.gov.ru/https://zakupki.gov.ru/223/purchase/public/purchase/info/common-info.html?regNumber=32009875041;Работа комиссии;Запрос котировок в электронной форме № 4705/ЗКТЭ-СЕВ/20 на право заключения договора оказания услуг по проведению дератизации и дезинсекции(Ярославская, Вологодская, Сольвычегодская, Сосногорская дистанции гражданских сооружений);"ОТКРЫТОЕ АКЦИОНЕРНОЕ ОБЩЕСТВО ""РОССИЙСКИЕ ЖЕЛЕЗНЫЕДОРОГИ""";31.12.2020;2 615 730,24 ₽;;;;;;;;;;;;;;
№ 0171200001920002733;https://zakupki.gov.ru//epz/order/notice/ea44/view/common-info.html?regNumber=0171200001920002733;Подача заявок;Ремонт участков автомобильнойдорогиТутаев-Шопша в Тутаевском и Гаврилов-Ямском муниципальных районахЯрославскойобласти (2 этап, 3 этап);ДЕПАРТАМЕНТ ГОСУДАРСТВЕННОГО ЗАКАЗАЯРОСЛАВСКОЙОБЛАСТИ;30.12.2020;534 869 920,80 ₽;;;;;;;;;;;;;;
№ 0330100010520000135;https://zakupki.gov.ru//epz/order/notice/ea44/view/common-info.html?regNumber=0330100010520000135;Определение поставщика завершено;"Установка комплексов фотовидеофиксации нарушенийправил дорожного движения на участках км 716+731 (средняя скорость сустановленным комплексом на км 724+250), км 735+900 – 753+650 (средняяскорость), км 790+500 – км 805+500 (средняя скорость), км 840+509, автомобильнойдорогиобщего пользования федерального значения М-8 ""Холмогоры""Москва –Ярославль– Вологда – Архангельск (в Архангельской области)";"ФЕДЕРАЛЬНОЕ КАЗЕННОЕ УЧРЕЖДЕНИЕ ""УПРАВЛЕНИЕ АВТОМОБИЛЬНОЙ МАГИСТРАЛИ МОСКВА-АРХАНГЕЛЬСК ФЕДЕРАЛЬНОГО ДОРОЖНОГО АГЕНТСТВА""";29.12.2020;18 303 905,00 ₽;https://zakupki.gov.ru/epz/order/notice/ea44/view/supplier-results.html?regNumber=0330100010520000135;"ФЕДЕРАЛЬНОЕ КАЗЕННОЕ УЧРЕЖДЕНИЕ ""УПРАВЛЕНИЕ АВТОМОБИЛЬНОЙ МАГИСТРАЛИ МОСКВА-АРХАНГЕЛЬСК ФЕДЕРАЛЬНОГО ДОРОЖНОГО АГЕНТСТВА""";"ОБЩЕСТВО С ОГРАНИЧЕННОЙ ОТВЕТСТВЕННОСТЬЮ ""ДОРОЖНЫЕ МОНИТОРИНГОВЫЕ СИСТЕМЫ""";1 - Победитель;18 212 385,47;"ОБЩЕСТВО С ОГРАНИЧЕННОЙ ОТВЕТСТВЕННОСТЬЮ ""РУСРОБОТ""";2 - Второй номер;18 212 385,47;;;;;;
№ 0330100010520000134;https://zakupki.gov.ru//epz/order/notice/ea44/view/common-info.html?regNumber=0330100010520000134;Определение поставщика завершено;"Установка комплексов фотовидеофиксации нарушенийправил дорожного движения на участках км 1219+339 (справа) - км 1224+555(справа) (средняя скорость), км 1219+237 (слева) - км 1224+856 (слева) (средняяскорость), км 978+500–985+500 (средняя скорость), автомобильнойдорогиобщегопользования федерального значения М-8 ""Холмогоры"" Москва –Ярославль– Вологда – Архангельск (в Архангельской области)";"ФЕДЕРАЛЬНОЕ КАЗЕННОЕ УЧРЕЖДЕНИЕ ""УПРАВЛЕНИЕ АВТОМОБИЛЬНОЙ МАГИСТРАЛИ МОСКВА-АРХАНГЕЛЬСК ФЕДЕРАЛЬНОГО ДОРОЖНОГО АГЕНТСТВА""";29.12.2020;18 303 905,00 ₽;https://zakupki.gov.ru/epz/order/notice/ea44/view/supplier-results.html?regNumber=0330100010520000134;"ФЕДЕРАЛЬНОЕ КАЗЕННОЕ УЧРЕЖДЕНИЕ ""УПРАВЛЕНИЕ АВТОМОБИЛЬНОЙ МАГИСТРАЛИ МОСКВА-АРХАНГЕЛЬСК ФЕДЕРАЛЬНОГО ДОРОЖНОГО АГЕНТСТВА""";"ОБЩЕСТВО С ОГРАНИЧЕННОЙ ОТВЕТСТВЕННОСТЬЮ ""ДОРОЖНЫЕ МОНИТОРИНГОВЫЕ СИСТЕМЫ""";1 - Победитель;18 212 385,47;"ОБЩЕСТВО С ОГРАНИЧЕННОЙ ОТВЕТСТВЕННОСТЬЮ ""РУСРОБОТ""";2 - Второй номер;18 212 385,47;30.08.2021;02.02.2021;;121205, г.Москва, Сколково территория инновационного центра,, ул. Нобеля, дом 7, этаж 2, помещение 56, Раб 3;9731039472;субъект малого предпринимательства
№ 0171200001920002689;https://zakupki.gov.ru//epz/order/notice/ea44/view/common-info.html?regNumber=0171200001920002689;Определение поставщика завершено;Ремонт автомобильныхдорогобщего пользования местного значения городаЯрославляв 2021 году (лот 1);ДЕПАРТАМЕНТ ГОСУДАРСТВЕННОГО ЗАКАЗАЯРОСЛАВСКОЙОБЛАСТИ;28.12.2020;326 215 728,00 ₽;https://zakupki.gov.ru/epz/order/notice/ea44/view/supplier-results.html?regNumber=0171200001920002689;"МУНИЦИПАЛЬНОЕ КАЗЕННОЕ УЧРЕЖДЕНИЕ ""АГЕНТСТВО ПО МУНИЦИПАЛЬНОМУ ЗАКАЗУ ЖКХ"" ГОРОДА ЯРОСЛАВЛЯ";Согласование не проводилось;;По результатам рассмотрения вторых частей заявок принято решение о соответствии указанным требованиям только одной второй части заявки на участие в нем (ч.13 ст.69 Закона № 44-ФЗ).;;"АКЦИОНЕРНОЕ ОБЩЕСТВО ""РЫБИНСКОЕ УМСР""";;;;;;;
№ 32009849395;https://zakupki.gov.ru/https://zakupki.gov.ru/223/purchase/public/purchase/info/common-info.html?regNumber=32009849395;Закупка завершена;Проведение периодических проверок работниковЯрославскогоотряда филиала ФГП ВО ЖДТ России на Северной железнойдорогев г. Кострома;"ФЕДЕРАЛЬНОЕ ГОСУДАРСТВЕННОЕ ПРЕДПРИЯТИЕ ""ВЕДОМСТВЕННАЯ ОХРАНА ЖЕЛЕЗНОДОРОЖНОГО ТРАНСПОРТА РОССИЙСКОЙ ФЕДЕРАЦИИ""";25.12.2020;89 400,00 ₽;;;;;;;;;;;;;;
№ 32009848236;https://zakupki.gov.ru/https://zakupki.gov.ru/223/purchase/public/purchase/info/common-info.html?regNumber=32009848236;Закупка завершена;Проведение периодических проверок работниковЯрославскогоотряда филиала ФГП ВО ЖДТ России на Северной железнойдорогев г.Ярославль;"ФЕДЕРАЛЬНОЕ ГОСУДАРСТВЕННОЕ ПРЕДПРИЯТИЕ ""ВЕДОМСТВЕННАЯ ОХРАНА ЖЕЛЕЗНОДОРОЖНОГО ТРАНСПОРТА РОССИЙСКОЙ ФЕДЕРАЦИИ""";25.12.2020;568 300,00 ₽;;;;;;;;;;;;;;
