№ 0137200001220003678;https://zakupki.gov.ru//epz/order/notice/ea44/view/common-info.html?regNumber=0137200001220003678;Определение поставщика завершено;Выполнение работ по содержанию автомобильныхдорогобщего пользования местного значения и городских территорий муниципального образования «ГородКалуга» (операции по уборке, погрузке и вывозу смета и мусора, окоса территорий по заявкам Заказчика);МИНИСТЕРСТВО КОНКУРЕНТНОЙ ПОЛИТИКИ КАЛУЖСКОЙ ОБЛАСТИ;04.08.2020;9 923 905,85 ₽;https://zakupki.gov.ru/epz/order/notice/ea44/view/supplier-results.html?regNumber=0137200001220003678;"МУНИЦИПАЛЬНОЕ БЮДЖЕТНОЕ УЧРЕЖДЕНИЕ ""СПЕЦИАЛИЗИРОВАННОЕ МОНТАЖНО - ЭКСПЛУАТАЦИОННОЕ УПРАВЛЕНИЕ""";"ОБЩЕСТВО С ОГРАНИЧЕННОЙ ОТВЕТСТВЕННОСТЬЮ ""АЛЬЯНС""";1 - Победитель;8 683 417,60;"ОБЩЕСТВО С ОГРАНИЧЕННОЙ ОТВЕТСТВЕННОСТЬЮ ""ЭКО""";2 - Второй номер;8 733 037,13;;;;;;
№ 0137200001220003617;https://zakupki.gov.ru//epz/order/notice/zp504/view/common-info.html?regNumber=0137200001220003617;Определение поставщика завершено;"Выполнение работ по строительству улично - дорожной сети от ул.Комфортная до СНТ ""Долина""";МИНИСТЕРСТВО КОНКУРЕНТНОЙ ПОЛИТИКИ КАЛУЖСКОЙ ОБЛАСТИ;31.07.2020;46 036 275,00 ₽;https://zakupki.gov.ru/epz/order/notice/ea44/view/supplier-results.html?regNumber=0137200001220003617;"МУНИЦИПАЛЬНОЕ КАЗЕННОЕ УЧРЕЖДЕНИЕ ""УПРАВЛЕНИЕ КАПИТАЛЬНОГО СТРОИТЕЛЬСТВА ГОРОДА КАЛУГИ""";;По окончании срока подачи заявок подана только одна заявка (ч. 26 ст. 83.1 Закона № 44-ФЗ).;;"ОБЩЕСТВО С ОГРАНИЧЕННОЙ ОТВЕТСТВЕННОСТЬЮ ""ТОРГОВО-СТРОИТЕЛЬНАЯ КОМПАНИЯ""";;45 800 000,00;;;;;;
№ 0137300004420000113;https://zakupki.gov.ru//epz/order/notice/ea44/view/common-info.html?regNumber=0137300004420000113;Определение поставщика завершено;"Ремонт участкаавтодороги1Р92 ""Калуга- Перемышль - Белев - Орел"" - Козельск"" - Дубровка, Козельского района, Калужской области (Реестровый номер: 2146Э-07/20сб)";"АДМИНИСТРАЦИЯ МУНИЦИПАЛЬНОГО РАЙОНА ""КОЗЕЛЬСКИЙ РАЙОН"" (ИСПОЛНИТЕЛЬНО-РАСПОРЯДИТЕЛЬНЫЙ ОРГАН)";30.07.2020;554 132,40 ₽;https://zakupki.gov.ru/epz/order/notice/ea44/view/supplier-results.html?regNumber=0137300004420000113;"АДМИНИСТРАЦИЯ МУНИЦИПАЛЬНОГО РАЙОНА ""КОЗЕЛЬСКИЙ РАЙОН"" (ИСПОЛНИТЕЛЬНО-РАСПОРЯДИТЕЛЬНЫЙ ОРГАН)";Орикян А. Г.;1 - Победитель;493 177,88;"ОБЩЕСТВО С ОГРАНИЧЕННОЙ ОТВЕТСТВЕННОСТЬЮ ""ЮНИСНАБ""";2 - Второй номер;495 948,54;;;;;;
№ 0137200001220003616;https://zakupki.gov.ru//epz/order/notice/ea44/view/common-info.html?regNumber=0137200001220003616;Определение поставщика завершено;Выполнение работ по содержанию автомобильныхдорогобщего пользования регионального или межмуниципального значения Малоярославецкого района Калужской области (доп.объемы);МИНИСТЕРСТВО КОНКУРЕНТНОЙ ПОЛИТИКИ КАЛУЖСКОЙ ОБЛАСТИ;31.07.2020;9 862 556,00 ₽;https://zakupki.gov.ru/epz/order/notice/ea44/view/supplier-results.html?regNumber=0137200001220003616;"ГОСУДАРСТВЕННОЕ КАЗЕННОЕ УЧРЕЖДЕНИЕ КАЛУЖСКОЙ ОБЛАСТИ ""КАЛУГАДОРЗАКАЗЧИК""";;По результатам рассмотрения вторых частей заявок принято решение о соответствии указанным требованиям только одной второй части заявки на участие в нем (ч.13 ст.69 Закона № 44-ФЗ).;;"АКЦИОНЕРНОЕ ОБЩЕСТВО ""КАЛУГАВТОДОР""";;9 615 992,10;;;;;;
№ 32009344351;https://zakupki.gov.ru/https://zakupki.gov.ru/223/purchase/public/purchase/info/common-info.html?regNumber=32009344351;Закупка завершена;Конкурс в электронной форме на право заключения Договора на  выполнение расчётов грузоподъёмности мостовых сооружений на автомобильныхдорогахМ-1 «Беларусь» Москва - граница с Республикой Белоруссия, М-3 «Украина» Москва -Калуга- Брянск - граница с Украиной, М-4 «Дон» Москва - Воронеж - Ростов-на-Дону - Краснодар – Новороссийск(участниками которого могут являться только субъекты малого и среднего предпринимательства);"ОБЩЕСТВО С ОГРАНИЧЕННОЙ ОТВЕТСТВЕННОСТЬЮ ""АВТОДОР-ИНЖИНИРИНГ""";23.07.2020;10 982 848,67 ₽;;;;;;;;;;;;;;
№ 32009331370;https://zakupki.gov.ru/https://zakupki.gov.ru/223/purchase/public/purchase/info/common-info.html?regNumber=32009331370;Закупка завершена;"""Выполнение работ по завершению строительства объектов:- «Сети и сооружения самотечной дождевой канализации». «3 этап. ОСПС и подводящие к ним трубопроводы дождевой канализации вдоль автомобильныхдорог» (Далее  - Объект №1); - «Автомобильныедорогипромышленных предприятий с освещением». «2 этап. Межплощадочные автомобильныедорогикатегории I-B и III-B с освещением» (Далее - Объект №2), расположенные по адресу: Калужская область, Людиновский район, д. Войлово""";"АКЦИОНЕРНОЕ ОБЩЕСТВО ""ОСОБАЯ ЭКОНОМИЧЕСКАЯ ЗОНА ПРОМЫШЛЕННО-ПРОИЗВОДСТВЕННОГО ТИПА ""КАЛУГА""";17.07.2020;508 990 934,40 ₽;;;;;;;;;;;;;;
№ 0137200001220003668;https://zakupki.gov.ru//epz/order/notice/ea44/view/common-info.html?regNumber=0137200001220003668;Определение поставщика завершено;Выполнение ремонтно-восстановительных работ аппаратно-программного комплекса, установленного в месте дислокации: Калужская обл., Козельский район,автодорога1Р-92 «Калуга-Перемышль-Белев-Орел» - Козельск» км 20+000 (д. Каменка);МИНИСТЕРСТВО КОНКУРЕНТНОЙ ПОЛИТИКИ КАЛУЖСКОЙ ОБЛАСТИ;04.08.2020;1 720 226,00 ₽;https://zakupki.gov.ru/epz/order/notice/ea44/view/supplier-results.html?regNumber=0137200001220003668;"ГОСУДАРСТВЕННОЕ КАЗЕННОЕ УЧРЕЖДЕНИЕ КАЛУЖСКОЙ ОБЛАСТИ ""ЦЕНТР БЕЗОПАСНОСТИ ДОРОЖНОГО ДВИЖЕНИЯ""";;По окончании срока подачи заявок подана только одна заявка. Такая заявка признана соответствующей требованиям Федерального закона № 44-ФЗ и документации об аукционе. Электронный аукцион признан несостоявшимся по основанию, предусмотренному ч. 1 ст. 71 Федерального закона № 44-ФЗ;;Дмитриев С. А.;;1 720 226,00;;;;;;
№ 0137200001220003622;https://zakupki.gov.ru//epz/order/notice/ea44/view/common-info.html?regNumber=0137200001220003622;Определение поставщика завершено;Выполнение работ по содержанию автомобильныхдорогобщего пользования регионального или межмуниципального значения Сухиничского района Калужской области (доп.объемы);МИНИСТЕРСТВО КОНКУРЕНТНОЙ ПОЛИТИКИ КАЛУЖСКОЙ ОБЛАСТИ;31.07.2020;12 361 239,00 ₽;https://zakupki.gov.ru/epz/order/notice/ea44/view/supplier-results.html?regNumber=0137200001220003622;"ГОСУДАРСТВЕННОЕ КАЗЕННОЕ УЧРЕЖДЕНИЕ КАЛУЖСКОЙ ОБЛАСТИ ""КАЛУГАДОРЗАКАЗЧИК""";;По окончании срока подачи заявок подана только одна заявка. Такая заявка признана соответствующей требованиям Федерального закона № 44-ФЗ и документации об аукционе. Электронный аукцион признан несостоявшимся по основанию, предусмотренному ч. 1 ст. 71 Федерального закона № 44-ФЗ;;"АКЦИОНЕРНОЕ ОБЩЕСТВО ""КАЛУГАВТОДОР""";;12 361 239,00;;;;;;
№ 0137200001220003613;https://zakupki.gov.ru//epz/order/notice/ea44/view/common-info.html?regNumber=0137200001220003613;Определение поставщика завершено;Выполнение работ по содержанию автомобильныхдорогобщего пользования регионального или межмуниципального значения Перемышльского района Калужской области (доп.объемы);МИНИСТЕРСТВО КОНКУРЕНТНОЙ ПОЛИТИКИ КАЛУЖСКОЙ ОБЛАСТИ;31.07.2020;3 498 415,00 ₽;https://zakupki.gov.ru/epz/order/notice/ea44/view/supplier-results.html?regNumber=0137200001220003613;"ГОСУДАРСТВЕННОЕ КАЗЕННОЕ УЧРЕЖДЕНИЕ КАЛУЖСКОЙ ОБЛАСТИ ""КАЛУГАДОРЗАКАЗЧИК""";;По окончании срока подачи заявок подана только одна заявка. Такая заявка признана соответствующей требованиям Федерального закона № 44-ФЗ и документации об аукционе. Электронный аукцион признан несостоявшимся по основанию, предусмотренному ч. 1 ст. 71 Федерального закона № 44-ФЗ;;"АКЦИОНЕРНОЕ ОБЩЕСТВО ""КАЛУГАВТОДОР""";;3 498 415,00;;;;;;
№ 0137200001220003583;https://zakupki.gov.ru//epz/order/notice/ea44/view/common-info.html?regNumber=0137200001220003583;Определение поставщика завершено;Выполнение работ по реконструкциидорогипо ул. Веры Андриановой в г.Калуга;МИНИСТЕРСТВО КОНКУРЕНТНОЙ ПОЛИТИКИ КАЛУЖСКОЙ ОБЛАСТИ;30.07.2020;81 352 002,55 ₽;https://zakupki.gov.ru/epz/order/notice/ea44/view/supplier-results.html?regNumber=0137200001220003583;"МУНИЦИПАЛЬНОЕ КАЗЕННОЕ УЧРЕЖДЕНИЕ ""УПРАВЛЕНИЕ КАПИТАЛЬНОГО СТРОИТЕЛЬСТВА ГОРОДА КАЛУГИ""";;По окончании срока подачи заявок не подано ни одной заявки (ч. 16 ст. 66 44-ФЗ);;;;;;;;;;
№ 0137200001220003531;https://zakupki.gov.ru//epz/order/notice/ea44/view/common-info.html?regNumber=0137200001220003531;Определение поставщика завершено;Выполнение работ по замене оборудования автоматизированных систем управления дорожным движением на автомобильныхдорогахобщего пользования регионального или межмуниципального значения в Куйбышевском и Хвастовичском районах Калужской области;МИНИСТЕРСТВО КОНКУРЕНТНОЙ ПОЛИТИКИ КАЛУЖСКОЙ ОБЛАСТИ;28.07.2020;1 357 275,00 ₽;https://zakupki.gov.ru/epz/order/notice/ea44/view/supplier-results.html?regNumber=0137200001220003531;"ГОСУДАРСТВЕННОЕ КАЗЕННОЕ УЧРЕЖДЕНИЕ КАЛУЖСКОЙ ОБЛАСТИ ""КАЛУГАДОРЗАКАЗЧИК""";;В течение десяти минут после начала проведения электронного аукциона ни один из его участников не подал предложение о цене контракта (ч.20 ст.68 44-ФЗ). По результатам рассмотрения вторых частей заявок принято решение о соответствии требованиям, установленным документацией об электронном аукционе, двух и более вторых частей заявок.;;Минаев О. В.;2 - Второй номер;1 357 275,00;;;;;;
№ 0337100016520000048;https://zakupki.gov.ru//epz/order/notice/ea44/view/common-info.html?regNumber=0337100016520000048;Определение поставщика завершено;"...  сети автомобильныхдорогобщего пользования федерального значения. АвтомобильнаядорогаР-132 «Золотое ...  – Гусь-Хрустальный – Рязань – Михайлов – Тула -Калуга– Вязьма – Ржев – Тверь – Углич – Ярославль ... : - на участке Вязьма –Калуга, в Калужской области протяженностью 89 ...  км; - на участке Р-132Калуга– Тула – Михайлов – Рязань (обход ...  г.Калугиот М-3 «Украина»), в Калужской ... ,209 км – на участке Вязьма –Калуга, в Смоленской области протяженностью 60 ...";"ФЕДЕРАЛЬНОЕ КАЗЕННОЕ УЧРЕЖДЕНИЕ ""УПРАВЛЕНИЕ АВТОМОБИЛЬНОЙ МАГИСТРАЛИ МОСКВА-БОБРУЙСК ФЕДЕРАЛЬНОГО ДОРОЖНОГО АГЕНТСТВА""";20.07.2020;1 113 513 720,00 ₽;https://zakupki.gov.ru/epz/order/notice/ea44/view/supplier-results.html?regNumber=0337100016520000048;"ФЕДЕРАЛЬНОЕ КАЗЕННОЕ УЧРЕЖДЕНИЕ ""УПРАВЛЕНИЕ АВТОМОБИЛЬНОЙ МАГИСТРАЛИ МОСКВА-БОБРУЙСК ФЕДЕРАЛЬНОГО ДОРОЖНОГО АГЕНТСТВА""";Согласование получено;;По окончании срока подачи заявок подана только одна заявка. Такая заявка признана соответствующей требованиям Федерального закона № 44-ФЗ и документации об аукционе. Электронный аукцион признан несостоявшимся по основанию, предусмотренному ч. 1 ст. 71 Федерального закона № 44-ФЗ;;"ОБЩЕСТВО С ОГРАНИЧЕННОЙ ОТВЕТСТВЕННОСТЬЮ ""ЕВРОТРАНССТРОЙ""";;;;;;;
№ 32009377048;https://zakupki.gov.ru/https://zakupki.gov.ru/223/purchase/public/purchase/info/common-info.html?regNumber=32009377048;Закупка завершена;Оказание услуг по выдаче Технических условий на разработку проектной документации на пересечение напорной канализацией железнодорожных путей на станцииКалугаII Московской железнойдорогив рамках реализации проекта по объекту: «Сети напорной канализации и водопровода с проколом под железнойдорогойв районе ж/д станции «КалугаII»;"ГОСУДАРСТВЕННОЕ ПРЕДПРИЯТИЕ КАЛУЖСКОЙ ОБЛАСТИ ""КАЛУГАОБЛВОДОКАНАЛ""";04.08.2020;130 496,96 ₽;;;;;;;;;;;;;;
№ 0137200001220003432;https://zakupki.gov.ru//epz/order/notice/ea44/view/common-info.html?regNumber=0137200001220003432;Определение поставщика завершено;Выполнение работ по установке элементов освещения на пешеходных переходах, автобусных остановках, кольцевых пересечениях и локальных пересечениях и примыканиях в  Малоярославецком  районе Калужской области;МИНИСТЕРСТВО КОНКУРЕНТНОЙ ПОЛИТИКИ КАЛУЖСКОЙ ОБЛАСТИ;22.07.2020;6 813 121,00 ₽;https://zakupki.gov.ru/epz/order/notice/ea44/view/supplier-results.html?regNumber=0137200001220003432;"ГОСУДАРСТВЕННОЕ КАЗЕННОЕ УЧРЕЖДЕНИЕ КАЛУЖСКОЙ ОБЛАСТИ ""КАЛУГАДОРЗАКАЗЧИК""";"ОБЩЕСТВО С ОГРАНИЧЕННОЙ ОТВЕТСТВЕННОСТЬЮ ""КАЛУЖСКОЕ МОНТАЖНОЕ УПРАВЛЕНИЕ ""ЦЕНТРОЭЛЕКТРОМОНТАЖ""";1 - Победитель;5 275 834,87;"ОБЩЕСТВО С ОГРАНИЧЕННОЙ ОТВЕТСТВЕННОСТЬЮ ""МОНТАЖНАЯ ЭЛЕКТРИЧЕСКАЯ КОМПАНИЯ""";2 - Второй номер;5 309 900,48;;;;;;
№ 0137200001220003464;https://zakupki.gov.ru//epz/order/notice/ea44/view/common-info.html?regNumber=0137200001220003464;Определение поставщика завершено;Выполнение комплекса работ по благоустройству дворовой территории микрорайона Солнечный в границах улиц: ул. Аллейная, ул. Маяковского, ул. Тополиная (демонтажные работы, устройство а/б покрытия, установка бортовых камней, устройство пешеходных дорожек, корчевка деревьев и кустарников, освещение);МИНИСТЕРСТВО КОНКУРЕНТНОЙ ПОЛИТИКИ КАЛУЖСКОЙ ОБЛАСТИ;23.07.2020;16 161 328,54 ₽;https://zakupki.gov.ru/epz/order/notice/ea44/view/supplier-results.html?regNumber=0137200001220003464;"МУНИЦИПАЛЬНОЕ БЮДЖЕТНОЕ УЧРЕЖДЕНИЕ ""КАЛУГАБЛАГОУСТРОЙСТВО""";"ОБЩЕСТВО С ОГРАНИЧЕННОЙ ОТВЕТСТВЕННОСТЬЮ ""ЭКСПЕРТ ГРУПП""";1 - Победитель;15 272 455,50;"ОБЩЕСТВО С ОГРАНИЧЕННОЙ ОТВЕТСТВЕННОСТЬЮ ""СК ГАМ-СТРОЙ""";2 - Второй номер;15 353 262,14;;;;;;
№ 0137200001220003433;https://zakupki.gov.ru//epz/order/notice/ea44/view/common-info.html?regNumber=0137200001220003433;Определение поставщика завершено;Выполнение работ по установке элементов освещения на пешеходных переходах, автобусных остановках, кольцевых пересечениях и локальных пересечениях и примыканиях в  Тарусском  районе Калужской области;МИНИСТЕРСТВО КОНКУРЕНТНОЙ ПОЛИТИКИ КАЛУЖСКОЙ ОБЛАСТИ;22.07.2020;4 578 281,00 ₽;https://zakupki.gov.ru/epz/order/notice/ea44/view/supplier-results.html?regNumber=0137200001220003433;"ГОСУДАРСТВЕННОЕ КАЗЕННОЕ УЧРЕЖДЕНИЕ КАЛУЖСКОЙ ОБЛАСТИ ""КАЛУГАДОРЗАКАЗЧИК""";"ОБЩЕСТВО С ОГРАНИЧЕННОЙ ОТВЕТСТВЕННОСТЬЮ ""КАЛУГАЭЛЕКТРОМОНТАЖ""";1 - Победитель;3 456 602,08;"ОБЩЕСТВО С ОГРАНИЧЕННОЙ ОТВЕТСТВЕННОСТЬЮ ""МОНТАЖНАЯ ЭЛЕКТРИЧЕСКАЯ КОМПАНИЯ""";2 - Второй номер;3 479 493,49;;;;;;
№ 32009373002;https://zakupki.gov.ru/https://zakupki.gov.ru/223/purchase/public/purchase/info/common-info.html?regNumber=32009373002;Закупка завершена;88-Е.Выполнение работ, связанных с восстановлением асфальтного покрытия после проведения ремонта участков тепловых сетей.;"МУНИЦИПАЛЬНОЕ УНИТАРНОЕ ПРЕДПРИЯТИЕ ""КАЛУГАТЕПЛОСЕТЬ"" ГКАЛУГИ";03.08.2020;300 000,00 ₽;;;;;;;;;;;;;;
№ 32009351708;https://zakupki.gov.ru/https://zakupki.gov.ru/223/purchase/public/purchase/info/common-info.html?regNumber=32009351708;Закупка завершена;Оказание услуг по выдаче Технических условий на разработку проектной документации на пересечение водопроводом железнодорожных путей на станцииКалугаII Московской железнойдорогив рамках реализации проекта по объекту: «Сети напорной канализации и водопровода с проколом под железнойдорогойв районе ж/д станции «КалугаII»;"ГОСУДАРСТВЕННОЕ ПРЕДПРИЯТИЕ КАЛУЖСКОЙ ОБЛАСТИ ""КАЛУГАОБЛВОДОКАНАЛ""";27.07.2020;130 496,96 ₽;;;;;;;;;;;;;;
№ 0137200001220003287;https://zakupki.gov.ru//epz/order/notice/ea44/view/common-info.html?regNumber=0137200001220003287;Определение поставщика завершено;"Оказание услуг по проведению комплекса кадастровых работ в отношении автомобильнойдорогиКозельск-Сухиничи-М-3 ""Украина"" в Сухиничском и Козельском районах";МИНИСТЕРСТВО КОНКУРЕНТНОЙ ПОЛИТИКИ КАЛУЖСКОЙ ОБЛАСТИ;13.07.2020;1 348 350,00 ₽;https://zakupki.gov.ru/epz/order/notice/ea44/view/supplier-results.html?regNumber=0137200001220003287;"ГОСУДАРСТВЕННОЕ КАЗЕННОЕ УЧРЕЖДЕНИЕ КАЛУЖСКОЙ ОБЛАСТИ ""КАЛУГАДОРЗАКАЗЧИК""";"ОБЩЕСТВО С ОГРАНИЧЕННОЙ ОТВЕТСТВЕННОСТЬЮ ""КАДГЕОКАЛУГА""";1 - Победитель;182 027,25;"АКЦИОНЕРНОЕ ОБЩЕСТВО ""КАЛУЖСКОЕ ЗЕМЛЕУСТРОИТЕЛЬНОЕ И ПРОЕКТНО-ИЗЫСКАТЕЛЬСКОЕ ПРЕДПРИЯТИЕ""";2 - Второй номер;505 631,25;;;;;;
№ 0137200001220003226;https://zakupki.gov.ru//epz/order/notice/ea44/view/common-info.html?regNumber=0137200001220003226;Определение поставщика завершено;"Выполнение работ по строительству улично - дорожной сети от ул.Комфортная до СНТ ""Долина""";МИНИСТЕРСТВО КОНКУРЕНТНОЙ ПОЛИТИКИ КАЛУЖСКОЙ ОБЛАСТИ;08.07.2020;46 036 275,00 ₽;https://zakupki.gov.ru/epz/order/notice/ea44/view/supplier-results.html?regNumber=0137200001220003226;"МУНИЦИПАЛЬНОЕ КАЗЕННОЕ УЧРЕЖДЕНИЕ ""УПРАВЛЕНИЕ КАПИТАЛЬНОГО СТРОИТЕЛЬСТВА ГОРОДА КАЛУГИ""";;По результатам рассмотрения вторых частей заявок принято решение о несоответствии требованиям, установленным документацией об электронном аукционе, всех вторых частей заявок на участие в нем (ч.13 ст.69 Закона № 44-ФЗ).;;;;;;;;;;
