№ 32009583710;https://zakupki.gov.ru/https://zakupki.gov.ru/223/purchase/public/purchase/info/common-info.html?regNumber=32009583710;Закупка завершена;Оказание услуг по строительному контролю за выполнением комплекса строительных (монтажных) работ по объекту: «Сети и сооружения самотечной дождевой канализации». 3 этап. ОСПС и подводящие к ним трубопроводы дождевой канализации вдоль автомобильныхдорог»;"АКЦИОНЕРНОЕ ОБЩЕСТВО ""ОСОБАЯ ЭКОНОМИЧЕСКАЯ ЗОНА ПРОМЫШЛЕННО-ПРОИЗВОДСТВЕННОГО ТИПА ""КАЛУГА""";15.10.2020;496 457,76 ₽;;;;;;;;;;;;;;
№ 32009583914;https://zakupki.gov.ru/https://zakupki.gov.ru/223/purchase/public/purchase/info/common-info.html?regNumber=32009583914;Закупка завершена;Оказание услуг по строительному контролю за выполнением комплекса строительных (монтажных) работ по объекту: «Автомобильныедорогипромышленных предприятий с освещением». «2 этап. Межплощадочные автомобильныедорогикатегории I-B и III-В с освещением»;"АКЦИОНЕРНОЕ ОБЩЕСТВО ""ОСОБАЯ ЭКОНОМИЧЕСКАЯ ЗОНА ПРОМЫШЛЕННО-ПРОИЗВОДСТВЕННОГО ТИПА ""КАЛУГА""";15.10.2020;5 254 579,03 ₽;;;;;;;;;;;;;;
№ 0137200001220004558;https://zakupki.gov.ru//epz/order/notice/ea44/view/common-info.html?regNumber=0137200001220004558;Определение поставщика завершено;Выполнение работ по благоустройству территории в районе д.170 по ул.Московская, г.Калуги(устройство пешеходных дорожек);МИНИСТЕРСТВО КОНКУРЕНТНОЙ ПОЛИТИКИ КАЛУЖСКОЙ ОБЛАСТИ;06.10.2020;644 092,80 ₽;https://zakupki.gov.ru/epz/order/notice/ea44/view/supplier-results.html?regNumber=0137200001220004558;"МУНИЦИПАЛЬНОЕ КАЗЕННОЕ УЧРЕЖДЕНИЕ ""УПРАВЛЕНИЕ КАПИТАЛЬНОГО СТРОИТЕЛЬСТВА ГОРОДА КАЛУГИ""";;По окончании срока подачи заявок подана только одна заявка. Такая заявка признана соответствующей требованиям Федерального закона № 44-ФЗ и документации об аукционе. Электронный аукцион признан несостоявшимся по основанию, предусмотренному ч. 1 ст. 71 Федерального закона № 44-ФЗ;;"ОБЩЕСТВО С ОГРАНИЧЕННОЙ ОТВЕТСТВЕННОСТЬЮ ""ЭКОГРАД""";;644 092,80;;;;;;
№ 0336100012520000117;https://zakupki.gov.ru//epz/order/notice/ea44/view/common-info.html?regNumber=0336100012520000117;Определение поставщика завершено;...  дорожного контроля метеосистемы на автомобильнойдорогеобщего пользования федерального значения Р-132 ...  – Владимир – Гусь-Хрустальный – Рязань – Михайлов – Тула –Калуга– Вязьма – Ржев – Тверь – Углич – Ярославль ...  интенсивности дорожного движения на автомобильнойдорогеобщего пользования федерального значения Р-132 ...  – Владимир – Гусь-Хрустальный – Рязань – Михайлов – Тула –Калуга– Вязьма – Ржев – Тверь – Углич – Ярославль;"ФЕДЕРАЛЬНОЕ КАЗЕННОЕ УЧРЕЖДЕНИЕ ""УПРАВЛЕНИЕ АВТОМОБИЛЬНОЙ МАГИСТРАЛИ ОРДЕНА ЛЕНИНА ""МОСКВА-САНКТ-ПЕТЕРБУРГ"" ФЕДЕРАЛЬНОГО ДОРОЖНОГО АГЕНТСТВА""";05.10.2020;52 740 310,92 ₽;https://zakupki.gov.ru/epz/order/notice/ea44/view/supplier-results.html?regNumber=0336100012520000117;"ФЕДЕРАЛЬНОЕ КАЗЕННОЕ УЧРЕЖДЕНИЕ ""УПРАВЛЕНИЕ АВТОМОБИЛЬНОЙ МАГИСТРАЛИ ОРДЕНА ЛЕНИНА ""МОСКВА-САНКТ-ПЕТЕРБУРГ"" ФЕДЕРАЛЬНОГО ДОРОЖНОГО АГЕНТСТВА""";;По окончании срока подачи заявок подана только одна заявка. Такая заявка признана соответствующей требованиям Федерального закона № 44-ФЗ и документации об аукционе. Электронный аукцион признан несостоявшимся по основанию, предусмотренному ч. 1 ст. 71 Федерального закона № 44-ФЗ;;"ОБЩЕСТВО С ОГРАНИЧЕННОЙ ОТВЕТСТВЕННОСТЬЮ ""ВОСТОК-М""";;52 740 310,92;;;;;;
№ 0137200001220004395;https://zakupki.gov.ru//epz/order/notice/ea44/view/common-info.html?regNumber=0137200001220004395;Определение поставщика завершено;Выполнение работ по содержанию автомобильныхдорогобщего пользования регионального или межмуниципального значения Дзержинского района Калужской области;МИНИСТЕРСТВО КОНКУРЕНТНОЙ ПОЛИТИКИ КАЛУЖСКОЙ ОБЛАСТИ;24.09.2020;485 516 961,00 ₽;https://zakupki.gov.ru/epz/order/notice/ea44/view/supplier-results.html?regNumber=0137200001220004395;"ГОСУДАРСТВЕННОЕ КАЗЕННОЕ УЧРЕЖДЕНИЕ КАЛУЖСКОЙ ОБЛАСТИ ""КАЛУГАДОРЗАКАЗЧИК""";"ОБЩЕСТВО С ОГРАНИЧЕННОЙ ОТВЕТСТВЕННОСТЬЮ ""ЭКО""";2 - Второй номер;390 841 153,60;"АКЦИОНЕРНОЕ ОБЩЕСТВО ""КАЛУГАВТОДОР""";1 - Победитель;366 565 305,55;;;;;;
№ 0137200001220004450;https://zakupki.gov.ru//epz/order/notice/ea44/view/common-info.html?regNumber=0137200001220004450;Определение поставщика завершено;Выполнение работ по содержанию искусственных дорожных сооружений на автомобильныхдорогахобщего пользования регионального или межмуниципального значения в Ульяновском районе Калужской области на 2021-2024 гг.;МИНИСТЕРСТВО КОНКУРЕНТНОЙ ПОЛИТИКИ КАЛУЖСКОЙ ОБЛАСТИ;29.09.2020;17 061 916,00 ₽;https://zakupki.gov.ru/epz/order/notice/ea44/view/supplier-results.html?regNumber=0137200001220004450;"ГОСУДАРСТВЕННОЕ КАЗЕННОЕ УЧРЕЖДЕНИЕ КАЛУЖСКОЙ ОБЛАСТИ ""КАЛУГАДОРЗАКАЗЧИК""";;По окончании срока подачи заявок подана только одна заявка. Такая заявка признана соответствующей требованиям Федерального закона № 44-ФЗ и документации об аукционе. Электронный аукцион признан несостоявшимся по основанию, предусмотренному ч. 1 ст. 71 Федерального закона № 44-ФЗ;;"АКЦИОНЕРНОЕ ОБЩЕСТВО ""ХВАСТОВИЧСКАЯ ПМК-9""";;17 061 916,00;;;;;;
№ 0137200001220004449;https://zakupki.gov.ru//epz/order/notice/ea44/view/common-info.html?regNumber=0137200001220004449;Определение поставщика завершено;Выполнение работ по содержанию искусственных дорожных сооружений на автомобильныхдорогахобщего пользования регионального или межмуниципального значения в Хвастовичском районе Калужской области на 2021-2024 гг.;МИНИСТЕРСТВО КОНКУРЕНТНОЙ ПОЛИТИКИ КАЛУЖСКОЙ ОБЛАСТИ;29.09.2020;18 988 395,00 ₽;https://zakupki.gov.ru/epz/order/notice/ea44/view/supplier-results.html?regNumber=0137200001220004449;"ГОСУДАРСТВЕННОЕ КАЗЕННОЕ УЧРЕЖДЕНИЕ КАЛУЖСКОЙ ОБЛАСТИ ""КАЛУГАДОРЗАКАЗЧИК""";;По окончании срока подачи заявок подана только одна заявка. Такая заявка признана соответствующей требованиям Федерального закона № 44-ФЗ и документации об аукционе. Электронный аукцион признан несостоявшимся по основанию, предусмотренному ч. 1 ст. 71 Федерального закона № 44-ФЗ;;"АКЦИОНЕРНОЕ ОБЩЕСТВО ""ХВАСТОВИЧСКАЯ ПМК-9""";;18 988 395,00;;;;;;
№ 0137200001220004451;https://zakupki.gov.ru//epz/order/notice/ea44/view/common-info.html?regNumber=0137200001220004451;Определение поставщика завершено;Выполнение работ по содержанию искусственных дорожных сооружений на автомобильныхдорогахобщего пользования регионального или межмуниципального значения в Сухиничском районе Калужской области на 2021-2024 гг.;МИНИСТЕРСТВО КОНКУРЕНТНОЙ ПОЛИТИКИ КАЛУЖСКОЙ ОБЛАСТИ;29.09.2020;17 308 606,00 ₽;https://zakupki.gov.ru/epz/order/notice/ea44/view/supplier-results.html?regNumber=0137200001220004451;"ГОСУДАРСТВЕННОЕ КАЗЕННОЕ УЧРЕЖДЕНИЕ КАЛУЖСКОЙ ОБЛАСТИ ""КАЛУГАДОРЗАКАЗЧИК""";"ОБЩЕСТВО С ОГРАНИЧЕННОЙ ОТВЕТСТВЕННОСТЬЮ СОВМЕСТНОЕ ПРЕДПРИЯТИЕ ""РЕМСТРОЙДОРСЕРВИС""";1 - Победитель;17 135 519,94;"ОБЩЕСТВО С ОГРАНИЧЕННОЙ ОТВЕТСТВЕННОСТЬЮ ""УНИВЕРСАЛ СЕРВИС""";2 - Второй номер;17 222 062,97;;;;;;
№ 0137200001220004453;https://zakupki.gov.ru//epz/order/notice/ea44/view/common-info.html?regNumber=0137200001220004453;Определение поставщика завершено;Выполнение работ по содержанию искусственных дорожных сооружений на автомобильныхдорогахобщего пользования регионального или межмуниципального значения в Спас-Деменском районе Калужской области на 2021-2024 гг.;МИНИСТЕРСТВО КОНКУРЕНТНОЙ ПОЛИТИКИ КАЛУЖСКОЙ ОБЛАСТИ;29.09.2020;6 090 516,00 ₽;https://zakupki.gov.ru/epz/order/notice/ea44/view/supplier-results.html?regNumber=0137200001220004453;"ГОСУДАРСТВЕННОЕ КАЗЕННОЕ УЧРЕЖДЕНИЕ КАЛУЖСКОЙ ОБЛАСТИ ""КАЛУГАДОРЗАКАЗЧИК""";;По окончании срока подачи заявок подана только одна заявка. Такая заявка признана соответствующей требованиям Федерального закона № 44-ФЗ и документации об аукционе. Электронный аукцион признан несостоявшимся по основанию, предусмотренному ч. 1 ст. 71 Федерального закона № 44-ФЗ;;"ОБЩЕСТВО С ОГРАНИЧЕННОЙ ОТВЕТСТВЕННОСТЬЮ СОВМЕСТНОЕ ПРЕДПРИЯТИЕ ""РЕМСТРОЙДОРСЕРВИС""";;6 090 516,00;;;;;;
№ 0137200001220004407;https://zakupki.gov.ru//epz/order/notice/ea44/view/common-info.html?regNumber=0137200001220004407;Определение поставщика завершено;Выполнение работ по содержанию искусственных дорожных сооружений на автомобильныхдорогахобщего пользования регионального или межмуниципального значения в Мещовском районе Калужской области на 2021-2024 гг.;МИНИСТЕРСТВО КОНКУРЕНТНОЙ ПОЛИТИКИ КАЛУЖСКОЙ ОБЛАСТИ;25.09.2020;15 609 119,00 ₽;https://zakupki.gov.ru/epz/order/notice/ea44/view/supplier-results.html?regNumber=0137200001220004407;"ГОСУДАРСТВЕННОЕ КАЗЕННОЕ УЧРЕЖДЕНИЕ КАЛУЖСКОЙ ОБЛАСТИ ""КАЛУГАДОРЗАКАЗЧИК""";"ОБЩЕСТВО С ОГРАНИЧЕННОЙ ОТВЕТСТВЕННОСТЬЮ ""УНИВЕРСАЛ СЕРВИС""";2 - Второй номер;15 531 073,40;"ОБЩЕСТВО С ОГРАНИЧЕННОЙ ОТВЕТСТВЕННОСТЬЮ СОВМЕСТНОЕ ПРЕДПРИЯТИЕ ""РЕМСТРОЙДОРСЕРВИС""";1 - Победитель;15 453 027,80;;;;;;
№ 32009541327;https://zakupki.gov.ru/https://zakupki.gov.ru/223/purchase/public/purchase/info/common-info.html?regNumber=32009541327;Закупка завершена;Запрос котировок среди субъектов малого и среднего предпринимательства в электронной форме № 3010/ЗКТЭ-ДЖВ/20 на право заключения договора оказания услуг по расчету категорий взрывопожарной и пожарной опасности помещений вокзальных комплексов (Белорусский, Рижский, Казанский, Курский, Киевский, Савеловский, Павелецкий, Ярославский,Калуга-1, Курск, Орел, Брянск-Орловский, Смоленск, Тула, Рязань-1, Царицыно);"ОТКРЫТОЕ АКЦИОНЕРНОЕ ОБЩЕСТВО ""РОССИЙСКИЕ ЖЕЛЕЗНЫЕДОРОГИ""";30.09.2020;1 732 117,09 ₽;;;;;;;;;;;;;;
№ 0348100006020000050;https://zakupki.gov.ru//epz/order/notice/ea44/view/common-info.html?regNumber=0348100006020000050;Определение поставщика завершено;"Оказаниеуслуг по содержанию автомобильнойдорогиР-132 ""Золотое кольцо""Ярославль - Кострома - Иваново - Владимир - Гусь-Хрустальный - Рязань -Михайлов - Тула -Калуга- Вязьма - Ржев - Тверь - Углич - Ярославль км 304+312- км 411+353, Владимирская областьОказание услуг по содержанию искусственных сооружений  на автомобильнойдорогеР-132 ""Золотоекольцо"" Ярославль - Кострома - Иваново - Владимир - Гусь-Хрустальный -Рязань - Михайлов - Тула -Калуга- Вязьма - Ржев - Тверь - Углич - Ярославлькм 304+312 - км 411+353, Владимирская область";"ФЕДЕРАЛЬНОЕ КАЗЕННОЕ УЧРЕЖДЕНИЕ ""УПРАВЛЕНИЕ АВТОМОБИЛЬНОЙ МАГИСТРАЛИ МОСКВА - НИЖНИЙ НОВГОРОД ФЕДЕРАЛЬНОГО ДОРОЖНОГО АГЕНТСТВА""";22.09.2020;75 406 846,62 ₽;https://zakupki.gov.ru/epz/order/notice/ea44/view/supplier-results.html?regNumber=0348100006020000050;"ФЕДЕРАЛЬНОЕ КАЗЕННОЕ УЧРЕЖДЕНИЕ ""УПРАВЛЕНИЕ АВТОМОБИЛЬНОЙ МАГИСТРАЛИ МОСКВА - НИЖНИЙ НОВГОРОД ФЕДЕРАЛЬНОГО ДОРОЖНОГО АГЕНТСТВА""";;Принято решение о признании только одного участника закупки, подавшего заявку на участие в электронном аукционе, его участником. По результатам рассмотрения заявки единственного участника, данная заявка признана соответствующей требованиям Федерального закона № 44-ФЗ и документации об аукционе. (п. 3 ч.2 ст. 71);;"ОБЩЕСТВО С ОГРАНИЧЕННОЙ ОТВЕТСТВЕННОСТЬЮ ""ВЛАДИМИРСКАЯ СТРОИТЕЛЬНАЯ КОМПАНИЯ""";;75 406 846,62;;;;;;
№ 0336100012520000113;https://zakupki.gov.ru//epz/order/notice/ea44/view/common-info.html?regNumber=0336100012520000113;Определение поставщика завершено;"...  искусственных дорожных сооружений на автомобильныхдорогах: АвтомобильнаядорогаР-132 «Золотое кольцо» Ярославль ...  – Владимир – Гусь-Хрустальный – Рязань – Михайлов – Тула –Калуга– Вязьма – Ржев – Тверь – Углич – Ярославль ... +450 – км 96+850; АвтомобильнаядорогаР-132 «Золотое кольцо» Ярославль – Кострома ...  – Владимир – Гусь-Хрустальный – Рязань – Михайлов – Тула –Калуга– Вязьма – Ржев – Тверь – Углич – Ярославль ... +286 – км 27+735; АвтомобильнаядорогаР-132 «Золотое кольцо» Ярославль – Кострома ...  – Владимир – Гусь-Хрустальный – Рязань – Михайлов – Тула –Калуга– Вязьма – Ржев – Тверь – Углич – Ярославль ...";"ФЕДЕРАЛЬНОЕ КАЗЕННОЕ УЧРЕЖДЕНИЕ ""УПРАВЛЕНИЕ АВТОМОБИЛЬНОЙ МАГИСТРАЛИ ОРДЕНА ЛЕНИНА ""МОСКВА-САНКТ-ПЕТЕРБУРГ"" ФЕДЕРАЛЬНОГО ДОРОЖНОГО АГЕНТСТВА""";24.09.2020;14 010 771,63 ₽;https://zakupki.gov.ru/epz/order/notice/ea44/view/supplier-results.html?regNumber=0336100012520000113;"ФЕДЕРАЛЬНОЕ КАЗЕННОЕ УЧРЕЖДЕНИЕ ""УПРАВЛЕНИЕ АВТОМОБИЛЬНОЙ МАГИСТРАЛИ ОРДЕНА ЛЕНИНА ""МОСКВА-САНКТ-ПЕТЕРБУРГ"" ФЕДЕРАЛЬНОГО ДОРОЖНОГО АГЕНТСТВА""";;По окончании срока подачи заявок подана только одна заявка. Такая заявка признана соответствующей требованиям Федерального закона № 44-ФЗ и документации об аукционе. Электронный аукцион признан несостоявшимся по основанию, предусмотренному ч. 1 ст. 71 Федерального закона № 44-ФЗ;;"ОБЩЕСТВО С ОГРАНИЧЕННОЙ ОТВЕТСТВЕННОСТЬЮ ""ПРОЕКТСТРОЙ""";;14 010 771,63;;;;;;
№ 32009559090;https://zakupki.gov.ru/https://zakupki.gov.ru/223/purchase/public/purchase/info/common-info.html?regNumber=32009559090;Закупка завершена;Оказание услуг по согласованию проектной документации на пересечение проектируемым водопроводом железнодорожных путей на 168 км ПК 1 + 75 метров перегонаКалугаI – Перспективная Московской железнойдорогипо объекту: «Сети водоснабжения для отдельно стоящей котельной для теплоснабжения потребителей существующей котельной ФГУП «НТЦ Базис» ФСБ России, расположенный по адресу: Калужская область, г.Калуга, ул. Грабцевское шоссе, р-н д. 35»;"ГОСУДАРСТВЕННОЕ ПРЕДПРИЯТИЕ КАЛУЖСКОЙ ОБЛАСТИ ""КАЛУГАОБЛВОДОКАНАЛ""";07.10.2020;207 818,99 ₽;;;;;;;;;;;;;;
№ 32009558908;https://zakupki.gov.ru/https://zakupki.gov.ru/223/purchase/public/purchase/info/common-info.html?regNumber=32009558908;Закупка завершена;Оказание услуг по выдаче Технических условий на разработку проектной документации на пересечение водоводом железнодорожных путей в районе станции Азарово Московской железнойдорогипо объекту: «Аварийно-восстановительные работы водовода Ду 300 мм под железнодорожным полотном по ул. Азаровская г.Калуга»;"ГОСУДАРСТВЕННОЕ ПРЕДПРИЯТИЕ КАЛУЖСКОЙ ОБЛАСТИ ""КАЛУГАОБЛВОДОКАНАЛ""";07.10.2020;130 496,96 ₽;;;;;;;;;;;;;;
№ 0336100012520000111;https://zakupki.gov.ru//epz/order/notice/ea44/view/common-info.html?regNumber=0336100012520000111;Определение поставщика завершено;"Оказание услуг по содержанию автомобильнойдорогиР-132 «Золотое кольцо» Ярославль – Кострома –  ...  – Тула –Калуга– Вязьма – Ржев – Тверь – Углич – Ярославль, включая: - автомобильнуюдорогуТверь ... , протяженностью 28,993 км; автомобильнуюдорогуКалязин – Кашин – Горицы - Кушалино ... , протяженностью 129,988 км; автомобильнуюдорогуСтарое направление по г. ... , протяженностью 2,636 км; автомобильнуюдорогуСергиев Посад – Калязин – Рыбинск – Череповец ...";"ФЕДЕРАЛЬНОЕ КАЗЕННОЕ УЧРЕЖДЕНИЕ ""УПРАВЛЕНИЕ АВТОМОБИЛЬНОЙ МАГИСТРАЛИ ОРДЕНА ЛЕНИНА ""МОСКВА-САНКТ-ПЕТЕРБУРГ"" ФЕДЕРАЛЬНОГО ДОРОЖНОГО АГЕНТСТВА""";22.09.2020;110 244 905,00 ₽;https://zakupki.gov.ru/epz/order/notice/ea44/view/supplier-results.html?regNumber=0336100012520000111;"ФЕДЕРАЛЬНОЕ КАЗЕННОЕ УЧРЕЖДЕНИЕ ""УПРАВЛЕНИЕ АВТОМОБИЛЬНОЙ МАГИСТРАЛИ ОРДЕНА ЛЕНИНА ""МОСКВА-САНКТ-ПЕТЕРБУРГ"" ФЕДЕРАЛЬНОГО ДОРОЖНОГО АГЕНТСТВА""";"ОБЩЕСТВО С ОГРАНИЧЕННОЙ ОТВЕТСТВЕННОСТЬЮ ""ДОРЭКС""";1 - Победитель;98 117 965,34;"ОБЩЕСТВО С ОГРАНИЧЕННОЙ ОТВЕТСТВЕННОСТЬЮ ""ЯРАВТОДОР""";2 - Второй номер;98 669 189,87;;;;;;
№ 0137200001220004333;https://zakupki.gov.ru//epz/order/notice/ea44/view/common-info.html?regNumber=0137200001220004333;Определение поставщика завершено;Выполнение работ по благоустройству территории в д.Лихуны  по ул.Молодежная в г.Калуга(устройство пешеходных дорожек);МИНИСТЕРСТВО КОНКУРЕНТНОЙ ПОЛИТИКИ КАЛУЖСКОЙ ОБЛАСТИ;21.09.2020;5 438 422,42 ₽;https://zakupki.gov.ru/epz/order/notice/ea44/view/supplier-results.html?regNumber=0137200001220004333;"МУНИЦИПАЛЬНОЕ КАЗЕННОЕ УЧРЕЖДЕНИЕ ""УПРАВЛЕНИЕ КАПИТАЛЬНОГО СТРОИТЕЛЬСТВА ГОРОДА КАЛУГИ""";;По результатам рассмотрения вторых частей заявок принято решение о соответствии указанным требованиям только одной второй части заявки на участие в нем (ч.13 ст.69 Закона № 44-ФЗ).;;"ОБЩЕСТВО С ОГРАНИЧЕННОЙ ОТВЕТСТВЕННОСТЬЮ ""АЛЬЯНС""";;4 622 658,94;;;;;;
