№ 0306100000420000074;https://zakupki.gov.ru//epz/order/notice/ea44/view/common-info.html?regNumber=0306100000420000074;Определение поставщика завершено;"Выполнение работ в целях компенсационного озеленения за снос зеленых насаждений при проведении работ на объекте: ""Строительство и реконструкция участков автомобильнойдорогиР-21 ""Кола"" Санкт-Петербург - Петрозаводск -Мурманск- Печенга - граница с Королевством Норвегия. Реконструкция автомобильнойдорогиР-21 ""Кола"" Санкт-Петербург - Петрозаводск -Мурманск- Печенга - граница с Королевством Норвегия. Подъезд к г.Мурманскна участке км 14+297 - км 19+027,Мурманскаяобласть""";"ФЕДЕРАЛЬНОЕ КАЗЕННОЕ УЧРЕЖДЕНИЕ ""УПРАВЛЕНИЕ АВТОМОБИЛЬНОЙ МАГИСТРАЛИ САНКТ-ПЕТЕРБУРГ -МУРМАНСКФЕДЕРАЛЬНОГО ДОРОЖНОГО АГЕНТСТВА""";09.09.2020;15 435 682,67 ₽;https://zakupki.gov.ru/epz/order/notice/ea44/view/supplier-results.html?regNumber=0306100000420000074;"ФЕДЕРАЛЬНОЕ КАЗЕННОЕ УЧРЕЖДЕНИЕ ""УПРАВЛЕНИЕ АВТОМОБИЛЬНОЙ МАГИСТРАЛИ САНКТ-ПЕТЕРБУРГ - МУРМАНСК ФЕДЕРАЛЬНОГО ДОРОЖНОГО АГЕНТСТВА""";"ОБЩЕСТВО С ОГРАНИЧЕННОЙ ОТВЕТСТВЕННОСТЬЮ СТРОИТЕЛЬНАЯ КОМПАНИЯ ""СТРОЙКОМ""";1 - Победитель;9 724 479,59;"ОБЩЕСТВО С ОГРАНИЧЕННОЙ ОТВЕТСТВЕННОСТЬЮ ""ПРОИЗВОДСТВЕННАЯ КОМПАНИЯ ""БСМ-ГРУПП""";2 - Второй номер;9 801 658,00;;;;;;
№ 32009113397;https://zakupki.gov.ru/https://zakupki.gov.ru/223/purchase/public/purchase/info/common-info.html?regNumber=32009113397;Закупка завершена;"Открытый аукцион среди субъектов малого и среднего предпринимательства в электронной форме № 2040/ОАЭ-ДКРС/20 на право заключения договора выполнения работ по обследованию и очистке территории от взрывоопасных предметов, а также по вывозу выявленных при выполнении работ взрывоопасных предметов по проекту:""Развитие участкаМурманск- Волховстрой. Реконструкция участкаМурманск- Оленегорск со строительством вторых путей""";"ОТКРЫТОЕ АКЦИОНЕРНОЕ ОБЩЕСТВО ""РОССИЙСКИЕ ЖЕЛЕЗНЫЕДОРОГИ""";27.04.2020;16 823 758,12 ₽;;;;;;;;;;;;;;
№ 0149200002320005568;https://zakupki.gov.ru//epz/order/notice/ea44/view/common-info.html?regNumber=0149200002320005568;Определение поставщика завершено;Выполнение работ по обустройству наиболее опасных участков автомобильнойдорогиКола - Серебрянские ГЭС, км 0 - км 50 дорожными ограждениями;КОМИТЕТ ПО КОНКУРЕНТНОЙ ПОЛИТИКЕМУРМАНСКОЙОБЛАСТИ;04.09.2020;96 775 650,00 ₽;https://zakupki.gov.ru/epz/order/notice/ea44/view/supplier-results.html?regNumber=0149200002320005568;ГОСУДАРСТВЕННОЕ ОБЛАСТНОЕ КАЗЕННОЕ УЧРЕЖДЕНИЕ ПО УПРАВЛЕНИЮ АВТОМОБИЛЬНЫМИ ДОРОГАМИ МУРМАНСКОЙ ОБЛАСТИ;"ОБЩЕСТВО С ОГРАНИЧЕННОЙ ОТВЕТСТВЕННОСТЬЮ ""ДОР ИНЖИНИРИНГ""";1 - Победитель;57 000 000,00;"АКЦИОНЕРНОЕ ОБЩЕСТВО ""КОМПЛЕКСНЫЙ ТЕХНИЧЕСКИЙ ЦЕНТР ""МЕТАЛЛОКОНСТРУКЦИЯ""";2 - Второй номер;58 065 390,00;;;;;;
№ 0149200002320005646;https://zakupki.gov.ru//epz/order/notice/ea44/view/common-info.html?regNumber=0149200002320005646;Определение поставщика завершено;Выполнение работ на принципах контракта жизненного цикла по установке светофорного объекта и его содержание на автоподъезде к населенному пункту Лиинахамари, км 1+766;КОМИТЕТ ПО КОНКУРЕНТНОЙ ПОЛИТИКЕМУРМАНСКОЙОБЛАСТИ;10.09.2020;1 145 384,09 ₽;https://zakupki.gov.ru/epz/order/notice/ea44/view/supplier-results.html?regNumber=0149200002320005646;ГОСУДАРСТВЕННОЕ ОБЛАСТНОЕ КАЗЕННОЕ УЧРЕЖДЕНИЕ ПО УПРАВЛЕНИЮ АВТОМОБИЛЬНЫМИ ДОРОГАМИ МУРМАНСКОЙ ОБЛАСТИ;;По окончании срока подачи заявок не подано ни одной заявки (ч. 16 ст. 66 44-ФЗ);;;;;;;;;;
№ 0306100000420000073;https://zakupki.gov.ru//epz/order/notice/ea44/view/common-info.html?regNumber=0306100000420000073;Определение поставщика завершено;Создание автоматизированной системы метеорологического обеспечения на сети автомобильныхдорогобщего пользования федерального значения;"ФЕДЕРАЛЬНОЕ КАЗЕННОЕ УЧРЕЖДЕНИЕ ""УПРАВЛЕНИЕ АВТОМОБИЛЬНОЙ МАГИСТРАЛИ САНКТ-ПЕТЕРБУРГ -МУРМАНСКФЕДЕРАЛЬНОГО ДОРОЖНОГО АГЕНТСТВА""";04.09.2020;10 963 016,57 ₽;https://zakupki.gov.ru/epz/order/notice/ea44/view/supplier-results.html?regNumber=0306100000420000073;"ФЕДЕРАЛЬНОЕ КАЗЕННОЕ УЧРЕЖДЕНИЕ ""УПРАВЛЕНИЕ АВТОМОБИЛЬНОЙ МАГИСТРАЛИ САНКТ-ПЕТЕРБУРГ - МУРМАНСК ФЕДЕРАЛЬНОГО ДОРОЖНОГО АГЕНТСТВА""";;Принято решение о признании только одного участника закупки, подавшего заявку на участие в электронном аукционе, его участником. По результатам рассмотрения заявки единственного участника, данная заявка признана соответствующей требованиям Федерального закона № 44-ФЗ и документации об аукционе. (п. 3 ч.2 ст. 71);;"ОБЩЕСТВО С ОГРАНИЧЕННОЙ ОТВЕТСТВЕННОСТЬЮ ""ВОСТОК-М""";;10 963 016,57;;;;;;
№ 0849100000920000063;https://zakupki.gov.ru//epz/order/notice/ea44/view/common-info.html?regNumber=0849100000920000063;Определение поставщика завершено;Выполнение работ по текущему ремонту асфальтового покрытия внутреннего двора административного здания УМВДРоссии поМурманскойобласти.;"ФЕДЕРАЛЬНОЕ КАЗЕННОЕ УЧРЕЖДЕНИЕ ""ЦЕНТР ХОЗЯЙСТВЕННОГО И СЕРВИСНОГО ОБЕСПЕЧЕНИЯ УПРАВЛЕНИЯ МИНИСТЕРСТВА ВНУТРЕННИХ ДЕЛ РОССИЙСКОЙ ФЕДЕРАЦИИ ПОМУРМАНСКОЙОБЛАСТИ""";08.09.2020;170 000,00 ₽;https://zakupki.gov.ru/epz/order/notice/ea44/view/supplier-results.html?regNumber=0849100000920000063;"ФЕДЕРАЛЬНОЕ КАЗЕННОЕ УЧРЕЖДЕНИЕ ""ЦЕНТР ХОЗЯЙСТВЕННОГО И СЕРВИСНОГО ОБЕСПЕЧЕНИЯ УПРАВЛЕНИЯ МИНИСТЕРСТВА ВНУТРЕННИХ ДЕЛ РОССИЙСКОЙ ФЕДЕРАЦИИ ПО МУРМАНСКОЙ ОБЛАСТИ""";;По окончании срока подачи заявок не подано ни одной заявки (ч. 16 ст. 66 44-ФЗ);;;;;;;;;;
№ 0149300005020000069;https://zakupki.gov.ru//epz/order/notice/ea44/view/common-info.html?regNumber=0149300005020000069;Определение поставщика завершено;Выполнение работ по содержанию автомобильныхдорогместного значения муниципального образования ЗАТО г. Островной на сентябрь-декабрь 2020 года;АДМИНИСТРАЦИЯ ЗАКРЫТОГО АДМИНИСТРАТИВНО-ТЕРРИТОРИАЛЬНОГО ОБРАЗОВАНИЯ  ГОРОД ОСТРОВНОЙМУРМАНСКОЙОБЛАСТИ;04.09.2020;7 524 685,89 ₽;https://zakupki.gov.ru/epz/order/notice/ea44/view/supplier-results.html?regNumber=0149300005020000069;"МУНИЦИПАЛЬНОЕ КАЗЕННОЕ УЧРЕЖДЕНИЕ ""СЛУЖБА ГОРОДСКОГО ХОЗЯЙСТВА ЗАКРЫТОГО АДМИНИСТРАТИВНО-ТЕРРИТОРИАЛЬНОГО ОБРАЗОВАНИЯ ГОРОД ОСТРОВНОЙ МУРМАНСКОЙ ОБЛАСТИ""";;По окончании срока подачи заявок не подано ни одной заявки (ч. 16 ст. 66 44-ФЗ);;;;;;;;;;
№ 0149200002320005133;https://zakupki.gov.ru//epz/order/notice/ok504/view/common-info.html?regNumber=0149200002320005133;Определение поставщика завершено;Выполнение работ по разработке проектной и рабочей документации на реконструкцию мостового перехода через р. Канентъявр на км 49+100 автомобильнойдорогиКола-Серебрянские ГЭС с подъездами;КОМИТЕТ ПО КОНКУРЕНТНОЙ ПОЛИТИКЕМУРМАНСКОЙОБЛАСТИ;07.08.2020;4 995 679,00 ₽;https://zakupki.gov.ru/epz/order/notice/ea44/view/supplier-results.html?regNumber=0149200002320005133;ГОСУДАРСТВЕННОЕ ОБЛАСТНОЕ КАЗЕННОЕ УЧРЕЖДЕНИЕ ПО УПРАВЛЕНИЮ АВТОМОБИЛЬНЫМИ ДОРОГАМИ МУРМАНСКОЙ ОБЛАСТИ;;По окончании срока подачи заявок подана только одна заявка, заявка соответствует требованиям. Конкурс в электронной форме признан несостоявшимся (ч. 16 ст. 54.4 Закона № 44-ФЗ);;"ОБЩЕСТВО С ОГРАНИЧЕННОЙ ОТВЕТСТВЕННОСТЬЮ ""ГЕОЛАЙН""";;4 995 679,00;;;;;;
№ 0306100000420000062;https://zakupki.gov.ru//epz/order/notice/ok504/view/common-info.html?regNumber=0306100000420000062;Определение поставщика завершено;"Разработка проектной документации на капитальный ремонт автомобильнойдорогиР-21 ""Кола"" Санкт-Петербург - Петрозаводск -Мурманск- Печенга - граница с Королевством Норвегия на участке км 436 - км 446, Республика Карелия";"ФЕДЕРАЛЬНОЕ КАЗЕННОЕ УЧРЕЖДЕНИЕ ""УПРАВЛЕНИЕ АВТОМОБИЛЬНОЙ МАГИСТРАЛИ САНКТ-ПЕТЕРБУРГ -МУРМАНСКФЕДЕРАЛЬНОГО ДОРОЖНОГО АГЕНТСТВА""";17.07.2020;12 567 083,33 ₽;https://zakupki.gov.ru/epz/order/notice/ea44/view/supplier-results.html?regNumber=0306100000420000062;"ФЕДЕРАЛЬНОЕ КАЗЕННОЕ УЧРЕЖДЕНИЕ ""УПРАВЛЕНИЕ АВТОМОБИЛЬНОЙ МАГИСТРАЛИ САНКТ-ПЕТЕРБУРГ - МУРМАНСК ФЕДЕРАЛЬНОГО ДОРОЖНОГО АГЕНТСТВА""";"ОБЩЕСТВО С ОГРАНИЧЕННОЙ ОТВЕТСТВЕННОСТЬЮ ""ГЕОМАКИНФО""";1 - Победитель - отказ от заключения контракта или уклонение участника от заключения контракта;3 795 259,00;"ОБЩЕСТВО С ОГРАНИЧЕННОЙ ОТВЕТСТВЕННОСТЬЮ ""АЛЬЯНС ГРУПП""";2 - Второй номер;11 800 000,00;;;;;;
№ 32009483214;https://zakupki.gov.ru/https://zakupki.gov.ru/223/purchase/public/purchase/info/common-info.html?regNumber=32009483214;Закупка завершена;Выполнения работ по восстановлению асфальтобетонного покрытия автомобильныхдорог, дворовых проездов и тротуаров после проведения земляных работ на территории г.Мурманска.;"АКЦИОНЕРНОЕ ОБЩЕСТВО ""МУРМАНСКАЯОБЛАСТНАЯ ЭЛЕКТРОСЕТЕВАЯ КОМПАНИЯ""";10.09.2020;709 976,40 ₽;;;;;;;;;;;;;;
№ 32009463975;https://zakupki.gov.ru/https://zakupki.gov.ru/223/purchase/public/purchase/info/common-info.html?regNumber=32009463975;Закупка отменена;Выполнения работ по восстановлению асфальтобетонного покрытия автомобильныхдорог, дворовых проездов и тротуаров после проведения земляных работ на территории г.Мурманска;"АКЦИОНЕРНОЕ ОБЩЕСТВО ""МУРМАНСКАЯОБЛАСТНАЯ ЭЛЕКТРОСЕТЕВАЯ КОМПАНИЯ""";03.09.2020;737 798,40 ₽;;;;;;;;;;;;;;
№ 32009366951;https://zakupki.gov.ru/https://zakupki.gov.ru/223/purchase/public/purchase/info/common-info.html?regNumber=32009366951;Закупка отменена;Открытый аукцион среди субъектов малого и среднего предпринимательства в электронной форме № 3626/ОАЭ-ДЖВ/20 на право заключения договоров оказания услуг по уборке вокзальных комплексов;"ОТКРЫТОЕ АКЦИОНЕРНОЕ ОБЩЕСТВО ""РОССИЙСКИЕ ЖЕЛЕЗНЫЕДОРОГИ""";30.07.2020;;;;;;;;;;;;;;;
№ 0149200002320005390;https://zakupki.gov.ru//epz/order/notice/ea44/view/common-info.html?regNumber=0149200002320005390;Определение поставщика завершено;Разработка проектно-сметной документации по объекту: «Строительство автомобильнойдорогик земельным участкам, предоставленным многодетным семьям в селе Ловозеро Ловозерского районаМурманскойобласти, кадастровый номер земельного участка 51:02:0010201:20»;КОМИТЕТ ПО КОНКУРЕНТНОЙ ПОЛИТИКЕМУРМАНСКОЙОБЛАСТИ;26.08.2020;1 643 666,67 ₽;https://zakupki.gov.ru/epz/order/notice/ea44/view/supplier-results.html?regNumber=0149200002320005390;АДМИНИСТРАЦИЯ ЛОВОЗЕРСКОГО РАЙОНА;;По окончании срока подачи заявок подана только одна заявка. Такая заявка признана соответствующей требованиям Федерального закона № 44-ФЗ и документации об аукционе. Электронный аукцион признан несостоявшимся по основанию, предусмотренному ч. 1 ст. 71 Федерального закона № 44-ФЗ;;"ОБЩЕСТВО С ОГРАНИЧЕННОЙ ОТВЕТСТВЕННОСТЬЮ ""СЕВЕРНЫЙ МОРСКОЙ ПРОЕКТНЫЙ ИНСТИТУТ""";;1 643 666,67;;;;;;
№ 0306100000420000065;https://zakupki.gov.ru//epz/order/notice/ea44/view/common-info.html?regNumber=0306100000420000065;Определение поставщика завершено;"Ремонт автомобильнойдорогиР-21 ""Кола"" Санкт-Петербург - Петрозаводск -Мурманск- Печенга - граница с Королевством Норвегия на участке км 1225 - км 1248,Мурманскаяобласть; ремонт автомобильнойдорогиР-21 ""Кола"" Санкт-Петербург - Петрозаводск -Мурманск- Печенга - граница с Королевством Норвегия на участке км 1390 - км 1408,Мурманскаяобласть; ремонт автомобильнойдорогиА-119 Вологда - Медвежьегорск - автомобильнаядорогаР-21 ""Кола"" на участке км 502 - км 532, Республика Карелия";"ФЕДЕРАЛЬНОЕ КАЗЕННОЕ УЧРЕЖДЕНИЕ ""УПРАВЛЕНИЕ АВТОМОБИЛЬНОЙ МАГИСТРАЛИ САНКТ-ПЕТЕРБУРГ -МУРМАНСКФЕДЕРАЛЬНОГО ДОРОЖНОГО АГЕНТСТВА""";21.07.2020;1 482 337 908,00 ₽;https://zakupki.gov.ru/epz/order/notice/ea44/view/supplier-results.html?regNumber=0306100000420000065;"ФЕДЕРАЛЬНОЕ КАЗЕННОЕ УЧРЕЖДЕНИЕ ""УПРАВЛЕНИЕ АВТОМОБИЛЬНОЙ МАГИСТРАЛИ САНКТ-ПЕТЕРБУРГ - МУРМАНСК ФЕДЕРАЛЬНОГО ДОРОЖНОГО АГЕНТСТВА""";В согласовании отказано;;По окончании срока подачи заявок подана только одна заявка. Такая заявка признана соответствующей требованиям Федерального закона № 44-ФЗ и документации об аукционе. Электронный аукцион признан несостоявшимся по основанию, предусмотренному ч. 1 ст. 71 Федерального закона № 44-ФЗ;;"АКЦИОНЕРНОЕ ОБЩЕСТВО ""ВАД""";;;;;;;
№ 0306100000420000071;https://zakupki.gov.ru//epz/order/notice/ea44/view/common-info.html?regNumber=0306100000420000071;Определение поставщика завершено;"Выполнение работ по содержанию искусственных дорожных сооружений на сети автомобильныхдорогобщего пользования федерального значения на 2020 г. Содержание (планово-предупредительные работы) моста через реку Кола на км 1386+680 автомобильнойдорогиР-21 ""Кола"" Санкт-Петербург - Петрозаводск -Мурманск- Печенга - граница с Королевством Норвегия,Мурманскаяобласть";"ФЕДЕРАЛЬНОЕ КАЗЕННОЕ УЧРЕЖДЕНИЕ ""УПРАВЛЕНИЕ АВТОМОБИЛЬНОЙ МАГИСТРАЛИ САНКТ-ПЕТЕРБУРГ -МУРМАНСКФЕДЕРАЛЬНОГО ДОРОЖНОГО АГЕНТСТВА""";20.08.2020;7 513 381,28 ₽;https://zakupki.gov.ru/epz/order/notice/ea44/view/supplier-results.html?regNumber=0306100000420000071;"ФЕДЕРАЛЬНОЕ КАЗЕННОЕ УЧРЕЖДЕНИЕ ""УПРАВЛЕНИЕ АВТОМОБИЛЬНОЙ МАГИСТРАЛИ САНКТ-ПЕТЕРБУРГ - МУРМАНСК ФЕДЕРАЛЬНОГО ДОРОЖНОГО АГЕНТСТВА""";;По окончании срока подачи заявок подана только одна заявка. Такая заявка признана соответствующей требованиям Федерального закона № 44-ФЗ и документации об аукционе. Электронный аукцион признан несостоявшимся по основанию, предусмотренному ч. 1 ст. 71 Федерального закона № 44-ФЗ;;"ОБЩЕСТВО С ОГРАНИЧЕННОЙ ОТВЕТСТВЕННОСТЬЮ ""СЕВЕРО-ЗАПАДНАЯ ТЕХНОЛОГИЧЕСКАЯ ЭКСПЕРТНАЯ КОМПАНИЯ""";;7 513 381,28;;;;;;
№ 0149200002320005241;https://zakupki.gov.ru//epz/order/notice/ea44/view/common-info.html?regNumber=0149200002320005241;Определение поставщика завершено;Выполнение работ по ремонту дворовых проездов в городеМурманске;КОМИТЕТ ПО КОНКУРЕНТНОЙ ПОЛИТИКЕМУРМАНСКОЙОБЛАСТИ;14.08.2020;2 213 575,94 ₽;https://zakupki.gov.ru/epz/order/notice/ea44/view/supplier-results.html?regNumber=0149200002320005241;"МУРМАНСКОЕ МУНИЦИПАЛЬНОЕ БЮДЖЕТНОЕ УЧРЕЖДЕНИЕ ""УПРАВЛЕНИЕ ДОРОЖНОГО ХОЗЯЙСТВА""";"ОБЩЕСТВО С ОГРАНИЧЕННОЙ ОТВЕТСТВЕННОСТЬЮ ""БИЗНЕС-КОМПАНИЯ""";1 - Победитель;2 080 761,38;"ОБЩЕСТВО С ОГРАНИЧЕННОЙ ОТВЕТСТВЕННОСТЬЮ ""СПЕКТР""";2 - Второй номер;2 091 829,26;;;;;;
№ 0149200002320005240;https://zakupki.gov.ru//epz/order/notice/ea44/view/common-info.html?regNumber=0149200002320005240;Определение поставщика завершено;Выполнение работ по ремонту дворовых проездов в городеМурманске;КОМИТЕТ ПО КОНКУРЕНТНОЙ ПОЛИТИКЕМУРМАНСКОЙОБЛАСТИ;14.08.2020;1 411 841,28 ₽;https://zakupki.gov.ru/epz/order/notice/ea44/view/supplier-results.html?regNumber=0149200002320005240;"МУРМАНСКОЕ МУНИЦИПАЛЬНОЕ БЮДЖЕТНОЕ УЧРЕЖДЕНИЕ ""УПРАВЛЕНИЕ ДОРОЖНОГО ХОЗЯЙСТВА""";"ОБЩЕСТВО С ОГРАНИЧЕННОЙ ОТВЕТСТВЕННОСТЬЮ ""БНК-ГРУП""";1 - Победитель;1 185 946,56;"ОБЩЕСТВО С ОГРАНИЧЕННОЙ ОТВЕТСТВЕННОСТЬЮ ""БАРЕНЦ-ЛИГА""";2 - Второй номер;1 193 005,77;;;;;;
№ 0306100000420000061;https://zakupki.gov.ru//epz/order/notice/ok504/view/common-info.html?regNumber=0306100000420000061;Определение поставщика завершено;"Разработка проектной документации на капитальный ремонт автомобильнойдорогиР-21 ""Кола"" Санкт-Петербург - Петрозаводск-Мурманск- Печенга - граница с Королевством Норвегия на участке км 446 - км 461, Республика Карелия";"ФЕДЕРАЛЬНОЕ КАЗЕННОЕ УЧРЕЖДЕНИЕ ""УПРАВЛЕНИЕ АВТОМОБИЛЬНОЙ МАГИСТРАЛИ САНКТ-ПЕТЕРБУРГ -МУРМАНСКФЕДЕРАЛЬНОГО ДОРОЖНОГО АГЕНТСТВА""";17.07.2020;20 192 700,00 ₽;https://zakupki.gov.ru/epz/order/notice/ea44/view/supplier-results.html?regNumber=0306100000420000061;"ФЕДЕРАЛЬНОЕ КАЗЕННОЕ УЧРЕЖДЕНИЕ ""УПРАВЛЕНИЕ АВТОМОБИЛЬНОЙ МАГИСТРАЛИ САНКТ-ПЕТЕРБУРГ - МУРМАНСК ФЕДЕРАЛЬНОГО ДОРОЖНОГО АГЕНТСТВА""";НИКИТИН ВЯЧЕСЛАВ ВЯЧЕСЛАВОВИЧ -;2 - Второй номер;13 800 000,00;"ОБЩЕСТВО С ОГРАНИЧЕННОЙ ОТВЕТСТВЕННОСТЬЮ ""АЛЬЯНС ГРУПП""";1 - Победитель;19 100 000,00;;;;;;
№ 0149200002320005203;https://zakupki.gov.ru//epz/order/notice/ea44/view/common-info.html?regNumber=0149200002320005203;Определение поставщика завершено;"Выполнение работ по отдельным мероприятиям по технической эксплуатации автомобильнойдороги""Лесная"", км 0 - км 38 (выборочно)";КОМИТЕТ ПО КОНКУРЕНТНОЙ ПОЛИТИКЕМУРМАНСКОЙОБЛАСТИ;12.08.2020;57 475 450,38 ₽;https://zakupki.gov.ru/epz/order/notice/ea44/view/supplier-results.html?regNumber=0149200002320005203;ГОСУДАРСТВЕННОЕ ОБЛАСТНОЕ КАЗЕННОЕ УЧРЕЖДЕНИЕ ПО УПРАВЛЕНИЮ АВТОМОБИЛЬНЫМИ ДОРОГАМИ МУРМАНСКОЙ ОБЛАСТИ;"ОБЩЕСТВО С ОГРАНИЧЕННОЙ ОТВЕТСТВЕННОСТЬЮ ""КОЛЬСКОЕ ДОРОЖНОЕ УПРАВЛЕНИЕ""";1 - Победитель;39 945 437,95;"ОБЩЕСТВО С ОГРАНИЧЕННОЙ ОТВЕТСТВЕННОСТЬЮ ""СЕВЕР СТРОЙ""";2 - Второй номер;40 232 815,21;;;;;;
