№ 0306100000420000014;https://zakupki.gov.ru//epz/order/notice/ea44/view/common-info.html?regNumber=0306100000420000014;Определение поставщика завершено;"Содержание действующей сети автомобильныхдорогобщего пользования федерального значения (устройство защитных слоев, слоев износа и поверхностной обработки). Устройство защитных слоёв на автомобильнойдорогеР-21 ""Кола"" Санкт-Петербург - Петрозаводск -Мурманск- Печенга - граница с Королевством Норвегия на участке км 334+183- км 397+430, Республика Карелия";"ФЕДЕРАЛЬНОЕ КАЗЕННОЕ УЧРЕЖДЕНИЕ ""УПРАВЛЕНИЕ АВТОМОБИЛЬНОЙ МАГИСТРАЛИ САНКТ-ПЕТЕРБУРГ -МУРМАНСКФЕДЕРАЛЬНОГО ДОРОЖНОГО АГЕНТСТВА""";26.03.2020;523 259 629,00 ₽;https://zakupki.gov.ru/epz/order/notice/ea44/view/supplier-results.html?regNumber=0306100000420000014;"ФЕДЕРАЛЬНОЕ КАЗЕННОЕ УЧРЕЖДЕНИЕ ""УПРАВЛЕНИЕ АВТОМОБИЛЬНОЙ МАГИСТРАЛИ САНКТ-ПЕТЕРБУРГ - МУРМАНСК ФЕДЕРАЛЬНОГО ДОРОЖНОГО АГЕНТСТВА""";;По окончании срока подачи заявок подана только одна заявка. Такая заявка признана соответствующей требованиям Федерального закона № 44-ФЗ и документации об аукционе. Электронный аукцион признан несостоявшимся по основанию, предусмотренному ч. 1 ст. 71 Федерального закона № 44-ФЗ;;"АКЦИОНЕРНОЕ ОБЩЕСТВО ""ВАД""";;523 259 629,00;;;;;;
№ 0306100000420000032;https://zakupki.gov.ru//epz/order/notice/ea44/view/common-info.html?regNumber=0306100000420000032;Определение поставщика завершено;"Содержание действующей сети автомобильныхдорогобщего пользования федерального значения (устройство защитных слоев, слоев износа и поверхностной обработки). Устройство защитных слоёв на автомобильнойдорогеР-21 ""Кола"" Санкт-Петербург - Петрозаводск -Мурманск- Печенга - граница с Королевством Норвегия на участке км 608- км 622, Республика Карелия";"ФЕДЕРАЛЬНОЕ КАЗЕННОЕ УЧРЕЖДЕНИЕ ""УПРАВЛЕНИЕ АВТОМОБИЛЬНОЙ МАГИСТРАЛИ САНКТ-ПЕТЕРБУРГ -МУРМАНСКФЕДЕРАЛЬНОГО ДОРОЖНОГО АГЕНТСТВА""";30.03.2020;136 726 000,00 ₽;https://zakupki.gov.ru/epz/order/notice/ea44/view/supplier-results.html?regNumber=0306100000420000032;"ФЕДЕРАЛЬНОЕ КАЗЕННОЕ УЧРЕЖДЕНИЕ ""УПРАВЛЕНИЕ АВТОМОБИЛЬНОЙ МАГИСТРАЛИ САНКТ-ПЕТЕРБУРГ - МУРМАНСК ФЕДЕРАЛЬНОГО ДОРОЖНОГО АГЕНТСТВА""";;По окончании срока подачи заявок подана только одна заявка. Такая заявка признана соответствующей требованиям Федерального закона № 44-ФЗ и документации об аукционе. Электронный аукцион признан несостоявшимся по основанию, предусмотренному ч. 1 ст. 71 Федерального закона № 44-ФЗ;;"АКЦИОНЕРНОЕ ОБЩЕСТВО ""ВАД""";;136 726 000,00;;;;;;
№ 0306100000420000033;https://zakupki.gov.ru//epz/order/notice/ea44/view/common-info.html?regNumber=0306100000420000033;Определение поставщика завершено;"Выполнениеработ по содержанию искусственныхсооружений на сети автомобильныхдорогобщего пользования федерального значенияна 2020 г. Содержание (планово-предупредительныеработы) моста через ручей на км 1345+225автомобильнойдорогиР-21 ""Кола""Санкт-Петербург - Петрозаводск -Мурманск- Печенга граница с Королевством Норвегия,Мурманскаяобласть";"ФЕДЕРАЛЬНОЕ КАЗЕННОЕ УЧРЕЖДЕНИЕ ""УПРАВЛЕНИЕ АВТОМОБИЛЬНОЙ МАГИСТРАЛИ САНКТ-ПЕТЕРБУРГ -МУРМАНСКФЕДЕРАЛЬНОГО ДОРОЖНОГО АГЕНТСТВА""";02.04.2020;2 616 773,00 ₽;https://zakupki.gov.ru/epz/order/notice/ea44/view/supplier-results.html?regNumber=0306100000420000033;"ФЕДЕРАЛЬНОЕ КАЗЕННОЕ УЧРЕЖДЕНИЕ ""УПРАВЛЕНИЕ АВТОМОБИЛЬНОЙ МАГИСТРАЛИ САНКТ-ПЕТЕРБУРГ - МУРМАНСК ФЕДЕРАЛЬНОГО ДОРОЖНОГО АГЕНТСТВА""";;По окончании срока подачи заявок подана только одна заявка. Такая заявка признана соответствующей требованиям Федерального закона № 44-ФЗ и документации об аукционе. Электронный аукцион признан несостоявшимся по основанию, предусмотренному ч. 1 ст. 71 Федерального закона № 44-ФЗ;;"ОБЩЕСТВО С ОГРАНИЧЕННОЙ ОТВЕТСТВЕННОСТЬЮ ""ЗСК-МУРМАН""";;2 616 773,00;;;;;;
№ 0149200002320002087;https://zakupki.gov.ru//epz/order/notice/ea44/view/common-info.html?regNumber=0149200002320002087;Определение поставщика завершено;Выполнение работ по благоустройству дворовой территории по адресу:Мурманскаяобласть, Кольский район, н.п. Пушной, улица Ленинградская, д. 3 в рамках реализации муниципальной программы «Формирование комфортной городской среды муниципального образования сельское поселение Пушной Кольского районаМурманскойобласти»;КОМИТЕТ ПО КОНКУРЕНТНОЙ ПОЛИТИКЕМУРМАНСКОЙОБЛАСТИ;31.03.2020;800 000,00 ₽;https://zakupki.gov.ru/epz/order/notice/ea44/view/supplier-results.html?regNumber=0149200002320002087;"МУНИЦИПАЛЬНОЕ КАЗЕННОЕ УЧРЕЖДЕНИЕ ""УПРАВЛЕНИЕ ДЕЯТЕЛЬНОСТЬЮ СЕЛЬСКОГО ПОСЕЛЕНИЯ ПУШНОЙ КОЛЬСКОГО РАЙОНА МУРМАНСКОЙ ОБЛАСТИ""";;По окончании срока подачи заявок подана только одна заявка. Такая заявка признана соответствующей требованиям Федерального закона № 44-ФЗ и документации об аукционе. Электронный аукцион признан несостоявшимся по основанию, предусмотренному ч. 1 ст. 71 Федерального закона № 44-ФЗ;;"ОБЩЕСТВО С ОГРАНИЧЕННОЙ ОТВЕТСТВЕННОСТЬЮ ""БИЗНЕС-КОМПАНИЯ""";;800 000,00;;;;;;
№ 0149200002320002234;https://zakupki.gov.ru//epz/order/notice/ea44/view/common-info.html?regNumber=0149200002320002234;Определение поставщика завершено;Выполнение работ по капитальному ремонту участка придомовой территории дома № 3 по ул. Жертв Интервенции;КОМИТЕТ ПО КОНКУРЕНТНОЙ ПОЛИТИКЕМУРМАНСКОЙОБЛАСТИ;03.04.2020;2 216 945,00 ₽;https://zakupki.gov.ru/epz/order/notice/ea44/view/supplier-results.html?regNumber=0149200002320002234;"МУНИЦИПАЛЬНОЕ КАЗЕННОЕ УЧРЕЖДЕНИЕ ""СЛУЖБА ГОРОДСКОГО ХОЗЯЙСТВА ЗАКРЫТОГО АДМИНИСТРАТИВНО-ТЕРРИТОРИАЛЬНОГО ОБРАЗОВАНИЯ ГОРОД ОСТРОВНОЙ МУРМАНСКОЙ ОБЛАСТИ""";;По окончании срока подачи заявок не подано ни одной заявки (ч. 16 ст. 66 44-ФЗ);;;;;;;;;;
№ 0306100000420000017;https://zakupki.gov.ru//epz/order/notice/ea44/view/common-info.html?regNumber=0306100000420000017;Определение поставщика отменено;"Содержание действующей сети автомобильныхдорогобщего пользования федерального значения ( ...  защитных слоёв на автомобильнойдорогеА-137 автомобильнаядорогаР-21 ""Кола"" - Тикша ...  защитных слоёв на автомобильнойдорогеА-137 автомобильнаядорогаР-21 ""Кола"" - Тикша ...  Устройство защитных слоёв на автомобильнойдорогеА-119 Вологда - Медвежьегорск - ...  автомобильнаядорогаР-21 ""Кола"" на участке км ...";"ФЕДЕРАЛЬНОЕ КАЗЕННОЕ УЧРЕЖДЕНИЕ ""УПРАВЛЕНИЕ АВТОМОБИЛЬНОЙ МАГИСТРАЛИ САНКТ-ПЕТЕРБУРГ -МУРМАНСКФЕДЕРАЛЬНОГО ДОРОЖНОГО АГЕНТСТВА""";26.03.2020;645 728 063,84 ₽;;;;;;;;;;;;;;
№ 0149200002320001643;https://zakupki.gov.ru//epz/order/notice/ea44/view/common-info.html?regNumber=0149200002320001643;Определение поставщика завершено;"Выполнение работ по планово-предупредительному ремонту моста через ручей на 195+910 км автомобильнойдорогиКола-Верхнетуломский-КПП ""Лотта""";КОМИТЕТ ПО КОНКУРЕНТНОЙ ПОЛИТИКЕМУРМАНСКОЙОБЛАСТИ;23.03.2020;8 176 865,17 ₽;https://zakupki.gov.ru/epz/order/notice/ea44/view/supplier-results.html?regNumber=0149200002320001643;ГОСУДАРСТВЕННОЕ ОБЛАСТНОЕ КАЗЕННОЕ УЧРЕЖДЕНИЕ ПО УПРАВЛЕНИЮ АВТОМОБИЛЬНЫМИ ДОРОГАМИ МУРМАНСКОЙ ОБЛАСТИ;"ОБЩЕСТВО С ОГРАНИЧЕННОЙ ОТВЕТСТВЕННОСТЬЮ ""СТРОИТЕЛЬНАЯ КОМПАНИЯ БАРЕНЦ РЕГИОН""";1 - Победитель;8 095 096,51;"ОБЩЕСТВО С ОГРАНИЧЕННОЙ ОТВЕТСТВЕННОСТЬЮ ""БГК""";2 - Второй номер;8 135 980,84;;;;;;
№ 0149200002320001644;https://zakupki.gov.ru//epz/order/notice/ea44/view/common-info.html?regNumber=0149200002320001644;Определение поставщика завершено;Оказание услуг по проведению строительного контроля при осуществлении реконструкции автоподъезда к селу Териберка, км 0 - км 10;КОМИТЕТ ПО КОНКУРЕНТНОЙ ПОЛИТИКЕМУРМАНСКОЙОБЛАСТИ;23.03.2020;8 553 261,55 ₽;https://zakupki.gov.ru/epz/order/notice/ea44/view/supplier-results.html?regNumber=0149200002320001644;ГОСУДАРСТВЕННОЕ ОБЛАСТНОЕ КАЗЕННОЕ УЧРЕЖДЕНИЕ ПО УПРАВЛЕНИЮ АВТОМОБИЛЬНЫМИ ДОРОГАМИ МУРМАНСКОЙ ОБЛАСТИ;"ОБЩЕСТВО С ОГРАНИЧЕННОЙ ОТВЕТСТВЕННОСТЬЮ ""ЦЕНТР ДИАГНОСТИКИ КОМПЛЕКСНОЙ ИНФРАСТРУКТУРЫ""";1 - Победитель;1 957 233,68;"ОБЩЕСТВО С ОГРАНИЧЕННОЙ ОТВЕТСТВЕННОСТЬЮ ""ГРАЖДАНПРОМСТРОЙПРОЕКТ""";2 - Второй номер;1 999 999,99;;;;;;
№ 0146300005120000008;https://zakupki.gov.ru//epz/order/notice/ea44/view/common-info.html?regNumber=0146300005120000008;Определение поставщика завершено;Ремонт автомобильныхдорогс твердым покрытием по улицамМурманская, Молодежная, Мира, Центральная, Юбилейная с. Верхняя-Колыбелька сельского поселения Верхне-Колыбельский сельсовет, улицам Калинина, 8 Марта д. Гудовка, ул. Школьная д. Муравьевка сельского поселения Дмитряшевский сельсовет Хлевенского района Липецкой области;АДМИНИСТРАЦИЯ ХЛЕВЕНСКОГО МУНИЦИПАЛЬНОГО РАЙОНА;19.03.2020;6 262 845,49 ₽;https://zakupki.gov.ru/epz/order/notice/ea44/view/supplier-results.html?regNumber=0146300005120000008;АДМИНИСТРАЦИЯ ХЛЕВЕНСКОГО МУНИЦИПАЛЬНОГО РАЙОНА;"ОБЩЕСТВО С ОГРАНИЧЕННОЙ ОТВЕТСТВЕННОСТЬЮ ""ВЕКТОР""";1 - Победитель;3 848 306,16;"ОБЩЕСТВО С ОГРАНИЧЕННОЙ ОТВЕТСТВЕННОСТЬЮ ""МЕТТОРГПРОМ - Л""";2 - Второй номер;3 879 620,39;;;;;;
№ 0349300046720000011;https://zakupki.gov.ru//epz/order/notice/ea44/view/common-info.html?regNumber=0349300046720000011;Определение поставщика завершено;Выполнение работ по ремонту автомобильнойдорогиместного значения в н.п. Мишуково Кольского районаМурманскойобласти;"МУНИЦИПАЛЬНОЕ УЧРЕЖДЕНИЕ ""ОТДЕЛ МУНИЦИПАЛЬНОГО ЗАКАЗА АДМИНИСТРАЦИИ КОЛЬСКОГО РАЙОНА""";26.02.2020;11 400 000,00 ₽;https://zakupki.gov.ru/epz/order/notice/ea44/view/supplier-results.html?regNumber=0349300046720000011;"МУНИЦИПАЛЬНОЕ КАЗЕННОЕ УЧРЕЖДЕНИЕ ""ХОЗЯЙСТВЕННО-ЭКСПЛУАТАЦИОННАЯ СЛУЖБА КОЛЬСКОГО РАЙОНА""";"ОБЩЕСТВО С ОГРАНИЧЕННОЙ ОТВЕТСТВЕННОСТЬЮ ""МУРМАНСКАЯ ДОРОЖНАЯ ОРГАНИЗАЦИЯ""";1 - Победитель;10 259 999,80;"ОБЩЕСТВО С ОГРАНИЧЕННОЙ ОТВЕТСТВЕННОСТЬЮ ""БИЗНЕС-КОМПАНИЯ""";2 - Второй номер;10 316 999,80;;;;;;
№ 0306100000420000027;https://zakupki.gov.ru//epz/order/notice/ea44/view/common-info.html?regNumber=0306100000420000027;Определение поставщика отменено;"выполнение работ по очистке от взрывоопасных предметов (ВОП) территории строительной площадки объекта: «Строительство и реконструкция участков автомобильнойдорогиР-21 ""Кола"" Санкт-Петербург - Петрозаводск -Мурманск- Печенга - граница с Королевством Норвегия. Реконструкция автомобильнойдорогиР-21 ""Кола"" Санкт-Петербург - Петрозаводск -Мурманск- Печенга - граница с Королевством Норвегия. Подъезд к г.Мурманскна участке км 14+297 - км 19+027,Мурманскаяобласть»";"ФЕДЕРАЛЬНОЕ КАЗЕННОЕ УЧРЕЖДЕНИЕ ""УПРАВЛЕНИЕ АВТОМОБИЛЬНОЙ МАГИСТРАЛИ САНКТ-ПЕТЕРБУРГ -МУРМАНСКФЕДЕРАЛЬНОГО ДОРОЖНОГО АГЕНТСТВА""";30.03.2020;17 508 908,00 ₽;;;;;;;;;;;;;;
№ 0145300005020000093;https://zakupki.gov.ru//epz/order/notice/ea44/view/common-info.html?regNumber=0145300005020000093;Определение поставщика завершено;Ремонт автомобильнойдорогипо ул. Гоголя от ул. Петрозаводской до железнодорожной станцииМурманскиеВорота в г. Волхов Ленинградской области;АДМИНИСТРАЦИЯ ВОЛХОВСКОГО МУНИЦИПАЛЬНОГО РАЙОНА ЛЕНИНГРАДСКОЙ ОБЛАСТИ;23.03.2020;6 245 761,00 ₽;https://zakupki.gov.ru/epz/order/notice/ea44/view/supplier-results.html?regNumber=0145300005020000093;"МУНИЦИПАЛЬНОЕ КАЗЕННОЕ УЧРЕЖДЕНИЕ ""СЛУЖБА ЗАКАЗЧИКА"" МУНИЦИПАЛЬНОГО ОБРАЗОВАНИЯ ГОРОД ВОЛХОВ ВОЛХОВСКОГО МУНИЦИПАЛЬНОГО РАЙОНА ЛЕНИНГРАДСКОЙ ОБЛАСТИ";"ОБЩЕСТВО С ОГРАНИЧЕННОЙ ОТВЕТСТВЕННОСТЬЮ ""ДОРОЖНО-СТРОИТЕЛЬНАЯ КОМПАНИЯ ""АВРОРА""";1 - Победитель;3 852 968,95;"ОБЩЕСТВО С ОГРАНИЧЕННОЙ ОТВЕТСТВЕННОСТЬЮ ""УПРАВЛЕНИЕ МЕХАНИЗАЦИИ 68""";2 - Второй номер;3 884 197,76;;;;;;
№ 0149200002320001206;https://zakupki.gov.ru//epz/order/notice/ea44/view/common-info.html?regNumber=0149200002320001206;Определение поставщика завершено;Выполнение работ по ремонту автомобильнойдорогиУмба-Варзуга, км 124+900 - км 134+900;КОМИТЕТ ПО КОНКУРЕНТНОЙ ПОЛИТИКЕМУРМАНСКОЙОБЛАСТИ;10.03.2020;105 698 441,62 ₽;https://zakupki.gov.ru/epz/order/notice/ea44/view/supplier-results.html?regNumber=0149200002320001206;ГОСУДАРСТВЕННОЕ ОБЛАСТНОЕ КАЗЕННОЕ УЧРЕЖДЕНИЕ ПО УПРАВЛЕНИЮ АВТОМОБИЛЬНЫМИ ДОРОГАМИ МУРМАНСКОЙ ОБЛАСТИ;;По результатам рассмотрения вторых частей заявок принято решение о соответствии указанным требованиям только одной второй части заявки на участие в нем (ч.13 ст.69 Закона № 44-ФЗ).;;"ОБЩЕСТВО С ОГРАНИЧЕННОЙ ОТВЕТСТВЕННОСТЬЮ ""ТЕХПРОМ""";;105 698 441,61;;;;;;
№ 0149200002320001635;https://zakupki.gov.ru//epz/order/notice/ea44/view/common-info.html?regNumber=0149200002320001635;Определение поставщика завершено;Выполнение работ по ремонту участков автомобильнойдорогип. Островная - ул. Бессонова;КОМИТЕТ ПО КОНКУРЕНТНОЙ ПОЛИТИКЕМУРМАНСКОЙОБЛАСТИ;23.03.2020;2 354 342,91 ₽;https://zakupki.gov.ru/epz/order/notice/ea44/view/supplier-results.html?regNumber=0149200002320001635;"МУНИЦИПАЛЬНОЕ КАЗЕННОЕ УЧРЕЖДЕНИЕ ""СЛУЖБА ГОРОДСКОГО ХОЗЯЙСТВА ЗАКРЫТОГО АДМИНИСТРАТИВНО-ТЕРРИТОРИАЛЬНОГО ОБРАЗОВАНИЯ ГОРОД ОСТРОВНОЙ МУРМАНСКОЙ ОБЛАСТИ""";;По окончании срока подачи заявок не подано ни одной заявки (ч. 16 ст. 66 44-ФЗ);;;;;;;;;;
№ 0149200002320001709;https://zakupki.gov.ru//epz/order/notice/ea44/view/common-info.html?regNumber=0149200002320001709;Определение поставщика завершено;Выполнение работ по ремонту участка автомобильнойдорогиВнутрибазовый, 14-й участок: (км 0+096 - км 0+231);КОМИТЕТ ПО КОНКУРЕНТНОЙ ПОЛИТИКЕМУРМАНСКОЙОБЛАСТИ;24.03.2020;8 959 952,85 ₽;https://zakupki.gov.ru/epz/order/notice/ea44/view/supplier-results.html?regNumber=0149200002320001709;"МУНИЦИПАЛЬНОЕ КАЗЕННОЕ УЧРЕЖДЕНИЕ ""СЛУЖБА ГОРОДСКОГО ХОЗЯЙСТВА ЗАКРЫТОГО АДМИНИСТРАТИВНО-ТЕРРИТОРИАЛЬНОГО ОБРАЗОВАНИЯ ГОРОД ОСТРОВНОЙ МУРМАНСКОЙ ОБЛАСТИ""";;По окончании срока подачи заявок не подано ни одной заявки (ч. 16 ст. 66 44-ФЗ);;;;;;;;;;
№ 32009002801;https://zakupki.gov.ru/https://zakupki.gov.ru/223/purchase/public/purchase/info/common-info.html?regNumber=32009002801;Закупка завершена;"Открытый аукцион среди субъектов малого и среднего предпринимательства в электронной форме № 1184/ОАЭ-ДКРС/20 на право заключения договора выполнения работ по обследованию и очистке территории от взрывоопасных предметов, а также по вывозу выявленных при выполнении работ взрывоопасных предметов по проекту:""Развитие участкаМурманск- Волховстрой. Реконструкция участкаМурманск- Оленегорск со строительством вторых путей""";"ОТКРЫТОЕ АКЦИОНЕРНОЕ ОБЩЕСТВО ""РОССИЙСКИЕ ЖЕЛЕЗНЫЕДОРОГИ""";18.03.2020;23 492 380,50 ₽;;;;;;;;;;;;;;
№ 0306100000420000012;https://zakupki.gov.ru//epz/order/notice/ok504/view/common-info.html?regNumber=0306100000420000012;Определение поставщика завершено;Разработка проектной документации на капитальный ремонт моста через реку Тохма на км 269+032 автомобильнойдорогиА-121 Сортавала Санкт-Петербург-Сортавала- автомобильнаядорогаР-21 Кола», Республика Карелия (корректировка);"ФЕДЕРАЛЬНОЕ КАЗЕННОЕ УЧРЕЖДЕНИЕ ""УПРАВЛЕНИЕ АВТОМОБИЛЬНОЙ МАГИСТРАЛИ САНКТ-ПЕТЕРБУРГ -МУРМАНСКФЕДЕРАЛЬНОГО ДОРОЖНОГО АГЕНТСТВА""";14.02.2020;2 104 700,00 ₽;https://zakupki.gov.ru/epz/order/notice/ea44/view/supplier-results.html?regNumber=0306100000420000012;"ФЕДЕРАЛЬНОЕ КАЗЕННОЕ УЧРЕЖДЕНИЕ ""УПРАВЛЕНИЕ АВТОМОБИЛЬНОЙ МАГИСТРАЛИ САНКТ-ПЕТЕРБУРГ - МУРМАНСК ФЕДЕРАЛЬНОГО ДОРОЖНОГО АГЕНТСТВА""";"ОБЩЕСТВО С ОГРАНИЧЕННОЙ ОТВЕТСТВЕННОСТЬЮ ""ДОРМОСТСТРОЙ""";1 - Победитель;1 313 000,00;"ОБЩЕСТВО С ОГРАНИЧЕННОЙ ОТВЕТСТВЕННОСТЬЮ ""ЭСТАКАДА""";2 - Второй номер;2 100 000,00;;;;;;
№ 0149200002320001430;https://zakupki.gov.ru//epz/order/notice/ea44/view/common-info.html?regNumber=0149200002320001430;Определение поставщика завершено;Выполнение работ по капитальному ремонту участка придомовой территории дома № 3 по ул. Жертв Интервенции;КОМИТЕТ ПО КОНКУРЕНТНОЙ ПОЛИТИКЕМУРМАНСКОЙОБЛАСТИ;17.03.2020;2 216 945,00 ₽;https://zakupki.gov.ru/epz/order/notice/ea44/view/supplier-results.html?regNumber=0149200002320001430;"МУНИЦИПАЛЬНОЕ КАЗЕННОЕ УЧРЕЖДЕНИЕ ""СЛУЖБА ГОРОДСКОГО ХОЗЯЙСТВА ЗАКРЫТОГО АДМИНИСТРАТИВНО-ТЕРРИТОРИАЛЬНОГО ОБРАЗОВАНИЯ ГОРОД ОСТРОВНОЙ МУРМАНСКОЙ ОБЛАСТИ""";;По окончании срока подачи заявок не подано ни одной заявки (ч. 16 ст. 66 44-ФЗ);;;;;;;;;;
