№ 0350300029220000004;https://zakupki.gov.ru//epz/order/notice/ea44/view/common-info.html?regNumber=0350300029220000004;Определение поставщика завершено;Ремонт автомобильнойдорогиулицы Первомайская от д. № 14 до школьной границы пос. Большая Вишера Большевишерского городского поселения Маловишерского районаНовгородскойобласти;АДМИНИСТРАЦИЯ БОЛЬШЕВИШЕРСКОГО ГОРОДСКОГО ПОСЕЛЕНИЯ;16.09.2020;940 512,00 ₽;https://zakupki.gov.ru/epz/order/notice/ea44/view/supplier-results.html?regNumber=0350300029220000004;АДМИНИСТРАЦИЯ БОЛЬШЕВИШЕРСКОГО ГОРОДСКОГО ПОСЕЛЕНИЯ;;По окончании срока подачи заявок подана только одна заявка. Такая заявка признана соответствующей требованиям Федерального закона № 44-ФЗ и документации об аукционе. Электронный аукцион признан несостоявшимся по основанию, предусмотренному ч. 1 ст. 71 Федерального закона № 44-ФЗ;;"ОБЩЕСТВО С ОГРАНИЧЕННОЙ ОТВЕТСТВЕННОСТЬЮ ""МФК СТРОЙ""";;940 512,00;;;;;;
№ 0336100012520000107;https://zakupki.gov.ru//epz/order/notice/ea44/view/common-info.html?regNumber=0336100012520000107;Определение поставщика завершено;"Оказание услуг по содержанию искусственных дорожных сооружений на автомобильнойдороге: А-122 автомобильнаядорогаА-114 – Устюжна – Крестцы – Яжелбицы – Великие Луки – Невель, Демянск – Марёво – Холм на участке км 0+000 – км 130+746; Шимск – Старая Русса – Локня – Великие Луки на участке км 151+759 – км 189+340,Новгородскаяобласть";"ФЕДЕРАЛЬНОЕ КАЗЕННОЕ УЧРЕЖДЕНИЕ ""УПРАВЛЕНИЕ АВТОМОБИЛЬНОЙ МАГИСТРАЛИ ОРДЕНА ЛЕНИНА ""МОСКВА-САНКТ-ПЕТЕРБУРГ"" ФЕДЕРАЛЬНОГО ДОРОЖНОГО АГЕНТСТВА""";17.09.2020;20 896 356,25 ₽;https://zakupki.gov.ru/epz/order/notice/ea44/view/supplier-results.html?regNumber=0336100012520000107;"ФЕДЕРАЛЬНОЕ КАЗЕННОЕ УЧРЕЖДЕНИЕ ""УПРАВЛЕНИЕ АВТОМОБИЛЬНОЙ МАГИСТРАЛИ ОРДЕНА ЛЕНИНА ""МОСКВА-САНКТ-ПЕТЕРБУРГ"" ФЕДЕРАЛЬНОГО ДОРОЖНОГО АГЕНТСТВА""";;По окончании срока подачи заявок подана только одна заявка. Такая заявка признана соответствующей требованиям Федерального закона № 44-ФЗ и документации об аукционе. Электронный аукцион признан несостоявшимся по основанию, предусмотренному ч. 1 ст. 71 Федерального закона № 44-ФЗ;;"ОБЩЕСТВО С ОГРАНИЧЕННОЙ ОТВЕТСТВЕННОСТЬЮ ""ПРОЕКТСТРОЙ""";;20 896 356,25;;;;;;
№ 0372100009920000079;https://zakupki.gov.ru//epz/order/notice/ok504/view/common-info.html?regNumber=0372100009920000079;Определение поставщика завершено;"...  по содержанию действующей сети автомобильныхдорогобщего пользования федерального значения на ... : Устройство слоев износа на автомобильнойдорогеА-121 ""Сортавала"" Санкт-Петербург - Сортавала ...  - автомобильнаядорогаР-21 ""Кола"" на участке км ... ; Устройство слоев износа на автомобильнойдорогеР-21 ""Кола"" Санкт-Петербург - Петрозаводск ... ; Устройство слоев износа на автомобильнойдорогеА-180 ""Нарва"" Санкт-Петербург - граница ...  износа на автомобильнойдорогеА-114 Вологда – Тихвин – автомобильнаядорогаР-21 ""Кола"" на ...  на автомобильнойдорогеМ-10 ""Россия"" Москва - Тверь - ВеликийНовгород- ...";"ФЕДЕРАЛЬНОЕ КАЗЕННОЕ УЧРЕЖДЕНИЕ ""УПРАВЛЕНИЕ ФЕДЕРАЛЬНЫХ АВТОМОБИЛЬНЫХДОРОГ""СЕВЕРО-ЗАПАД"" ИМЕНИ Н.В. СМИРНОВА ФЕДЕРАЛЬНОГО ДОРОЖНОГО АГЕНТСТВА""";04.09.2020;7 766 451,00 ₽;https://zakupki.gov.ru/epz/order/notice/ea44/view/supplier-results.html?regNumber=0372100009920000079;"ФЕДЕРАЛЬНОЕ КАЗЕННОЕ УЧРЕЖДЕНИЕ ""УПРАВЛЕНИЕ ФЕДЕРАЛЬНЫХ АВТОМОБИЛЬНЫХ ДОРОГ ""СЕВЕРО-ЗАПАД"" ИМЕНИ Н.В. СМИРНОВА ФЕДЕРАЛЬНОГО ДОРОЖНОГО АГЕНТСТВА""";;По окончании срока подачи заявок подана только одна заявка, заявка соответствует требованиям. Конкурс в электронной форме признан несостоявшимся (ч. 16 ст. 54.4 Закона № 44-ФЗ);;"ОБЩЕСТВО С ОГРАНИЧЕННОЙ ОТВЕТСТВЕННОСТЬЮ ГРУППА ПРЕДПРИЯТИЙ ""РЕГИОН""";;7 750 004,00;;;;;;
№ 0859200001120010417;https://zakupki.gov.ru//epz/order/notice/ea44/view/common-info.html?regNumber=0859200001120010417;Определение поставщика завершено;Выполнение проектно-изыскательских работ на ремонт железобетонного моста через реку Мошка на км 59+010 автомобильнойдорогиРяжск – Касимов – НижнийНовгород(48+594 – 77+586) в Сапожковском районе Рязанской области;"ГОСУДАРСТВЕННОЕ КАЗЕННОЕ УЧРЕЖДЕНИЕ РЯЗАНСКОЙ ОБЛАСТИ ""ЦЕНТР ЗАКУПОК РЯЗАНСКОЙ ОБЛАСТИ""";15.09.2020;594 106,00 ₽;https://zakupki.gov.ru/epz/order/notice/ea44/view/supplier-results.html?regNumber=0859200001120010417;"ГОСУДАРСТВЕННОЕ КАЗЕННОЕ УЧРЕЖДЕНИЕ РЯЗАНСКОЙ ОБЛАСТИ ""ДИРЕКЦИЯ ДОРОГ РЯЗАНСКОЙ ОБЛАСТИ""";;В течение десяти минут после начала проведения электронного аукциона было подано единственное предложение о цене контракта. По результатам рассмотрения второй части такой заявки принято решение о ее соответствии требованиям, установленным документацией об электронном аукционе (ч.13 ст.69 Закона № 44-ФЗ).;;"АКЦИОНЕРНОЕ ОБЩЕСТВО ""ИНСТИТУТ ПО ПРОЕКТИРОВАНИЮ ОБЪЕКТОВ ИНЖЕНЕРНОГО И СОЦИАЛЬНОГО ОБУСТРОЙСТВА СЕЛЬСКИХ И ГОРОДСКИХ ТЕРРИТОРИЙ ""ИНЖСОЦПРОЕКТ""";;591 135,47;;;;;;
№ 32009495089;https://zakupki.gov.ru/https://zakupki.gov.ru/223/purchase/public/purchase/info/common-info.html?regNumber=32009495089;Закупка завершена;Выполнение работ по содержанию автомобильныхдороги элементов обустройства автомобильныхдорог(ручная уборка) на территории Автозаводского,  Ленинского, Московского, Нижегородского, Советского районов города НижнегоНовгорода;"МУНИЦИПАЛЬНОЕ ПРЕДПРИЯТИЕ ГОРОДА НИЖНЕГОНОВГОРОДА""РЕМОНТ И ЭКСПЛУАТАЦИЯДОРОГАВТОЗАВОДСКОГО РАЙОНА""";15.09.2020;15 336 234,07 ₽;;;;;;;;;;;;;;
№ 32009501912;https://zakupki.gov.ru/https://zakupki.gov.ru/223/purchase/public/purchase/info/common-info.html?regNumber=32009501912;Закупка завершена;Поставка хозяйственного инвентаря;"МУНИЦИПАЛЬНОЕ ПРЕДПРИЯТИЕ ГОРОДА НИЖНЕГОНОВГОРОДА""РЕМОНТ И ЭКСПЛУАТАЦИЯДОРОГАВТОЗАВОДСКОГО РАЙОНА""";17.09.2020;1 100 000,00 ₽;;;;;;;;;;;;;;
№ 0350300001620000009;https://zakupki.gov.ru//epz/order/notice/ea44/view/common-info.html?regNumber=0350300001620000009;Определение поставщика завершено;Выполнение работ по нанесению горизонтальной разметки на асфальтобетонное покрытие по  ул. Советская, Комсомольская,  Школьная, Ленинградская, Центральная Проскурка в р. п. Неболчи Любытинского районаНовгородскойобласти;АДМИНИСТРАЦИЯ НЕБОЛЧСКОГО СЕЛЬСКОГО ПОСЕЛЕНИЯ;17.09.2020;44 702,00 ₽;https://zakupki.gov.ru/epz/order/notice/ea44/view/supplier-results.html?regNumber=0350300001620000009;АДМИНИСТРАЦИЯ НЕБОЛЧСКОГО СЕЛЬСКОГО ПОСЕЛЕНИЯ;;По окончании срока подачи заявок не подано ни одной заявки (ч. 16 ст. 66 44-ФЗ);;;;;;;;;;
№ 0336100012520000106;https://zakupki.gov.ru//epz/order/notice/ea44/view/common-info.html?regNumber=0336100012520000106;Определение поставщика завершено;Оказание услуг по содержанию искусственных дорожных сооружений на автомобильнойдороге: А-122 автомобильнаядорогаА-114 – Устюжна – Крестцы – Яжелбицы – Великие Луки – Невель, Устюжна - Валдай на участке км 26+245 – км 166+520,Новгородскаяобласть;"ФЕДЕРАЛЬНОЕ КАЗЕННОЕ УЧРЕЖДЕНИЕ ""УПРАВЛЕНИЕ АВТОМОБИЛЬНОЙ МАГИСТРАЛИ ОРДЕНА ЛЕНИНА ""МОСКВА-САНКТ-ПЕТЕРБУРГ"" ФЕДЕРАЛЬНОГО ДОРОЖНОГО АГЕНТСТВА""";16.09.2020;21 277 694,00 ₽;https://zakupki.gov.ru/epz/order/notice/ea44/view/supplier-results.html?regNumber=0336100012520000106;"ФЕДЕРАЛЬНОЕ КАЗЕННОЕ УЧРЕЖДЕНИЕ ""УПРАВЛЕНИЕ АВТОМОБИЛЬНОЙ МАГИСТРАЛИ ОРДЕНА ЛЕНИНА ""МОСКВА-САНКТ-ПЕТЕРБУРГ"" ФЕДЕРАЛЬНОГО ДОРОЖНОГО АГЕНТСТВА""";;По окончании срока подачи заявок подана только одна заявка. Такая заявка признана соответствующей требованиям Федерального закона № 44-ФЗ и документации об аукционе. Электронный аукцион признан несостоявшимся по основанию, предусмотренному ч. 1 ст. 71 Федерального закона № 44-ФЗ;;"ОБЩЕСТВО С ОГРАНИЧЕННОЙ ОТВЕТСТВЕННОСТЬЮ ""ПРОЕКТСТРОЙ""";;21 277 694,00;;;;;;
№ 0350300011820000158;https://zakupki.gov.ru//epz/order/notice/ea44/view/common-info.html?regNumber=0350300011820000158;Определение поставщика завершено;Выполнение работ по содержанию автомобильныхдорогВеликогоНовгорода;КОМИТЕТ ПО УПРАВЛЕНИЮ МУНИЦИПАЛЬНЫМ ИМУЩЕСТВОМ И ЗЕМЕЛЬНЫМИ РЕСУРСАМИ ВЕЛИКОГОНОВГОРОДА;07.09.2020;213 164 563,00 ₽;https://zakupki.gov.ru/epz/order/notice/ea44/view/supplier-results.html?regNumber=0350300011820000158;"МУНИЦИПАЛЬНОЕ КАЗЕННОЕ УЧРЕЖДЕНИЕ ВЕЛИКОГО НОВГОРОДА ""ГОРОДСКОЕ ХОЗЯЙСТВО""";;По результатам рассмотрения единственной заявки, данная заявка отклонена. Электронный аукцион признан несостоявшимся по основанию, предусмотренному ч. 1 ст. 71 Федерального закона № 44-ФЗ;;;;;;;;;;
№ 0150300000920000011;https://zakupki.gov.ru//epz/order/notice/ea44/view/common-info.html?regNumber=0150300000920000011;Определение поставщика завершено;Выполнение работ по ремонту асфальтобетонного покрытия автомобильныхдорогобщего пользования местного значения с. Поддорье Поддорского районаНовгородскойобласти;АДМИНИСТРАЦИЯ ПОДДОРСКОГО МУНИЦИПАЛЬНОГО РАЙОНА;27.08.2020;5 065 695,00 ₽;https://zakupki.gov.ru/epz/order/notice/ea44/view/supplier-results.html?regNumber=0150300000920000011;АДМИНИСТРАЦИЯ ПОДДОРСКОГО МУНИЦИПАЛЬНОГО РАЙОНА;Умаров Р. И.;1 - Победитель;4 533 796,92;"ОБЩЕСТВО С ОГРАНИЧЕННОЙ ОТВЕТСТВЕННОСТЬЮ ""СОЛИД""";2 - Второй номер;4 559 125,40;;;;;;
№ 32009478096;https://zakupki.gov.ru/https://zakupki.gov.ru/223/purchase/public/purchase/info/common-info.html?regNumber=32009478096;Закупка завершена;Выполнение работ по содержанию автомобильныхдороги элементов обустройства автомобильныхдорогна территории Нижегородского  района  города НижнегоНовгорода;"МУНИЦИПАЛЬНОЕ ПРЕДПРИЯТИЕ ГОРОДА НИЖНЕГОНОВГОРОДА""РЕМОНТ И ЭКСПЛУАТАЦИЯДОРОГАВТОЗАВОДСКОГО РАЙОНА""";09.09.2020;;;;;;;;;;;;;;;
№ 32009473645;https://zakupki.gov.ru/https://zakupki.gov.ru/223/purchase/public/purchase/info/common-info.html?regNumber=32009473645;Закупка завершена;Выполнение работ по содержанию автомобильныхдороги элементов обустройства автомобильныхдорогна территории Нижегородского района города НижнегоНовгорода;"МУНИЦИПАЛЬНОЕ ПРЕДПРИЯТИЕ ГОРОДА НИЖНЕГОНОВГОРОДА""РЕМОНТ И ЭКСПЛУАТАЦИЯДОРОГАВТОЗАВОДСКОГО РАЙОНА""";08.09.2020;;;;;;;;;;;;;;;
№ 0311100007220000126;https://zakupki.gov.ru//epz/order/notice/ea44/view/common-info.html?regNumber=0311100007220000126;Определение поставщика завершено;"РемонтавтомобильнойдорогиМ-7 ""Волга"" Москва - Владимир - НижнийНовгород- Казань - Уфа на участке км 1103+000 - км 1109+000 , Республика Татарстан(дополнительные работы)";"ФЕДЕРАЛЬНОЕ КАЗЕННОЕ УЧРЕЖДЕНИЕ ""ФЕДЕРАЛЬНОЕ УПРАВЛЕНИЕ АВТОМОБИЛЬНЫХДОРОГВОЛГО-ВЯТСКОГО РЕГИОНА ФЕДЕРАЛЬНОГО ДОРОЖНОГО АГЕНТСТВА""";17.09.2020;31 205,00 ₽;https://zakupki.gov.ru/epz/order/notice/ea44/view/supplier-results.html?regNumber=0311100007220000126;"ФЕДЕРАЛЬНОЕ КАЗЕННОЕ УЧРЕЖДЕНИЕ ""ФЕДЕРАЛЬНОЕ УПРАВЛЕНИЕ АВТОМОБИЛЬНЫХ ДОРОГ ВОЛГО-ВЯТСКОГО РЕГИОНА ФЕДЕРАЛЬНОГО ДОРОЖНОГО АГЕНТСТВА""";;По окончании срока подачи заявок подана только одна заявка. Такая заявка признана соответствующей требованиям Федерального закона № 44-ФЗ и документации об аукционе. Электронный аукцион признан несостоявшимся по основанию, предусмотренному ч. 1 ст. 71 Федерального закона № 44-ФЗ;;"АКЦИОНЕРНОЕ ОБЩЕСТВО ""КАМСКИЙ ТРЕСТ ПО СТРОИТЕЛЬСТВУ АВТОМОБИЛЬНЫХ ДОРОГ И АЭРОДРОМОВ""";;31 205,00;;;;;;
№ 32009499064;https://zakupki.gov.ru/https://zakupki.gov.ru/223/purchase/public/purchase/info/common-info.html?regNumber=32009499064;Закупка завершена;Оказание услуг по уборке помещений для нужд филиала ФГП ВО ЖДТ России на Горьковской железнойдорогев г. НижнийНовгород;"ФЕДЕРАЛЬНОЕ ГОСУДАРСТВЕННОЕ ПРЕДПРИЯТИЕ ""ВЕДОМСТВЕННАЯ ОХРАНА ЖЕЛЕЗНОДОРОЖНОГО ТРАНСПОРТА РОССИЙСКОЙ ФЕДЕРАЦИИ""";16.09.2020;504 000,00 ₽;;;;;;;;;;;;;;
№ 0832200006620000702;https://zakupki.gov.ru//epz/order/notice/ea44/view/common-info.html?regNumber=0832200006620000702;Определение поставщика завершено;Выполнение работ по ремонту объекта: «Автомобильнаядорога» Казанский съезд от наб. Верхневолжской до наб. Нижневолжской» в Нижегородском районе г. НижнегоНовгорода»;"ГОСУДАРСТВЕННОЕ КАЗЕННОЕ УЧРЕЖДЕНИЕ НИЖЕГОРОДСКОЙ ОБЛАСТИ ""ЦЕНТР РАЗМЕЩЕНИЯ ЗАКАЗА НИЖЕГОРОДСКОЙ ОБЛАСТИ""";10.09.2020;13 911 763,00 ₽;https://zakupki.gov.ru/epz/order/notice/ea44/view/supplier-results.html?regNumber=0832200006620000702;"МУНИЦИПАЛЬНОЕ КАЗЕННОЕ УЧРЕЖДЕНИЕ ""ГЛАВНОЕ УПРАВЛЕНИЕ ПО СТРОИТЕЛЬСТВУ И РЕМОНТУ МЕТРОПОЛИТЕНА, МОСТОВ И ДОРОЖНЫХ СЕТЕЙ В ГОРОДЕ НИЖНЕМ НОВГОРОДЕ""";"ОБЩЕСТВО С ОГРАНИЧЕННОЙ ОТВЕТСТВЕННОСТЬЮ ""РУССКИЙ БИЗНЕС КОНЦЕРН-РУБИКОН""";1 - Победитель;13 494 410,08;"ОБЩЕСТВО С ОГРАНИЧЕННОЙ ОТВЕТСТВЕННОСТЬЮ КОРПОРАЦИЯ ""СТРОЙИНВЕСТ""";2 - Второй номер;13 563 968,90;;;;;;
№ 0315100000320000127;https://zakupki.gov.ru//epz/order/notice/ea44/view/common-info.html?regNumber=0315100000320000127;Определение поставщика завершено;Оказание услуг по содержанию искусственных дорожных сооружений на автомобильнойдорогеМ-7 «Волга» Москва – Владимир – НижнийНовгород– Казань – Уфа, подъезд к г. Пермь, км 477+644 – км 509+867, Пермский край;"ФЕДЕРАЛЬНОЕ КАЗЕННОЕ УЧРЕЖДЕНИЕ ""УПРАВЛЕНИЕ ФЕДЕРАЛЬНЫХ АВТОМОБИЛЬНЫХДОРОГ""ПРИКАМЬЕ"" ФЕДЕРАЛЬНОГО ДОРОЖНОГО АГЕНТСТВА""";10.09.2020;180 349 456,00 ₽;https://zakupki.gov.ru/epz/order/notice/ea44/view/supplier-results.html?regNumber=0315100000320000127;"ФЕДЕРАЛЬНОЕ КАЗЕННОЕ УЧРЕЖДЕНИЕ ""УПРАВЛЕНИЕ ФЕДЕРАЛЬНЫХ АВТОМОБИЛЬНЫХ ДОРОГ ""ПРИКАМЬЕ"" ФЕДЕРАЛЬНОГО ДОРОЖНОГО АГЕНТСТВА""";"ОБЩЕСТВО С ОГРАНИЧЕННОЙ ОТВЕТСТВЕННОСТЬЮ ""ТЕХНОГРАД""";1 - Победитель;93 781 717,11;"ОБЩЕСТВО С ОГРАНИЧЕННОЙ ОТВЕТСТВЕННОСТЬЮ ""ШИПИК""";2 - Второй номер;93 781 717,12;;;;;;
№ 0355100004520000098;https://zakupki.gov.ru//epz/order/notice/ok504/view/common-info.html?regNumber=0355100004520000098;Определение поставщика завершено;Подготовка проектной документации и выполнение инженерных изысканий «Капитальный ремонт автомобильнойдорогиР-158 НижнийНовгород- Арзамас – Саранск - Исса - Пенза - Саратов на участке км 425+000 - км 440+000, Пензенская область»;"ФЕДЕРАЛЬНОЕ КАЗЕННОЕ УЧРЕЖДЕНИЕ ""ФЕДЕРАЛЬНОЕ УПРАВЛЕНИЕ АВТОМОБИЛЬНЫХДОРОГ""БОЛЬШАЯ ВОЛГА"" ФЕДЕРАЛЬНОГО ДОРОЖНОГО АГЕНТСТВА""";20.08.2020;15 515 728,00 ₽;https://zakupki.gov.ru/epz/order/notice/ea44/view/supplier-results.html?regNumber=0355100004520000098;"ФЕДЕРАЛЬНОЕ КАЗЕННОЕ УЧРЕЖДЕНИЕ ""ФЕДЕРАЛЬНОЕ УПРАВЛЕНИЕ АВТОМОБИЛЬНЫХ ДОРОГ ""БОЛЬШАЯ ВОЛГА"" ФЕДЕРАЛЬНОГО ДОРОЖНОГО АГЕНТСТВА""";"ОБЩЕСТВО С ОГРАНИЧЕННОЙ ОТВЕТСТВЕННОСТЬЮ ""ВМС ИНЖИНИРИНГ""";1 - Победитель;14 750 000,00;"ОБЩЕСТВО С ОГРАНИЧЕННОЙ ОТВЕТСТВЕННОСТЬЮ ""ПЕРМПРОЕКТИЗЫСКАНИЯ""";2 - Второй номер;9 100 000,00;;;;;;
№ 0315100000320000126;https://zakupki.gov.ru//epz/order/notice/ea44/view/common-info.html?regNumber=0315100000320000126;Определение поставщика завершено;Расходы на приобретение автоматизированного оборудования учета интенсивности дорожного движения, в т.ч: Установка пункта учета интенсивности дорожного движения на км 5+350 автомобильнойдорогиобщего пользования федерального значения Р-176 «Вятка» Чебоксары – Йошкар-Ола – Киров – Сыктывкар, обход г. Котельнич. Установка пункта учета интенсивности дорожного движения на км 8+095 автомобильнойдорогиобщего пользования федерального значения М-7 «Волга» Москва – Владимир – НижнийНовгород– Казань – Уфа, обход г. Ижевск.;"ФЕДЕРАЛЬНОЕ КАЗЕННОЕ УЧРЕЖДЕНИЕ ""УПРАВЛЕНИЕ ФЕДЕРАЛЬНЫХ АВТОМОБИЛЬНЫХДОРОГ""ПРИКАМЬЕ"" ФЕДЕРАЛЬНОГО ДОРОЖНОГО АГЕНТСТВА""";08.09.2020;2 404 000,00 ₽;https://zakupki.gov.ru/epz/order/notice/ea44/view/supplier-results.html?regNumber=0315100000320000126;"ФЕДЕРАЛЬНОЕ КАЗЕННОЕ УЧРЕЖДЕНИЕ ""УПРАВЛЕНИЕ ФЕДЕРАЛЬНЫХ АВТОМОБИЛЬНЫХ ДОРОГ ""ПРИКАМЬЕ"" ФЕДЕРАЛЬНОГО ДОРОЖНОГО АГЕНТСТВА""";;В течение десяти минут после начала проведения электронного аукциона было подано единственное предложение о цене контракта. По результатам рассмотрения второй части такой заявки принято решение о ее соответствии требованиям, установленным документацией об электронном аукционе (ч.13 ст.69 Закона № 44-ФЗ).;;"ОБЩЕСТВО С ОГРАНИЧЕННОЙ ОТВЕТСТВЕННОСТЬЮ ""ВОСТОК-М""";;2 391 980,00;;;;;;
