№ 0350300005520000032;https://zakupki.gov.ru//epz/order/notice/ea44/view/common-info.html?regNumber=0350300005520000032;Определение поставщика завершено;Выполнение работ по содержанию муниципальных гравийныхдорогХолмского районаНовгородскойобласти в летне-зимний период;АДМИНИСТРАЦИЯ ХОЛМСКОГО МУНИЦИПАЛЬНОГО РАЙОНА;25.06.2020;565 432,80 ₽;https://zakupki.gov.ru/epz/order/notice/ea44/view/supplier-results.html?regNumber=0350300005520000032;АДМИНИСТРАЦИЯ ХОЛМСКОГО МУНИЦИПАЛЬНОГО РАЙОНА;;По окончании срока подачи заявок подана только одна заявка. Такая заявка признана соответствующей требованиям Федерального закона № 44-ФЗ и документации об аукционе. Электронный аукцион признан несостоявшимся по основанию, предусмотренному ч. 1 ст. 71 Федерального закона № 44-ФЗ;;"ОБЩЕСТВО С ОГРАНИЧЕННОЙ ОТВЕТСТВЕННОСТЬЮ ""ТРЭКСЕРВИС""";;565 432,80;;;;;;
№ 0132300007420000062;https://zakupki.gov.ru//epz/order/notice/ea44/view/common-info.html?regNumber=0132300007420000062;Определение поставщика завершено;"Выполнение работ по нанесению дорожной разметки на автомобильнойдороге""Автомобильнаядорогак в/ч 54008 от а/д Москва- НижнийНовгороддо Обелиска"" протяженностью 10072 м.";АДМИНИСТРАЦИЯ ВОЛОДАРСКОГО МУНИЦИПАЛЬНОГО РАЙОНА НИЖЕГОРОДСКОЙ ОБЛАСТИ;22.06.2020;337 726,00 ₽;https://zakupki.gov.ru/epz/order/notice/ea44/view/supplier-results.html?regNumber=0132300007420000062;АДМИНИСТРАЦИЯ ВОЛОДАРСКОГО МУНИЦИПАЛЬНОГО РАЙОНА НИЖЕГОРОДСКОЙ ОБЛАСТИ;;По окончании срока подачи заявок подана только одна заявка. Такая заявка признана соответствующей требованиям Федерального закона № 44-ФЗ и документации об аукционе. Электронный аукцион признан несостоявшимся по основанию, предусмотренному ч. 1 ст. 71 Федерального закона № 44-ФЗ;;"ОБЩЕСТВО С ОГРАНИЧЕННОЙ ОТВЕТСТВЕННОСТЬЮ ""АВТОДОРСЕРВИС""";;337 726,00;;;;;;
№ 0332300330620000121;https://zakupki.gov.ru//epz/order/notice/ea44/view/common-info.html?regNumber=0332300330620000121;Определение поставщика завершено;"на выполнение работ на ремонт автомобильнойдороги22 237 ОП МР-63 ""Подъезд к с. Шелокша от а/д 22 ОП Р 22К-0037 ""Кстово-Д. Константиново-а/д Н.Новгород-Саратов""";"МУНИЦИПАЛЬНОЕ КАЗЕННОЕ УЧРЕЖДЕНИЕ ""АДМИНИСТРАТИВНО-ТЕХНИЧЕСКОЕ ОБЕСПЕЧЕНИЕ КСТОВСКОГО МУНИЦИПАЛЬНОГО РАЙОНА НИЖЕГОРОДСКОЙ ОБЛАСТИ""";25.06.2020;13 089 881,00 ₽;https://zakupki.gov.ru/epz/order/notice/ea44/view/supplier-results.html?regNumber=0332300330620000121;"МУНИЦИПАЛЬНОЕ КАЗЕННОЕ УЧРЕЖДЕНИЕ ""ДОРОГИ КСТОВСКОГО МУНИЦИПАЛЬНОГО РАЙОНА""";"ОБЩЕСТВО С ОГРАНИЧЕННОЙ ОТВЕТСТВЕННОСТЬЮ ""ПРОФЕССИОНАЛ-СТРОЙРЕСУРС""";1 - Победитель;9 882 859,91;Кузнецов А. Н.;2 - Второй номер;9 948 309,32;;;;;;
№ 0150300021520000005;https://zakupki.gov.ru//epz/order/notice/ea44/view/common-info.html?regNumber=0150300021520000005;Определение поставщика завершено;Ремонт  автомобильнойдорогиул. Полевая, д. ГригоровоНовгородскогорайонаНовгородскойобласти;АДМИНИСТРАЦИЯ ЕРМОЛИНСКОГО СЕЛЬСКОГО ПОСЕЛЕНИЯ;22.06.2020;3 587 984,00 ₽;https://zakupki.gov.ru/epz/order/notice/ea44/view/supplier-results.html?regNumber=0150300021520000005;АДМИНИСТРАЦИЯ ЕРМОЛИНСКОГО СЕЛЬСКОГО ПОСЕЛЕНИЯ;"ОБЩЕСТВО С ОГРАНИЧЕННОЙ ОТВЕТСТВЕННОСТЬЮ ""НОВГОРОДСКАЯ ПМК""";1 - Победитель;2 870 387,20;"ОБЩЕСТВО С ОГРАНИЧЕННОЙ ОТВЕТСТВЕННОСТЬЮ ""СТРОЙ-М""";2 - Второй номер;2 888 327,12;;;;;;
№ 32009269914;https://zakupki.gov.ru/https://zakupki.gov.ru/223/purchase/public/purchase/info/common-info.html?regNumber=32009269914;Закупка завершена;Выполнение работ по содержанию автомобильныхдороги элементов обустройства автомобильныхдорог(устранение деформаций) на территории Автозаводского, Ленинского и Московского районов г. Н.Новгорода;"МУНИЦИПАЛЬНОЕ ПРЕДПРИЯТИЕ ГОРОДА НИЖНЕГОНОВГОРОДА""РЕМОНТ И ЭКСПЛУАТАЦИЯДОРОГАВТОЗАВОДСКОГО РАЙОНА""";25.06.2020;9 906 726,70 ₽;;;;;;;;;;;;;;
№ 0348100006020000037;https://zakupki.gov.ru//epz/order/notice/ea44/view/common-info.html?regNumber=0348100006020000037;Определение поставщика завершено;"Строительство и реконструкция автомобильнойдорогиМ-7 ""Волга"" от Москвы через Владимир, НижнийНовгород, Казань до Уфы Реконструкция автомобильнойдорогиМ-7 ""Волга"" Москва - Владимир - НижнийНовгород- Казань - Уфа на участке км 442 - км 472, Нижегородская область";"ФЕДЕРАЛЬНОЕ КАЗЕННОЕ УЧРЕЖДЕНИЕ ""УПРАВЛЕНИЕ АВТОМОБИЛЬНОЙ МАГИСТРАЛИ МОСКВА - НИЖНИЙНОВГОРОДФЕДЕРАЛЬНОГО ДОРОЖНОГО АГЕНТСТВА""";09.06.2020;4 134 245 219,00 ₽;https://zakupki.gov.ru/epz/order/notice/ea44/view/supplier-results.html?regNumber=0348100006020000037;"ФЕДЕРАЛЬНОЕ КАЗЕННОЕ УЧРЕЖДЕНИЕ ""УПРАВЛЕНИЕ АВТОМОБИЛЬНОЙ МАГИСТРАЛИ МОСКВА - НИЖНИЙ НОВГОРОД ФЕДЕРАЛЬНОГО ДОРОЖНОГО АГЕНТСТВА""";Согласование получено;;По окончании срока подачи заявок подана только одна заявка. Такая заявка признана соответствующей требованиям Федерального закона № 44-ФЗ и документации об аукционе. Электронный аукцион признан несостоявшимся по основанию, предусмотренному ч. 1 ст. 71 Федерального закона № 44-ФЗ;;"ОБЩЕСТВО С ОГРАНИЧЕННОЙ ОТВЕТСТВЕННОСТЬЮ ""ДОРОЖНАЯ СТРОИТЕЛЬНАЯ КОМПАНИЯ""";;;;;;;
№ 0150300002420000105;https://zakupki.gov.ru//epz/order/notice/ea44/view/common-info.html?regNumber=0150300002420000105;Определение поставщика завершено;Выполнение работ по ремонту автомобильныхдорогобщего пользования местного значения до д. Овсянниково отд. Котово,  Боровичского района,Новгородскойобласти, до д. Ерюхино отавтодорогиУкроево-Дерягино, Боровичскогорайона,Новгородскойобласти.;АДМИНИСТРАЦИЯ БОРОВИЧСКОГО МУНИЦИПАЛЬНОГО РАЙОНА;15.06.2020;1 775 994,00 ₽;https://zakupki.gov.ru/epz/order/notice/ea44/view/supplier-results.html?regNumber=0150300002420000105;"МУНИЦИПАЛЬНОЕ КАЗЕННОЕ УЧРЕЖДЕНИЕ ""СЛУЖБА ЗАКАЗЧИКА БОРОВИЧСКОГО МУНИЦИПАЛЬНОГО РАЙОНА""";"ОБЩЕСТВО С ОГРАНИЧЕННОЙ ОТВЕТСТВЕННОСТЬЮ ""СПЕЦТРАНС-53""";1 - Победитель;1 438 554,03;Мульт С. Э.;2 - Второй номер;1 447 434,00;;;;;;
№ 0150300011620000066;https://zakupki.gov.ru//epz/order/notice/ea44/view/common-info.html?regNumber=0150300011620000066;Определение поставщика завершено;Осуществление строительного контроля по капитальному ремонту автомобильныхдорог, расположенных на территории Валдайского муниципального районаНовгородскойобласти.;АДМИНИСТРАЦИЯ ВАЛДАЙСКОГО МУНИЦИПАЛЬНОГО РАЙОНА;18.06.2020;103 411,00 ₽;https://zakupki.gov.ru/epz/order/notice/ea44/view/supplier-results.html?regNumber=0150300011620000066;АДМИНИСТРАЦИЯ ВАЛДАЙСКОГО МУНИЦИПАЛЬНОГО РАЙОНА;"ОБЩЕСТВО С ОГРАНИЧЕННОЙ ОТВЕТСТВЕННОСТЬЮ ""ЛИГА""";1 - Победитель;92 497,67;"ОБЩЕСТВО С ОГРАНИЧЕННОЙ ОТВЕТСТВЕННОСТЬЮ ""АЛЕКСГРУПП""";2 - Второй номер;93 014,73;;;;;;
№ 32009264329;https://zakupki.gov.ru/https://zakupki.gov.ru/223/purchase/public/purchase/info/common-info.html?regNumber=32009264329;Закупка завершена;Выполнение работ по содержанию автомобильныхдороги элементов обустройства автомобильныхдорог, выполняемых  на территории Советского района города НижнегоНовгорода;"МУНИЦИПАЛЬНОЕ ПРЕДПРИЯТИЕ ГОРОДА НИЖНЕГОНОВГОРОДА""РЕМОНТ И ЭКСПЛУАТАЦИЯДОРОГАВТОЗАВОДСКОГО РАЙОНА""";23.06.2020;;;;;;;;;;;;;;;
№ 32009259814;https://zakupki.gov.ru/https://zakupki.gov.ru/223/purchase/public/purchase/info/common-info.html?regNumber=32009259814;Закупка завершена;Выполнение работ по содержанию автомобильныхдороги элементов обустройства автомобильныхдорогна территории Ленинского района  города НижнегоНовгорода;"МУНИЦИПАЛЬНОЕ ПРЕДПРИЯТИЕ ГОРОДА НИЖНЕГОНОВГОРОДА""РЕМОНТ И ЭКСПЛУАТАЦИЯДОРОГАВТОЗАВОДСКОГО РАЙОНА""";22.06.2020;;;;;;;;;;;;;;;
№ 32009264642;https://zakupki.gov.ru/https://zakupki.gov.ru/223/purchase/public/purchase/info/common-info.html?regNumber=32009264642;Закупка завершена;Выполнение работ по содержанию автомобильныхдороги элементов обустройства автомобильныхдорог, выполняемых  на территории Московского  района города НижнегоНовгорода;"МУНИЦИПАЛЬНОЕ ПРЕДПРИЯТИЕ ГОРОДА НИЖНЕГОНОВГОРОДА""РЕМОНТ И ЭКСПЛУАТАЦИЯДОРОГАВТОЗАВОДСКОГО РАЙОНА""";23.06.2020;49 819 110,82 ₽;;;;;;;;;;;;;;
№ 0150300017520000001;https://zakupki.gov.ru//epz/order/notice/ea44/view/common-info.html?regNumber=0150300017520000001;Определение поставщика завершено;на выполнение работ  по ремонту автомобильнойдорогиобщего пользования местного значения  в д. Внуто, Анциферовского сельского поселения Хвойнинского районаНовгородскойобласти с применением ПГС;АДМИНИСТРАЦИЯ АНЦИФЕРОВСКОГО СЕЛЬСКОГО ПОСЕЛЕНИЯ;18.06.2020;328 864,00 ₽;https://zakupki.gov.ru/epz/order/notice/ea44/view/supplier-results.html?regNumber=0150300017520000001;АДМИНИСТРАЦИЯ АНЦИФЕРОВСКОГО СЕЛЬСКОГО ПОСЕЛЕНИЯ;Мульт С. Э.;1 - Победитель;248 284,00;"МУНИЦИПАЛЬНОЕ УНИТАРНОЕ ПРЕДПРИЯТИЕ ""ХВОЙНИНСКИЙ ВОДОКАНАЛ""";2 - Второй номер;249 928,68;;;;;;
№ 0350300003220000054;https://zakupki.gov.ru//epz/order/notice/ea44/view/common-info.html?regNumber=0350300003220000054;Определение поставщика завершено;"Оказание услуг по строительному контролю за выполнением работ по ремонту автомобильныхдорогобщего пользования местного значения муниципального района ""Любытино-Неболчи-Бокситогорск""-Звонец-Теребутенец (асфальтобетон), ""Любытино-Неболчи-Бокситогорск"" -Звонец-Теребутенец (грунт) в Любытинском муниципальном районеНовгородскойобласти";АДМИНИСТРАЦИЯ ЛЮБЫТИНСКОГО МУНИЦИПАЛЬНОГО РАЙОНА;18.06.2020;223 500,00 ₽;https://zakupki.gov.ru/epz/order/notice/ea44/view/supplier-results.html?regNumber=0350300003220000054;АДМИНИСТРАЦИЯ ЛЮБЫТИНСКОГО МУНИЦИПАЛЬНОГО РАЙОНА;"ОБЩЕСТВО С ОГРАНИЧЕННОЙ ОТВЕТСТВЕННОСТЬЮ ""АЛЕКСГРУПП""";1 - Победитель;200 032,50;"ОБЩЕСТВО С ОГРАНИЧЕННОЙ ОТВЕТСТВЕННОСТЬЮ ""ИСПЫТАНИЯ. ДИАГНОСТИКА. КОНТРОЛЬ""";2 - Второй номер;200 032,50;;;;;;
№ 0350300011820000104;https://zakupki.gov.ru//epz/order/notice/ea44/view/common-info.html?regNumber=0350300011820000104;Определение поставщика завершено;выполнениеработ по ремонтудорогина полигон твердых бытовых отходов;КОМИТЕТ ПО УПРАВЛЕНИЮ МУНИЦИПАЛЬНЫМ ИМУЩЕСТВОМ И ЗЕМЕЛЬНЫМИ РЕСУРСАМИ ВЕЛИКОГОНОВГОРОДА;22.06.2020;7 051 728,00 ₽;https://zakupki.gov.ru/epz/order/notice/ea44/view/supplier-results.html?regNumber=0350300011820000104;КОМИТЕТ ПО УПРАВЛЕНИЮ ГОРОДСКИМ ХОЗЯЙСТВОМ АДМИНИСТРАЦИИ ВЕЛИКОГО НОВГОРОДА;"ОБЩЕСТВО С ОГРАНИЧЕННОЙ ОТВЕТСТВЕННОСТЬЮ ""ЭКОСЕРВИС""";1 - Победитель;6 205 520,64;"АКЦИОНЕРНОЕ ОБЩЕСТВО ""СМУ-57""";2 - Второй номер;6 240 779,28;;;;;;
№ 0348100006020000039;https://zakupki.gov.ru//epz/order/notice/ea44/view/common-info.html?regNumber=0348100006020000039;Определение поставщика завершено;"Капитальный ремонт автомобильнойдорогиМ-7 ""Волга"" Москва - Владимир - НижнийНовгород- Казань - Уфа на участке км 57+000 - км 60+000, Московская область";"ФЕДЕРАЛЬНОЕ КАЗЕННОЕ УЧРЕЖДЕНИЕ ""УПРАВЛЕНИЕ АВТОМОБИЛЬНОЙ МАГИСТРАЛИ МОСКВА - НИЖНИЙНОВГОРОДФЕДЕРАЛЬНОГО ДОРОЖНОГО АГЕНТСТВА""";17.06.2020;703 086 810,00 ₽;https://zakupki.gov.ru/epz/order/notice/ea44/view/supplier-results.html?regNumber=0348100006020000039;"ФЕДЕРАЛЬНОЕ КАЗЕННОЕ УЧРЕЖДЕНИЕ ""УПРАВЛЕНИЕ АВТОМОБИЛЬНОЙ МАГИСТРАЛИ МОСКВА - НИЖНИЙ НОВГОРОД ФЕДЕРАЛЬНОГО ДОРОЖНОГО АГЕНТСТВА""";"АКЦИОНЕРНОЕ ОБЩЕСТВО ""ФИРМА НОВОСТРОЙ""";1 - Победитель;671 447 903,55;"ОБЩЕСТВО С ОГРАНИЧЕННОЙ ОТВЕТСТВЕННОСТЬЮ ""ТЕХСТРОЙКОНТРАКТ""";2 - Второй номер;674 963 337,60;;;;;;
№ 0355100004520000079;https://zakupki.gov.ru//epz/order/notice/ea44/view/common-info.html?regNumber=0355100004520000079;Определение поставщика завершено;"Выполнение работ по установке стационарного электрического освещения на участках автомобильныхдорогобщего пользования федерального значения: М-5 ""Урал"" Москва – Рязань – Пенза – Самара – Уфа – Челябинск, Рязанскаяобласть, Пензенская область, Ульяновская область, Самарская область; Р-158 НижнийНовгород– Арзамас – Саранск – Исса – Пенза – Саратов, Пензенская область; А-300 Самара – Большая Черниговка – граница с Республикой Казахстан,Самарская область";"ФЕДЕРАЛЬНОЕ КАЗЕННОЕ УЧРЕЖДЕНИЕ ""ФЕДЕРАЛЬНОЕ УПРАВЛЕНИЕ АВТОМОБИЛЬНЫХДОРОГ""БОЛЬШАЯ ВОЛГА"" ФЕДЕРАЛЬНОГО ДОРОЖНОГО АГЕНТСТВА""";17.06.2020;193 560 000,00 ₽;https://zakupki.gov.ru/epz/order/notice/ea44/view/supplier-results.html?regNumber=0355100004520000079;"ФЕДЕРАЛЬНОЕ КАЗЕННОЕ УЧРЕЖДЕНИЕ ""ФЕДЕРАЛЬНОЕ УПРАВЛЕНИЕ АВТОМОБИЛЬНЫХ ДОРОГ ""БОЛЬШАЯ ВОЛГА"" ФЕДЕРАЛЬНОГО ДОРОЖНОГО АГЕНТСТВА""";"ОБЩЕСТВО С ОГРАНИЧЕННОЙ ОТВЕТСТВЕННОСТЬЮ ПРЕДПРИЯТИЕ ""ПИК""";1 - Победитель;169 386 400,00;"ОБЩЕСТВО С ОГРАНИЧЕННОЙ ОТВЕТСТВЕННОСТЬЮ ""ДОРРЕМСТРОЙ-1""";2 - Второй номер;170 354 200,00;;;;;;
№ 0150300002420000095;https://zakupki.gov.ru//epz/order/notice/ea44/view/common-info.html?regNumber=0150300002420000095;Определение поставщика завершено;Выполнение работ по ремонту тротуаров города БоровичиНовгородскойобласти;АДМИНИСТРАЦИЯ БОРОВИЧСКОГО МУНИЦИПАЛЬНОГО РАЙОНА;05.06.2020;1 968 946,00 ₽;https://zakupki.gov.ru/epz/order/notice/ea44/view/supplier-results.html?regNumber=0150300002420000095;"МУНИЦИПАЛЬНОЕ КАЗЕННОЕ УЧРЕЖДЕНИЕ ""ЦЕНТР ПО РАБОТЕ С НАСЕЛЕНИЕМ""";Жукова В. Н.;1 - Победитель - отказ от заключения контракта или уклонение участника от заключения контракта;1 732 672,48;Оганисян К. Б.;2 - Второй номер;1 831 119,78;;;;;;
№ 0311100007220000099;https://zakupki.gov.ru//epz/order/notice/ea44/view/common-info.html?regNumber=0311100007220000099;Определение поставщика завершено;"Расходы на мероприятия по повышению уровня обустройства автомобильныхдорогфедерального значения. Строительство пешеходных переходов в разных уровнях на км 1043+200, км 1047+500 автомобильнойдорогиМ-7 ""Волга"" Москва - Владимир - НижнийНовгород- Казань - Уфа, Республика Татарстан (1 этап)";"ФЕДЕРАЛЬНОЕ КАЗЕННОЕ УЧРЕЖДЕНИЕ ""ФЕДЕРАЛЬНОЕ УПРАВЛЕНИЕ АВТОМОБИЛЬНЫХДОРОГВОЛГО-ВЯТСКОГО РЕГИОНА ФЕДЕРАЛЬНОГО ДОРОЖНОГО АГЕНТСТВА""";24.06.2020;67 779 103,00 ₽;https://zakupki.gov.ru/epz/order/notice/ea44/view/supplier-results.html?regNumber=0311100007220000099;"ФЕДЕРАЛЬНОЕ КАЗЕННОЕ УЧРЕЖДЕНИЕ ""ФЕДЕРАЛЬНОЕ УПРАВЛЕНИЕ АВТОМОБИЛЬНЫХ ДОРОГ ВОЛГО-ВЯТСКОГО РЕГИОНА ФЕДЕРАЛЬНОГО ДОРОЖНОГО АГЕНТСТВА""";;По окончании срока подачи заявок подана только одна заявка. Такая заявка признана соответствующей требованиям Федерального закона № 44-ФЗ и документации об аукционе. Электронный аукцион признан несостоявшимся по основанию, предусмотренному ч. 1 ст. 71 Федерального закона № 44-ФЗ;;"ОБЩЕСТВО С ОГРАНИЧЕННОЙ ОТВЕТСТВЕННОСТЬЮ ""МОСТЫ РЕСПУБЛИКИ ТАТАРСТАН""";;67 779 103,00;;;;;;
№ 32009256769;https://zakupki.gov.ru/https://zakupki.gov.ru/223/purchase/public/purchase/info/common-info.html?regNumber=32009256769;Закупка завершена;Выполнение работ по содержанию автомобильныхдороги элементов обустройства автомобильныхдорог, выполняемых  на территории Приокского района города НижнегоНовгорода;"МУНИЦИПАЛЬНОЕ ПРЕДПРИЯТИЕ ГОРОДА НИЖНЕГОНОВГОРОДА""РЕМОНТ И ЭКСПЛУАТАЦИЯДОРОГАВТОЗАВОДСКОГО РАЙОНА""";19.06.2020;;;;;;;;;;;;;;;
№ 0133200001720001478;https://zakupki.gov.ru//epz/order/notice/ea44/view/common-info.html?regNumber=0133200001720001478;Определение поставщика завершено;Выполнение работ по замене светильников на линии искусственного освещения региональной автомобильнойдорогиРостов-Иваново-НижнийНовгород(км 124+210 - 124+700) в п. Ново-Талицы Ивановского района Ивановской области;ДЕПАРТАМЕНТ КОНКУРСОВ И АУКЦИОНОВ ИВАНОВСКОЙ ОБЛАСТИ;16.06.2020;3 397 451,00 ₽;https://zakupki.gov.ru/epz/order/notice/ea44/view/supplier-results.html?regNumber=0133200001720001478;ДЕПАРТАМЕНТ ДОРОЖНОГО ХОЗЯЙСТВА И ТРАНСПОРТА ИВАНОВСКОЙ ОБЛАСТИ;;В течение десяти минут после начала проведения электронного аукциона было подано единственное предложение о цене контракта. По результатам рассмотрения второй части такой заявки принято решение о ее соответствии требованиям, установленным документацией об электронном аукционе (ч.13 ст.69 Закона № 44-ФЗ).;;"ОБЩЕСТВО С ОГРАНИЧЕННОЙ ОТВЕТСТВЕННОСТЬЮ ""ПРОЭКСП""";;3 380 463,74;;;;;;
№ 0350300011820000103;https://zakupki.gov.ru//epz/order/notice/ea44/view/common-info.html?regNumber=0350300011820000103;Определение поставщика завершено;Выполнение работпо ремонту ул. ПавлаЛевитта;КОМИТЕТ ПО УПРАВЛЕНИЮ МУНИЦИПАЛЬНЫМ ИМУЩЕСТВОМ И ЗЕМЕЛЬНЫМИ РЕСУРСАМИ ВЕЛИКОГОНОВГОРОДА;22.06.2020;3 087 955,00 ₽;https://zakupki.gov.ru/epz/order/notice/ea44/view/supplier-results.html?regNumber=0350300011820000103;КОМИТЕТ ПО УПРАВЛЕНИЮ ГОРОДСКИМ ХОЗЯЙСТВОМ АДМИНИСТРАЦИИ ВЕЛИКОГО НОВГОРОДА;;По окончании срока подачи заявок подана только одна заявка. Такая заявка признана соответствующей требованиям Федерального закона № 44-ФЗ и документации об аукционе. Электронный аукцион признан несостоявшимся по основанию, предусмотренному ч. 1 ст. 71 Федерального закона № 44-ФЗ;;"ОБЩЕСТВО С ОГРАНИЧЕННОЙ ОТВЕТСТВЕННОСТЬЮ ""ЛЕГИОНСТРОЙ""";;3 087 955,00;;;;;;
