№ 0150300011520000002;https://zakupki.gov.ru//epz/order/notice/ea44/view/common-info.html?regNumber=0150300011520000002;Определение поставщика завершено;Выполнение работ по ремонту автомобильнойдорогиобщего пользования местного значения в п.Кневицы по ул.Центральная от дома №59Б до дома №66 Кневицкого сельского поселения Демянского районаНовгородскойобласти;АДМИНИСТРАЦИЯ КНЕВИЦКОГО СЕЛЬСКОГО ПОСЕЛЕНИЯ;13.04.2020;544 182,00 ₽;https://zakupki.gov.ru/epz/order/notice/ea44/view/supplier-results.html?regNumber=0150300011520000002;АДМИНИСТРАЦИЯ КНЕВИЦКОГО СЕЛЬСКОГО ПОСЕЛЕНИЯ;;По окончании срока подачи заявок подана только одна заявка. Такая заявка признана соответствующей требованиям Федерального закона № 44-ФЗ и документации об аукционе. Электронный аукцион признан несостоявшимся по основанию, предусмотренному ч. 1 ст. 71 Федерального закона № 44-ФЗ;;Толоконников И. Н.;;544 182,00;;;;;;
№ 32009085132;https://zakupki.gov.ru/https://zakupki.gov.ru/223/purchase/public/purchase/info/common-info.html?regNumber=32009085132;Закупка завершена;Открытый аукцион среди субъектов малого и среднего предпринимательства в электронной форме № 1841/ОАЭ-ДЖВ/20 на право заключения договора на оказание услуг по огнезащитной обработке и проверке качества огнезащитной обработки (вокзалы Псков, Выборг, Ладожский, Петрозаводск, Великие Луки, Тверь, Ленинградский, ВеликийНовгород, Финляндский, Московский, Мурманск, Балтийский, Витебский);"ОТКРЫТОЕ АКЦИОНЕРНОЕ ОБЩЕСТВО ""РОССИЙСКИЕ ЖЕЛЕЗНЫЕДОРОГИ""";16.04.2020;5 447 738,97 ₽;;;;;;;;;;;;;;
№ 0348100006020000021;https://zakupki.gov.ru//epz/order/notice/ok504/view/common-info.html?regNumber=0348100006020000021;Определение поставщика отменено;Расходы на оснащение объектов дорожного хозяйства инженерно-техническими средствами (системами) обеспечения транспортной безопасности;"ФЕДЕРАЛЬНОЕ КАЗЕННОЕ УЧРЕЖДЕНИЕ ""УПРАВЛЕНИЕ АВТОМОБИЛЬНОЙ МАГИСТРАЛИ МОСКВА - НИЖНИЙНОВГОРОДФЕДЕРАЛЬНОГО ДОРОЖНОГО АГЕНТСТВА""";31.03.2020;108 368 695,00 ₽;;;;;;;;;;;;;;
№ 0315100000320000048;https://zakupki.gov.ru//epz/order/notice/ok504/view/common-info.html?regNumber=0315100000320000048;Определение поставщика завершено;Проведение проектных и изыскательских работ по объекту: «Капитальный ремонт автомобильнойдорогиМ-7 «Волга» Москва – Владимир – НижнийНовгород– Казань – Уфа, подъезд к городам Ижевск и Пермь на участке км 78+000 – км 86+000, Удмуртская Республика»;"ФЕДЕРАЛЬНОЕ КАЗЕННОЕ УЧРЕЖДЕНИЕ ""УПРАВЛЕНИЕ ФЕДЕРАЛЬНЫХ АВТОМОБИЛЬНЫХДОРОГ""ПРИКАМЬЕ"" ФЕДЕРАЛЬНОГО ДОРОЖНОГО АГЕНТСТВА""";20.03.2020;15 586 530,00 ₽;https://zakupki.gov.ru/epz/order/notice/ea44/view/supplier-results.html?regNumber=0315100000320000048;"ФЕДЕРАЛЬНОЕ КАЗЕННОЕ УЧРЕЖДЕНИЕ ""УПРАВЛЕНИЕ ФЕДЕРАЛЬНЫХ АВТОМОБИЛЬНЫХ ДОРОГ ""ПРИКАМЬЕ"" ФЕДЕРАЛЬНОГО ДОРОЖНОГО АГЕНТСТВА""";"ОБЩЕСТВО С ОГРАНИЧЕННОЙ ОТВЕТСТВЕННОСТЬЮ ""ЛАДЬЯ-ПРОЕКТ""";1 - Победитель;9 500 000,00;"ОБЩЕСТВО С ОГРАНИЧЕННОЙ ОТВЕТСТВЕННОСТЬЮ ""ДОРОГИ ПРИВОЛЖЬЯ""";2 - Второй номер;14 500 000,00;;;;;;
№ 0315100000320000049;https://zakupki.gov.ru//epz/order/notice/ok504/view/common-info.html?regNumber=0315100000320000049;Определение поставщика завершено;Проведение проектных и изыскательских работ по объекту: «Капитальный ремонт автомобильнойдорогиМ-7 «Волга» Москва – Владимир – НижнийНовгород– Казань – Уфа, подъезд к городам Ижевск и Пермь на участке км 141+000 – км 153+300, Удмуртская Республика»;"ФЕДЕРАЛЬНОЕ КАЗЕННОЕ УЧРЕЖДЕНИЕ ""УПРАВЛЕНИЕ ФЕДЕРАЛЬНЫХ АВТОМОБИЛЬНЫХДОРОГ""ПРИКАМЬЕ"" ФЕДЕРАЛЬНОГО ДОРОЖНОГО АГЕНТСТВА""";20.03.2020;22 782 570,00 ₽;https://zakupki.gov.ru/epz/order/notice/ea44/view/supplier-results.html?regNumber=0315100000320000049;"ФЕДЕРАЛЬНОЕ КАЗЕННОЕ УЧРЕЖДЕНИЕ ""УПРАВЛЕНИЕ ФЕДЕРАЛЬНЫХ АВТОМОБИЛЬНЫХ ДОРОГ ""ПРИКАМЬЕ"" ФЕДЕРАЛЬНОГО ДОРОЖНОГО АГЕНТСТВА""";"ОБЩЕСТВО С ОГРАНИЧЕННОЙ ОТВЕТСТВЕННОСТЬЮ ""ДОРОГИ ПРИВОЛЖЬЯ""";1 - Победитель;21 200 000,00;"ОБЩЕСТВО С ОГРАНИЧЕННОЙ ОТВЕТСТВЕННОСТЬЮ ""ЛАДЬЯ-ПРОЕКТ""";2 - Второй номер;22 782 570,00;;;;;;
№ 0315100000320000052;https://zakupki.gov.ru//epz/order/notice/ok504/view/common-info.html?regNumber=0315100000320000052;Определение поставщика завершено;Проведение проектных и изыскательских работ по объекту: «Капитальный ремонт автомобильнойдорогиМ-7 «Волга» Москва – Владимир – НижнийНовгород– Казань – Уфа, подъезд к городам Ижевск и Пермь на участке км 42+000 – км 55+060, Удмуртская Республика»;"ФЕДЕРАЛЬНОЕ КАЗЕННОЕ УЧРЕЖДЕНИЕ ""УПРАВЛЕНИЕ ФЕДЕРАЛЬНЫХ АВТОМОБИЛЬНЫХДОРОГ""ПРИКАМЬЕ"" ФЕДЕРАЛЬНОГО ДОРОЖНОГО АГЕНТСТВА""";23.03.2020;19 446 380,00 ₽;https://zakupki.gov.ru/epz/order/notice/ea44/view/supplier-results.html?regNumber=0315100000320000052;"ФЕДЕРАЛЬНОЕ КАЗЕННОЕ УЧРЕЖДЕНИЕ ""УПРАВЛЕНИЕ ФЕДЕРАЛЬНЫХ АВТОМОБИЛЬНЫХ ДОРОГ ""ПРИКАМЬЕ"" ФЕДЕРАЛЬНОГО ДОРОЖНОГО АГЕНТСТВА""";"ОБЩЕСТВО С ОГРАНИЧЕННОЙ ОТВЕТСТВЕННОСТЬЮ ""ДОРОГИ ПРИВОЛЖЬЯ""";1 - Победитель;18 100 000,00;"ОБЩЕСТВО С ОГРАНИЧЕННОЙ ОТВЕТСТВЕННОСТЬЮ ""ЛАДЬЯ-ПРОЕКТ""";2 - Второй номер;19 446 380,00;;;;;;
№ 0150300002420000048;https://zakupki.gov.ru//epz/order/notice/ea44/view/common-info.html?regNumber=0150300002420000048;Определение поставщика завершено;"Выполнение работ по ремонту участков автомобильныхдорогобщего пользования местного значения отавтодорогиБоровичи-Коегоща до д. №120 в  д. Заречная; по д. Заречная от начала ул. Новая до ул. Новая д. 23, от ул. Новая д. 23 до детского сада д. Заречная;  от д. №2 до д. №14 в д. Заречная;  от д. №22 до д. №27 в д. Коремера;  от д. №18 до д.№15 в д. Черемошье Сушанского сельского поселения Боровичского районаНовгородскойобласти";АДМИНИСТРАЦИЯ БОРОВИЧСКОГО МУНИЦИПАЛЬНОГО РАЙОНА;07.04.2020;1 391 732,00 ₽;https://zakupki.gov.ru/epz/order/notice/ea44/view/supplier-results.html?regNumber=0150300002420000048;АДМИНИСТРАЦИЯ СУШАНСКОГО СЕЛЬСКОГО ПОСЕЛЕНИЯ;Харченко О. В.;1 - Победитель;995 088,38;"ОБЩЕСТВО С ОГРАНИЧЕННОЙ ОТВЕТСТВЕННОСТЬЮ ""СПЕЦТРАНС-53""";2 - Второй номер;1 002 047,04;;;;;;
№ 0301100012720000036;https://zakupki.gov.ru//epz/order/notice/ea44/view/common-info.html?regNumber=0301100012720000036;Определение поставщика завершено;Капитальный ремонт автомобильнойдорогиМ-7 «Волга»Москва – Владимир – НижнийНовгород– Казань – Уфа на участке км 1169+910 – км1180+000, Республика Башкортостан.;"ФЕДЕРАЛЬНОЕ КАЗЕННОЕ УЧРЕЖДЕНИЕ ""ФЕДЕРАЛЬНОЕ УПРАВЛЕНИЕ АВТОМОБИЛЬНЫХДОРОГ""ПРИУРАЛЬЕ"" ФЕДЕРАЛЬНОГО ДОРОЖНОГО АГЕНТСТВА """;15.04.2020;803 213 718,00 ₽;https://zakupki.gov.ru/epz/order/notice/ea44/view/supplier-results.html?regNumber=0301100012720000036;"ФЕДЕРАЛЬНОЕ КАЗЕННОЕ УЧРЕЖДЕНИЕ ""ФЕДЕРАЛЬНОЕ УПРАВЛЕНИЕ АВТОМОБИЛЬНЫХ ДОРОГ ""ПРИУРАЛЬЕ"" ФЕДЕРАЛЬНОГО ДОРОЖНОГО АГЕНТСТВА """;;По окончании срока подачи заявок подана только одна заявка. Такая заявка признана соответствующей требованиям Федерального закона № 44-ФЗ и документации об аукционе. Электронный аукцион признан несостоявшимся по основанию, предусмотренному ч. 1 ст. 71 Федерального закона № 44-ФЗ;;"ОБЩЕСТВО С ОГРАНИЧЕННОЙ ОТВЕТСТВЕННОСТЬЮ ""ДОРТЕХСТРОЙ""";;803 213 718,00;;;;;;
№ 0150300005220000021;https://zakupki.gov.ru//epz/order/notice/ea44/view/common-info.html?regNumber=0150300005220000021;Определение поставщика завершено;Выполнение работ по благоустройству обочин вдоль автомобильнойдорогиот разворотного кольца конечной остановки автобусного маршрута №112 до пересечения с ул. Зеленая р.п. ПанковкаНовгородскойобласти;АДМИНИСТРАЦИЯ ПАНКОВСКОГО ГОРОДСКОГО ПОСЕЛЕНИЯ;14.04.2020;264 263,36 ₽;https://zakupki.gov.ru/epz/order/notice/ea44/view/supplier-results.html?regNumber=0150300005220000021;АДМИНИСТРАЦИЯ ПАНКОВСКОГО ГОРОДСКОГО ПОСЕЛЕНИЯ;Ковальков А. А.;1 - Победитель;205 632,72;"ОБЩЕСТВО С ОГРАНИЧЕННОЙ ОТВЕТСТВЕННОСТЬЮ ""АЛЕКС-СТРОЙСЕРВИС""";2 - Второй номер;206 954,04;;;;;;
№ 0855300003920000017;https://zakupki.gov.ru//epz/order/notice/ea44/view/common-info.html?regNumber=0855300003920000017;Определение поставщика завершено;"Ремонт автомобильнойдороги""г.НижнийНовгород- г. Саратов"" - с. Васильевка Пензенского района Пензенской области";"МУНИЦИПАЛЬНОЕ КАЗЕННОЕ УЧРЕЖДЕНИЕ ""УПРАВЛЕНИЕ ПО ОСУЩЕСТВЛЕНИЮ ЗАКУПОК ПЕНЗЕНСКОГО РАЙОНА ПЕНЗЕНСКОЙ ОБЛАСТИ""";02.04.2020;35 451 514,80 ₽;https://zakupki.gov.ru/epz/order/notice/ea44/view/supplier-results.html?regNumber=0855300003920000017;АДМИНИСТРАЦИЯ БОГОСЛОВСКОГО СЕЛЬСОВЕТА ПЕНЗЕНСКОГО РАЙОНА ПЕНЗЕНСКОЙ ОБЛАСТИ;"ОБЩЕСТВО С ОГРАНИЧЕННОЙ ОТВЕТСТВЕННОСТЬЮ ""СТРОИТЕЛЬНЫЙ РЕСУРС""";1 - Победитель;28 183 954,37;"ОБЩЕСТВО С ОГРАНИЧЕННОЙ ОТВЕТСТВЕННОСТЬЮ "" ДОРОЖНЫЙ СТРОИТЕЛЬ""";2 - Второй номер;28 361 211,94;;;;;;
№ 32009071202;https://zakupki.gov.ru/https://zakupki.gov.ru/223/purchase/public/purchase/info/common-info.html?regNumber=32009071202;Закупка завершена;строительство подъезднойдорогив с. Залучье,Новгородскойобл;"ОБЩЕСТВО С ОГРАНИЧЕННОЙ ОТВЕТСТВЕННОСТЬЮ ""ТЕПЛОВАЯ КОМПАНИЯ СЕВЕРНАЯ""";10.04.2020;338 448,00 ₽;;;;;;;;;;;;;;
№ 32009107363;https://zakupki.gov.ru/https://zakupki.gov.ru/223/purchase/public/purchase/info/common-info.html?regNumber=32009107363;Закупка завершена;Оказание услуг по кузовному ремонту, техническому обслуживанию, ремонту и мойке автотранспортных средств;"МУНИЦИПАЛЬНОЕ ПРЕДПРИЯТИЕ ГОРОДА НИЖНЕГОНОВГОРОДА""РЕМОНТ И ЭКСПЛУАТАЦИЯДОРОГАВТОЗАВОДСКОГО РАЙОНА""";24.04.2020;1 250 000,00 ₽;;;;;;;;;;;;;;
№ 0336100012520000027;https://zakupki.gov.ru//epz/order/notice/ea44/view/common-info.html?regNumber=0336100012520000027;Определение поставщика завершено;"Капитальный ремонт автомобильнойдорогиМ-10 ""Россия"" Москва - Тверь - ВеликийНовгород- Санкт-Петербург на участке км 570+000 - км 585+600,Новгородскаяобласть";"ФЕДЕРАЛЬНОЕ КАЗЕННОЕ УЧРЕЖДЕНИЕ ""УПРАВЛЕНИЕ АВТОМОБИЛЬНОЙ МАГИСТРАЛИ ОРДЕНА ЛЕНИНА ""МОСКВА-САНКТ-ПЕТЕРБУРГ"" ФЕДЕРАЛЬНОГО ДОРОЖНОГО АГЕНТСТВА""";25.03.2020;3 105 086 593,00 ₽;https://zakupki.gov.ru/epz/order/notice/ea44/view/supplier-results.html?regNumber=0336100012520000027;"ФЕДЕРАЛЬНОЕ КАЗЕННОЕ УЧРЕЖДЕНИЕ ""УПРАВЛЕНИЕ АВТОМОБИЛЬНОЙ МАГИСТРАЛИ ОРДЕНА ЛЕНИНА ""МОСКВА-САНКТ-ПЕТЕРБУРГ"" ФЕДЕРАЛЬНОГО ДОРОЖНОГО АГЕНТСТВА""";;По окончании срока подачи заявок подана только одна заявка. Такая заявка признана соответствующей требованиям Федерального закона № 44-ФЗ и документации об аукционе. Электронный аукцион признан несостоявшимся по основанию, предусмотренному ч. 1 ст. 71 Федерального закона № 44-ФЗ;;"ОБЩЕСТВО С ОГРАНИЧЕННОЙ ОТВЕТСТВЕННОСТЬЮ ""ТЕХНОСТРОЙ""";;3 105 086 593,00;;;;;;
№ 0150300021220000006;https://zakupki.gov.ru//epz/order/notice/ea44/view/common-info.html?regNumber=0150300021220000006;Определение поставщика завершено;Капитальный ремонт автомобильныхдорогобщего пользования местного значения в границах населенного пункта д.Шолохово ул.Каштановая-1 Савинского сельского поселенияНовгородскогорайонаНовгородскойобласти;АДМИНИСТРАЦИЯ САВИНСКОГО СЕЛЬСКОГО ПОСЕЛЕНИЯ;14.04.2020;6 633 170,00 ₽;https://zakupki.gov.ru/epz/order/notice/ea44/view/supplier-results.html?regNumber=0150300021220000006;АДМИНИСТРАЦИЯ САВИНСКОГО СЕЛЬСКОГО ПОСЕЛЕНИЯ;"ОБЩЕСТВО С ОГРАНИЧЕННОЙ ОТВЕТСТВЕННОСТЬЮ ""ТОРГОВО-СТРОИТЕЛЬНЫЙ КОМПЛЕКС ""СЕРВИС""";1 - Победитель;4 974 877,50;"ОБЩЕСТВО С ОГРАНИЧЕННОЙ ОТВЕТСТВЕННОСТЬЮ ""ДИК""";2 - Второй номер;5 008 043,34;;;;;;
№ 0150300021220000007;https://zakupki.gov.ru//epz/order/notice/ea44/view/common-info.html?regNumber=0150300021220000007;Определение поставщика завершено;Капитальный ремонт автомобильныхдорогобщего пользования местного значения в границах населенного пункта д.Шолохово ул.Каштановая-2 Савинского сельского поселенияНовгородскогорайонаНовгородскойобласти;АДМИНИСТРАЦИЯ САВИНСКОГО СЕЛЬСКОГО ПОСЕЛЕНИЯ;14.04.2020;7 378 080,00 ₽;https://zakupki.gov.ru/epz/order/notice/ea44/view/supplier-results.html?regNumber=0150300021220000007;АДМИНИСТРАЦИЯ САВИНСКОГО СЕЛЬСКОГО ПОСЕЛЕНИЯ;"ОБЩЕСТВО С ОГРАНИЧЕННОЙ ОТВЕТСТВЕННОСТЬЮ ""ТОРГОВО-СТРОИТЕЛЬНЫЙ КОМПЛЕКС ""СЕРВИС""";1 - Победитель;5 728 926,32;"ОБЩЕСТВО С ОГРАНИЧЕННОЙ ОТВЕТСТВЕННОСТЬЮ ""ДИК""";2 - Второй номер;5 765 816,71;;;;;;
№ 32009039234;https://zakupki.gov.ru/https://zakupki.gov.ru/223/purchase/public/purchase/info/common-info.html?regNumber=32009039234;Закупка завершена;Выполнение проектно-изыскательских работ по строительству объекта: «Водопроводные и канализационные сети для подключения объектов капитального строительства, расположенных на территории, ограниченной Шушарскойдорогой, Новгородскимпроспектом, Пушкинской улицей, Перспективным проездом, береговой линией реки Волковки, полосой отвода железнойдорогив поселке Шушары, Пушкинский район, улица Школьная, (северо-западнее дома 181, литера А по улице Школьная)»;"ГОСУДАРСТВЕННОЕ УНИТАРНОЕ ПРЕДПРИЯТИЕ ""ВОДОКАНАЛ САНКТ-ПЕТЕРБУРГА""";27.03.2020;9 087 659,83 ₽;;;;;;;;;;;;;;
№ 0350300020320000039;https://zakupki.gov.ru//epz/order/notice/ea44/view/common-info.html?regNumber=0350300020320000039;Определение поставщика завершено;выполнение работ по ремонту автомобильнойдорогиобщего пользования по ул. Октябрьская в г. ОкуловкаНовгородскойобласти;АДМИНИСТРАЦИЯ ОКУЛОВСКОГО МУНИЦИПАЛЬНОГО РАЙОНА;08.04.2020;1 883 171,00 ₽;https://zakupki.gov.ru/epz/order/notice/ea44/view/supplier-results.html?regNumber=0350300020320000039;АДМИНИСТРАЦИЯ ОКУЛОВСКОГО МУНИЦИПАЛЬНОГО РАЙОНА;"ОБЩЕСТВО С ОГРАНИЧЕННОЙ ОТВЕТСТВЕННОСТЬЮ ""СОЛИД""";1 - Победитель;1 864 339,28;"ОБЩЕСТВО С ОГРАНИЧЕННОЙ ОТВЕТСТВЕННОСТЬЮ ""АЛЬЯНС ГРУПП""";2 - Второй номер;1 873 755,14;;;;;;
№ 32009079969;https://zakupki.gov.ru/https://zakupki.gov.ru/223/purchase/public/purchase/info/common-info.html?regNumber=32009079969;Закупка завершена;Поставка запчастей к спецтехнике Урал и ПАЗ с двигателями Cummins;"МУНИЦИПАЛЬНОЕ ПРЕДПРИЯТИЕ ГОРОДА НИЖНЕГОНОВГОРОДА""РЕМОНТ И ЭКСПЛУАТАЦИЯДОРОГАВТОЗАВОДСКОГО РАЙОНА""";15.04.2020;3 100 000,00 ₽;;;;;;;;;;;;;;
№ 32009068092;https://zakupki.gov.ru/https://zakupki.gov.ru/223/purchase/public/purchase/info/common-info.html?regNumber=32009068092;Закупка завершена;Поставка огнетушителей и сопутствующих товаров;"МУНИЦИПАЛЬНОЕ ПРЕДПРИЯТИЕ ГОРОДА НИЖНЕГОНОВГОРОДА""РЕМОНТ И ЭКСПЛУАТАЦИЯДОРОГАВТОЗАВОДСКОГО РАЙОНА""";09.04.2020;1 200 000,00 ₽;;;;;;;;;;;;;;
№ 0350300011820000061;https://zakupki.gov.ru//epz/order/notice/ea44/view/common-info.html?regNumber=0350300011820000061;Определение поставщика завершено;выполнениеработ поремонту автомобильныхдорогВеликогоНовгорода;КОМИТЕТ ПО УПРАВЛЕНИЮ МУНИЦИПАЛЬНЫМ ИМУЩЕСТВОМ И ЗЕМЕЛЬНЫМИ РЕСУРСАМИ ВЕЛИКОГОНОВГОРОДА;09.04.2020;20 833 821,00 ₽;https://zakupki.gov.ru/epz/order/notice/ea44/view/supplier-results.html?regNumber=0350300011820000061;"МУНИЦИПАЛЬНОЕ КАЗЕННОЕ УЧРЕЖДЕНИЕ ВЕЛИКОГО НОВГОРОДА ""ГОРОДСКОЕ ХОЗЯЙСТВО""";;В течение десяти минут после начала проведения электронного аукциона было подано единственное предложение о цене контракта. По результатам рассмотрения второй части такой заявки принято решение о ее соответствии требованиям, установленным документацией об электронном аукционе (ч.13 ст.69 Закона № 44-ФЗ).;;"ОБЩЕСТВО С ОГРАНИЧЕННОЙ ОТВЕТСТВЕННОСТЬЮ ""СТРОЙ-КАПИТАЛ""";;20 729 651,89;;;;;;
№ 0336100012520000026;https://zakupki.gov.ru//epz/order/notice/ea44/view/common-info.html?regNumber=0336100012520000026;Определение поставщика завершено;Капитальный ремонт автомобильнойдорогиМ-10 «Россия» Москва – Тверь – ВеликийНовгород– Санкт-Петербург км 83+000 – км 93+000, Московская область;"ФЕДЕРАЛЬНОЕ КАЗЕННОЕ УЧРЕЖДЕНИЕ ""УПРАВЛЕНИЕ АВТОМОБИЛЬНОЙ МАГИСТРАЛИ ОРДЕНА ЛЕНИНА ""МОСКВА-САНКТ-ПЕТЕРБУРГ"" ФЕДЕРАЛЬНОГО ДОРОЖНОГО АГЕНТСТВА""";25.03.2020;1 024 215 171,00 ₽;https://zakupki.gov.ru/epz/order/notice/ea44/view/supplier-results.html?regNumber=0336100012520000026;"ФЕДЕРАЛЬНОЕ КАЗЕННОЕ УЧРЕЖДЕНИЕ ""УПРАВЛЕНИЕ АВТОМОБИЛЬНОЙ МАГИСТРАЛИ ОРДЕНА ЛЕНИНА ""МОСКВА-САНКТ-ПЕТЕРБУРГ"" ФЕДЕРАЛЬНОГО ДОРОЖНОГО АГЕНТСТВА""";;По результатам рассмотрения вторых частей заявок принято решение о соответствии указанным требованиям только одной второй части заявки на участие в нем (ч.13 ст.69 Закона № 44-ФЗ).;;"ОБЩЕСТВО С ОГРАНИЧЕННОЙ ОТВЕТСТВЕННОСТЬЮ ""СТРОИТЕЛЬНАЯ КОМПАНИЯ ""ОРИОН ПЛЮС""";;998 609 791,70;;;;;;
