Номер закупки;Ссылка на продукт;Статус;Описание объекта;Организация;Дата размещения;Цена;Ссылка на поставщика;Поле 1;Поле 2;Поле 3;Поле 4;Поле 5;Поле 6;Поле 7;ФИО Руководителя (Победитель);Контактные данные (Победитель);ИНН (Победитель);ФИО Руководителя (Второй номер);Контактные данные (Второй номер);ИНН (Второй номер)
№ 32009844655;https://zakupki.gov.ru/https://zakupki.gov.ru/223/purchase/public/purchase/info/common-info.html?regNumber=32009844655;Подача заявок;Конкурс в электронной форме на право заключения договора на оказание услуг по проведению лабораторных испытаний дорожно-строительных материалов, применяемых на объектах Государственной компании «Российские автомобильныедороги» на строящейся автомобильнойдорогеМ-12 «Москва- НижнийНовгород-Казань» в Республике Татарстан (участниками которого могут являться только субъекты малого и среднего предпринимательства);"ОБЩЕСТВО С ОГРАНИЧЕННОЙ ОТВЕТСТВЕННОСТЬЮ ""АВТОДОР-ИНЖИНИРИНГ""";24.12.2020;19 070 143,27 ₽;;;;;;;;;;;;;;
№ 0132300007520001007;https://zakupki.gov.ru//epz/order/notice/ea44/view/common-info.html?regNumber=0132300007520001007;Определение поставщика завершено;Выполнение работ по комплексному благоустройству общественной территории «Сквер имени Луначарского (ул. Трамвайная, у дома № 11 А)» в Ленинском районе города НижнегоНовгорода.;Департамент экономического развития и закупок администрации города НижнегоНовгорода;14.12.2020;7 154 754,00 ₽;https://zakupki.gov.ru/epz/order/notice/ea44/view/supplier-results.html?regNumber=0132300007520001007;АДМИНИСТРАЦИЯ ЛЕНИНСКОГО РАЙОНА ГОРОДА НИЖНЕГО НОВГОРОДА;"ОБЩЕСТВО С ОГРАНИЧЕННОЙ ОТВЕТСТВЕННОСТЬЮ ""ГОРСТРОЙ""";2 - Второй номер;5 330 291,22;"ОБЩЕСТВО С ОГРАНИЧЕННОЙ ОТВЕТСТВЕННОСТЬЮ ""СПЕЦДОРСТРОЙ""";1 - Победитель;5 294 517,44;;;;;;
№ 0132300007520001004;https://zakupki.gov.ru//epz/order/notice/ea44/view/common-info.html?regNumber=0132300007520001004;Определение поставщика завершено;Выполнение работ по комплексному благоустройству общественной территории «Сквер (пер. Трамвайный, напротив домов № 21-23)» в Ленинском районе города НижнегоНовгорода.;Департамент экономического развития и закупок администрации города НижнегоНовгорода;14.12.2020;21 338 578,80 ₽;https://zakupki.gov.ru/epz/order/notice/ea44/view/supplier-results.html?regNumber=0132300007520001004;АДМИНИСТРАЦИЯ ЛЕНИНСКОГО РАЙОНА ГОРОДА НИЖНЕГО НОВГОРОДА;"ОБЩЕСТВО С ОГРАНИЧЕННОЙ ОТВЕТСТВЕННОСТЬЮ ""АРС""";2 - Второй номер;17 497 634,46;"ОБЩЕСТВО С ОГРАНИЧЕННОЙ ОТВЕТСТВЕННОСТЬЮ ""ГОРСТРОЙ""";1 - Победитель;17 390 941,56;;;;;;
№ 0360200054020000129;https://zakupki.gov.ru//epz/order/notice/ok504/view/common-info.html?regNumber=0360200054020000129;Работа комиссии;Выполнение работ по разработке проектной документации на ремонт автомобильнойдороги«Р-158 «НижнийНовгород– Арзамас – Саранск – Исса – Пенза – Саратов» – «Березовка – Студеный» на участке км 0+000 – км 25+355, на участке км 0+000 – км 17+800 в Петровском районе Саратовской области;"ГОСУДАРСТВЕННОЕ КАЗЕННОЕ УЧРЕЖДЕНИЕ САРАТОВСКОЙ ОБЛАСТИ ""ДИРЕКЦИЯ ТРАНСПОРТА И ДОРОЖНОГО ХОЗЯЙСТВА""";20.11.2020;5 604 792,00 ₽;;;;;;;;;;;;;;
№ 0350300001620000013;https://zakupki.gov.ru//epz/order/notice/ea44/view/common-info.html?regNumber=0350300001620000013;Подача заявок;Выполнение работ по содержаниюдорогв населенных пунктах Неболчского сельского поселения Любытинского районаНовгородскойобласти;АДМИНИСТРАЦИЯ НЕБОЛЧСКОГО СЕЛЬСКОГО ПОСЕЛЕНИЯ;24.12.2020;600 000,00 ₽;;;;;;;;;;;;;;
№ 0350300011820000234;https://zakupki.gov.ru//epz/order/notice/ea44/view/common-info.html?regNumber=0350300011820000234;Подача заявок;Выполнение работ по ремонту проспекта Мира в ВеликомНовгороде;КОМИТЕТ ПО УПРАВЛЕНИЮ МУНИЦИПАЛЬНЫМ ИМУЩЕСТВОМ И ЗЕМЕЛЬНЫМИ РЕСУРСАМИ ВЕЛИКОГОНОВГОРОДА;16.12.2020;200 855 848,00 ₽;;;;;;;;;;;;;;
№ 0348100006020000064;https://zakupki.gov.ru//epz/order/notice/ea44/view/common-info.html?regNumber=0348100006020000064;Подача заявок;"Оказание услуг по содержанию автомобильнойдорогиобщего пользования федерального значения М-5 ""Урал"" Москва - Рязань - Пенза - Самара - Уфа - Челябинск, подъезд к г. Саранск, км 78+370 - км 89+020, Республика Мордовия. Оказание услуг по содержанию искусственных дорожных сооружений на автомобильнойдорогеобщего пользования федерального значения М-5 ""Урал"" Москва - Рязань - Пенза - Самара - Уфа - Челябинск, подъезд к г. Саранск, км 78+370 - км 89+020, Республика Мордовия";"ФЕДЕРАЛЬНОЕ КАЗЕННОЕ УЧРЕЖДЕНИЕ ""УПРАВЛЕНИЕ АВТОМОБИЛЬНОЙ МАГИСТРАЛИ МОСКВА - НИЖНИЙНОВГОРОДФЕДЕРАЛЬНОГО ДОРОЖНОГО АГЕНТСТВА""";23.12.2020;33 683 342,39 ₽;;;;;;;;;;;;;;
№ 0348100006020000063;https://zakupki.gov.ru//epz/order/notice/ea44/view/common-info.html?regNumber=0348100006020000063;Подача заявок;"Оказание услуг по содержанию искусственных сооружений: Автомобильнаядорогаобщего пользования федерального значения М-5 ""Урал"" Москва - Рязань - Пенза - Самара - Уфа - Челябинск, подъезд к г. Саранск, км 0+000 - км 78+730; Автомобильнаядорогаобщего пользования федерального значения М-5 ""Урал"" Москва - Рязань - Пенза - Самара - Уфа - Челябинск, подъезд к г.Саранск, обход г.Краснослободск, км 78+650 - км 89+850";"ФЕДЕРАЛЬНОЕ КАЗЕННОЕ УЧРЕЖДЕНИЕ ""УПРАВЛЕНИЕ АВТОМОБИЛЬНОЙ МАГИСТРАЛИ МОСКВА - НИЖНИЙНОВГОРОДФЕДЕРАЛЬНОГО ДОРОЖНОГО АГЕНТСТВА""";23.12.2020;8 633 683,97 ₽;;;;;;;;;;;;;;
№ 0132300007520001006;https://zakupki.gov.ru//epz/order/notice/ea44/view/common-info.html?regNumber=0132300007520001006;Определение поставщика завершено;Выполнение работ по комплексному благоустройству общественной территории «Сквер по ул. Премудрова» (у здания ДК «Красная Этна») в Ленинском районе города НижнегоНовгорода.;Департамент экономического развития и закупок администрации города НижнегоНовгорода;14.12.2020;4 999 730,40 ₽;https://zakupki.gov.ru/epz/order/notice/ea44/view/supplier-results.html?regNumber=0132300007520001006;АДМИНИСТРАЦИЯ ЛЕНИНСКОГО РАЙОНА ГОРОДА НИЖНЕГО НОВГОРОДА;"ОБЩЕСТВО С ОГРАНИЧЕННОЙ ОТВЕТСТВЕННОСТЬЮ ""ТЕХСТРОЙ""";2 - Второй номер;3 999 784,00;"ОБЩЕСТВО С ОГРАНИЧЕННОЙ ОТВЕТСТВЕННОСТЬЮ ""ГОРСТРОЙ""";1 - Победитель;3 999 784,00;;;;;;
№ 0832200006620001142;https://zakupki.gov.ru//epz/order/notice/ea44/view/common-info.html?regNumber=0832200006620001142;Подача заявок;Cодержание сетей наружного освещения на автомобильныхдорогахобщего пользования регионального или межмуниципального значения в Кстовском районе и городе областного значения НижнийНовгородНижегородской области;"ГОСУДАРСТВЕННОЕ КАЗЕННОЕ УЧРЕЖДЕНИЕ НИЖЕГОРОДСКОЙ ОБЛАСТИ ""ЦЕНТР РАЗМЕЩЕНИЯ ЗАКАЗА НИЖЕГОРОДСКОЙ ОБЛАСТИ""";23.12.2020;3 747 890,00 ₽;;;;;;;;;;;;;;
№ 0336100012520000146;https://zakupki.gov.ru//epz/order/notice/ok504/view/common-info.html?regNumber=0336100012520000146;Подача заявок;Капитальный ремонт автомобильнойдорогиМ-10 «Россия» Москва – Тверь – ВеликийНовгород– Санкт-Петербург на участке км 271+000 – км 292+000, Тверская область. I этап км 271+000 – км 281+500.;"ФЕДЕРАЛЬНОЕ КАЗЕННОЕ УЧРЕЖДЕНИЕ ""УПРАВЛЕНИЕ АВТОМОБИЛЬНОЙ МАГИСТРАЛИ ОРДЕНА ЛЕНИНА ""МОСКВА-САНКТ-ПЕТЕРБУРГ"" ФЕДЕРАЛЬНОГО ДОРОЖНОГО АГЕНТСТВА""";23.12.2020;1 352 044 311,00 ₽;;;;;;;;;;;;;;
№ 0150300002420000184;https://zakupki.gov.ru//epz/order/notice/ea44/view/common-info.html?regNumber=0150300002420000184;Работа комиссии;Выполнение работ по содержанию железобетонного автодорожного моста через р. Мста (с правобережным подходом) у д. Бобровик иавтодорогидо границы с городским поселением в сторону ул. Газа г. БоровичиНовгородскойобласти  в 2021 году;АДМИНИСТРАЦИЯ БОРОВИЧСКОГО МУНИЦИПАЛЬНОГО РАЙОНА;15.12.2020;1 078 961,03 ₽;;;;;;;;;;;;;;
№ 0132300007520001011;https://zakupki.gov.ru//epz/order/notice/ea44/view/common-info.html?regNumber=0132300007520001011;Работа комиссии;Комплексное благоустройство общественной территории «Сквер по ул. Куйбышева (вдоль домов 1,3,5)» в Московском районе г. НижнегоНовгородав рамках МП «Формирование комфортной городской среды  г. Н.Новгорода»;Департамент экономического развития и закупок администрации города НижнегоНовгорода;15.12.2020;16 637 180,40 ₽;;;;;;;;;;;;;;
№ 0132300007520001010;https://zakupki.gov.ru//epz/order/notice/ea44/view/common-info.html?regNumber=0132300007520001010;Работа комиссии;Комплексное благоустройство общественной территории «Сквер Выставка цветов» по ул. Просвещенская (в границах д. 36 улицы 50-летия Победы и д. 6 ул. Просвещенская)» в Московском районе г. НижнегоНовгородав рамках МП «Формирование комфортной городской среды  г. Н.Новгорода»;Департамент экономического развития и закупок администрации города НижнегоНовгорода;15.12.2020;10 015 191,50 ₽;;;;;;;;;;;;;;
№ 32009836957;https://zakupki.gov.ru/https://zakupki.gov.ru/223/purchase/public/purchase/info/common-info.html?regNumber=32009836957;Закупка завершена;Услуги по организации получения платформ с одорантом, прибывающих на станцию Зелецино Горьковской железнойдороги;"ОБЩЕСТВО С ОГРАНИЧЕННОЙ ОТВЕТСТВЕННОСТЬЮ ""ГАЗПРОМ ТРАНСГАЗ НИЖНИЙНОВГОРОД""";23.12.2020;574 346,16 ₽;;;;;;;;;;;;;;
№ 32009717334;https://zakupki.gov.ru/https://zakupki.gov.ru/223/purchase/public/purchase/info/common-info.html?regNumber=32009717334;Работа комиссии;Конкурс в электронной форме на право заключения договора на оказание услуг по проведению лабораторных испытаний дорожно-строительных материалов, применяемых на объектах Государственной компании «Российские автомобильныедороги» на строящейся автомобильнойдорогеМ-12 «Москва- НижнийНовгород-Казань» в Московской и Владимирской областях (участниками которого могут являться только субъекты малого и среднего предпринимательства);"ОБЩЕСТВО С ОГРАНИЧЕННОЙ ОТВЕТСТВЕННОСТЬЮ ""АВТОДОР-ИНЖИНИРИНГ""";24.11.2020;19 070 143,27 ₽;;;;;;;;;;;;;;
№ 32009717202;https://zakupki.gov.ru/https://zakupki.gov.ru/223/purchase/public/purchase/info/common-info.html?regNumber=32009717202;Закупка завершена;Конкурс в электронной форме на право заключения договора на оказание услуг по проведению лабораторных испытаний дорожно-строительных материалов, применяемых на объектах Государственной компании «Российские автомобильныедороги» на строящейся автомобильнойдорогеМ-12 «Москва- НижнийНовгород-Казань» в Республике Татарстан (участниками которого могут являться только субъекты малого и среднего предпринимательства);"ОБЩЕСТВО С ОГРАНИЧЕННОЙ ОТВЕТСТВЕННОСТЬЮ ""АВТОДОР-ИНЖИНИРИНГ""";24.11.2020;19 070 143,27 ₽;;;;;;;;;;;;;;
№ 0372100009920000117;https://zakupki.gov.ru//epz/order/notice/ea44/view/common-info.html?regNumber=0372100009920000117;Подача заявок;"...  автомобильныхдорогобщего пользования федерального значения в Ленинградской области: автомобильнаядорогаР-23 ...  Республикой Белоруссия, Гатчинский  район; автомобильнаядорогаА-120 «Санкт-Петербургское южное полукольцо» Кировск ... , Ломоносовский и Кировский районы; автомобильнаядорогаА-121 «Сортавала» Санкт-Петербург - Сортавала ...  - автомобильнаядорогаР-21 «Кола», Приозерский район; автомобильная ...дорогаА-181 «Скандинавия» Санкт-Петербург - Выборг  ...  район; автомобильнаядорогаМ-10 «Россия» Москва - Тверь - ВеликийНовгород- ...  Санкт-Петербург, Тосненский район; автомобильнаядорогаА-180 «Нарва ... , Волосовский и Кингисеппский районы; автомобильнаядорогаР-21 «Кола» Санкт-Петербург - Петрозаводск ...";"ФЕДЕРАЛЬНОЕ КАЗЕННОЕ УЧРЕЖДЕНИЕ ""УПРАВЛЕНИЕ ФЕДЕРАЛЬНЫХ АВТОМОБИЛЬНЫХДОРОГ""СЕВЕРО-ЗАПАД"" ИМЕНИ Н.В. СМИРНОВА ФЕДЕРАЛЬНОГО ДОРОЖНОГО АГЕНТСТВА""";23.12.2020;128 058 371,00 ₽;;;;;;;;;;;;;;
№ 32009827955;https://zakupki.gov.ru/https://zakupki.gov.ru/223/purchase/public/purchase/info/common-info.html?regNumber=32009827955;Подача заявок;Поставка соли;"МУНИЦИПАЛЬНОЕ ПРЕДПРИЯТИЕ ГОРОДА НИЖНЕГОНОВГОРОДА""РЕМОНТ И ЭКСПЛУАТАЦИЯДОРОГ""";21.12.2020;7 410 600,00 ₽;;;;;;;;;;;;;;
№ 32009835020;https://zakupki.gov.ru/https://zakupki.gov.ru/223/purchase/public/purchase/info/common-info.html?regNumber=32009835020;Подача заявок;Запрос котировок среди субъектов малого и среднего предпринимательства в электронной форме № 4540/ЗКТЭ-ДЖВ/20 на право заключения договора оказания услуг по техническому обслуживанию и аварийно-восстановительному ремонту эскалаторов;"ОТКРЫТОЕ АКЦИОНЕРНОЕ ОБЩЕСТВО ""РОССИЙСКИЕ ЖЕЛЕЗНЫЕДОРОГИ""";23.12.2020;;;;;;;;;;;;;;;
№ 0336100012520000145;https://zakupki.gov.ru//epz/order/notice/ok504/view/common-info.html?regNumber=0336100012520000145;Подача заявок;Строительный контроль при проведении работ по объекту: «Капитальный ремонт автомобильнойдорогиР-56 ВеликийНовгород– Сольцы – Порхов – Псков на участке км 4+397 – км 38+650,Новгородскаяобласть. II этап км 17+667 – км 38+650»;"ФЕДЕРАЛЬНОЕ КАЗЕННОЕ УЧРЕЖДЕНИЕ ""УПРАВЛЕНИЕ АВТОМОБИЛЬНОЙ МАГИСТРАЛИ ОРДЕНА ЛЕНИНА ""МОСКВА-САНКТ-ПЕТЕРБУРГ"" ФЕДЕРАЛЬНОГО ДОРОЖНОГО АГЕНТСТВА""";22.12.2020;23 923 839,40 ₽;;;;;;;;;;;;;;
№ 0832200006620001125;https://zakupki.gov.ru//epz/order/notice/ok504/view/common-info.html?regNumber=0832200006620001125;Подача заявок;Разработка проекта планировки и проекта межевания территории по объекту: «Строительство автомобильнойдорогиВосточный обход города НижнегоНовгородав Кстовском районе и городе областного значения НижнийНовгородНижегородской области»;"ГОСУДАРСТВЕННОЕ КАЗЕННОЕ УЧРЕЖДЕНИЕ НИЖЕГОРОДСКОЙ ОБЛАСТИ ""ЦЕНТР РАЗМЕЩЕНИЯ ЗАКАЗА НИЖЕГОРОДСКОЙ ОБЛАСТИ""";08.12.2020;14 904 081,89 ₽;;;;;;;;;;;;;;
№ 0150300002420000182;https://zakupki.gov.ru//epz/order/notice/ea44/view/common-info.html?regNumber=0150300002420000182;Работа комиссии;Выполнение работ по техническому обслуживанию, замене и установке дорожных знаков на уличной дорожной сети города БоровичиНовгородскойобласти.;АДМИНИСТРАЦИЯ БОРОВИЧСКОГО МУНИЦИПАЛЬНОГО РАЙОНА;11.12.2020;1 199 842,00 ₽;;;;;;;;;;;;;;
№ 0150300002420000185;https://zakupki.gov.ru//epz/order/notice/ea44/view/common-info.html?regNumber=0150300002420000185;Подача заявок;Выполнение работ по ремонту участка автомобильнойдорогиобщего пользования местного значения от д. Сорокино до д.Рябиновка Боровичского районаНовгородскойобласти с км. 3+847 по км.4+358.;АДМИНИСТРАЦИЯ БОРОВИЧСКОГО МУНИЦИПАЛЬНОГО РАЙОНА;22.12.2020;736 726,60 ₽;;;;;;;;;;;;;;
№ 32009830218;https://zakupki.gov.ru/https://zakupki.gov.ru/223/purchase/public/purchase/info/common-info.html?regNumber=32009830218;Подача заявок;Запрос котировок среди субъектов малого и среднего предпринимательства в электронной форме № 4519/ЗКТЭ-ДЖВ/20 на право заключения договора оказания услуг по стирке постельного белья и полотенец (вокзалы Арзамас-2, Ковров, Чебоксары, Сарапул, Йошкар-Ола, Шахунья, Янаул, Навашино, Ижквск, Агрыз, Казань, Восстание, Котельнич, Глазов, Канаш, НижнийНовгород);"ОТКРЫТОЕ АКЦИОНЕРНОЕ ОБЩЕСТВО ""РОССИЙСКИЕ ЖЕЛЕЗНЫЕДОРОГИ""";22.12.2020;979 200,00 ₽;;;;;;;;;;;;;;
№ 0132300007520001008;https://zakupki.gov.ru//epz/order/notice/ea44/view/common-info.html?regNumber=0132300007520001008;Работа комиссии;"Выполнение работ по комплексному благоустройству общественной территории ""Юбилейный бульвар"" в Сормовском районе города НижнегоНовгорода.";Департамент экономического развития и закупок администрации города НижнегоНовгорода;14.12.2020;29 773 149,60 ₽;;;;;;;;;;;;;;
№ 0360200054020000143;https://zakupki.gov.ru//epz/order/notice/ea44/view/common-info.html?regNumber=0360200054020000143;Работа комиссии;Ремонт автомобильнойдороги«Ремонт автомобильнойдороги«Аткарск - Песчанка» - автомобильнаядорога«Р - 158 «НижнийНовгород– Арзамас – Саранск – Исса – Пенза – Саратов» на участке км 0+000 – км 36+833 в  Аткарском районе Саратовской области»   (этап на участке км 0+000+км8+000).;"ГОСУДАРСТВЕННОЕ КАЗЕННОЕ УЧРЕЖДЕНИЕ САРАТОВСКОЙ ОБЛАСТИ ""ДИРЕКЦИЯ ТРАНСПОРТА И ДОРОЖНОГО ХОЗЯЙСТВА""";10.12.2020;140 071 816,80 ₽;;;;;;;;;;;;;;
№ 32009822904;https://zakupki.gov.ru/https://zakupki.gov.ru/223/purchase/public/purchase/info/common-info.html?regNumber=32009822904;Закупка завершена;Работы по изоляции грунтом полигона ТКО на отметке 9,0 м, изоляция грунтом откосов по периметру рабочей зоны полигона, ремонт подъезднойдорогииз железобетонных плит к рабочей зоне полигона, устройство временнойдорогии разворотных площадок из железобетонных плит на отметке 9,25 метров  на объекте: Полигон твердых коммунальных отходов расположенный по адресу:Новгородскаяобласть, Чудовский район, д. Торфяное;"ОБЩЕСТВО С ОГРАНИЧЕННОЙ ОТВЕТСТВЕННОСТЬЮ ""КЛИН-ОК""";18.12.2020;2 809 299,94 ₽;;;;;;;;;;;;;;
