№ 0309200000220000084;https://zakupki.gov.ru//epz/order/notice/ea44/view/common-info.html?regNumber=0309200000220000084;Определение поставщика завершено;"Капитальный ремонт объекта: Автомобильнаядорогаг.Рузаевка - с.Сузгарье - с.Ключарево - п.Левженский - ""г.Саранск- г.Рузаевка"" на участке км 12+300 - км 15+100 в Рузаевском муниципальном районе Республики Мордовия";"ГОСУДАРСТВЕННОЕ КАЗЕННОЕ УЧРЕЖДЕНИЕ ""УПРАВЛЕНИЕ АВТОМОБИЛЬНЫХДОРОГРЕСПУБЛИКИ МОРДОВИЯ""";07.07.2020;56 949 026,00 ₽;https://zakupki.gov.ru/epz/order/notice/ea44/view/supplier-results.html?regNumber=0309200000220000084;"ГОСУДАРСТВЕННОЕ КАЗЕННОЕ УЧРЕЖДЕНИЕ ""УПРАВЛЕНИЕ АВТОМОБИЛЬНЫХ ДОРОГ РЕСПУБЛИКИ МОРДОВИЯ""";;В течение десяти минут после начала проведения электронного аукциона ни один из его участников не подал предложение о цене контракта (ч.20 ст.68 44-ФЗ). По результатам рассмотрения вторых частей заявок принято решение о соответствии требованиям, установленным документацией об электронном аукционе, двух и более вторых частей заявок.;;"ОБЩЕСТВО С ОГРАНИЧЕННОЙ ОТВЕТСТВЕННОСТЬЮ ""МОРДОВДОРСТРОЙ""";1 - Победитель;56 949 026,00;;;1327156382;;;
№ 0309200000220000083;https://zakupki.gov.ru//epz/order/notice/ea44/view/common-info.html?regNumber=0309200000220000083;Определение поставщика завершено;Капитальный ремонтавтодорогиг.Саранск- г.Кочкурово - гр.Пензенской обл. на участке км 13+700 - км 14+000 с устройством системы автоматического пункта весового и габаритного контроля транспортных средств в Октябрьском районе г.о.СаранскРеспублики Мордовия;"ГОСУДАРСТВЕННОЕ КАЗЕННОЕ УЧРЕЖДЕНИЕ ""УПРАВЛЕНИЕ АВТОМОБИЛЬНЫХДОРОГРЕСПУБЛИКИ МОРДОВИЯ""";30.06.2020;37 084 360,00 ₽;https://zakupki.gov.ru/epz/order/notice/ea44/view/supplier-results.html?regNumber=0309200000220000083;"ГОСУДАРСТВЕННОЕ КАЗЕННОЕ УЧРЕЖДЕНИЕ ""УПРАВЛЕНИЕ АВТОМОБИЛЬНЫХ ДОРОГ РЕСПУБЛИКИ МОРДОВИЯ""";;По окончании срока подачи заявок подана только одна заявка. Такая заявка признана соответствующей требованиям Федерального закона № 44-ФЗ и документации об аукционе. Электронный аукцион признан несостоявшимся по основанию, предусмотренному ч. 1 ст. 71 Федерального закона № 44-ФЗ;;"ПУБЛИЧНОЕ АКЦИОНЕРНОЕ ОБЩЕСТВО ""ВЫМПЕЛ-КОММУНИКАЦИИ""";;37 084 360,00;;;7713076301;;;
№ 0355100004520000086;https://zakupki.gov.ru//epz/order/notice/ea44/view/common-info.html?regNumber=0355100004520000086;Определение поставщика завершено;"...  элементов обустройства на участках автомобильныхдорогобщего пользования федерального значения: М ... ; Р-158 Нижний Новгород – Арзамас –Саранск– Исса – Пенза – Саратов";"ФЕДЕРАЛЬНОЕ КАЗЕННОЕ УЧРЕЖДЕНИЕ ""ФЕДЕРАЛЬНОЕ УПРАВЛЕНИЕ АВТОМОБИЛЬНЫХДОРОГ""БОЛЬШАЯ ВОЛГА"" ФЕДЕРАЛЬНОГО ДОРОЖНОГО АГЕНТСТВА""";30.06.2020;215 426 357,00 ₽;https://zakupki.gov.ru/epz/order/notice/ea44/view/supplier-results.html?regNumber=0355100004520000086;"ФЕДЕРАЛЬНОЕ КАЗЕННОЕ УЧРЕЖДЕНИЕ ""ФЕДЕРАЛЬНОЕ УПРАВЛЕНИЕ АВТОМОБИЛЬНЫХ ДОРОГ ""БОЛЬШАЯ ВОЛГА"" ФЕДЕРАЛЬНОГО ДОРОЖНОГО АГЕНТСТВА""";"ОБЩЕСТВО С ОГРАНИЧЕННОЙ ОТВЕТСТВЕННОСТЬЮ ""НОВЫЕ ТЕХНОЛОГИИ""";1 - Победитель;201 423 643,73;"ОБЩЕСТВО С ОГРАНИЧЕННОЙ ОТВЕТСТВЕННОСТЬЮ ПРЕДПРИЯТИЕ ""ПИК""";2 - Второй номер;201 423 643,73;;;7721750972;;;
№ 0309200000220000081;https://zakupki.gov.ru//epz/order/notice/ok504/view/common-info.html?regNumber=0309200000220000081;Определение поставщика завершено;"Подготовка проектной документации на капитальный ремонт и экспертиза проекта по объекту: Автомобильнаядорога""г.Саранск- р. п. Ромоданово - с. Большое Игнатово"" - с. Трофимовщина на участке  км 6+700 – км 8+700 в Ромодановском муниципальном районе Республики Мордовия";"ГОСУДАРСТВЕННОЕ КАЗЕННОЕ УЧРЕЖДЕНИЕ ""УПРАВЛЕНИЕ АВТОМОБИЛЬНЫХДОРОГРЕСПУБЛИКИ МОРДОВИЯ""";29.06.2020;1 385 824,00 ₽;https://zakupki.gov.ru/epz/order/notice/ea44/view/supplier-results.html?regNumber=0309200000220000081;"ГОСУДАРСТВЕННОЕ КАЗЕННОЕ УЧРЕЖДЕНИЕ ""УПРАВЛЕНИЕ АВТОМОБИЛЬНЫХ ДОРОГ РЕСПУБЛИКИ МОРДОВИЯ""";"ОБЩЕСТВО С ОГРАНИЧЕННОЙ ОТВЕТСТВЕННОСТЬЮ ""РЕГИОНАЛЬНЫЙ НАУЧНО-ИССЛЕДОВАТЕЛЬСКИЙ ИНФОРМАЦИОННЫЙ ЦЕНТР""";1 - Победитель;770 000,00;"ОБЩЕСТВО С ОГРАНИЧЕННОЙ ОТВЕТСТВЕННОСТЬЮ ""БАЗИС""";2 - Второй номер;1 385 824,00;;;1326186923;;;
№ 0309200000220000079;https://zakupki.gov.ru//epz/order/notice/ok504/view/common-info.html?regNumber=0309200000220000079;Определение поставщика завершено;"Подготовка проектной документации на капитальный ремонт и экспертиза проекта по объекту: Автомобильнаядорога""г.Саранск- с. Сурское - г. Ульяновск"" - с. Татарская Тавла на участке км 0+000 – км 4+150 в Лямбирском муниципальном районе Республики Мордовия";"ГОСУДАРСТВЕННОЕ КАЗЕННОЕ УЧРЕЖДЕНИЕ ""УПРАВЛЕНИЕ АВТОМОБИЛЬНЫХДОРОГРЕСПУБЛИКИ МОРДОВИЯ""";26.06.2020;1 305 186,00 ₽;https://zakupki.gov.ru/epz/order/notice/ea44/view/supplier-results.html?regNumber=0309200000220000079;"ГОСУДАРСТВЕННОЕ КАЗЕННОЕ УЧРЕЖДЕНИЕ ""УПРАВЛЕНИЕ АВТОМОБИЛЬНЫХ ДОРОГ РЕСПУБЛИКИ МОРДОВИЯ""";"ОБЩЕСТВО С ОГРАНИЧЕННОЙ ОТВЕТСТВЕННОСТЬЮ ""РЕГИОНАЛЬНЫЙ НАУЧНО-ИССЛЕДОВАТЕЛЬСКИЙ ИНФОРМАЦИОННЫЙ ЦЕНТР""";1 - Победитель;730 000,00;"ОБЩЕСТВО С ОГРАНИЧЕННОЙ ОТВЕТСТВЕННОСТЬЮ ""БАЗИС""";2 - Второй номер;1 305 186,00;;;1326186923;;;
№ 32009253777;https://zakupki.gov.ru/https://zakupki.gov.ru/223/purchase/public/purchase/info/common-info.html?regNumber=32009253777;Закупка завершена;Запрос котировок среди субъектов малого и среднего предпринимательства в электронной форме № 1797/ЗКТЭ-ДЖВ/20 на право заключения договора оказания услуг по погрузке и вывозу снега и наледи с территории вокзальных комплексов;"ОТКРЫТОЕ АКЦИОНЕРНОЕ ОБЩЕСТВО ""РОССИЙСКИЕ ЖЕЛЕЗНЫЕДОРОГИ""";19.06.2020;;;;;;;;;;;;;;;
№ 0355100004520000079;https://zakupki.gov.ru//epz/order/notice/ea44/view/common-info.html?regNumber=0355100004520000079;Определение поставщика завершено;"Выполнение работ по установке стационарного электрического освещения на участках автомобильныхдорогобщего пользования федерального значения: М-5 ""Урал"" Москва – Рязань – Пенза – Самара – Уфа – Челябинск, Рязанскаяобласть, Пензенская область, Ульяновская область, Самарская область; Р-158 Нижний Новгород – Арзамас –Саранск– Исса – Пенза – Саратов, Пензенская область; А-300 Самара – Большая Черниговка – граница с Республикой Казахстан,Самарская область";"ФЕДЕРАЛЬНОЕ КАЗЕННОЕ УЧРЕЖДЕНИЕ ""ФЕДЕРАЛЬНОЕ УПРАВЛЕНИЕ АВТОМОБИЛЬНЫХДОРОГ""БОЛЬШАЯ ВОЛГА"" ФЕДЕРАЛЬНОГО ДОРОЖНОГО АГЕНТСТВА""";17.06.2020;193 560 000,00 ₽;https://zakupki.gov.ru/epz/order/notice/ea44/view/supplier-results.html?regNumber=0355100004520000079;"ФЕДЕРАЛЬНОЕ КАЗЕННОЕ УЧРЕЖДЕНИЕ ""ФЕДЕРАЛЬНОЕ УПРАВЛЕНИЕ АВТОМОБИЛЬНЫХ ДОРОГ ""БОЛЬШАЯ ВОЛГА"" ФЕДЕРАЛЬНОГО ДОРОЖНОГО АГЕНТСТВА""";"ОБЩЕСТВО С ОГРАНИЧЕННОЙ ОТВЕТСТВЕННОСТЬЮ ПРЕДПРИЯТИЕ ""ПИК""";1 - Победитель;169 386 400,00;"ОБЩЕСТВО С ОГРАНИЧЕННОЙ ОТВЕТСТВЕННОСТЬЮ ""ДОРРЕМСТРОЙ-1""";2 - Второй номер;170 354 200,00;;;5257002344;;;
№ 0360200054020000084;https://zakupki.gov.ru//epz/order/notice/ok504/view/common-info.html?regNumber=0360200054020000084;Определение поставщика завершено;Выполнение проектно-изыскательских работ по ремонту автомобильнойдороги«Аткарск - Песчанка» - автомобильнаядорога«Р - 158 «Нижний Новгород – Арзамас –Саранск– Исса – Пенза – Саратов» на участке км 0+000 – км 36+833 в  Аткарском районе Саратовской области.;"ГОСУДАРСТВЕННОЕ КАЗЕННОЕ УЧРЕЖДЕНИЕ САРАТОВСКОЙ ОБЛАСТИ ""ДИРЕКЦИЯ ТРАНСПОРТА И ДОРОЖНОГО ХОЗЯЙСТВА""";16.06.2020;3 257 812,34 ₽;https://zakupki.gov.ru/epz/order/notice/ea44/view/supplier-results.html?regNumber=0360200054020000084;"ГОСУДАРСТВЕННОЕ КАЗЕННОЕ УЧРЕЖДЕНИЕ САРАТОВСКОЙ ОБЛАСТИ ""ДИРЕКЦИЯ ТРАНСПОРТА И ДОРОЖНОГО ХОЗЯЙСТВА""";"ОБЩЕСТВО С ОГРАНИЧЕННОЙ ОТВЕТСТВЕННОСТЬЮ ""ПРОЕКТНО-ИЗЫСКАТЕЛЬСКИЙ ИНСТИТУТ ВОЛГАГРАЖДАНПРОЕКТ""";1 - Победитель;900 000,00;"ОБЩЕСТВО С ОГРАНИЧЕННОЙ ОТВЕТСТВЕННОСТЬЮ ""САРАТОВСКОЕ ПРОЕКТНОЕ БЮРО""";2 - Второй номер;3 257 000,00;;;3444216631;;;
№ 0309300012320000083;https://zakupki.gov.ru//epz/order/notice/ea44/view/common-info.html?regNumber=0309300012320000083;Определение поставщика завершено;Нанесение горизонтальной дорожной разметки на автомобильныхдорогахг.о.Саранск;"КАЗЕННОЕ УЧРЕЖДЕНИЕ ГОРОДСКОГО ОКРУГАСАРАНСК""ДИРЕКЦИЯ КОММУНАЛЬНОГО ХОЗЯЙСТВА И БЛАГОУСТРОЙСТВА""";08.06.2020;2 720 578,25 ₽;https://zakupki.gov.ru/epz/order/notice/ea44/view/supplier-results.html?regNumber=0309300012320000083;"КАЗЕННОЕ УЧРЕЖДЕНИЕ ГОРОДСКОГО ОКРУГА САРАНСК ""ДИРЕКЦИЯ КОММУНАЛЬНОГО ХОЗЯЙСТВА И БЛАГОУСТРОЙСТВА""";Коровин николай алексеевич -.;1 - Победитель;1 673 154,95;"ОБЩЕСТВО С ОГРАНИЧЕННОЙ ОТВЕТСТВЕННОСТЬЮ ""ПРОИЗВОДСТВЕННОЕ ОБЪЕДИНЕНИЕ ""МАРКЛАЙН""";2 - Второй номер;1 686 757,85;;;Да;;;
№ 0309300012320000082;https://zakupki.gov.ru//epz/order/notice/ea44/view/common-info.html?regNumber=0309300012320000082;Определение поставщика завершено;Нанесение горизонтальной дорожной разметки на автомобильныхдорогахг.о.Саранск;"КАЗЕННОЕ УЧРЕЖДЕНИЕ ГОРОДСКОГО ОКРУГАСАРАНСК""ДИРЕКЦИЯ КОММУНАЛЬНОГО ХОЗЯЙСТВА И БЛАГОУСТРОЙСТВА""";08.06.2020;10 671 035,00 ₽;https://zakupki.gov.ru/epz/order/notice/ea44/view/supplier-results.html?regNumber=0309300012320000082;"КАЗЕННОЕ УЧРЕЖДЕНИЕ ГОРОДСКОГО ОКРУГА САРАНСК ""ДИРЕКЦИЯ КОММУНАЛЬНОГО ХОЗЯЙСТВА И БЛАГОУСТРОЙСТВА""";"ОБЩЕСТВО С ОГРАНИЧЕННОЙ ОТВЕТСТВЕННОСТЬЮ ""А-101""";1 - Победитель;7 683 144,92;"ОБЩЕСТВО С ОГРАНИЧЕННОЙ ОТВЕТСТВЕННОСТЬЮ ""СТРОЙПОЛИМЕР""";2 - Второй номер;7 736 500,10;;;1328017014;;;
№ 0309300012320000081;https://zakupki.gov.ru//epz/order/notice/ea44/view/common-info.html?regNumber=0309300012320000081;Определение поставщика завершено;Нанесение горизонтальной дорожной разметки на автомобильныхдорогахг.о.Саранск;"КАЗЕННОЕ УЧРЕЖДЕНИЕ ГОРОДСКОГО ОКРУГАСАРАНСК""ДИРЕКЦИЯ КОММУНАЛЬНОГО ХОЗЯЙСТВА И БЛАГОУСТРОЙСТВА""";08.06.2020;6 811 903,18 ₽;https://zakupki.gov.ru/epz/order/notice/ea44/view/supplier-results.html?regNumber=0309300012320000081;"КАЗЕННОЕ УЧРЕЖДЕНИЕ ГОРОДСКОГО ОКРУГА САРАНСК ""ДИРЕКЦИЯ КОММУНАЛЬНОГО ХОЗЯЙСТВА И БЛАГОУСТРОЙСТВА""";"ОБЩЕСТВО С ОГРАНИЧЕННОЙ ОТВЕТСТВЕННОСТЬЮ ""МАТЕРИК""";1 - Победитель;4 768 331,98;"ОБЩЕСТВО С ОГРАНИЧЕННОЙ ОТВЕТСТВЕННОСТЬЮ ""СТРОЙПОЛИМЕР""";2 - Второй номер;4 802 391,50;;;1326218438;;;
№ 0309200000220000058;https://zakupki.gov.ru//epz/order/notice/ok504/view/common-info.html?regNumber=0309200000220000058;Определение поставщика завершено;"Подготовка проектной документации на капитальный ремонт и экспертиза проекта по объекту: Автомобильнаядорога""р. п. Чамзинка - с.  Большие Березники"" - с. Косогоры - с.  Гузынцы - ""г.Саранск-  с.  Большие Березники - с.  Дубенки"" на участке км 16+750 – км 19+300 в Большеберезниковском муниципальном районе Республики Мордовия";"ГОСУДАРСТВЕННОЕ КАЗЕННОЕ УЧРЕЖДЕНИЕ ""УПРАВЛЕНИЕ АВТОМОБИЛЬНЫХДОРОГРЕСПУБЛИКИ МОРДОВИЯ""";01.06.2020;677 838,00 ₽;https://zakupki.gov.ru/epz/order/notice/ea44/view/supplier-results.html?regNumber=0309200000220000058;"ГОСУДАРСТВЕННОЕ КАЗЕННОЕ УЧРЕЖДЕНИЕ ""УПРАВЛЕНИЕ АВТОМОБИЛЬНЫХ ДОРОГ РЕСПУБЛИКИ МОРДОВИЯ""";"АКЦИОНЕРНОЕ ОБЩЕСТВО ""ДОРПРОЕКТ""";1 - Победитель;677 838,00;"ОБЩЕСТВО С ОГРАНИЧЕННОЙ ОТВЕТСТВЕННОСТЬЮ ""РЕГИОНАЛЬНЫЙ НАУЧНО-ИССЛЕДОВАТЕЛЬСКИЙ ИНФОРМАЦИОННЫЙ ЦЕНТР""";2 - Второй номер;570 000,00;;;1326202212;;;
№ 0803300209920000035;https://zakupki.gov.ru//epz/order/notice/ea44/view/common-info.html?regNumber=0803300209920000035;Определение поставщика завершено;Ремонт внутрисельскихдорогв с. Хели-Пенджик Табасранского района РД;"МУНИЦИПАЛЬНОЕ КАЗЕННОЕ УЧРЕЖДЕНИЕ ""СЛУЖБА ЕДИНОГО ЗАКАЗЧИКА"" МУНИЦИПАЛЬНОГО РАЙОНА ""ТАБАСАРАНСКИЙРАЙОН"" РЕСПУБЛИКИ ДАГЕСТАН";01.06.2020;924 573,00 ₽;https://zakupki.gov.ru/epz/order/notice/ea44/view/supplier-results.html?regNumber=0803300209920000035;"МУНИЦИПАЛЬНОЕ КАЗЕННОЕ УЧРЕЖДЕНИЕ ""СЛУЖБА ЕДИНОГО ЗАКАЗЧИКА"" МУНИЦИПАЛЬНОГО РАЙОНА ""ТАБАСАРАНСКИЙ РАЙОН"" РЕСПУБЛИКИ ДАГЕСТАН";"ОБЩЕСТВО С ОГРАНИЧЕННОЙ ОТВЕТСТВЕННОСТЬЮ ""МК""";1 - Победитель;832 115,60;"ОБЩЕСТВО С ОГРАНИЧЕННОЙ ОТВЕТСТВЕННОСТЬЮ ""БИЛАЙ""";2 - Второй номер;836 738,47;;;0530010300;;;
№ 0309200000220000052;https://zakupki.gov.ru//epz/order/notice/ea44/view/common-info.html?regNumber=0309200000220000052;Определение поставщика завершено;Устройство временного объезда для ликвидации аварийной ситуации на мосту через ручей Гремячий на км 13+470автодорогиг.Саранск- с. Кочкурово - гр. Пензенской обл.;"ГОСУДАРСТВЕННОЕ КАЗЕННОЕ УЧРЕЖДЕНИЕ ""УПРАВЛЕНИЕ АВТОМОБИЛЬНЫХДОРОГРЕСПУБЛИКИ МОРДОВИЯ""";26.05.2020;4 877 568,00 ₽;https://zakupki.gov.ru/epz/order/notice/ea44/view/supplier-results.html?regNumber=0309200000220000052;"ГОСУДАРСТВЕННОЕ КАЗЕННОЕ УЧРЕЖДЕНИЕ ""УПРАВЛЕНИЕ АВТОМОБИЛЬНЫХ ДОРОГ РЕСПУБЛИКИ МОРДОВИЯ""";;По окончании срока подачи заявок подана только одна заявка. Такая заявка признана соответствующей требованиям Федерального закона № 44-ФЗ и документации об аукционе. Электронный аукцион признан несостоявшимся по основанию, предусмотренному ч. 1 ст. 71 Федерального закона № 44-ФЗ;;"ОБЩЕСТВО С ОГРАНИЧЕННОЙ ОТВЕТСТВЕННОСТЬЮ ""МОРДОВДОРСТРОЙ""";;4 877 568,00;;;1327156382;;;
№ 0109300021420000009;https://zakupki.gov.ru//epz/order/notice/ea44/view/common-info.html?regNumber=0109300021420000009;Определение поставщика завершено;"Капитальный ремонт дворовой территории многоквартирного дома №37 по ул. Веселовского г.Саранскав рамках реализации муниципальной программы ""Формирование современной городской среды в городском округеСаранскв 2018-2024 годах""";АДМИНИСТРАЦИЯ ПРОЛЕТАРСКОГО РАЙОНА ГОРОДСКОГО ОКРУГАСАРАНСК;25.05.2020;2 842 274,00 ₽;https://zakupki.gov.ru/epz/order/notice/ea44/view/supplier-results.html?regNumber=0109300021420000009;АДМИНИСТРАЦИЯ ПРОЛЕТАРСКОГО РАЙОНА ГОРОДСКОГО ОКРУГА САРАНСК;;По окончании срока подачи заявок подана только одна заявка. Такая заявка признана соответствующей требованиям Федерального закона № 44-ФЗ и документации об аукционе. Электронный аукцион признан несостоявшимся по основанию, предусмотренному ч. 1 ст. 71 Федерального закона № 44-ФЗ;;"ОБЩЕСТВО С ОГРАНИЧЕННОЙ ОТВЕТСТВЕННОСТЬЮ ""СТРОЙМ""";;2 842 274,00;;;1328016010;;;
№ 0803300209920000032;https://zakupki.gov.ru//epz/order/notice/ea44/view/common-info.html?regNumber=0803300209920000032;Определение поставщика завершено;Ремонт внутрисельскойдорогив с. ГелинбатанТабасаранскогорайона РД;"МУНИЦИПАЛЬНОЕ КАЗЕННОЕ УЧРЕЖДЕНИЕ ""СЛУЖБА ЕДИНОГО ЗАКАЗЧИКА"" МУНИЦИПАЛЬНОГО РАЙОНА ""ТАБАСАРАНСКИЙРАЙОН"" РЕСПУБЛИКИ ДАГЕСТАН";10.05.2020;755 390,00 ₽;https://zakupki.gov.ru/epz/order/notice/ea44/view/supplier-results.html?regNumber=0803300209920000032;"МУНИЦИПАЛЬНОЕ КАЗЕННОЕ УЧРЕЖДЕНИЕ ""СЛУЖБА ЕДИНОГО ЗАКАЗЧИКА"" МУНИЦИПАЛЬНОГО РАЙОНА ""ТАБАСАРАНСКИЙ РАЙОН"" РЕСПУБЛИКИ ДАГЕСТАН";Зияудинов Э. Н.;1 - Победитель;686 309,81;Абдулкадырова А. Д.;2 - Второй номер;690 086,76;;;Да;;;
№ 0309200000220000036;https://zakupki.gov.ru//epz/order/notice/ok504/view/common-info.html?regNumber=0309200000220000036;Определение поставщика завершено;Подготовка проектной документации на капитальный ремонт и экспертиза проекта по объекту: Автомобильнаядорогаг.Саранск- с. Кочкурово - гр. Пензенской обл. на участках км 20+095 – км 24+360, км 27+860 – км 30+900 в Кочкуровском муниципальном районе Республики Мордовия;"ГОСУДАРСТВЕННОЕ КАЗЕННОЕ УЧРЕЖДЕНИЕ ""УПРАВЛЕНИЕ АВТОМОБИЛЬНЫХДОРОГРЕСПУБЛИКИ МОРДОВИЯ""";07.05.2020;2 145 461,00 ₽;https://zakupki.gov.ru/epz/order/notice/ea44/view/supplier-results.html?regNumber=0309200000220000036;"ГОСУДАРСТВЕННОЕ КАЗЕННОЕ УЧРЕЖДЕНИЕ ""УПРАВЛЕНИЕ АВТОМОБИЛЬНЫХ ДОРОГ РЕСПУБЛИКИ МОРДОВИЯ""";"АКЦИОНЕРНОЕ ОБЩЕСТВО ""ДОРПРОЕКТ""";1 - Победитель;1 779 990,00;"ОБЩЕСТВО С ОГРАНИЧЕННОЙ ОТВЕТСТВЕННОСТЬЮ ""РЕГИОНАЛЬНЫЙ НАУЧНО-ИССЛЕДОВАТЕЛЬСКИЙ ИНФОРМАЦИОННЫЙ ЦЕНТР""";2 - Второй номер;1 230 000,00;;;1326202212;;;
№ 0109300021420000008;https://zakupki.gov.ru//epz/order/notice/ea44/view/common-info.html?regNumber=0109300021420000008;Определение поставщика завершено;"Капитальный ремонт дворовой территории многоквартирного дома №53 по проспекту 60 лет Октября г.Саранскав рамках реализации муниципальной программы ""Формирование современной городской среды в городском округеСаранскв 2018-2024 годах"".";АДМИНИСТРАЦИЯ ПРОЛЕТАРСКОГО РАЙОНА ГОРОДСКОГО ОКРУГАСАРАНСК;30.04.2020;1 291 199,00 ₽;https://zakupki.gov.ru/epz/order/notice/ea44/view/supplier-results.html?regNumber=0109300021420000008;АДМИНИСТРАЦИЯ ПРОЛЕТАРСКОГО РАЙОНА ГОРОДСКОГО ОКРУГА САРАНСК;"ОБЩЕСТВО С ОГРАНИЧЕННОЙ ОТВЕТСТВЕННОСТЬЮ ""СТРОЙМ""";1 - Победитель;1 220 183,00;"ОБЩЕСТВО С ОГРАНИЧЕННОЙ ОТВЕТСТВЕННОСТЬЮ ""РОДНИК""";2 - Второй номер;1 226 639,00;;;1328016010;;;
