№ 0309300012320000026;https://zakupki.gov.ru//epz/order/notice/ea44/view/common-info.html?regNumber=0309300012320000026;Определение поставщика завершено;Ремонтавтодорогипо ул. Пуркаева в г.о.Саранск;"КАЗЕННОЕ УЧРЕЖДЕНИЕ ГОРОДСКОГО ОКРУГАСАРАНСК""ДИРЕКЦИЯ КОММУНАЛЬНОГО ХОЗЯЙСТВА И БЛАГОУСТРОЙСТВА""";18.02.2020;4 714 061,00 ₽;https://zakupki.gov.ru/epz/order/notice/ea44/view/supplier-results.html?regNumber=0309300012320000026;"КАЗЕННОЕ УЧРЕЖДЕНИЕ ГОРОДСКОГО ОКРУГА САРАНСК ""ДИРЕКЦИЯ КОММУНАЛЬНОГО ХОЗЯЙСТВА И БЛАГОУСТРОЙСТВА""";;По окончании срока подачи заявок подана только одна заявка. Такая заявка признана соответствующей требованиям Федерального закона № 44-ФЗ и документации об аукционе. Электронный аукцион признан несостоявшимся по основанию, предусмотренному ч. 1 ст. 71 Федерального закона № 44-ФЗ;;"ОБЩЕСТВО С ОГРАНИЧЕННОЙ ОТВЕТСТВЕННОСТЬЮ ""МАПО-ТРАНС""";;4 714 061,00;;;1328903647;;;
№ 0355100004520000027;https://zakupki.gov.ru//epz/order/notice/ok504/view/common-info.html?regNumber=0355100004520000027;Определение поставщика завершено;Проведениестроительного контроля при осуществлении капитального ремонта автомобильнойдорогиР-158 Нижний Новгород-Арзамас-Саранск-Исса-Пенза-Саратов на участке км505+000- км 516+000, Пензенская область;"ФЕДЕРАЛЬНОЕ КАЗЕННОЕ УЧРЕЖДЕНИЕ ""ФЕДЕРАЛЬНОЕ УПРАВЛЕНИЕ АВТОМОБИЛЬНЫХДОРОГ""БОЛЬШАЯ ВОЛГА"" ФЕДЕРАЛЬНОГО ДОРОЖНОГО АГЕНТСТВА""";18.02.2020;21 114 410,00 ₽;https://zakupki.gov.ru/epz/order/notice/ea44/view/supplier-results.html?regNumber=0355100004520000027;"ФЕДЕРАЛЬНОЕ КАЗЕННОЕ УЧРЕЖДЕНИЕ ""ФЕДЕРАЛЬНОЕ УПРАВЛЕНИЕ АВТОМОБИЛЬНЫХ ДОРОГ ""БОЛЬШАЯ ВОЛГА"" ФЕДЕРАЛЬНОГО ДОРОЖНОГО АГЕНТСТВА""";"ОБЩЕСТВО С ОГРАНИЧЕННОЙ ОТВЕТСТВЕННОСТЬЮ ""ПМК 7""";1 - Победитель;2 111 400,00;"ОБЩЕСТВО С ОГРАНИЧЕННОЙ ОТВЕТСТВЕННОСТЬЮ ""ВМС ИНЖИНИРИНГ""";2 - Второй номер;17 500 000,00;;;2634100432;;;
№ 0355100004520000020;https://zakupki.gov.ru//epz/order/notice/ea44/view/common-info.html?regNumber=0355100004520000020;Определение поставщика завершено;Устройствозащитных слоев на участках автомобильныхдорог: Р-158 Нижний Новгород - Арзамас-Саранск- Исса - Пенза – Саратов, Р-208 Тамбов - Пенза, Пензенская область;"ФЕДЕРАЛЬНОЕ КАЗЕННОЕ УЧРЕЖДЕНИЕ ""ФЕДЕРАЛЬНОЕ УПРАВЛЕНИЕ АВТОМОБИЛЬНЫХДОРОГ""БОЛЬШАЯ ВОЛГА"" ФЕДЕРАЛЬНОГО ДОРОЖНОГО АГЕНТСТВА""";17.02.2020;146 651 440,00 ₽;https://zakupki.gov.ru/epz/order/notice/ea44/view/supplier-results.html?regNumber=0355100004520000020;"ФЕДЕРАЛЬНОЕ КАЗЕННОЕ УЧРЕЖДЕНИЕ ""ФЕДЕРАЛЬНОЕ УПРАВЛЕНИЕ АВТОМОБИЛЬНЫХ ДОРОГ ""БОЛЬШАЯ ВОЛГА"" ФЕДЕРАЛЬНОГО ДОРОЖНОГО АГЕНТСТВА""";;По окончании срока подачи заявок подана только одна заявка. Такая заявка признана соответствующей требованиям Федерального закона № 44-ФЗ и документации об аукционе. Электронный аукцион признан несостоявшимся по основанию, предусмотренному ч. 1 ст. 71 Федерального закона № 44-ФЗ;;"ОБЩЕСТВО С ОГРАНИЧЕННОЙ ОТВЕТСТВЕННОСТЬЮ ""ПЕНЗАДОРСТРОЙ""";;146 651 440,00;;;5837017175;;;
№ 0309300012320000023;https://zakupki.gov.ru//epz/order/notice/ea44/view/common-info.html?regNumber=0309300012320000023;Определение поставщика завершено;Строительство автомобильнойдорогиУПТ-1 в 5 микрорайоне и УПТ-5 в 4 микрорайоне комплексной застройки многоквартирными жилыми домами на участке между ул. Волгоградская и автомобильнойдорогойна с. Кочкурово (в районе р. Тавла) г.Саранск;"КАЗЕННОЕ УЧРЕЖДЕНИЕ ГОРОДСКОГО ОКРУГАСАРАНСК""ДИРЕКЦИЯ КОММУНАЛЬНОГО ХОЗЯЙСТВА И БЛАГОУСТРОЙСТВА""";14.02.2020;85 201 429,00 ₽;https://zakupki.gov.ru/epz/order/notice/ea44/view/supplier-results.html?regNumber=0309300012320000023;"КАЗЕННОЕ УЧРЕЖДЕНИЕ ГОРОДСКОГО ОКРУГА САРАНСК ""ДИРЕКЦИЯ КОММУНАЛЬНОГО ХОЗЯЙСТВА И БЛАГОУСТРОЙСТВА""";;По окончании срока подачи заявок подана только одна заявка. Такая заявка признана соответствующей требованиям Федерального закона № 44-ФЗ и документации об аукционе. Электронный аукцион признан несостоявшимся по основанию, предусмотренному ч. 1 ст. 71 Федерального закона № 44-ФЗ;;"ОБЩЕСТВО С ОГРАНИЧЕННОЙ ОТВЕТСТВЕННОСТЬЮ ""МОРДОВДОРСТРОЙ""";;85 201 429,00;;;1327156382;;;
№ 0311100007220000022;https://zakupki.gov.ru//epz/order/notice/ea44/view/common-info.html?regNumber=0311100007220000022;Определение поставщика завершено;Капитальный ремонт автомобильнойдорогиР-178Саранск- Сурское - Ульяновск на участке км 125+000 - км 135+000, Ульяновская область;"ФЕДЕРАЛЬНОЕ КАЗЕННОЕ УЧРЕЖДЕНИЕ ""ФЕДЕРАЛЬНОЕ УПРАВЛЕНИЕ АВТОМОБИЛЬНЫХДОРОГВОЛГО-ВЯТСКОГО РЕГИОНА ФЕДЕРАЛЬНОГО ДОРОЖНОГО АГЕНТСТВА""";14.02.2020;604 042 609,00 ₽;https://zakupki.gov.ru/epz/order/notice/ea44/view/supplier-results.html?regNumber=0311100007220000022;"ФЕДЕРАЛЬНОЕ КАЗЕННОЕ УЧРЕЖДЕНИЕ ""ФЕДЕРАЛЬНОЕ УПРАВЛЕНИЕ АВТОМОБИЛЬНЫХ ДОРОГ ВОЛГО-ВЯТСКОГО РЕГИОНА ФЕДЕРАЛЬНОГО ДОРОЖНОГО АГЕНТСТВА""";;По окончании срока подачи заявок подана только одна заявка. Такая заявка признана соответствующей требованиям Федерального закона № 44-ФЗ и документации об аукционе. Электронный аукцион признан несостоявшимся по основанию, предусмотренному ч. 1 ст. 71 Федерального закона № 44-ФЗ;;"ОБЩЕСТВО С ОГРАНИЧЕННОЙ ОТВЕТСТВЕННОСТЬЮ ""ДОРОЖНОЕ СТРОИТЕЛЬСТВО""";;604 042 609,00;;;6312074182;;;
№ 0360200054020000022;https://zakupki.gov.ru//epz/order/notice/ea44/view/common-info.html?regNumber=0360200054020000022;Определение поставщика завершено;Ремонт автомобильнойдороги«Р-158 «Нижний Новгород-Арзамас-Саранск-Исса-Пенза-Саратов» - «Савкино-Лопатино (Пензенская область)» на участке км 0+040 - км 3+540 в Петровском районе Саратовской области.;"ГОСУДАРСТВЕННОЕ КАЗЕННОЕ УЧРЕЖДЕНИЕ САРАТОВСКОЙ ОБЛАСТИ ""ДИРЕКЦИЯ ТРАНСПОРТА И ДОРОЖНОГО ХОЗЯЙСТВА""";13.02.2020;57 082 446,00 ₽;https://zakupki.gov.ru/epz/order/notice/ea44/view/supplier-results.html?regNumber=0360200054020000022;"ГОСУДАРСТВЕННОЕ КАЗЕННОЕ УЧРЕЖДЕНИЕ САРАТОВСКОЙ ОБЛАСТИ ""ДИРЕКЦИЯ ТРАНСПОРТА И ДОРОЖНОГО ХОЗЯЙСТВА""";"ОБЩЕСТВО С ОГРАНИЧЕННОЙ ОТВЕТСТВЕННОСТЬЮ ""ДОРОЖНИК""";1 - Победитель;41 000 000,00;"ОБЩЕСТВО С ОГРАНИЧЕННОЙ ОТВЕТСТВЕННОСТЬЮ ""ОПТИМА""";2 - Второй номер;54 780 000,00;;;6444005499;;;
№ 0309200000220000006;https://zakupki.gov.ru//epz/order/notice/ea44/view/common-info.html?regNumber=0309200000220000006;Определение поставщика завершено;"Ремонтавтодорогиа/д ""Подъезд к г.Саранскуот а/д ""Урал"" - п. Преображенский на участке км 0+000 - км 0+830 в Краснослободском муниципальном районе Республики Мордовия";"ГОСУДАРСТВЕННОЕ КАЗЕННОЕ УЧРЕЖДЕНИЕ ""УПРАВЛЕНИЕ АВТОМОБИЛЬНЫХДОРОГРЕСПУБЛИКИ МОРДОВИЯ""";13.02.2020;7 052 986,00 ₽;https://zakupki.gov.ru/epz/order/notice/ea44/view/supplier-results.html?regNumber=0309200000220000006;"ГОСУДАРСТВЕННОЕ КАЗЕННОЕ УЧРЕЖДЕНИЕ ""УПРАВЛЕНИЕ АВТОМОБИЛЬНЫХ ДОРОГ РЕСПУБЛИКИ МОРДОВИЯ""";;По окончании срока подачи заявок подана только одна заявка. Такая заявка признана соответствующей требованиям Федерального закона № 44-ФЗ и документации об аукционе. Электронный аукцион признан несостоявшимся по основанию, предусмотренному ч. 1 ст. 71 Федерального закона № 44-ФЗ;;"ОБЩЕСТВО С ОГРАНИЧЕННОЙ ОТВЕТСТВЕННОСТЬЮ ""МАПО-ТРАНС""";;7 052 986,00;;;1328903647;;;
№ 0309200000220000005;https://zakupki.gov.ru//epz/order/notice/ea44/view/common-info.html?regNumber=0309200000220000005;Определение поставщика завершено;Реконструкцияавтодорогиг.Саранск– с.Большие Березники – с.Дубенки на участке км 84+300 – км 90+820 в Дубенском муниципальном районе Республики Мордовия;"ГОСУДАРСТВЕННОЕ КАЗЕННОЕ УЧРЕЖДЕНИЕ ""УПРАВЛЕНИЕ АВТОМОБИЛЬНЫХДОРОГРЕСПУБЛИКИ МОРДОВИЯ""";13.02.2020;172 122 251,00 ₽;https://zakupki.gov.ru/epz/order/notice/ea44/view/supplier-results.html?regNumber=0309200000220000005;"ГОСУДАРСТВЕННОЕ КАЗЕННОЕ УЧРЕЖДЕНИЕ ""УПРАВЛЕНИЕ АВТОМОБИЛЬНЫХ ДОРОГ РЕСПУБЛИКИ МОРДОВИЯ""";;;;;;;;;;;;
№ 0309300012320000015;https://zakupki.gov.ru//epz/order/notice/ea44/view/common-info.html?regNumber=0309300012320000015;Определение поставщика завершено;"Ремонтавтодорогипо ул.Октябрьская в рп. Луховка г.о.Саранскот ООТ ""Луховский пруд"" до поворота на с. Булгаково";"КАЗЕННОЕ УЧРЕЖДЕНИЕ ГОРОДСКОГО ОКРУГАСАРАНСК""ДИРЕКЦИЯ КОММУНАЛЬНОГО ХОЗЯЙСТВА И БЛАГОУСТРОЙСТВА""";11.02.2020;21 441 422,00 ₽;https://zakupki.gov.ru/epz/order/notice/ea44/view/supplier-results.html?regNumber=0309300012320000015;"КАЗЕННОЕ УЧРЕЖДЕНИЕ ГОРОДСКОГО ОКРУГА САРАНСК ""ДИРЕКЦИЯ КОММУНАЛЬНОГО ХОЗЯЙСТВА И БЛАГОУСТРОЙСТВА""";;По окончании срока подачи заявок подана только одна заявка. Такая заявка признана соответствующей требованиям Федерального закона № 44-ФЗ и документации об аукционе. Электронный аукцион признан несостоявшимся по основанию, предусмотренному ч. 1 ст. 71 Федерального закона № 44-ФЗ;;"ОБЩЕСТВО С ОГРАНИЧЕННОЙ ОТВЕТСТВЕННОСТЬЮ ""МАПО-ТРАНС""";;21 441 422,00;;;1328903647;;;
№ 0309300012320000014;https://zakupki.gov.ru//epz/order/notice/ea44/view/common-info.html?regNumber=0309300012320000014;Определение поставщика завершено;Ремонтавтодорогипо ул. 1-я Промышленная от ул. Пролетарская до Лямбирского шоссе в г.о.Саранск;"КАЗЕННОЕ УЧРЕЖДЕНИЕ ГОРОДСКОГО ОКРУГАСАРАНСК""ДИРЕКЦИЯ КОММУНАЛЬНОГО ХОЗЯЙСТВА И БЛАГОУСТРОЙСТВА""";11.02.2020;29 161 022,00 ₽;https://zakupki.gov.ru/epz/order/notice/ea44/view/supplier-results.html?regNumber=0309300012320000014;"КАЗЕННОЕ УЧРЕЖДЕНИЕ ГОРОДСКОГО ОКРУГА САРАНСК ""ДИРЕКЦИЯ КОММУНАЛЬНОГО ХОЗЯЙСТВА И БЛАГОУСТРОЙСТВА""";;По окончании срока подачи заявок подана только одна заявка. Такая заявка признана соответствующей требованиям Федерального закона № 44-ФЗ и документации об аукционе. Электронный аукцион признан несостоявшимся по основанию, предусмотренному ч. 1 ст. 71 Федерального закона № 44-ФЗ;;"ОБЩЕСТВО С ОГРАНИЧЕННОЙ ОТВЕТСТВЕННОСТЬЮ ""МАПО-ТРАНС""";;29 161 022,00;;;1328903647;;;
№ 0309300012320000013;https://zakupki.gov.ru//epz/order/notice/ea44/view/common-info.html?regNumber=0309300012320000013;Определение поставщика завершено;Ремонтавтодорогипо ул. Гожувская от ул. Косарева до ул. Т. Бибиной в г.о.Саранск;"КАЗЕННОЕ УЧРЕЖДЕНИЕ ГОРОДСКОГО ОКРУГАСАРАНСК""ДИРЕКЦИЯ КОММУНАЛЬНОГО ХОЗЯЙСТВА И БЛАГОУСТРОЙСТВА""";11.02.2020;10 047 312,00 ₽;https://zakupki.gov.ru/epz/order/notice/ea44/view/supplier-results.html?regNumber=0309300012320000013;"КАЗЕННОЕ УЧРЕЖДЕНИЕ ГОРОДСКОГО ОКРУГА САРАНСК ""ДИРЕКЦИЯ КОММУНАЛЬНОГО ХОЗЯЙСТВА И БЛАГОУСТРОЙСТВА""";;По окончании срока подачи заявок подана только одна заявка. Такая заявка признана соответствующей требованиям Федерального закона № 44-ФЗ и документации об аукционе. Электронный аукцион признан несостоявшимся по основанию, предусмотренному ч. 1 ст. 71 Федерального закона № 44-ФЗ;;"ОБЩЕСТВО С ОГРАНИЧЕННОЙ ОТВЕТСТВЕННОСТЬЮ ""МАПО-ТРАНС""";;10 047 312,00;;;1328903647;;;
№ 0309300012320000012;https://zakupki.gov.ru//epz/order/notice/ea44/view/common-info.html?regNumber=0309300012320000012;Определение поставщика завершено;Ремонтавтодорогипо ул. Мордовская от ул. Первомайская до ул.  А.Невского в г.о.Саранск;"КАЗЕННОЕ УЧРЕЖДЕНИЕ ГОРОДСКОГО ОКРУГАСАРАНСК""ДИРЕКЦИЯ КОММУНАЛЬНОГО ХОЗЯЙСТВА И БЛАГОУСТРОЙСТВА""";11.02.2020;12 095 515,00 ₽;https://zakupki.gov.ru/epz/order/notice/ea44/view/supplier-results.html?regNumber=0309300012320000012;"КАЗЕННОЕ УЧРЕЖДЕНИЕ ГОРОДСКОГО ОКРУГА САРАНСК ""ДИРЕКЦИЯ КОММУНАЛЬНОГО ХОЗЯЙСТВА И БЛАГОУСТРОЙСТВА""";;По окончании срока подачи заявок подана только одна заявка. Такая заявка признана соответствующей требованиям Федерального закона № 44-ФЗ и документации об аукционе. Электронный аукцион признан несостоявшимся по основанию, предусмотренному ч. 1 ст. 71 Федерального закона № 44-ФЗ;;"ОБЩЕСТВО С ОГРАНИЧЕННОЙ ОТВЕТСТВЕННОСТЬЮ ""МАПО-ТРАНС""";;12 095 515,00;;;1328903647;;;
№ 0309300012320000011;https://zakupki.gov.ru//epz/order/notice/ea44/view/common-info.html?regNumber=0309300012320000011;Определение поставщика завершено;Ремонтавтодорогипо ул. Кооперативная в рп. Николаевка г.о.Саранск;"КАЗЕННОЕ УЧРЕЖДЕНИЕ ГОРОДСКОГО ОКРУГАСАРАНСК""ДИРЕКЦИЯ КОММУНАЛЬНОГО ХОЗЯЙСТВА И БЛАГОУСТРОЙСТВА""";11.02.2020;6 627 583,00 ₽;https://zakupki.gov.ru/epz/order/notice/ea44/view/supplier-results.html?regNumber=0309300012320000011;"КАЗЕННОЕ УЧРЕЖДЕНИЕ ГОРОДСКОГО ОКРУГА САРАНСК ""ДИРЕКЦИЯ КОММУНАЛЬНОГО ХОЗЯЙСТВА И БЛАГОУСТРОЙСТВА""";;По окончании срока подачи заявок подана только одна заявка. Такая заявка признана соответствующей требованиям Федерального закона № 44-ФЗ и документации об аукционе. Электронный аукцион признан несостоявшимся по основанию, предусмотренному ч. 1 ст. 71 Федерального закона № 44-ФЗ;;"ОБЩЕСТВО С ОГРАНИЧЕННОЙ ОТВЕТСТВЕННОСТЬЮ ""МАПО-ТРАНС""";;6 627 583,00;;;1328903647;;;
№ 0309300012320000010;https://zakupki.gov.ru//epz/order/notice/ea44/view/common-info.html?regNumber=0309300012320000010;Определение поставщика завершено;Ремонтавтодорогипо ул. Евсевьева от ул. Ульянова до ул. Транспортная в г. о.Саранск;"КАЗЕННОЕ УЧРЕЖДЕНИЕ ГОРОДСКОГО ОКРУГАСАРАНСК""ДИРЕКЦИЯ КОММУНАЛЬНОГО ХОЗЯЙСТВА И БЛАГОУСТРОЙСТВА""";11.02.2020;15 057 019,00 ₽;https://zakupki.gov.ru/epz/order/notice/ea44/view/supplier-results.html?regNumber=0309300012320000010;"КАЗЕННОЕ УЧРЕЖДЕНИЕ ГОРОДСКОГО ОКРУГА САРАНСК ""ДИРЕКЦИЯ КОММУНАЛЬНОГО ХОЗЯЙСТВА И БЛАГОУСТРОЙСТВА""";;По окончании срока подачи заявок подана только одна заявка. Такая заявка признана соответствующей требованиям Федерального закона № 44-ФЗ и документации об аукционе. Электронный аукцион признан несостоявшимся по основанию, предусмотренному ч. 1 ст. 71 Федерального закона № 44-ФЗ;;"ОБЩЕСТВО С ОГРАНИЧЕННОЙ ОТВЕТСТВЕННОСТЬЮ ""МАПО-ТРАНС""";;15 057 019,00;;;1328903647;;;
№ 0309300012320000009;https://zakupki.gov.ru//epz/order/notice/ea44/view/common-info.html?regNumber=0309300012320000009;Определение поставщика завершено;Ремонтавтодорогипо ул. Большевистская от ул. Васенко до Промышленного проезда в г. о.Саранск;"КАЗЕННОЕ УЧРЕЖДЕНИЕ ГОРОДСКОГО ОКРУГАСАРАНСК""ДИРЕКЦИЯ КОММУНАЛЬНОГО ХОЗЯЙСТВА И БЛАГОУСТРОЙСТВА""";11.02.2020;13 623 412,00 ₽;https://zakupki.gov.ru/epz/order/notice/ea44/view/supplier-results.html?regNumber=0309300012320000009;"КАЗЕННОЕ УЧРЕЖДЕНИЕ ГОРОДСКОГО ОКРУГА САРАНСК ""ДИРЕКЦИЯ КОММУНАЛЬНОГО ХОЗЯЙСТВА И БЛАГОУСТРОЙСТВА""";;По окончании срока подачи заявок подана только одна заявка. Такая заявка признана соответствующей требованиям Федерального закона № 44-ФЗ и документации об аукционе. Электронный аукцион признан несостоявшимся по основанию, предусмотренному ч. 1 ст. 71 Федерального закона № 44-ФЗ;;"ОБЩЕСТВО С ОГРАНИЧЕННОЙ ОТВЕТСТВЕННОСТЬЮ ""МАПО-ТРАНС""";;13 623 412,00;;;1328903647;;;
№ 0309300012320000008;https://zakupki.gov.ru//epz/order/notice/ea44/view/common-info.html?regNumber=0309300012320000008;Определение поставщика завершено;Ремонтавтодорогипо ул. Московская (пересечение ул. Московская с ул. Республиканская и Московская с ул. А. Невского) г. о.Саранск;"КАЗЕННОЕ УЧРЕЖДЕНИЕ ГОРОДСКОГО ОКРУГАСАРАНСК""ДИРЕКЦИЯ КОММУНАЛЬНОГО ХОЗЯЙСТВА И БЛАГОУСТРОЙСТВА""";11.02.2020;4 548 312,00 ₽;https://zakupki.gov.ru/epz/order/notice/ea44/view/supplier-results.html?regNumber=0309300012320000008;"КАЗЕННОЕ УЧРЕЖДЕНИЕ ГОРОДСКОГО ОКРУГА САРАНСК ""ДИРЕКЦИЯ КОММУНАЛЬНОГО ХОЗЯЙСТВА И БЛАГОУСТРОЙСТВА""";;По окончании срока подачи заявок подана только одна заявка. Такая заявка признана соответствующей требованиям Федерального закона № 44-ФЗ и документации об аукционе. Электронный аукцион признан несостоявшимся по основанию, предусмотренному ч. 1 ст. 71 Федерального закона № 44-ФЗ;;"ОБЩЕСТВО С ОГРАНИЧЕННОЙ ОТВЕТСТВЕННОСТЬЮ ""МАПО-ТРАНС""";;4 548 312,00;;;1328903647;;;
№ 0309300012320000007;https://zakupki.gov.ru//epz/order/notice/ea44/view/common-info.html?regNumber=0309300012320000007;Определение поставщика завершено;Ремонтавтодорогипо ул. Попова от ул. М.Расковой до ул. Комарова в г. о.Саранск;"КАЗЕННОЕ УЧРЕЖДЕНИЕ ГОРОДСКОГО ОКРУГАСАРАНСК""ДИРЕКЦИЯ КОММУНАЛЬНОГО ХОЗЯЙСТВА И БЛАГОУСТРОЙСТВА""";11.02.2020;9 483 977,00 ₽;https://zakupki.gov.ru/epz/order/notice/ea44/view/supplier-results.html?regNumber=0309300012320000007;"КАЗЕННОЕ УЧРЕЖДЕНИЕ ГОРОДСКОГО ОКРУГА САРАНСК ""ДИРЕКЦИЯ КОММУНАЛЬНОГО ХОЗЯЙСТВА И БЛАГОУСТРОЙСТВА""";;По окончании срока подачи заявок подана только одна заявка. Такая заявка признана соответствующей требованиям Федерального закона № 44-ФЗ и документации об аукционе. Электронный аукцион признан несостоявшимся по основанию, предусмотренному ч. 1 ст. 71 Федерального закона № 44-ФЗ;;"ОБЩЕСТВО С ОГРАНИЧЕННОЙ ОТВЕТСТВЕННОСТЬЮ ""МАПО-ТРАНС""";;9 483 977,00;;;1328903647;;;
